1099824395789500417	Infamous_NoBody	2019-02-25 00:12:24+00:00	en	Has Regina King won an Oscar yet??   GIVE HER, HER THINGS!!!
1099824378521387009	mojisanNYC	2019-02-25 00:12:20+00:00	en	Regina King is amazing #Oscars
1099824376533446656	CP24	2019-02-25 00:12:19+00:00	en	Regina King stuns in white, Glenn Close dons queenly gold at Academy Awards https://t.co/XRkZYF5lci https://t.co/MVUH9wO20Y
1099824371466731520	Demohamedhesham	2019-02-25 00:12:18+00:00	en	@TheAcademy Best Picture: Roma Best Director: Alfonso Cuarón  Actor: Rami Malek Actress: Glenn Close Supporting Actor: Mahershala Ali Supporting Actress: Regina King Original Screenplay: The Favourite Adapted Screenplay: If Beale Street Could Talk Animated Film: Spiderman Best Song: Shallow
1099824329137836037	theeBrianaElise	2019-02-25 00:12:08+00:00	en	#JeniferLewis #JenniferHudson #ReginaKing #MelissaMcCarthy #GlennClose #BillyPorter #MichaelBJordan #JuicyJ #AngelaBassett #Shangela #ConstanceWu #HelenMirren #CharlizeTheron #MichelleYeoh are some of #Oscars favs so far! Power is out but I’m keeping up lol
1099824289862307840	iBitHeart	2019-02-25 00:11:59+00:00	en	@redcarpet @ReginaKing @OscardelaRenta Hair no, dress ok but a bit short
1099824284535377922	latestly	2019-02-25 00:11:57+00:00	en	Here's minute by minute update of the #Oscars2019 red carpet  #EmiliaClarke, #ReginaKing, #GlennClose  #OSCARSwithLatestLY #Oscars2019 #Oscars #OscarNoms #AcademyAwards #91stAcademyAwards #AcademyAwards2019 https://t.co/GfpsLMNadz https://t.co/Fwl3SjUSNr
1099824273009590279	msveasley	2019-02-25 00:11:55+00:00	en	Regina King out here serving with this thigh. #oscars https://t.co/tSgUr2AYM9
1099824269985542145	chulito_jotito	2019-02-25 00:11:54+00:00	en	@ashleygraham and #michelleyeoh look absolutely stunning. @ReginaKing looks absolutely breathtaking and that blue on @octaviaspencer was created specifically for her.
1099824259361316864	APEntertainment	2019-02-25 00:11:51+00:00	en	#Oscar fans gave rousing welcomes to Spike Lee and Regina King on the red carpet. https://t.co/uvTyV4NX6F
1099824236812595200	alexandracheney	2019-02-25 00:11:46+00:00	en	I always love seeing the up and coming stars, but tonight the leading ladies are also the well established ones. Here’s looking at you #glennclose @ReginaKing #helenmirren #oscars
1099824230366044160	ChrisJWThompson	2019-02-25 00:11:44+00:00	en	Best Supporting Actress:  I didn’t see the rumored favorite, Regina King, but here’s how the following break down:  1. Emma Stone 2. Rachel Weisz 3. Amy Adams 4. Marina de Tavira  #CTLive #Oscars #Oscars2019
1099824157234221056	NotTheWhosTommy	2019-02-25 00:11:27+00:00	en	What I want to magically see win tonight at the #Oscars : Picture: The Favourite Director: Spike Lee Actor: Willem Dafoe Actress: Olivia Coleman SupAct: Sam Elliott  SupActr: Regina King OS: The Favourite AS: If Beale Street Could Talk Animated: Spiderverse
1099824127978979330	BrianLop3z	2019-02-25 00:11:20+00:00	en	Not sure if he’ll win but rooting for Rami Malek. Mahershala Ali, Regina King, and Glenn Close def already have the Oscars in the bag
1099824115941289984	adamput	2019-02-25 00:11:17+00:00	en	Oscars: Amy Adams, Jennifer Hudson, Regina King and more arrive on the red carpet #Oscars https://t.co/cwMXNMWIZy
1099824108358062081	bezy_bby	2019-02-25 00:11:15+00:00	en	I normally don’t care about the Oscars, but I’m rooting for Mahershala Ali, Regina King, and Black Panther ✊🏾 #BlackExcellence
1099824084312051712	Latesia27	2019-02-25 00:11:10+00:00	en	I’m already bored by the Oscars and they haven’t even started 😂. I just want to see if the ppl I’m rooting for like Regina King win that’s all
1099824036580859905	ivanovish29	2019-02-25 00:10:58+00:00	en	@ReginaKing she looks beautiful! #oscars
1099824029601595392	dioinysus	2019-02-25 00:10:57+00:00	en	regina king ily
1099824017538797569	GoygarLand	2019-02-25 00:10:54+00:00	en	Why Regina King Wore Oscar De La Renta Dress To Oscars https://t.co/9yba0MqIPl https://t.co/x5di7h6kbv
1099824011632988160	LauraBKelley	2019-02-25 00:10:52+00:00	en	@josigirl41 I also didn't hear anything about celebrities spilling about who they will be wearing, but there are some celebrities such as Regina King who has mentioned how she will be prepping for the Oscars with various beauty treatments. #Oscars #uvu3 #UVUFashionPR
1099823945761648640	MarissaMFOX5	2019-02-25 00:10:37+00:00	en	I might end up crying if Regina King wins an Oscar tonight. She has been in the business practically her entire life. #Oscars https://t.co/6Tqnx2mlqH
1099812769489190912	NYTStyles	2019-02-24 23:26:12+00:00	en	Regina King said her role in #BealeStreet was inspired by women close to her. "That’s what Sharon was to me when I read her on the page," she said, "so that’s where I got it from, my mother and my grandmother." Her mom is with her at the #Oscars tonight. https://t.co/zNNmtS0dVW https://t.co/AsGj25jo2K
1099823930276282368	people	2019-02-25 00:10:33+00:00	en	Regina King Brings Her Mom as Her Date to the 2019 #Oscars https://t.co/fOF2t45BcC
1099823894947614721	nSquib	2019-02-25 00:10:24+00:00	en	It's hard to pull off white but Regina King is killing it with that dress! #Oscars #RedCarpet
1099823880066215938	BlaireMoskowitz	2019-02-25 00:10:21+00:00	en	Both Regina King’s gown and this Daniel Arsham figure both have a lot of movement in the pulls of fabric. ⭐️ ⭐️ ⭐️ #AwardShowsSoMuseum #oscars⁠ ⁠⁠ #oscars2019⁠ ⁠ #OscarsRedCarpet #OscarsAllAccess⁠ ⁠⁠#Oscars2019Live #Redcarpet #Oscars2019LiveStream https://t.co/QPjAouXK9Q
1099823877528514565	hwoodtimes	2019-02-25 00:10:20+00:00	en	Regina King in custom De La Renta with asymmetrical sweep
1099823874273890307	TD2timeMVP	2019-02-25 00:10:20+00:00	en	Who I think will win: Supporting Actress: Regina King (If Beale Street Could Talk) Supporting Actor: Mahershela Ali (Green Book) Actress: Glenn Close (The Wife) Actor: Rami Malek (Bohemian Rhapsody) Director: Alfonso Cuaron (Roma) Picture: Roma #Oscars #Oscars2019
1099823868464762880	80sthv	2019-02-25 00:10:18+00:00	en	REGINA KING IS SO GORGEOUS I CAN’T #Oscars
1099823850034991109	Clarisita	2019-02-25 00:10:14+00:00	en	#IfBealeStreetCouldTalk lives up to the written version of the story. Barry Jenkins has a way to transport emotion through images that few other directors possess. Beautiful, moving, elevated performances by the whole cast and specially by Regina King.
1099823817277558784	RoberAwards	2019-02-25 00:10:06+00:00	en	#OscarPredictions II Sup. Actress: Regina King (alt; Amy Adams) Or. Screenplay; The Favourite (alt. Green Book) Ad. Screenplay: Blackkklansman Custome Design: Black Panther (alt The Favourite) Cinematography: Roma (alt: Cold War) Prod. Design: The Favourite (alt: Black Panther)
1099823783161090048	amyslois	2019-02-25 00:09:58+00:00	en	Amy Adams and Regina King take a picture together challenge
1099823772683698176	13NewsNow	2019-02-25 00:09:55+00:00	en	Ladies and gentlemen, Regina King.  She's nominated for Best Supporting Actress this year. Should she win? #Oscars https://t.co/Fatl5oE8ea https://t.co/nPlDhgvvGD
1099823760344055808	CinematicMood	2019-02-25 00:09:52+00:00	en	It starts with Actress in A Supporting Role. So Rachel Weisz vs Regina King right at the beginning. I'm dying early i guess #Oscars
1099823749052940288	EncouragedOne	2019-02-25 00:09:50+00:00	en	@Variety @ReginaKing Love Regina King and her Mother... taking care of her on the Red Carpet ... and I am sure everywhere else.
1099823720737185792	TD2timeMVP	2019-02-25 00:09:43+00:00	en	Who I think should win: Supporting Actress: Regina King (If Beale Street Could Talk) Supporting Actor: Mahershela Ali (Green Book) Actress: Glenn Close (The Wife) Actor: Viggo Mortensen (Green Book) Director: Spike Lee (BlacKkKlansman) Picture: Green Book #Oscars #Oscars2019
1099823680782094336	tsripun	2019-02-25 00:09:33+00:00	en	@THR Regina King hands down
1099823676160163840	dianberly712	2019-02-25 00:09:32+00:00	en	#Oscars Finally, the big night of staggering hostless change is here&amp; I am totally excited.The red carpet looks are amazing.#ReginaKing killed&amp;#SpikeLee stood out w. his"purplerain"look,hat included.And those killer custom gold Jordans w.Lee's#40Acres&amp;AMule Logo was everything.
1099823657164001282	ReelPineapple	2019-02-25 00:09:28+00:00	en	Final #Oscars2019 Predictions:  Best Picture: Black Panther  Best Actor: Christian Bale  Best Actress: Glenn Close  Best Supporting Actress: Regina King   Best Supporting Actor: Mahershala Ali   Best Director: Spike Lee   Best Adapted Screenplay: If Beale Street Could Talk
1099823656589582336	M0U5	2019-02-25 00:09:28+00:00	en	Let us not pretend that Regina King was not important in giving us 80’s and 90’s babies a childhood today.   She did.  That is all.
1099823656304283648	WashDCInsiders	2019-02-25 00:09:28+00:00	en	Regina King Brings Her Mom as Her Date to the 2019 Oscars https://t.co/sND49VJm52 https://t.co/P0qhsK91g3
1099823626692554752	NickyCanny	2019-02-25 00:09:20+00:00	en	Regina King &amp; Gemma Chan my fave so far #Oscar2019 #OscarsRedCarpet
1099823591296651264	DarrellDass	2019-02-25 00:09:12+00:00	en	@OscardelaRenta Fitting, so regal a dress for the Queen @ReginaKing #OscarsSoDeLaRenta
1099823579288489985	Dame_Kelz	2019-02-25 00:09:09+00:00	en	Oscars: Amy Adams, Jennifer Hudson, Regina King and more arrive on the red carpet #Oscars https://t.co/nWLyn9fuEW
1099823532459126785	AllieK02	2019-02-25 00:08:58+00:00	en	@Variety @ReginaKing She came to slay, and win! Why is there so much pink?
1099823527522381824	Angela123RD	2019-02-25 00:08:57+00:00	en	Oscars: Amy Adams, Jennifer Hudson, Regina King and more arrive on the red carpet #Oscars https://t.co/tQa6o6flIT
1099823494420869120	voodoochile344	2019-02-25 00:08:49+00:00	en	Also award predictions:   Best Picture: Roma  Director:  Alfonso Cuaron  Actor:  Rami Malek   Supporting Actor: Mahershala Ali   Actress:  Glenn Close  Supporting Actress: Regina King  Animated Picture: Incredibles 2  Cinematography: Roma   Costume Design:  The Favourite
1099823446979153920	bohan	2019-02-25 00:08:38+00:00	en	Oscars: Amy Adams, Jennifer Hudson, Regina King and more arrive on the red carpet #Oscars https://t.co/eOMJr9yZNx
1099823396794388481	KW_Lifestyle	2019-02-25 00:08:26+00:00	en	@ReginaKing who is nominated for Best Supporting Actress in the Film “If Beale Street Could Talk” and co-star Stephan James embrace each other on the Red Carpet of the #Oscars. https://t.co/VnjK8UT9CC
1099823380780535809	firstpressNg	2019-02-25 00:08:22+00:00	en	Regina King's Dress at the 2019 Oscars Is Giving Angelina Jolie a Run For Her Money https://t.co/uPMLWPkfD2 https://t.co/xiG3qcpoNE
1099823374103183360	ActionManiac1	2019-02-25 00:08:20+00:00	en	Oscars Red Carpet Pics  Glenn Close, Regina King, Linda Cardellini, Spike Lee &amp; his wife. https://t.co/XtkPJIAHLK
1099823348899549186	SpencerDukoff	2019-02-25 00:08:14+00:00	en	Supp. Actor Should Win: Mahershala Ali Will Win: Mahershala Ali  Supp. Actress Should Win: Rachel Weisz Will Win: Regina King  Orig. Screenplay Should Win: The Favourite Will Win: Roma  Adapt. Screenplay Should Win: Beale Street Will Win: BlackKklansman
1099823342008389632	ginaschrock	2019-02-25 00:08:13+00:00	en	Perfection #ReginaKing  best dressed, effortless beauty!
1099823334290788354	justabloodygame	2019-02-25 00:08:11+00:00	en	BEST SUPPORTING ACTRESS:  WINNER: Regina King, If Beale St Could Talk/Rachel Weisz, The Favourite  Alt: Gideon Adlon, Blockers Elizabeth Debicki, Widows Anne Hathaway, Ocean's Eight Emma Stone, The Favourite Michelle Yeoh, Crazy, Rich Asians
1099823305270403078	GinaLawriw	2019-02-25 00:08:04+00:00	en	Regina King Brings Her Mom as Her Date to the 2019 Oscars https://t.co/OHqai4569d
1099823287201345536	jenkin_ann	2019-02-25 00:08:00+00:00	en	@tvonetv @ReginaKing Now she looks beautiful
1099823225209528320	LifesKandy	2019-02-25 00:07:45+00:00	en	Regina King looks amazing.
1099823217659662336	mblanos	2019-02-25 00:07:43+00:00	en	Regina King stuns in white and Glenn Close dons queenly gold https://t.co/cr331ufNqg via @SFGate
1099823190916976641	waeschlyus	2019-02-25 00:07:37+00:00	en	Constance Wu , Regina King and Jennifer Hudson all bringing it tonight
1099823176815599616	BoomerangOnBET	2019-02-25 00:07:33+00:00	en	@TheRoot @ReginaKing Stunning 👑 👏🏾 https://t.co/DOdFPWE4XP
1099823149460254720	AboutHerOFCL	2019-02-25 00:07:27+00:00	en	#ReginaKing has arrived and she’s looking amazing! #Oscars CC: @ReginaKing https://t.co/W36OVmcSW7
1099823131961618432	ijeomadaisy	2019-02-25 00:07:23+00:00	en	#Jenniferhudson #reginaking #angelabassett #charlizetheron all looking super stunning #oscars2019 #oscars https://t.co/0oNhBYe2gt
1099823127549394944	AndrewKMay	2019-02-25 00:07:21+00:00	en	Best Actress.  Should win = tough call. Only category I cant decide.  Will win = Glenn Close.  Best supporting actress.  Should win = Rachel Weisz  Will win = Regina King
1099823098591797249	jreadsjwrites	2019-02-25 00:07:15+00:00	en	Just saw #ReginaKing on a rerun of 227 about fifteen minutes ago. She’s on the #Oscars red carpet looking stunning as always ! #longevity
1099823097845346304	Robertdoc1984	2019-02-25 00:07:14+00:00	en	@NextBestPicture @ReginaKing Looks like you won't be in suspense for very long: https://t.co/xxWztFi3Ua
1099823068195766272	cw_1814	2019-02-25 00:07:07+00:00	en	@Essence @ReginaKing She better
1099823045315911680	TomAbrahams13	2019-02-25 00:07:02+00:00	en	Trending right now at the #Oscars --&gt; @ReginaKing @gemma_chan and @theebillyporter For the latest from the red carpet --&gt; https://t.co/oYTyyKw4Ge #abc13eyewitness
1099823032342900737	j0hnparker	2019-02-25 00:06:59+00:00	en	Supp Actor: Mahershala Ali Supp Actress: Regina King Costume: Black Panther Film Editing: Vice Score: BlacKkKlansman Animated Feature: Spidey Cinematography: Roma
1099822941745889282	brensmama	2019-02-25 00:06:37+00:00	en	@HerbertHistory Regina King
1099822928160530433	nervesofscared	2019-02-25 00:06:34+00:00	en	Next to the definition of classy is this picture of Regina King. https://t.co/A1GslIp0fH
1099822903518932992	shadowandact	2019-02-25 00:06:28+00:00	en	@IssaRae @theebillyporter @DeVonFranklin @MeaganGood @itsSHANGELA @realstephj @amandlastenberg @iamRuthECarter @ReginaKing Wow @ImAngelaBassett wrapped herself in a bow and we are not worthy of this gift! #Oscars https://t.co/gE6k4wHz1i
1099822891703492608	SCRIPTEDV0L28	2019-02-25 00:06:25+00:00	en	@TheAcademy best picture - roma  best actor- rami malek! best actress- glenn close best supporting actor- mahershala ali best supporting actress- regina king best original song- shallow adapted screenplay- blackkklansman  best score- beale street  best director- alfonso cuaron
1099822809231040512	DarthBlount47	2019-02-25 00:06:06+00:00	en	@TheAcademy Best Actor: @ItsRamiMalek  Best Supp Actor: Mahershala Ali  Best Actress: Glenn Close Best Supp Actress: Regina King Best Director: Alfonso Cuaron Best Picture: Green Book
1099822725869301760	FondaIrish65	2019-02-25 00:05:46+00:00	en	Regina King is stunning.
1099822686476386305	constablec29	2019-02-25 00:05:36+00:00	en	@ReginaKing ⭐️ that drape that silhouette that LEG!! ❤️❤️❤️
1099822685255806982	ClauCanoAcosta	2019-02-25 00:05:36+00:00	en	@TheAcademy BEST PICTURE: GREEN BOOK BEST ACTOR: RAMI MALEK BEST ACTRESS: GLENN CLOSE ACTOR SUPPORTING: MARHESALA ALI ACTRESS SUPPORTING: REGINA KING DIRECTING: ALFONSO CUARON FOREIGN LANGUAHE FILM: ROMA MUSIC: SHALLOW
1099822665320353794	Fame10_com	2019-02-25 00:05:31+00:00	en	Regina King is glowing in white on the #Oscars red carpet! https://t.co/hP0KSfsmwQ
1099822657346916352	amylloy28086598	2019-02-25 00:05:29+00:00	en	@cocoabutterbf @BuzzFeed @ReginaKing @TheAcademy I saw her walk out of the limo and thought “that is a star” she is gorgeous.
1099822621762506753	Jackie_McCord	2019-02-25 00:05:21+00:00	en	Regina King's dress is beautiful, classy.  No frou frou
1099822618918731778	jennphillipstx	2019-02-25 00:05:20+00:00	en	Regina King ❤️❤️❤️❤️ #OscarRedCarpet
1099822587541102592	DC4L_77	2019-02-25 00:05:13+00:00	en	I have yet to be blown away with the red carpet fashion, @ReginaKing has my best dress pick so far. #Oscars https://t.co/7dFzmBJrqx
1099822568478072834	TFPdaily	2019-02-25 00:05:08+00:00	en	Best Dressed At The Oscars — Amandla Stenberg, Regina King &amp; More https://t.co/6v8Mpt7HTK
1099822552116015104	SameBritDiffDay	2019-02-25 00:05:04+00:00	en	@porshalanee @ReginaKing I just retweeted a photo of him.
1099822545598140417	joss72	2019-02-25 00:05:03+00:00	en	@voguemagazine @IAMJHUD @ElieSaabWorld 2nd best for me so far - my favourite is Regina King's.
1099822539356946435	ToddHolden14	2019-02-25 00:05:01+00:00	en	My 2019 Oscar list of who should win.  Best Picture:  Green Book Beat Director: Spike Lee Best Song: Shallow  Best Actor : Rami Malek Best Supporting Actor: Sam Rockwell  Best Supporting Actress Regina King
1099822501788565504	RuminationsPod	2019-02-25 00:04:52+00:00	en	Actress  Yalitza Aparicio, Roma Glenn Close, The Wife✔️ Olivia Colman, The Favourite Lady Gaga, A Star Is Born Melissa McCarthy, Can You Ever Forgive Me?  Sup. Actress  Amy Adams, Vice Marina de Tavira, Roma Regina King, Beale St✔️ Emma Stone, Favourite Rachel Weisz, Favourite
1099822490833043456	MandyaMckamie	2019-02-25 00:04:50+00:00	en	I think best supporting actress could go to either of The Favourite gals, but I think 2 from the same movie splits the vote. So I’m thinking probably Regina King or maybe even Amy Adams if I’m correct about The Favourite votes
1099822485808111616	TFPdaily	2019-02-25 00:04:48+00:00	en	Regina King’s Dress at the 2019 Oscars Is Giving Angelina Jolie a Run For Her Money https://t.co/DDtuYaark4
1099822479885901825	JMuwonge	2019-02-25 00:04:47+00:00	en	#Oscars my favourite looks so far @TheAcademy on the #ERedCarpet  @IAMJHUD @ImAngelaBassett @ReginaKing https://t.co/LANz46jH1h
1099822466086641664	VeronicaParker4	2019-02-25 00:04:44+00:00	en	#Oscar2019 predictions: Best Actress #GlennClose Best Supporting Actor #MahershalaAli, Best Supporting Actress #RachelWeisz or #ReginaKing, #Roma to get best director and best film, #FreeSolo for best documentary best adapted screenplay #TheFavourite
1099822452232933376	alealup	2019-02-25 00:04:40+00:00	en	Regina king winning first so she can get drunk and party more, you go gurl #Oscars
1099822426119114752	SARAHEK69	2019-02-25 00:04:34+00:00	en	@RichardEGrant @LauraDern @OfficialMolina @TheAcademy @ReginaKing "We are not drunks. We are multi millionaires".
1099822403608141824	thewiz0915	2019-02-25 00:04:29+00:00	en	#Oscars2019   Best Picture Roma  Director Alfonso Cuaron  Best Actor Rami Malek  Best Actress Glenn Close  Supporting Actor Mahershala Ali  Supporting Actress Regina King #OscarPredictions
1099822391285424133	snajmi23	2019-02-25 00:04:26+00:00	en	Oscars: Jennifer Hudson, Nicholas Hoult, Regina King and more arrive on the red carpet #Oscars https://t.co/BZ8SRFZBte
1099822346880385024	vsejanea	2019-02-25 00:04:15+00:00	en	Regina King deserves all good things💛🌻
1099822346062327808	TRACKGABE	2019-02-25 00:04:15+00:00	en	RAMI MALEK...ACTOR  GLENN CLOSE...ACTRESS  Mahershala Ali...SUP ACTOR  Regina King...SUP ACTRESS  Spider Man..ANIMATED  Roma...Foreign Film  Roma...Cinematography  Vice..Makeup  The Favourite..Original Screenplay  Avengers...Visual Effects  Blackkklansman...ORIG SCREEN  92%
1099822335706591238	sandykate	2019-02-25 00:04:13+00:00	en	So far Regina King and Linda Cardellini are my the best looks of the night. #oscars https://t.co/ETjcWz8OBq
1099822331252346880	PublishFeed	2019-02-25 00:04:12+00:00	en	New post (NEW YORK | Regina King stuns in white and Glenn Close dons queenly gold) has been published on FeedPublish - https://t.co/O9j0EDDkjr https://t.co/Ctz1gKOsLl
1099822305956511744	PrinceEros_	2019-02-25 00:04:06+00:00	en	I love Regina King. She’s doesn’t get the legend title she deserves. 😍 @ReginaKing
1099822305436422146	McVibeMedia1	2019-02-25 00:04:05+00:00	en	Oscars: Jennifer Hudson, Nicholas Hoult, Regina King and more arrive on the red carpet #Oscars https://t.co/JIk3cbbk4X
1099822294514393088	Ivadale_2	2019-02-25 00:04:03+00:00	en	@OriginalFresca #reginaking looks amazing and hope she wins!
1099822251346665472	jalapenchlo	2019-02-25 00:03:53+00:00	en	@SamReedy1 Says you *regina king* Oh ItS mIcHeLlE oBaMa
1099822234565255168	marieclaire	2019-02-25 00:03:49+00:00	en	Regina King has ARRIVED! 🔥🔥🔥#Oscars https://t.co/L2gfqrDxm9
1099822230870114304	danideocampo	2019-02-25 00:03:48+00:00	en	🎭Mejor actriz  Glenn Close - The wife 🎭Mejor actor ➡️Rami Malek - Bohemian Rhapsody ➡️Willem Dafoe - At eternity's gate  🎭Mejor actriz de reparto ➡️Rachel Weisz - The Favorite Regina King - If Beale Street Could Talk 🎭Mejor actor de reparto Mahershala Ali - Green Book
1099822223886561280	OscardelaRenta	2019-02-25 00:03:46+00:00	en	Fit for a goddess. Best Supporting Actress nominee @ReginaKing is gorgeous in a custom gown at the 2019 #Oscars. https://t.co/7SYuDUJu0h
1099822188721594371	GigiMc102	2019-02-25 00:03:38+00:00	en	@OscardelaRenta Regina King!
1099822186477637632	clarbusta	2019-02-25 00:03:37+00:00	en	Oscars: Jennifer Hudson, Nicholas Hoult, Regina King and more arrive on the red carpet #Oscars https://t.co/w4LtDgXDGz
1099822184917360641	eumarcosmichel	2019-02-25 00:03:37+00:00	en	Regina King is the only one I want to see receiving her well-deserved prize tonight.
1099822181343789057	StephanieFierce	2019-02-25 00:03:36+00:00	en	I need Jennifer Hudson, Regina King  and Angela Bassett you all take a pic together tonight.
1099822175756918785	glassescully	2019-02-25 00:03:35+00:00	en	regina king invented being beautiful
1099822160548261888	Loliyah_P	2019-02-25 00:03:31+00:00	en	I always look forward to Regina King’s red carpet looks. So beautiful
1099809841948704768	eviIdead2013	2019-02-24 23:14:34+00:00	en	Regina King looks RADIANT. Truly gorgeous. #Oscars https://t.co/R6Ixy25DuO
1099822094395863048	newsdecide	2019-02-25 00:03:15+00:00	en	Regina King’s Dress at the 2019 Oscars Is Giving Angelina Jolie a Run For Her Money https://t.co/b1h8or9GA3 https://t.co/8E77opvDec
1099822055275429888	RushReads	2019-02-25 00:03:06+00:00	en	Regina King looks like a winner in white strapless Oscar de la Renta gown at 91st Academy Awards: The actress, 48, was the epitome of style in the strapless dress slit to the waist on one side. https://t.co/AEAB4Qjvtn https://t.co/jSVR5ME7h5
1099822047188971521	LHutnik	2019-02-25 00:03:04+00:00	en	E at the red carpet  Michelle Yeo and Regina King!  Wow!  Gorgeous gowns!  Glam, glam!
1099822046865874945	ymaaaanmadjilon	2019-02-25 00:03:04+00:00	en	Even though the film is problematic, it's still Green Book's Mahershala Ali that im rooting for best supporting actor.  For best supporting actress, I may want the two vying for the queen's Favourite: Emma Stone and Rachel Weisz to win. But IBSCT's Regina King may prob win. https://t.co/0oBM0gkUD4
1099822036791095296	jhavanis	2019-02-25 00:03:01+00:00	en	Favorite red carpet looks so far (from what I can see as I furiously scroll through my phone since I don’t have TV access for another hour): Emilia Clarke, Constance Wu, Regina King.
1099822021452673028	ericastrama	2019-02-25 00:02:58+00:00	en	THIS. @ReginaKing @OscardelaRenta #Oscars #bestdressed https://t.co/bSx4YG1ZSX
1099822017820401664	jessicamercer88	2019-02-25 00:02:57+00:00	en	@redcarpet @ReginaKing @OscardelaRenta She had one of the best dresses!
1099822002989400064	AnaLiviaJardine	2019-02-25 00:02:53+00:00	en	I'm so here for all the pink tule, women in suits and Regina King's dress. #Oscars
1099821990729396224	bigbabe2022	2019-02-25 00:02:50+00:00	en	Regina King looks looks gorgeous https://t.co/C1kT6ytJaD
1099821984391876610	SherryH75195074	2019-02-25 00:02:49+00:00	en	@tvonetv @ReginaKing BEAUTIFUL!!!!!!
1099821940305465345	kellyloumugg	2019-02-25 00:02:38+00:00	en	@redcarpet @ReginaKing @OscardelaRenta Perfection
1099821901931864065	DarCragg	2019-02-25 00:02:29+00:00	en	@redcarpet @ReginaKing @OscardelaRenta Hollywood class❤️
1099821899343790080	jkrishnaprasad_	2019-02-25 00:02:29+00:00	en	#Oscar2019 #AcademyAwards⁠ ⁠   Best actress in supporting role  - #RachelWeisz will win but would be great if #EmmaStone wins as well  3rd choice is #ReginaKing   #OscarPredictions2019
1099821887067181056	AleKrauseAlva	2019-02-25 00:02:26+00:00	en	@e_entertainment Regina King in a beautiful Oscar de la Renta white dress at Academy Awards. 👌🏻#BestDress #RedCarpet #AlfombraRoja #PremiosOscar
1099821879228067841	bloggingfilm	2019-02-25 00:02:24+00:00	en	Regina King looks wonderful, that dress is beautiful! #Oscars de la Renta https://t.co/uXPomCdhqW
1099821877130915840	KRMGtulsa	2019-02-25 00:02:23+00:00	en	Regina King stuns in white and Glenn Close dons queenly gold https://t.co/G2IcLbutta https://t.co/rcisX52k7h
1099821869442699264	NettaBear13	2019-02-25 00:02:22+00:00	en	Who I want to win vs Who will probably win:  Best Picture:   Black Panther - Bohemian Rhapsody  Best Actor:   Rami Malek - Rami Malek  Best Actress   Yaritza Aparicio - Glen Close  Supporting Actor    Mahershala Ali - Mahershala Ali  Supporting Actress   Regina King - Regina King
1099821866137604097	ThemFatale93	2019-02-25 00:02:21+00:00	en	An angel has entered the building #Oscars2019 @ReginaKing https://t.co/u8Fircnyvn
1099821847829307392	MorganicInk	2019-02-25 00:02:16+00:00	en	Regina King and Michelle Yeoh look like Christmas morning... gorgeous gifts for the eyes.  #Oscars
1099821829156425728	RamseyPetersson	2019-02-25 00:02:12+00:00	en	@ReginaKing  for the Win! #Oscars 🌟🏆
1099820531254206468	AP_Fashion	2019-02-24 23:57:02+00:00	en	.@ReginaKing brought Old Hollywood alive in romantic white, and Glenn Close was stunning in queenly gold on the #Oscars red carpet, writes @litalie. https://t.co/GvKZB5NsYi https://t.co/tQ7bFPiiv9
