1508338074043957248	ssteadman27	2022-03-28 06:59:55+00:00	en	@Independent Congratulations TROY KOTSUR for winning the best supporting actor and best film
1508338030603497473	atomicpopWI	2022-03-28 06:59:44+00:00	en	@TharushaGunawa4 It's a shame that's what people will likely remember from the night rather than celebrating Troy Kotsur winning Best Actor, or CODA for Best Picture.
1508337994855374848	Kazz08380108	2022-03-28 06:59:36+00:00	en	#Oscar Can we get a vehicle for Troy Kotsur and Youn Yuh-jung please? Maybe like a road trip movie? I’d watch that.
1508337932645535744	iambatgirl69	2022-03-28 06:59:21+00:00	en	Best Adapted Screenplay (@sianheder), Best Supporting Actor (@TroyKotsur) and Best Picture!!! #CODA https://t.co/nGTBi7QCRb
1508337865704497154	darceyxx	2022-03-28 06:59:05+00:00	en	#CODA is such a breathtaking film! I’m so happy Troy Kotsur 👏🏻
1508252932268994566	latimes	2022-03-28 01:21:35+00:00	en	Troy Kotsur is the first Deaf man to win an acting #Oscar! https://t.co/H0LMTK72EN
1508337438015602695	Gbkmnetwork	2022-03-28 06:57:23+00:00	en	See the full list of films and performances at the 94th Academy Awards, including Ariana DeBose, Jessica Chastain, Troy Kotsur, Will Smith, and CODA  Click https://t.co/EBBarIdNzc to read more.  #ag5 #arianagrandevocals #grammyawards
1508337431304572928	lwrcefilms	2022-03-28 06:57:21+00:00	en	troy kotsur had the best speech and deserved that oscar win
1508337419694837760	buzzpopnews	2022-03-28 06:57:19+00:00	en	Troy Kotsur is #trending on #Google today. Latest news... https://t.co/3q3mdxkopt
1508337361666523143	akhilkakkar	2022-03-28 06:57:05+00:00	en	Troy Kotsur is the true hero of this year's Oscars. #AcademyAwards #AcademyAwards2022  https://t.co/QFKdJlHL8y
1508337273175089162	ChuckUF06228465	2022-03-28 06:56:44+00:00	en	@IMDb @TroyKotsur @jes_chastain @ArianaDeBose It’s VERY telling that Smith is not in this photo! Despite his win, he embarrassed himself and his wife AND disrespected the Academy by disrupting the show with his assault on Chris Rock! Instead of taking the high road, he resorted to violence! He should be ashamed!
1508337197837037568	lishfejer	2022-03-28 06:56:26+00:00	en	In all the #Oscars heat .. the completely joyful #CODAfilm took out #BestPicture and @TroyKotsur, #BestActor. Here’s a chat on @abccanberra with the fabulous Brooke Pape from Canberra’s Deaf community around the film (&amp; she’s translated it into #Auslan 🧏‍♀️) https://t.co/oYzAhCV94s
1508337141595750402	TheElmoBird	2022-03-28 06:56:12+00:00	en	@Seanchuckle So you’d have to be an acting nominee (dream on Deakins), exceptions for a handful of auteurs (Tarantino, Spielberg). Have to be famous in America (Youn Yuh-Jung wouldn’t have got away with it). Would Troy Kotsur? Think the key is to be more famous than the host.
1508337079813558273	_JamesGtfo	2022-03-28 06:55:58+00:00	en	Good morning. I want to say a big congratulations to CODA on winning Best Pictures, Jessica Chastain, Will Smith, Ariana DeBose, Troy Kotsur and Jane Campion on their Oscar wins last night
1508337041955692549	Mascobot	2022-03-28 06:55:49+00:00	en	@EugenioDerbez @TroyKotsur @sianheder @DanielNDurant @EmiliaJonesy @MarleeMatlin Congrats @EugenioDerbez https://t.co/Y42Aju3F4A
1508336992018485248	KatiaYared	2022-03-28 06:55:37+00:00	en	@tim_cook @sianheder @TroyKotsur @MarleeMatlin @EmiliaJonesy @DanielNDurant @EugenioDerbez Eugenio Derbez, is not a source of pride for my country, Mexico.
1508336945834905606	TaintlessRed	2022-03-28 06:55:26+00:00	en	The most important thing at the Oscars was that CODA won best film and Troy Kotsur won the best supporting actor award. Tremendously important moment for the deaf community. Lovely film. Unfortunately all the headlines are about Smith's slap.
1508336940960997377	Amlaf3	2022-03-28 06:55:24+00:00	en	@TroyKotsur @ATVPlusNews @AppleTVPlus @AppleTV @MarleeMatlin @DanielNDurant @EugenioDerbez @EmiliaJonesy @DeafWest Congratulations! You and #CODA deserve everything! Amazing film and performances. Loved every moment.
1508336892273733639	_mobolaji_	2022-03-28 06:55:13+00:00	en	After watching Troy Kotsur win the SAG Award, I’m happy he won the OSCARS too
1508336856093581316	FeminaIndia	2022-03-28 06:55:04+00:00	en	“CODA” becomes the first film with a predominantly Deaf cast to win #BestPicture , star Troy Kotsur is the first Deaf male actor to win an #Oscar, Siân Heder wins Best Adapted Screenplay, Apple becomes the first streaming service honored with Best Picture at the #AcademyAwards. https://t.co/PYgZquqb6b
1508336771498606596	rachief9	2022-03-28 06:54:44+00:00	en	I’m soooo happy #CODA won #BestPicture #Oscars well deserved congratulations to @TroyKotsur 👏🏼 loved this movie! https://t.co/j1RBKdVzoE
1508336596260732928	sven_niklas	2022-03-28 06:54:02+00:00	en	#Coda #Oscar Congratulations to the whole cast of #CODAfilm especially to @TroyKotsur @MarleeMatlin and @DanielNDurant who made an amazing job with this movie on @AppleTVPlus. More awareness to the deaf community including the #Coda community. Celebrate your wonderful success 🤟🏻
1508336558897737730	ijuno_admr	2022-03-28 06:53:53+00:00	en	Of crs congratulations to Troy Kotsur too ❤
1508336490887143426	KatiaYared	2022-03-28 06:53:37+00:00	en	@tim_cook @sianheder @TroyKotsur @MarleeMatlin @EmiliaJonesy @DanielNDurant @EugenioDerbez No, he was always doing sexist, misogynistic, classist, racist, homophobic and transphobic "comedy" in Mexico.  This is not a national pride, just by doing a speech analysis, he is still the nefarious comedian ever.  So, yes, he always was and remains the same.
1508336490291482629	CarryFaze	2022-03-28 06:53:37+00:00	en	@awesomeVY @tim_cook @sianheder @TroyKotsur @MarleeMatlin @EmiliaJonesy @DanielNDurant @EugenioDerbez wasn't chris going to announce coda's oscars tho or smtn
1508336302722359297	axialcut	2022-03-28 06:52:52+00:00	en	Congratulations to Will Smith, Jessica Chastain, Troy Kotsur and Ariana DeBose on winning Best Actor, Best Actress, Best Supporting Actor and Best Supporting Actress respectively at the 2022 #Oscars https://t.co/JE7bhFGDOw
1508336300767997952	ThePynr	2022-03-28 06:52:52+00:00	en	Oscars 2022: Deaf actor Troy Kotsur makes history, Ariana DeBose wins supporting actress https://t.co/KjyjpqMb2P   #Oscars2022  #CODAfilm #Hollywood
1508336197483081731	NeilLumbard	2022-03-28 06:52:27+00:00	en	Troy Kotsur Makes Oscars History As First Deaf Man To Win https://t.co/bdQrhloTpX
1508336088649248769	SpeechTrans	2022-03-28 06:52:01+00:00	en	#breaking Troy Kotsur Troy Kotsur Becomes First Deaf Man to Win an Acting Oscar,CODA&amp;#39;s Troy Kotsur is now the first Deaf man to win an Oscar for ... This is dedicated to the deaf community, the CODA community and the disabled community,” he said in his acceptance speech, deli
1508335940137222144	alonsonm	2022-03-28 06:51:26+00:00	en	Will Smith ruined everyone’s #Oscar night: no one will be talking about Jessica Chastain, Ariana DeBose’s emotive speech, Beyoncé’s incredible performance, Troy Kotsur and disability representation in the media…
1508335904980619269	adabagcompany	2022-03-28 06:51:17+00:00	en	2022 Oscars: Best Supporting Actor Winner and Best Picture – Troy Kotsur, ‘CODA’ https://t.co/kbziXJEqMv
1508335538486800386	aliahsan0304	2022-03-28 06:49:50+00:00	en	For the 1st time ever, all my favorites won in major categories.. Yoohhoooo!!! #Oscars #WillSmith #JessicaChastain #ArianaDeBose #TroyKotsur #JaneCampion #CODAfilm https://t.co/CWb8B3p6KR
1508335352947175428	aliciaplasc	2022-03-28 06:49:06+00:00	en	@GMA @TroyKotsur king!!! so well deserved
1508335244675633157	MrFrewster	2022-03-28 06:48:40+00:00	en	Congratulations @TroyKotsur &amp; all of #CODA  #Oscar
1508335188862021636	QM79	2022-03-28 06:48:27+00:00	en	👋 Delighted to see the Oscars go to @TroyKotsur and Coda.
1508255251958218755	ABC	2022-03-28 01:30:48+00:00	en	"This is dedicated to the deaf community, the 'CODA' community, and the disabled community. This is our moment!"  @TroyKotsur is the first deaf man to win an Academy Award for acting.   Here is his acceptance full speech.  https://t.co/TZLBRpIUHo #oscars https://t.co/PARdxIzP1M
1508335135338467329	beccytad	2022-03-28 06:48:14+00:00	en	This is just the best news to wake up to today! So so so so proud. Deaf culture, language, heritage, talent all being recognised, accepted and appreciated 🙌🏻🙌🏻🙌🏻Massive, massive congratulations @TroyKotsur you totally deserve this for your amazing performance on #CODAfilm 🙌🏻🙌🏻
1508284951506165761	nowthisimpact	2022-03-28 03:28:49+00:00	en	Troy Kotsur received a standing ovation at the 94th Academy Awards after he became the first deaf male actor to ever win an Oscar — watch his acceptance speech #Oscars https://t.co/f8753VxLh0
1508335087137574913	BenJohnson2018	2022-03-28 06:48:02+00:00	en	Well done CODA, @sianheder, @TroyKotsur, and the entire team. So proud of you and what you accomplished. Story is king. https://t.co/3ZCPEXhUia
1508335037019734018	latstbollywood	2022-03-28 06:47:50+00:00	en	Troy Kotsur Wiki:- Troy Kotsur is a well known American actor and filmmaker. He won many awards in his careers such as Academy Award, British Academy Film Award, a Screen Actors Guild Award, and a Critics' Choice Award, making him the first deaf male  https://t.co/xwE21P1mnZ https://t.co/fW3ABzX78O
1508334972910055426	mediaindiagroup	2022-03-28 06:47:35+00:00	en	#CODAfilm about child of deaf adults wins best film at #Oscars2022, beating #ThePowerOfTheDog &amp; #Belfast. Coda director &amp; screenplay writer #SianHeder gets #Oscar for adapted screenplay &amp; @TroyKotsur best supporting actor. Director Jane Campion wins @TheAcademy for @TPOTD. #MIG https://t.co/Xe7mBG1qqG
1508334925044326403	CohenD	2022-03-28 06:47:24+00:00	en	And the amazing @TroyKotsur ?https://t.co/rXqfXQyVJi
1508334415751290882	booksmoviesph	2022-03-28 06:45:22+00:00	en	Troy Kotsur made history Sunday as the first deaf male actor to earn an Oscar, winning over voters with a funny, assured and authentic turn as the father of a loving family in the heartfelt indie drama "CODA." #TroyKotsur #CODA #Oscars  https://t.co/Mh2LoXmyg3
1508334368330297345	Gertvm1	2022-03-28 06:45:11+00:00	en	@AppleTVPlus @TroyKotsur Apple TV + with Coda 👍🏼👍🏼👍🏼
1508334287052935173	poppyfitch	2022-03-28 06:44:52+00:00	en	Congratulations to #CODAfilm for the well earned wins at the #Oscars￼ #BestPicture “This is dedicated to the deaf community, the Coda community and the disabled community. This is our moment.” ❤️@TroyKotsur @sianheder #DisabilityTwitter https://t.co/YFMTyeNTMC
1508334174909841413	JosephCalderonM	2022-03-28 06:44:25+00:00	en	@marcopacherre @tim_cook @sianheder @TroyKotsur @MarleeMatlin @EmiliaJonesy @DanielNDurant @EugenioDerbez It’s possible butt… you can see the movie in prime video; right now.
1508334023504023556	BKarkouch	2022-03-28 06:43:49+00:00	en	Troy Kotsur Makes Oscar History as First Deaf Male Winner, Dedicates Emotional Speech to Father  https://t.co/712fqLVCi1
1508334002477813761	llouiiee29	2022-03-28 06:43:44+00:00	en	Troy Kotsur won the Oscar’s today https://t.co/Kbw1WZGLXR
1508333876699181059	INPrimeMinister	2022-03-28 06:43:14+00:00	en	Ukraine leader demands Western nations give arms, asks if they re afraid of Moscow - Follow/RT/Fav - Canada : #Oscars : Will Smith : Chris Rock : Wordle 282 X : Dune : Lakers : BeyoncÃ© : Troy Kotsur : Zendaya : https://t.co/0pGpfLlr5b
1508333782998343686	nunyavi	2022-03-28 06:42:52+00:00	en	Troy Kotsur wins assisting actor Oscar for 'CODA'  https://t.co/H1gZrOYVgH
1508333688567783424	karistbh	2022-03-28 06:42:29+00:00	en	troy kotsur winning best supporting actor too!!! 🥺
1508333688072773633	CarmenLane	2022-03-28 06:42:29+00:00	en	@guardiannews @TroyKotsur 👋👋👐💞🤟well deserved! Outstanding performances 🏆 Loved CODA! 🎬💕 https://t.co/CyjrbzjeWy
1508333671593426946	jagrlemieux	2022-03-28 06:42:25+00:00	en	@jupitergirl @MovieMantz @AppleTVPlus @MarleeMatlin @TroyKotsur @EmiliaJonesy @DanielNDurant @sianheder Groan.
1508333576886046722	jagrlemieux	2022-03-28 06:42:02+00:00	en	@PieHardx13 @MovieMantz @AppleTVPlus @MarleeMatlin @TroyKotsur @EmiliaJonesy @DanielNDurant @sianheder Nope.
1508333551963582468	PresshubU	2022-03-28 06:41:56+00:00	en	CODA ‘Coda’ star Troy  #Kotsur is second deaf performer to win an Oscar https://t.co/txkfXxFA0R
1508333525124141057	silverscreenin	2022-03-28 06:41:50+00:00	en	The wins of #CODA, #ArianaDeBose, #TroyKotsur, and #JaneCampion marked a few firsts at the 94th edition of the Oscars. Check out more.  #Oscars  https://t.co/j0KW1noCpM
1508333453435187200	jagrlemieux	2022-03-28 06:41:33+00:00	en	@MovieMantz @AppleTVPlus @MarleeMatlin @TroyKotsur @EmiliaJonesy @DanielNDurant @sianheder Bummer.
1508333350330990592	KevinMRocks	2022-03-28 06:41:08+00:00	en	@tim_cook @sianheder @TroyKotsur @MarleeMatlin @EmiliaJonesy @DanielNDurant @EugenioDerbez Almost missed the win, was too busy on Twitter for obvious reasons  #Congrats
1508333285029539840	VictoriaTheo	2022-03-28 06:40:53+00:00	en	@codamovie won!! Congratulations to @sianheder @troykotsur and everyone who participated in this beautiful film. Thank you @mariusdevries for having me play your gorgeous score &amp; @fioramusic for booking me!  #CodaMovie #BestPictureAcademyAwards #AcademyAwards #Oscar #pianist https://t.co/vAAGA7MkS4
1508333198106890255	Dev_Discourse	2022-03-28 06:40:32+00:00	en	Oscar 2022: Troy Kotsur, the first deaf man wins supporting actor award for ‘CODA’ https://t.co/1y51TEABbO
1508333125323137033	RoomsofRealitea	2022-03-28 06:40:15+00:00	en	Congratulations to Troy Kotsur on his Historic Oscar win #Oscar2022 #CODA #OSCARS #TroyKotsur #theoscars https://t.co/9dPH4kUK7v
1508332935140761600	keith_wilson	2022-03-28 06:39:29+00:00	en	A thoroughly deserved win for #Coda and Troy Kotsur at the Oscars. Just a pity it was overshadowed by Will Smith’s outburst.
1508332920687185922	LatestN72062740	2022-03-28 06:39:26+00:00	en	Troy Kotsur’s moving Oscar win brings audience to their feet with silent applause https://t.co/N5DI7wXAgJ
1508332793385795584	StevenJTingus	2022-03-28 06:38:56+00:00	en	#Oscars2022  Congratulations to @TroyKotsur for his Supporting Actor win and @codamovie as Best Picture in breaking the glass ceiling for the #deaf and #disability community here in #Hollywood !!! 🙏🏽🎬♿️ @TheAcademy  https://t.co/3GxFvXjbBi https://t.co/qR3Xk5Xz4Q
1508332687995682820	RenaHar22994053	2022-03-28 06:38:30+00:00	en	@jabaarmohamed @TroyKotsur @VendomePictures @themandalorian @MarleeMatlin Congratulations!  I watched My deaf son, age 42, an advocate for the Deaf community, tearing up while you accepted  your award…critical moment for many.  Thank you!
1508332622283485185	INPrimeMinister	2022-03-28 06:38:15+00:00	en	Ranil calls for immediate debate in Parliament on IMF report - Follow/RT/Fav - Canada : #Oscars : Will Smith : Chris Rock : Wordle 282 X : Dune : Lakers : BeyoncÃ© : Troy Kotsur : Zendaya : https://t.co/qrTKQZ8Vgb
1508332593686761475	cybrum	2022-03-28 06:38:08+00:00	en	1st queer woman of colour @ArianaDeBose for West Side Story 1st deaf actor @TroyKotsur for Coda Only the 5th African-American best actor The legendary Liza Minnelli &amp; Lady Gaga being awesome Timothee Chalamet looking fierce These are the stories overnight from the Academy Awards.
1508332880036270083	Rohan_Sandhu	2022-03-28 06:39:16+00:00	en	Film Twitter, don’t fall into the trap of making these #Oscars all about Will Smith/Chris Rock. Lots to celebrate: - the heartwarming moment when Youn Yuh-jung handed the award to Troy Kotsur - those #TheGodfather50, #PulpFiction moments - the diversity among the acting winners
1508332109693394945	MetroUK	2022-03-28 06:36:13+00:00	en	Actress in a Supporting Role 🏆 Ariana DeBose - West Side Story  Actor in a Supporting Role 🏆 Troy Kotsur - Coda  Directing 🏆 Jane Campion - The Power of the Dog https://t.co/41iFFXXuUO
1508332016776867841	mpostdigital	2022-03-28 06:35:50+00:00	en	Troy Kotsur becomes second deaf actor to win Oscar trophy https://t.co/LlhYU2oZ6J
1508331997868953601	irampbilal	2022-03-28 06:35:46+00:00	en	And for sure @TroyKotsur’s heartfelt speech.
1508331962854912001	bigpphatdaddy	2022-03-28 06:35:38+00:00	en	@OnTheRedCarpet @TroyKotsur Yeah! Go Mesa Guy!
1508331838216933376	failsafe_seth	2022-03-28 06:35:08+00:00	en	In all seriousness, congrats to #CODA for winning best picture (and adapted screenplay), and that speech from Troy Kotsur for best supporting actor.  If you haven't seen the movie yet, see it as soon as you can.
1508331712396226560	KBSKorea24	2022-03-28 06:34:38+00:00	en	And finally, #actress Youn Yuh-jung once again moved #TheAcademy Awards audience after she presented the best-supporting actor award to Troy Kotsur of #CODA - the first #deaf male actor to win an acting #Oscar - using #AmericanSignLanguage (#ASL). #아카데미시상식 #윤여정 #수화
1508331653302734848	AFelipeAmaya	2022-03-28 06:34:24+00:00	en	@ShawnChapek1 I laughed my ass off seeing that and the Justice League one. My God, what a stupid ass poll. I muted it after that second poll result, went online and rewatched Troy Kotsur’s win.
1508331538655625218	LaceePants	2022-03-28 06:33:56+00:00	en	@tim_cook @AppleTV @sianheder @TroyKotsur @MarleeMatlin @EmiliaJonesy @DanielNDurant @EugenioDerbez Can we look forward to a physical media release on CODA? I would love to see a bluray packed with special features. Commentaries, behind the scenes, interviews, all of it.
1508331477209071619	RupertRoniger	2022-03-28 06:33:42+00:00	en	Congrats to @TroyKotsur - Best Supporting Actor in 'Coda' at #Oscars2022. Makes history as first Deaf man to win an Oscar. Director Heder cast all of the deaf characters with deaf actors.   https://t.co/9aRVWlvElV @WFDeaf_org @MyEDF @IDA_CRPD_Forum @ColinAllenAM @GallaudetU
1508331395831148547	republic	2022-03-28 06:33:22+00:00	en	At Oscars, hearing impaired 'CODA' star Troy Kotsur scripts history; gets silent applause https://t.co/AuE1LUB1ai
1508331375614648320	TAMUTurtle	2022-03-28 06:33:18+00:00	en	…And the moment when the #Oscars forgot to take into account that Troy Kotsur, a deaf actor, would need someone to hold his Oscar in order for him to sign his acceptance speech. https://t.co/FLkYTCIi8X
1508331352730570754	chr1shuang	2022-03-28 06:33:12+00:00	en	@TheAcademy @TroyKotsur What does Youn Yuh-Jung say audibly before reading Kotsur’s name? She apparently says “congratulations. I love you” in ASL
1508331304898764804	KSPerforms	2022-03-28 06:33:01+00:00	en	@SAGawards @jes_chastain @ArianaDeBose @TroyKotsur @TheAcademy does SAG condone violence??
1508331288066994178	AKlay19	2022-03-28 06:32:57+00:00	en	Some #Oscars takes:  Good: Jane Campion Will Smith (Except for, you know) Jessica Chastain Troy Kotsur Ariana DeBose DUNE CRUELLA  Bad: BELFAST and CODA in Original and Adapted Screenplay (there were much better options in both categories)  Wow: CODA in Picture (Defying all odds)
1508289971471405056	NextBestPicture	2022-03-28 03:48:46+00:00	en	Here are the #Oscar winners of the 94th #AcademyAward  #Oscars  #Oscars2022 #Awards #AwardsSeason #Movies #Film #Cinema #Streaming #FilmTwitter https://t.co/SdQz69uCfp
1508331038401265669	pluc_tv	2022-03-28 06:31:57+00:00	en	#CODA's Troy Kotsur is now the first deaf man to win an #Oscar  #CODAfilm #TroyKotsur #Oscars #Oscars2022 #AcademyAwards https://t.co/2339IMKQZr
1508330905253052417	jojojamantocjr	2022-03-28 06:31:25+00:00	en	movie: Comedy👍👌 CODA. 2021 Ruby is the only hearing member of a deaf family from Gloucester, Massachusetts. At 17, she works mornings before school to help her parents Emilia Jones (Ruby Rossi); Marlee Matlin (Jackie Rossi); Troy Kotsur (Frank Rossi); Daniel Durant (Leo Rossi) https://t.co/9JAlc4myQk
1508330886764314638	WitnessDaily_	2022-03-28 06:31:21+00:00	en	CODA star Troy Kotsur makes history as the first deaf actor to win Best Supporting Actor Oscar - https://t.co/XmeaBV7heL
1508330860684378112	246muskan	2022-03-28 06:31:15+00:00	en	@himanshukr2010 @TheAcademy @sianheder @TroyKotsur @EmiliaJonesy @EugenioDerbez This film belongs to France that's why I wrote french
1508330749186949121	guardiannews	2022-03-28 06:30:48+00:00	en	Troy Kotsur wins best supporting actor Oscar for Coda https://t.co/0fYLGRbw8c
1508330729352019971	sanatksenapati	2022-03-28 06:30:43+00:00	en	Youn Yuh-jung presenting the award to Troy Kotsur is the best and sweetest moment of #Oscars 2022.  I hope they invite her to present again next year!
1508256321270734851	BuzzFeed	2022-03-28 01:35:03+00:00	en	she held the oscar so he could sign 🥺😭 #Oscars #Oscars2022 https://t.co/rzSDRLfL5n
1508330365777334277	Big_City_Radio	2022-03-28 06:29:17+00:00	en	CODA star Troy Kotsur makes history as the first deaf actor to win Best Supporting Actor Oscar https://t.co/Wn6V8ek1OP
1508330302657433602	girishjohar	2022-03-28 06:29:02+00:00	en	Troy is the first deaf male actor ever to win an #Oscar Inspiration to all. Impossible is possible !! #CODA @TroyKotsur  #Oscars2022 https://t.co/TX5xuWo4fW
1508330088571420673	SundharesanSrs	2022-03-28 06:28:11+00:00	en	Congratulations to Troy Kotsur on his Best Supporting Actor #Oscars win!  He is the first deaf actor to ever win an Academy Award and the second deaf person to take home the trophy in an acting category. https://t.co/h6arbR6EiV
1508329594906152960	TodayFM	2022-03-28 06:26:13+00:00	en	🎞 Best Actor in a Supporting Role  Troy Kotsur – CODA  #Oscars2022 https://t.co/t4ct58xuht
1508329581786193923	omalleyrob	2022-03-28 06:26:10+00:00	en	@SAGawards @jes_chastain @ArianaDeBose @TroyKotsur @TheAcademy Read the room
1508329401120743425	Pacotakua	2022-03-28 06:25:27+00:00	en	@EugenioDerbez @TroyKotsur I have faith that sooner or later you’ll end up in jail along with your uncle. “There are no impossibles but only possibles”
1508329352534052865	DeafinitelyT	2022-03-28 06:25:15+00:00	en	Beautiful and heartfelt speech @TroyKotsur you done @DeafinitelyT very proud and believe we all actors can do a big achievements! A great role model. Big big big congratulations!!! 💗🥰💗
1508284951506165761	nowthisimpact	2022-03-28 03:28:49+00:00	en	Troy Kotsur received a standing ovation at the 94th Academy Awards after he became the first deaf male actor to ever win an Oscar — watch his acceptance speech #Oscars https://t.co/f8753VxLh0
1508329255352086541	ElsaKeslassy	2022-03-28 06:24:52+00:00	en	@BenoitSauvage @ArdavanSafaee @PhilRousselet @MarleeMatlin @TroyKotsur @TheAcademy @EugenioDerbez @sianheder @EmiliaJonesy @PatheFilms @DEADLINE @DeadlineNancy Amazing!!! 🇫🇷🎉👏😍
1508329167817003012	BiersElisabeth	2022-03-28 06:24:31+00:00	en	@etalkCTV @CTV @TroyKotsur I saw this movie when it first appeared on Apple TV and it was such a heart warmer. I loved it.
1508329131553042435	satellitecherry	2022-03-28 06:24:23+00:00	en	idc abt will smith and chris rock. i wanna  talk about the history made tonight. ariana debose being the first queer woman of colour to win an oscar, troy kotsur being the first deaf actor to win an oscar. the best picture tonight was won by a movie with disability. That matters.
1508329112418480134	marylinbitner	2022-03-28 06:24:18+00:00	en	History was made tonight at the  #Oscars2022 , when Troy Kotsur won . He is the first deaf actor to win an Academy Award. The film that he won it for #CODA , took home the #BestPicture award. A beautiful story about love.This is the imp moment from tonight’s Awards show
1508286508821852174	ABC	2022-03-28 03:35:00+00:00	en	BREAKING: @TheAcademy Award for Best Picture goes to #Coda.  #CodaFilm #Oscar #Oscars https://t.co/pJa5oWlPGw https://t.co/urefeyW2tH
1508328918780063747	MeganThompson	2022-03-28 06:23:32+00:00	en	I really hate that there’s a thousand think pieces being written about the Rock Smith hit and not about Troy Kotsur and Questlove right now. 😒
1508328668166500357	filmqAU	2022-03-28 06:22:32+00:00	en	Oscar goes to  Ariana DeBose (West Side Story) - Supporting actress Jessica Chastain (The Eyes of Tammy Faye) - Actress Troy Kotsur (Coda) - Supporting actor Will Smith (King Richard) - Actor Dune - Film editing,  production design,  visual effects Cruella - Costume design https://t.co/odA8DvHroZ
1508328657554898946	imjaycee87	2022-03-28 06:22:30+00:00	en	@jasminelep I mean, the guy btw is Troy Kotsur
1508328635559780362	iamanomad	2022-03-28 06:22:24+00:00	en	@Trevornoah And every single person and publication in Hollywood is talking about the “slap heard round the world.” Not one single one of you is giving any press to “Coda” or Jessica Chastain, or Troy Kotsur, or Ariana DeBose, or Jane Campion. Nope. It’s all Will all the time! He ruined it!
1508328621840248836	rowbar	2022-03-28 06:22:21+00:00	en	What an incredible moment. Congrats Troy Kotsur on becoming the first deaf man to win Best Supporting Actor - brilliant for deaf representation and more inclusivity in Hollywood. #CODA #Oscars
1508255144395390981	enews	2022-03-28 01:30:23+00:00	en	"Look at me now, I did it. I love you." 🤟 Troy Kotsur has made history as the first deaf male actor to win an Oscar, and the crowd signed their applause. #Oscars https://t.co/ejkCMrKylW
1508328560196345858	cazarespr	2022-03-28 06:22:06+00:00	en	The Will Smith drama took away the spotlight from other special Oscar winners:  1st #AfroLatino &amp; openly #queer: Ariana DeBose  1st #deaf man: Troy Kotsur  Best actress Jessica Chastain, playing a televangelist who promoted the acceptance of the #LGBTQ community ￼ https://t.co/bjag1mO8Oi
