1635173473340502016	gosaliya_ashik	2023-03-13 06:58:30+00:00	en	@HuXijin_GT Hey Hu, going crazy by obtruding in an unwelcoming celebration?  The lady doesn't even speak Mandarin or Cantonese. Besides, she is Malaysian &amp; not Chinese  So, fentanyl gave you this excitement?  Lemme remind you, Asia is not China. Stop claiming credit everywhere
1635518841907478528	iamthebrian_	2023-03-14 05:50:53+00:00	en	The past week Michelle Yeoh becomes one of the most prominent female artists in Asia - Govt criticised for not supporting the film industry  - Yeoh criticised for being part of the criminal dynasty  Muhyiddin Yassin  - Facing criminal charges - Refuses to admit to crime
1635273850111008768	lim_weijiet	2023-03-13 13:37:22+00:00	en	6. But I saw Michelle Yeoh's mother today celebrating &amp; proudly cheering "Malaysia Boleh!". Indeed, Michelle Yeoh herself has always reminded people of her Malaysian roots. https://t.co/ICzwrNSK13
1635518736701718528	JamesCStewartNZ	2023-03-14 05:50:27+00:00	en	So happy to see the success of Everything Everywhere All At Once! What a deserving Oscar winner for Michelle Yeoh! As well as Ke Huy Quan and @jamieleecurtis. Such a magical film. Well done to the Daniels and everyone involved. Every Oscar was truly well deserved! #Oscars2023 https://t.co/y6k34HXdRn
1635518436049846277	gonjunghive	2023-03-14 05:49:16+00:00	en	and after this y’all gonna see pann post abt Korean men whining bcs we drag them down for editing Michelle yeoh’s speech
1635518388473835520	slowstabs	2023-03-14 05:49:04+00:00	en	@pprxteam MIchelle Yeoh the goat. She's literally been a goat in a dimension
1757984327822868808	Shopify	2024-02-15 04:25:00+00:00	en	Ready to boost your business? Sign up for a free trial with Shopify and start your journey today.  Shopify’s Smart Order Routing is a powerful tool that helps you optimize your fulfillment process, reduce shipping costs, and deliver products faster to your customers.
1635518350607409154	GeeGammy	2023-03-14 05:48:55+00:00	en	I had goose pimples watching the #Oscars yesterday on @CNN. Congratulations 👏🎉 to the organizers. Ditto the winners 🏆: Brenda Fraser (Best Actor), Michelle Yeoh (Best Actress), Ké Guy Quan (Best Supporting Actor),...  #Oscars  #Oscars95
1635518082964676608	poppynhi	2023-03-14 05:47:52+00:00	en	Not only the graphic novel of my youth is finally getting adapted into a series, we get the family from Everything Everywhere All at Once in the cast. This is amazing. I am so happy for Michelle Yeoh, Stephanie Hsu, Ke Huy Quan and James Hong. I am happy for Gene Luen Yang.
1613959273733849088	DisneyPlus	2023-01-13 18:00:51+00:00	en	A journey that spans generations and transcends genres.  Michelle Yeoh, Ke Huy Quan, Ben Wang, Jim Liu, and Daniel Wu star in #AmericanBornChinese, an Original series coming to #DisneyPlus this spring. https://t.co/1qpx7AgYfU
1635517914110369792	THEOFFICIALB4U	2023-03-14 05:47:11+00:00	en	After Michelle Yeoh picked up the Oscar for Best Leading Actress, Indian actor Harsh Varrdhan Kapoor was trolled for his now-deleted tweet  #HarshVarrdhanKapoor #EverythingEverywhereAllAtOnce #MichelleYeoh #Oscars #Oscars2023 #Oscars95   Read more https://t.co/4CfAYEKm9I
1635517628218482688	tanerarchibald	2023-03-14 05:46:03+00:00	en	@nomandatesco To highlight the only good things from it: Jamie Lee Curtis won an Oscar, Ke Huy Kwan won an Oscar for his first acting work in twenty years. Michelle Yeoh won best actress. Just watch Everything,Everywhere, All at Once. It’s a masterpiece
1692608696356848124	NittoTire	2023-08-18 18:45:35+00:00	en	Nitto Ridge Grappler Hybrid-Terrain Light Truck Tire.  Perhaps the best compromise between the raw performance of a mud-terrain, and on-road manners of an all-terrain.
1635517610371497986	donnaproduction	2023-03-14 05:45:59+00:00	en	@admiralmpj Well, I've been to Singapore several times, and they eat just like anybody else. Maybe your "real" dream is for Michelle Yeoh to take you in her arms!
1635517569741344769	ahmed1shousha	2023-03-14 05:45:49+00:00	en	Remembering #JamieLeeCurtis always braise that #MichelleYeoh is the reason to call her #AcademyAwards    Nominee  for the rest of her life. Now she is an Academy Award Winner https://t.co/iW9qGwKRn0
1635517458420502528	_ReportWire	2023-03-14 05:45:23+00:00	en	Michelle Yeoh’s mom tearful, proud of ‘little princess’ https://t.co/AK82GSQ5P0
1635517433003016197	DennisKoch10	2023-03-14 05:45:17+00:00	en	Star Trek Celebrates Michelle Yeoh's Best Actress Oscar Win  Following Michelle Yeoh's Academy Award for Everything Everywhere All At Once, Star Trek congratulates the Best Actress winner. https://t.co/7KE28ckFHZ
1755225932174852402	MottandBow	2024-02-07 13:44:07+00:00	en	Easy and stylish. That’s what jeans should be, in our opinion, which is why that’s exactly how we created them. Throw them on in the morning for a put together yet hassle-free look, and let them elevate your everyday wardrobe.
1635517427588153347	anoeosman	2023-03-14 05:45:15+00:00	en	Everything Everywhere All At Once is literally full of lgbt references compared to Thor Love and Thunder. and it was okay to screen it here? what about scream 6? do we need to edit Michelle yeoh into the movie for it to be screen here? #MalaysiaBoleh
1635517362093826050	Koreaboo	2023-03-14 05:45:00+00:00	en	SBS Under Massive Fire For Censoring Michelle Yeoh’s Acceptance Speech — Responds To Allegations Of Misogyny  https://t.co/VwxtGfBjg2
1635517156820434945	RejasPercy	2023-03-14 05:44:11+00:00	en	@NikkiSixx @Rocknrollgirl92 Hi Nikki, greetings from Peru 🇵🇪 is it true that Michelle Yeoh appears in the video Too young to Fall In Love? Thank you.
1635517066227900417	chelsieellise	2023-03-14 05:43:49+00:00	en	After a long procrastination, i’ve finally watched michelle yeoh’s movie
1635517004542099456	FeithErnstjan	2023-03-14 05:43:34+00:00	en	MICHELLE YEOH wins BEST ACTRESS for EVERYTHING EVERYWHERE ALL AT ONCE | 2023 Oscars https://t.co/npV002Ou9x
1635517001182633984	zapzee_news	2023-03-14 05:43:34+00:00	en	SBS Under Fire After Intentionally Deleting “Ladies” in Michelle Yeoh’s Acceptance Speech https://t.co/TmAn8U5ZCU #LikeAMovie #MichelleYeoh #movie #Oscars
1635516754511409152	localshabba	2023-03-14 05:42:35+00:00	en	they're really out here saying "congrats to michelle yeoh (who happens to be from one of the many countries we colonized) 🥰" im speechless
1635411058423922688	RoyalFamily	2023-03-13 22:42:35+00:00	en	Congratulations to Michelle Yeoh (and her family watching at home in Malaysia) on her historic Oscar win on #CommonwealthDay!
1711803314424480070	Shopify	2023-10-10 17:58:08+00:00	en	Ready to boost your business? Sign up for a free trial with Shopify and start your journey today.  Shopify’s Smart Order Routing is a powerful tool that helps you optimize your fulfillment process, reduce shipping costs, and deliver products faster to your customers.
1635516748786171904	macturijatweets	2023-03-14 05:42:33+00:00	en	And did you know that Michelle Yeoh is the 2nd Miss World contestant to have won an Oscar for Best Actress? Michelle competed in Ms. World 1983 and won the Academy in 2023, while Halle Berry represented USA in Ms. World 3 years later and won the Oscar for Best Actress in 2002. https://t.co/rbq9woHuwI
1635516667425079297	yeet_baron	2023-03-14 05:42:14+00:00	en	When you wake up and remember its Academy Award winner Michelle Yeoh and Academy Award winner Ke Huy Quan now &gt;&gt;&gt;&gt;&gt; https://t.co/cYeDc1qDlj
1635516558964412417	unrulykush	2023-03-14 05:41:48+00:00	en	Check out alx  it's free Sanam Lineker MOTD Trossard Klay Anthony Taylor Hugh Grant Cheltenham Casemiro Ke Huy Quan RIP Gaz Jamie Lee Curtis HSBC Equality Constitution Hill Michelle Yeoh Refuge Giannis Gary Glitter The BBC Silicon Valley Bank Tatum Coffee Everything Everywhere
1635147064937168897	Kuimashaah	2023-03-13 05:13:34+00:00	en	AlX which is fully sponsored and the intake is still ongoing.Register here https://t.co/6cDuOVMn6K https://t.co/KtkUxuEIwL
1635516509043949568	Level20EastGuy	2023-03-14 05:41:36+00:00	en	Aussie press trying to somehow make an Australian connection to Michelle Yeoh. Turns out that she was once crowned as Miss Moomba! Imagine that! A Miss Moomba. https://t.co/uS2kPEMr5l
1692633990073643100	NittoTire	2023-08-18 20:26:05+00:00	en	Like all Grapplers, Nitto Ridge Grappler features dual sidewall design so that you can choose the side that best fits your vehicle.
1635516494493945857	palaceintrigue1	2023-03-14 05:41:33+00:00	en	UK Royal Family congratulates Michelle Yeoh for historic Oscar win on Commonwealth Day https://t.co/UeoY4VA6C2 #royalfamily
1635516494389051393	TerbaikPenang	2023-03-14 05:41:33+00:00	en	@anwaribrahim Tahniah TS MICHELLE YEOH.proud of you☺ #MalaysiaMadani #KerajaanPerpaduan #PManwarIbrahim
1635516452546674688	estheryangny	2023-03-14 05:41:23+00:00	en	‘Ladies, don’t let anybody ever tell you that you are past your prime’ - Michelle Yeoh.” #MichelleYeoh https://t.co/aBPykQjAmL
1635516413761949696	Trendin25843381	2023-03-14 05:41:14+00:00	en	💋Most Luxurious Beach Club in the world Watch the video: https://t.co/YPQHPIQ7MI #tujoothimainmakkaar #RohitShetty  #DeepikaPadukone #MichelleYeoh #BBTitans #TrendingNow #youtube #crufts2023 #daterush #DateRushReunion #Oscars #OMRCSA #Oscars2023 #Oscar #KsBharat #SalmanKhan𓃵 https://t.co/DhnwQhw4rn
1761802990095102322	bankpdftocsvxls	2024-02-25 17:19:00+00:00	en	Convert bank statement PDFs to Excel and CSV with https://t.co/lX8PMLl258!
1635516378382839808	haroldandmodd	2023-03-14 05:41:05+00:00	en	1. Olivia Colman 2. Frances McDormand ‘20 3. Frances McDormand ‘17 4. Michelle Yeoh 5. Cate Blanchett 6. Brie Larson 7. Julianne Moore 8. Emma Stone 9. Renée Zellweger 10. Jessica Chastain  (I like all of these but most of them are not my picks for their year)
1635516319402717185	The_Boskers	2023-03-14 05:40:51+00:00	en	@DonLew87 People behind her posting pics on IG and FB.   Here's a pic when Brendan Fraser won. Here's another of Lady Gaga singing Hold My Hand. And of course, Michelle Yeoh's acceptance speech. #LiftMeUpLiterally https://t.co/v22HjuX6nG
1635516234983936000	HBmagazine2019	2023-03-14 05:40:31+00:00	en	Rihanna and Michelle Yeoh in Moussaieff Jewelry at the 2023 Oscars Read the full piece at: https://t.co/SWFEs2rZme   HB | Hollywood Beat magazine #rihanna #michelleyeoh #moussaieff #oscars #hollywoodbeatmagazine https://t.co/BUnngqxTkm
1635516176460828672	AmirAbdRazak	2023-03-14 05:40:17+00:00	en	Michelle yeoh menang award berprestige . Meanwhile , malaysia zul ariffin . Get that ?
1635516014317420547	kramdas	2023-03-14 05:39:38+00:00	en	This is what a #feminist #shero looks like! Thanks 🙏🏽 #MichelleYeoh via @NYTOpinion https://t.co/AKHdlqy0jt
1635515880976023555	RabbiReport	2023-03-14 05:39:07+00:00	en	Michelle Yeoh is absolutely unique!
1635321965924974592	edgarwright	2023-03-13 16:48:34+00:00	en	Not all Best Actress winners could pull off the plate glass stunt at the end of this clip. Magnificent stuff.
1635515872608387072	HoopsWorld13	2023-03-14 05:39:05+00:00	en	Check out alx  it's free Sanam Lineker MOTD Trossard Klay Anthony Taylor Hugh Grant Cheltenham Casemiro Ke Huy Quan RIP Gaz Jamie Lee Curtis HSBC Equality Constitution Hill Michelle Yeoh Refuge Giannis Gary Glitter The BBC Silicon Valley Bank Tatum Coffee Everything Everywhere
1635335791881883649	limo_39	2023-03-13 17:43:30+00:00	en	I remember working on some codes sometime back, I had made all changes it required but still ran to errors. I tried turning off the computer and on. Imagine it worked like magic. Consider joining ALX SE. You'll learn more in Software Engineering: https://t.co/XmVeszpjqG https://t.co/8y5o2YhCVo
1635515857404325888	ejkyleem	2023-03-14 05:39:01+00:00	en	Y’all have seen the clips of Michelle Yeoh riding a motorcycle onto a moving train, right? Her career is just fantastic.
1635515793969668096	AmethystChew1	2023-03-14 05:38:46+00:00	en	@BurhanPlays nobody succeeds in the Undead Hollywood unless the Inner Circle  say so, and wannabes have to take part in creepy rituals. Jamie Lee Curtis kissed Michelle Yeoh full on the lips on live TV, the same pedophile Jamie Lee with the framed photo of a child packed into a suitcase 🤮🤮
1753595408197005355	Shopify	2024-02-03 01:45:00+00:00	en	🚨 Shopify’s latest Edition is here 🚨  It's time for our bi-annual product drop showcasing updates across Shopify to help merchants scale and grow their businesses.   Even more reasons why you should start your free trial today!
1635515652998873088	StephLewArt	2023-03-14 05:38:12+00:00	en	Decided to just sit and enjoy the Oscars yesterday instead of drawing dresses live. My favorite dress was Fan BingBing.  And yay Michelle Yeoh! #stephlew #photoshop #oscars #illustration https://t.co/HHwCM9UiuT https://t.co/rXsKnpR8jl
1635515607474126848	rup31	2023-03-14 05:38:01+00:00	en	@jessmcguire I think the correct honourific is 'Our Michelle Yeoh'  Yours sincerely, Melbourne
1635515604882051073	chinepaiyenoffl	2023-03-14 05:38:01+00:00	en	The fact that Michelle yeoh is the first Asian to win best actress and 20 years before it was halle Berry the first black actress...tells you about opportunities for POC and who's story gets the seat on the table. The first Asian woman had to hide her mixed ancestry in 1930s
1635515432739172352	RhodeToLove	2023-03-14 05:37:20+00:00	en	Michelle Yeoh may be the first Best Actress winner in an action movie but I think some previous winners could have benefited from more fight scenes
1692645750222487605	NittoTire	2023-08-18 21:12:49+00:00	en	Like all Grapplers, Nitto Ridge Grappler features dual-sidewall design so that you can choose the side that best fits your vehicle.
1635515373398425600	Everything4evah	2023-03-14 05:37:06+00:00	en	seeing so much racist shit on Twitter about Michelle yeoh winning the Oscar… y’all need help ! She ATE
1635515351806148608	Vselestinamaria	2023-03-14 05:37:00+00:00	en	Congratulations to our very own Tan Sri #MichelleYeoh! Loads of love to her❤ #Oscars2023
1635346280112357377	LeanInOrg	2023-03-13 18:25:11+00:00	en	#MondayMotivation message from #MichelleYeoh: excel despite the limits others place upon you. ⁠ ⁠ Yeoh won an #Oscar for her role in “Everything, Everywhere All at Once," making her the first Asian lead actress winner. #Oscars95 #RepresentationMatters #Oscars https://t.co/03eUmZAnOp
1635515283229032451	NRO	2023-03-14 05:36:44+00:00	en	The media's tortured word choices make it sound like the 60-year-old Michelle Yeoh has just come out of the closet. | @BecketAdams  https://t.co/FfyQ9p3Luq
1635515267420700672	Mhdude1Mhdude1	2023-03-14 05:36:40+00:00	en	“I loved Best Actress winner Michelle Yeoh’s jibe at CNN’s sexist Don Lemon: “Ladies, don’t let anyone tell you you are ever past your prime.” Especially knowing that somewhere, dinosaur Don was watching, and spontaneously suffocating from mortification.🎉🙏🏻Oscars now excrement
1756032240759476720	Past_Factory	2024-02-09 19:08:06+00:00	en	How much do you know about the United States? With the results we are getting from this quiz, chances are, not a lot.
1635515234961203201	malaymail	2023-03-14 05:36:33+00:00	en	From KFC to Genting, companies get creative celebrating Michelle Yeoh’s Oscar win https://t.co/FG6uxThqGg
1635515153511849984	Seotoptoolzcom	2023-03-14 05:36:13+00:00	en	Michelle Yeoh’s mom tearful, proud of ‘little princess’ https://t.co/dLCOcLDnGy
1635515114760863744	Harapan_Madani	2023-03-14 05:36:04+00:00	en	Michelle Yeoh Makes History as First Asian Woman to Win Best Actress at the Oscars  Michelle Yeoh, the renowned actress, made history at the Oscars by becoming the first Asian woman to win the Best Actress award for her outstanding performance in “Everything Everywhere All at https://t.co/8QBk12DHoQ
1635515090647793665	MC13331	2023-03-14 05:35:58+00:00	en	@mrsunlawyer Tho there were some issues Malaysians have in Michelle Yeoh, over all she’s better than these two guys
1635515048813813762	VeronicaAwakens	2023-03-14 05:35:48+00:00	en	I totally forgot that Michelle Yeoh was in Guardians of the Galaxy Vol 2 for like 15 seconds
1635515048029454336	Thefinnigans	2023-03-14 05:35:48+00:00	en	WTF. No doubt Australia will claim her too - Michelle Yeoh won Miss Moomba International 1984 pageant. https://t.co/JS93nNfUZ8
1635515037610549252	theshahshahid	2023-03-14 05:35:46+00:00	en	What makes me SO happy about #MichelleYeoh’s #Oscars win is that for YEARS she’s been part of SO many genre and geeky projects.   From sci-fi, fantasy, action and so much more.   But she wins a goddamned #Oscar for a genre movie. 👏🏼 👏🏼 #EEAAO
1635514867171074048	jessmcguire	2023-03-14 05:35:05+00:00	en	Losing my mind over the fact Michelle Yeoh was Miss Moomba International in the early 80s and she got to wave to the crowd from a float being towed by a tractor down Swanston St 😂
1635514855246692352	Carl_Gu11	2023-03-14 05:35:02+00:00	en	Feel happy for her.  #MichelleYeoh  , the Malaysian-born actress who rose to fame in #HongKong film industry, made history by becoming the first woman of #Asian descent to win the Best ­Actress award. https://t.co/czoZ1qOh3V
1635514726162784256	ModXpresss	2023-03-14 05:34:31+00:00	en	Highlights from the 95th Academy Awards   #academy_awards #Brendan_Fraser #CBS #Michelle_Yeoh https://t.co/wAQrLBDXue
1744356782582185997	CoinDesk	2024-01-08 13:54:00+00:00	en	Consensus 2024 by CoinDesk is the biggest and most established global hub for everything crypto, blockchain and Web3.
1635514612270653440	Account13445671	2023-03-14 05:34:04+00:00	en	1- Michelle Yeoh 2- Olivia Colman 3- Cate Blanchett  4- Brie Larson  5- Frances McDormand (Nomadland) 6- Frances McDormand (three billboards) 7- Emma Stone  8- Jessica Chastain  9- Julianne Moore  10- Renee Zellweger
1635423380177584128	vincentlao18	2023-03-13 23:31:33+00:00	en	Rankings of Best Actress #Oscar winners (2013-2022)  1. Colman, The Favourite 2. Yeoh, EEAAO 3. Blanchett, Blue Jasmine 4. McDormand, Nomadland 5. McDormand, 3 Billboards 6. Stone, La La Land 7. Moore, Still Alice 8. Chastain, Tammy Faye 9. Larson, Room 10. Zellweger, Judy https://t.co/NhlMfKIpHF
1635514515659051008	ISkorpiqn	2023-03-14 05:33:41+00:00	en	@benshapiro Was a cool movie with a great performance by Michelle Yeoh but you're absolutely correct.   It isn't a movie you'll rewatch.
1635514507857641472	kathy_skidmore1	2023-03-14 05:33:39+00:00	en	Surely the Oscar only barely pips this honour:  ABC archive vision shows Oscar winner Michelle Yeoh as Miss Moomba in 1984 https://t.co/FvGAHzSrAV
1635514441792987137	Harden_TF_Up	2023-03-14 05:33:23+00:00	en	@FruitSaladAni @MCU_Direct @MichelleYeoh_FP @shangchi @MarvelStudios @DisneyPlus I wouldn’t be surprised if she popped up for a cameo in Vol. 3.
1760384453392666810	RSVLTS	2024-02-21 19:22:14+00:00	en	"Hearts on Fire" shorts are back! 🇺🇸 Get 'em while you can!
1635514413963784192	thejoonmoon	2023-03-14 05:33:17+00:00	en	michelle yeoh's "and ladies, don't let anyone tell you you are ever past your prime" was directed towards women for a reason.  (ironically, sbs is a part of the same journalists association that published many of the articles in this thread- JAK/Journalists Association of Korea)
1635514407693299718	thejoonmoon	2023-03-14 05:33:15+00:00	en	to be honest, sbs censoring "and ladies" from michelle yeoh's speech is disappointing but not surprising. i had to do research on the state of gender equality within korean newsrooms for my internship last year and the things i found were dismal. (thread)
1635514379171946497	whoopsiedough	2023-03-14 05:33:09+00:00	en	@XaverDB Michelle Yeoh is asian, non white and because of that’s she’s a poc. it’s important to note race because the united states is extremely racist and PEOPLE OF COLOR are not often given credit for their work and efforts. it is not harmful
1635514361396736001	cresentruby	2023-03-14 05:33:04+00:00	en	Michelle Yeoh not really like Jackie Chan isn't she?  She called Jackie "Male Chauvinist Pig" 😂😂😂
1754420785203257430	doolaHQ	2024-02-05 08:24:45+00:00	en	See the exact pitch deck that helped doola win HubSpot’s Million Dollar Pitch Competition. Learn how to create a winning pitch deck, pitch to a live audience, and get investors on board.
1635514337204002816	peluzeus	2023-03-14 05:32:59+00:00	en	@JohnFusco12 Actually I don't like Everything , Everywhere All at Once. But I agree Oscar for Michelle Yeoh and Ke Huy Quan. They have done excellent works on screen so many times to be awared. Like Oscar for Martin Scorsese in The Departed. He should have been awarded for Taxi Driver.
1635513985759072256	MosPlaceRadio	2023-03-14 05:31:35+00:00	en	Michelle Yeoh’s mom tearful, proud of ‘little princess’ https://t.co/KhncsI4cZk
1635513871543963650	nammii___	2023-03-14 05:31:08+00:00	en	Still can’t get over! My one of my fave hollywood actresses of all time, Michelle Yeoh won an Oscar!   Jamie Lee Curtis still reminds me of Freaky Friday and she is💯 me rn. 😂👏🏼🙌🏼
1635122069502590976	Variety	2023-03-13 03:34:15+00:00	en	Michelle Yeoh accepts her #Oscar for Best Actress: "For all the little boys and girls who look like me watching tonight, this is a beacon of hope and possibilities. This is proof that dreams do come true." https://t.co/ndiKiHfmID https://t.co/pQN8nHDhCx
1635513807438233600	macturijatweets	2023-03-14 05:30:52+00:00	en	Do you know that 2 Hong Kong screen legends competed against each other in Miss World 1983? Maggie Cheung was Ms. HK (ending up in the Top 15) &amp; Michelle Yeoh was Ms. Malaysia. The two would later co-star in The Heroic Trio (the 3rd being HK icon Anita Mui) &amp; The Soong Sisters. https://t.co/NoZinEn1uD
1635513779437072384	njytolentino	2023-03-14 05:30:46+00:00	en	Anyway something on Michelle Yeoh's ties to HK Cinema, soon she'll just be one of the remaining fossils of HK's once great Cinema scene since Mainland is integrating it into the mainland to their own fold.
1635513665502998529	TotoB1217	2023-03-14 05:30:18+00:00	en	Michelle Yeoh: Asia cheers as actress's Oscar dream comes true https://t.co/O636gudVI6
1635513846994722817	taengirenes	2023-03-14 05:31:02+00:00	en	on sbs news, they deliberately edited out michelle yeoh saying "ladies" on her winning speech.  says alot about korean broadcasting stations...
1635272687215071234	loveisopentoeic	2023-03-13 13:32:45+00:00	ko	sbs뉴스 양자경 수상한거 보도하는데 “여성분들에게”라고 한 거 싹 잘라먹고 내보낸 거 봐 ㅋㅋㅋ 진짜 개띠껍다 https://t.co/kV2UFfgyqI
1635513662294065152	mamakdont	2023-03-14 05:30:18+00:00	en	Idk maybe we can have michelle yeoh herself to tell us who gets to congratulate her!! ❤️
1635513625103171587	shush_harry	2023-03-14 05:30:09+00:00	en	@rharryandmeghan @HRHDukeThomas a basic principles for most household in the world i guess? who want to get involved with low grade actress. but brf always have special place in their heart for artist. not all actress are artist unfortunately. and Michelle Yeoh clearly is an artist.
1743675814980301214	StoreHeroApp	2024-01-06 16:48:04+00:00	en	Do you know the true true profit of your e-commerce store?  Scale confidently with a profit-first view at a store, product or even order level with StoreHero.
1635513601090899969	daytondailynews	2023-03-14 05:30:03+00:00	en	KUALA LUMPUR, Malaysia (AP) — Michelle Yeoh’s mother cried for joy for her “little princess” when the Malaysian performe... https://t.co/fnU6bbgaRg
1635513596682686464	VIAwesome	2023-03-14 05:30:02+00:00	en	Replete with spellbinding multiverses, “Everything Everywhere All at Once” topped the 95th Academy Awards with big wins including best picture and a historic win for Michelle Yeoh . https://t.co/qcQ2zqgtGM
1635513345749991424	borgdoctor	2023-03-14 05:29:02+00:00	en	With International Women's day and Michelle Yeoh winning Oscars...it's especially exciting to finally be a part of #WOW in supporting them as the premier women led #NFT project! Please welcome my WOW #5231  #WorldOfWomen 🥰 https://t.co/tHD5juB5Py
1635513331485380608	MrAnonShadow	2023-03-14 05:28:59+00:00	en	Me with absolutely 0 mommy issues but hearing Michelle Yeoh say "I will always ALWAYS want to be here with you" makes me sob uncontrollably https://t.co/mHdcT3R6cx
1692610590940750280	NittoTire	2023-08-18 18:53:06+00:00	en	What's a Hybrid-Terrain Light Truck Tire?  Possibly the best solution for your truck when you want more performance than an all-terrain, but can't live with the road noise of a mud-terrain tire.  Check out Nitto Ridge Grappler Hybrid-Terrain Tire.
1635513212014829568	xPatecatlx	2023-03-14 05:28:30+00:00	en	Not Michelle Yeoh being a nepo baby
1635513065595899904	AfridaRahmanAli	2023-03-14 05:27:55+00:00	en	AND THIS….  Michelle Yeoh wins the Academy Award for Best Actress: “This is history in the making.” https://t.co/JgX7QDiRfC
1635512995257421824	reservedcoffin	2023-03-14 05:27:39+00:00	en	Y’all don’t even know just how much inspiration Tan Sri Michelle Yeoh is to the people at Malaysia. How we locals with dreams and stories to tell can see that if given a proper chance, we can really succeed. Not just one but TWO southeast asians won the Oscars that night. 1/2 https://t.co/GJAbTdwxby
1635512880849121281	ciddaluddung	2023-03-14 05:27:11+00:00	en	Still my favorite Michelle Yeoh movie is Crouching Tiger Hidden Dragon as Yu Shu Lien.  And also Zhang Ziyi and Chow Yun Fat.
1761162637868478795	zoodotdev	2024-02-23 22:54:28+00:00	en	Generate CAD files from text prompts and export them to the program of your choice using our Text-to-CAD tool.  Sign up and start creating CAD files faster than ever! 🚀
