1635505193373794304	10NewsFirstMelb	2023-03-14 04:56:38+00:00	en	Almost 40 years later, Michelle Yeoh won her first Oscar for Best Actress in 'Everything Everywhere All At Once."
1635505188206444547	10NewsFirstMelb	2023-03-14 04:56:37+00:00	en	Before she was awarded the Academy Award for Best Actress, Michelle Yeoh had already won the acclaimed position of 'Miss Moomba, 1984'!  #Oscars @moombafestival https://t.co/nmma37YoRj
1635505172008046592	theo_souphoe	2023-03-14 04:56:33+00:00	en	Michelle Yeoh's win really brought out the racism, misogyny and homophobia of these meleis.
1635505090034548737	TTGourmet	2023-03-14 04:56:14+00:00	en	Bond girl Michelle Yeoh wins Oscar.https://t.co/Ztf1Trhc9b
1635505046849724416	xenocryptsite	2023-03-14 04:56:04+00:00	en	Hit me with the best old Michelle Yeoh movies that are not in English.
1635504957196574723	PeterRabbit_4DX	2023-03-14 04:55:42+00:00	en	@reelandroll I believe the spirit of Anna May Wong would be so proud of Michelle Yeoh in the heaven.  Ms. Wong’s legacy and memories did paid off today. 🙏🏻❤️
1760375793736110559	consumerpal	2024-02-21 18:47:50+00:00	en	🚨 85% of New Jersey residents fear healthcare costs! ACI supports pricing transparency to ease financial burdens. Let's make healthcare accessible!   #AffordableHealthcare #HealthcareFairness #PriceTransparencyNow
1635504913513054210	IMRANbazil	2023-03-14 04:55:32+00:00	en	I know you're joking, but the character Michelle Yeoh is playing is far from being Chinese American at all (unlike on EEAAO), dw about it lmao
1635058870082244608	GejalaSosialite	2023-03-12 23:23:07+00:00	en	Aunty Michelle ur from Ipoh pls
1635504792977178625	ainaa089	2023-03-14 04:55:03+00:00	en	@Amerul_Affendi Tan Sri Michelle Yeoh muslim ke? Filem Everything Everywhere All at Once tu ada sentuh bab makan babi, air holy, murtad ke? Is it even filmed in Malaysia?
1754580724194177465	BenQAmerica	2024-02-05 19:00:17+00:00	en	✨ Join the #AQCOLOR Mindful Moments Contest!   Capture life's beauty: 1. Download the AQCOLOR Logo, add it to your image 2. Post on IG with a description 3. Use #BenQMoments #AQCOLOR 4. Follow &amp; tag @BenQNorthAmerica  Learn more: https://t.co/H2mUHq2rkD  #BenQ #MindfulMoments https://t.co/lrdjLFpWXz
1635504764481044481	squilliams	2023-03-14 04:54:56+00:00	en	It's Michelle Yeoh!!! 🔥🔥🔥 https://t.co/FzAVFtooIQ
1635504760282398722	MySandyShorts	2023-03-14 04:54:55+00:00	en	@ghostinmypocket I cant believe Michelle Yeoh didnt win decades ago!
1635504627901952000	NoniCafe_	2023-03-14 04:54:24+00:00	en	@etnow Why can’t you just say that Michelle Yeoh is the first Malaysian Actress to win.  Merle Oberon was from Mumbai, India so now you know the Asian differentiation.   Sheesh!
1635504581823299588	alsonette	2023-03-14 04:54:13+00:00	en	@tiongkingsing tourism minister, do we have the honor to appoint #MichelleYeoh as ambassador of tourism for Malaysia 😊
1635141399942430721	MyMOTAC	2023-03-13 04:51:03+00:00	en	Congratulations to YBhg. Tan Sri Dato’ Seri Michelle Yeoh for winning the Best Actress Oscar for Everything Everywhere All At Once
1746994219737043008	dotpenji	2024-01-15 20:34:14+00:00	en	PROBLEM: Your in-house marketing team can’t handle your business’ needs on their own.  SOLUTION: Penji, the unlimited service that pairs you with vetted graphic design professionals in seconds.
1635504469965434880	Prenzception	2023-03-14 04:53:46+00:00	en	Michelle Yeoh is truly a gorgeous woman all throughout her years ✨🫶
1635504427187445760	Winson_Yang	2023-03-14 04:53:36+00:00	en	"Michelle Yeoh: The Crisis That Changed My Life 8 Years Ago Keeps Happening" by Michelle Yeoh via NYT  As a goodwill ambassador for the United Nations Development Program, I have seen up close how crises like earthquakes can expose deep existing inequali… https://t.co/ZYkReEqrQo
1635504259381731330	centonlooker	2023-03-14 04:52:56+00:00	en	South Korea SBS News deliberately cut off “Ladies” mentioned when reporting #MichelleYeoh 's Oscar award-winning speech. Michelle Yeoh: “Ladies, don't let anyone tell you that you are ever past your prime." https://t.co/zsZkOqQWKK
1635219276461383681	centonlooker	2023-03-13 10:00:31+00:00	en	Michelle Yeoh is the first Asian woman to win Best Actress and she said, “Ladies, don't let anyone tell you that you are ever past your prime."  #Oscars  Congrats! https://t.co/0sUdgIOpyR
1635504224942567425	binjinerism	2023-03-14 04:52:48+00:00	en	michelle yeoh and ke huy quan’s signature pose throughout the whole awards season https://t.co/ZjNwXBiA5Z
1752700382273569022	Inc	2024-01-31 14:28:29+00:00	en	What makes your #smallbusiness unstoppable? @TheUPSStore #smallbizchallenge gives #smallbusinessowners like you the chance to win big: compete to win a share of the total prize pool of $35,000 for your business and a feature in @inc magazine! #BeUnstoppable #ad
1635504197658443777	GiteshPandya	2023-03-14 04:52:41+00:00	en	She will now and forever be known as...Oscar winner Michelle Yeoh!
1635504197499240448	tribunephl	2023-03-14 04:52:41+00:00	en	Michelle Yeoh, long a star in her home country in Malaysia and in Hong Kong but who became well-known in mainstream Hollywood only recently through the martial arts epic Crouching Tiger, Hidden Dragon and Crazy Rich Asians, won the Best Actress Award.  https://t.co/HDKoQ5XYoe https://t.co/a4kQ5H1Sch
1635504097863376896	drjpol	2023-03-14 04:52:17+00:00	en	Not into the #AcademyAwards but I am really happy that #EverythingEverywhereAllAtOnce @RealGDT #pinocchiomovie #BrendanFraser #KeHuyQuan #MichelleYeoh won. Congrats to all of the nominees &amp; winners. I wish Batman was nominated for cinematography but no luck. Love you all. 🙏✌️♥️
1635504068524163074	jscurry44	2023-03-14 04:52:10+00:00	en	@dijoni Consider Halle Berry won an Oscar in 2002. Michelle Yeoh won an Oscar this year.   How would you feel if there would have been a reverse. Hmm
1635503831802056707	rubyfrootjungle	2023-03-14 04:51:14+00:00	en	THANK YOU MICHELLE YEOH
1635397887197839360	FilmUpdates	2023-03-13 21:50:15+00:00	en	The 2023 #Oscars were watched by 18.7 million viewers, a 12% increase from last year’s ratings. https://t.co/41pJbaSGut
1635503803893170177	SaemiNadineEd	2023-03-14 04:51:07+00:00	en	"For all the little boys and girls who look like me watching tonight, this is a beacon of hope and possibilities." "Don't let anybody tell you you are past your prime" Yesssss!  #Oscar2023 #MichelleYeoh #DonLemon https://t.co/kejO1gFdmw
1635503779931119618	pentakels	2023-03-14 04:51:01+00:00	en	Michelle yeoh's longterm partner being Jean todt is so insane. What a power couple
1635503769965174784	Mehak944	2023-03-14 04:50:59+00:00	en	‘Isn’t there an Evelyn in all of us?’ — Josephine Teo congratulates Michelle Yeoh on Oscar award win – Singapore News – BestyWeb https://t.co/M5WuPMCH5p
1635503707436531712	fix_newspeak	2023-03-14 04:50:44+00:00	en	Michelle Yeoh's mother celebrates Oscars win from Malaysia - Los Angeles Times https://t.co/Ybi8V97cMY #TrendingNow #HotTopics #Trending #News #NewsUpdate #Forumidex #MyForumLink
1635503685475225601	anneloesleyssen	2023-03-14 04:50:39+00:00	en	Pride of Malaysia and all over the world: the first Asian best actress winner in Oscar history Michelle Yeoh.
1635238127026446337	Reuters	2023-03-13 11:15:25+00:00	en	Jubilation as 'pride of Malaysia' Yeoh wins first Oscar https://t.co/bQexhBfQ4A https://t.co/v8dQhIw08a
1635503590604427264	shafwanshukor	2023-03-14 04:50:16+00:00	en	Btw, at first Jakie Chan do not like the idea for women to fight in the film. But Michelle Yeoh prove that Jakie was wrong.
1633961980238110721	NickdeSemlyen	2023-03-09 22:44:28+00:00	en	Michelle Yeoh kicking ass in Yes Madam. Just ridiculous action. https://t.co/Vb8zSkD4ZO
1635503526745964550	NameNumbers999	2023-03-14 04:50:01+00:00	en	@DrDpkKumar @joeownsyou99 @NPR Previous Asian winners/nominees did not openly identify as Asian. Michelle Yeoh openly identifies as Asian, so she is the first person who identifies as Asian to win an Oscar. How is this pushing any type of agenda, and how do you have such a hard time understanding it?
1635503508354129920	sapphicpov	2023-03-14 04:49:57+00:00	en	i hope academy winner michelle yeoh is having such a wonderful day
1760384451354218950	RSVLTS	2024-02-21 19:22:14+00:00	en	"Hearts on Fire" shorts are back! 🇺🇸 Get 'em while you can!
1635503363642249216	honeysvh	2023-03-14 04:49:22+00:00	en	my gen z baby intern just asked me “who is michelle yeoh” https://t.co/E2FouqykBD
1635503299666362368	DustinVann	2023-03-14 04:49:07+00:00	en	NBD, just crying in bed as I rewatch Michelle Yeoh’s, Halle Berry’s, and Viola Davis’ #Oscars acceptance speeches   back to back to back 😭👏🏻😭👏🏻
1635503126303342592	annyeonghazeyoi	2023-03-14 04:48:26+00:00	en	can we talk about how everyone else in the world calls michelle yeoh, michelle yeoh but malaysian calls her by her full title  TAN SRI MICHELLE YEOH
1635503078920310787	nintyfan1991	2023-03-14 04:48:14+00:00	en	Take it away, Michelle Yeoh: https://t.co/Vb6PaTBh0A https://t.co/XN2kggWEup
1630766558854119424	inkbugfic	2023-03-01 03:07:00+00:00	en	for future reaction purposes, michelle yeoh yelling "shut up" throughout the multiverse https://t.co/FfNb28nW5Y
1757148389014474814	XploredHistory	2024-02-12 21:03:16+00:00	en	Thanks to the nuances that is evident everywhere, we are able to accurately guess where you grew up with this quiz.
1635502873277759488	Roganravenwood	2023-03-14 04:47:25+00:00	en	@albinokid Congratulations #MichelleYeoh such an amazing accomplishment and well deserved.
1635502860552245250	acidman_eth_	2023-03-14 04:47:22+00:00	en	TBH #MichelleYeoh deserved an #Oscars for that fight scene with Zhang ZiYi on Crouching Tiger Hidden Dragon... I mean, come oooon!!!
1635502726795898880	Rin_BruceFan	2023-03-14 04:46:50+00:00	en	Why Michelle Yeoh’s “Chinese Malaysian” Accent In Star Trek Made A Fan Cry https://t.co/pjTxn9tnRY
1635502624954003462	aidilarazak	2023-03-14 04:46:26+00:00	en	My hot take on Finas congratulating Michelle Yeoh - congratulating someone is not the same as taking credit for their success.   Could Finas do better in support Malaysian filmmaking and cinema? Absolutely.  But doesn't mean they shouldn't congratulate her.
1635502481726660610	Renmauzuo	2023-03-14 04:45:52+00:00	en	Since everyone is talking about Everything, Everywhere, All at Once again, I still can't get over the fact that the closet scene was filmed with practical effects and not CGI.  Michelle Yeoh acted everything out *very* slowly so they could speed it up to "normal" speed.
1635502276432330753	_____renart	2023-03-14 04:45:03+00:00	en	This is going crazy the channel confirmed that the reporter thought what Michelle Yeoh said, "don’t let anyone tell you that you are past your prime", was also for the men. So it is ok to chainge the whole fucking meaning of the sentance??? Is distorted report a ok thing to do???
1635363709274177536	_____renart	2023-03-13 19:34:26+00:00	en	Korean news channel cut out "and ladies" part in Michelle Yeoh's speach at the Oscars. I just fucking hate my country.
1635502084924772353	NewsBricks	2023-03-14 04:44:17+00:00	en	https://t.co/22kmNbhciw Oscars 2023: Best Actress Michelle Yeoh's Connection With India #michelleYeoh #Oscars #Oscars2023 #Oscars95
1635501984181616640	bookedbusy	2023-03-14 04:43:53+00:00	en	@RoyalFamily has hidden replies on their Michelle Yeoh post, not because they are abusive but because they ‘don’t like’ the anti-colonial comments.  Which means, all those racist replies they have still up under their posts of #HarryAndMeghan, they like.  Original racists
1635500187392122880	LoveLolaHeart	2023-03-14 04:36:45+00:00	en	The official @RoyalFamily account Tweeted congrats to Michelle Yeoh for her Oscar win and these are just some of the Tweets they hid. (Note that I have documented years of the BRF not hiding abusive Tweets about the Sussexes but as can be seen here, they clearly know how.) https://t.co/7Gnm6oxVOl
1758280027932860597	futurecaucus	2024-02-16 00:00:00+00:00	en	Millennial Action Project is now Future Caucus. Our mission is bigger than one generation.  Future Caucus is for Gen Z, millennial, and future generations of lawmakers who aim to transcend polarization and govern effectively.   Join us: https://t.co/NqaZwd0NZE
1635501703637397505	riktov	2023-03-14 04:42:46+00:00	en	@LivingInCA @krassenstein They still haven’t given an Oscar to an Asian American; Michelle Yeoh is not American.
1635501665301196801	stardrop_saloon	2023-03-14 04:42:37+00:00	en	i know that many were both happy and not happy about eeaao winning so much, but let's focus on what's important: i would let cate blanchett and michelle yeoh take turns pegging me
1635501658573623297	FillGapNews	2023-03-14 04:42:36+00:00	en	Michelle Yeoh Becomes the First Asian Actress to Win the Best Actress Oscar 2023 #MichelleYeoh #MichelleYeohBestActressOscar #Oscar2023 https://t.co/4uKsHqdkOI For more information visit: FillGap News
1635501654371110912	malaymail	2023-03-14 04:42:35+00:00	en	Everyone, everywhere all at once — claiming Michelle Yeoh as theirs after historic Oscar win https://t.co/7IRYB2enj6
1753584083794350325	BOXABL	2024-02-03 01:00:00+00:00	en	Check out this folding house 🤯  Most car factories like Ford or Tesla reportedly build one car per minute. Isn’t it time we do that for houses?
1635501607843688448	LerkShih	2023-03-14 04:42:24+00:00	en	Thanks Michelle Yeoh for normalising my accent.
1635501606060929024	hensleragency	2023-03-14 04:42:23+00:00	en	"Michelle Yeoh: The Crisis That Changed My Life 8 Years Ago Keeps Happening" via @nytimes: https://t.co/a9lj6tw9VH #trending #news
1635501534761963520	rapplerdotcom	2023-03-14 04:42:06+00:00	en	‘A LONG TIME COMING’  Halle Berry got emotional when she presented Michelle Yeoh’s ‘historic’ Oscar for Best Actress. To date, Berry and Yeoh are the only women of color to have won the award. https://t.co/Wa0zaIdP0w https://t.co/1n93LVzVMw
1635501469951467520	GABBYiSACTiVE	2023-03-14 04:41:51+00:00	en	“Michelle Yeoh: The Crisis That Changed My Life 8 Years Ago Keeps Happening” As a goodwill ambassador for the United Nations Development Program, I have seen up close how crises like earthquakes can expose deep existing inequalities. https://t.co/Hk94CI3Hn4 https://t.co/oIA3JuwWNY
1760384451324862700	RSVLTS	2024-02-21 19:22:14+00:00	en	"Hearts on Fire" shorts are back! 🇺🇸 Get 'em while you can!
1635501362715975681	ThatsHowWeRoll_	2023-03-14 04:41:25+00:00	en	Convince me that Michelle Yeoh isn't actually Guanyin. I'll wait......  :D  https://t.co/qk6N9E1yb6
1635501341228277760	JayeTweet	2023-03-14 04:41:20+00:00	en	like don't get me wrong! this is a HUGE DEAL for East Asian Actresses! and Michelle Yeoh is AMAZING and absolutely deserves it
1635501169329180674	ViuMalaysia	2023-03-14 04:40:39+00:00	en	"Ladies, Don't let anybody tell you, you are ever past your prime. Never give up" - Tan Sri Michelle Yeoh  #Oscars95 #EverythingEverywhereAllAtOnce #Oscar #BestActress  🎥 @variety https://t.co/9hYSCDcQqk
1635500962931671040	ETovarICRC	2023-03-14 04:39:50+00:00	en	Oscar winner Michelle Yeoh: The Crisis That Changed My Life 8 Years Ago Keeps Happening "Crises aren’t just moments of catastrophe: They expose deep existing inequalities. Those living in poverty, especially women and girls, bear the brunt".  https://t.co/Ar01W9538U
1635500861748137984	rmnstr	2023-03-14 04:39:26+00:00	en	"Michelle Yeoh: The Crisis That Changed My Life 8 Years Ago Keeps Happening" by Michelle Yeoh via NYT https://t.co/i8tb6nUGrt
1635500852117995522	Mima45753173	2023-03-14 04:39:23+00:00	en	"Michelle Yeoh: The Crisis That Changed My Life 8 Years Ago Keeps Happening" by Michelle Yeoh via NYT https://t.co/0MKW7RdDsk https://t.co/a86e0ZWXhG
1635500839707049985	ricekrizpies	2023-03-14 04:39:20+00:00	en	@sirdamesander @ghostinmypocket i mean, ok... if we're considering her a lead then she would absolutely still lose to michelle yeoh
1635500805494308864	JiffSchwazz	2023-03-14 04:39:12+00:00	en	Pluto TV with the Michelle Yeoh marathon today. Reign of Assassins into Crouching Tiger Hidden Dragon 🐉
1635500767225479168	bevng1971	2023-03-14 04:39:03+00:00	en	Front news/headlines from #thestar newspapers here in #malaysia abt #MichelleYeoh . Proud moments for her &amp; family! 🎊👌👍👏❤️ https://t.co/tuUewHFjEl
1635500757188329473	exemplary_veg	2023-03-14 04:39:01+00:00	en	Can I just say how awesome it is that Michelle Yeoh won an Academy Award yesterday? ❤️🥰🌟  Yes, it's pretty damn awesome.
1635500690331299840	BettinaBoomBoom	2023-03-14 04:38:45+00:00	en	@nancywyuen Michelle Yeoh was robbed of the Oscar for Crouching Tiger, Hidden Dragon.
1635500631782834179	xenocryptsite	2023-03-14 04:38:31+00:00	en	Well arguable Michelle Yeoh and JLC did too, partially.
1635332715796127744	jordanjwoodson	2023-03-13 17:31:17+00:00	en	Last night Brendan Fraser became the 9th man to win an Oscar for playing an LGBT character https://t.co/WpfBhw6YZ2
1635500409170042883	KingofPopTweets	2023-03-14 04:37:38+00:00	en	She was a BAFTA nominee for 2023 and she didn't win.  Best Actor - Elvis Best Actress - Cate Blanchett  Prior to BAFTA nomination, she won Best Actress awards for Golden Globe and SAGAwards  Now, Michelle Yeoh is suddenly is British-Asian. 😂
1635193822908129280	sturdyAlex	2023-03-13 08:19:22+00:00	en	British media is doing that thing British media does on Oscars morning, that I love.   Michelle Yeoh is, apparently, British-Asian. Which will come as news to most people, including Michelle Yeoh. https://t.co/V8IKZMtyLb
1635500382955925506	hanakokane	2023-03-14 04:37:32+00:00	en	No I love Michelle Yeoh so much like she just brings so much comfort and ugh she’s so beautiful
1635500316182429696	VouxSite	2023-03-14 04:37:16+00:00	en	Romantic story of how Michael Schumacher played cupid with ex-Ferrari boss Jean Todt and Oscar winner wife Michelle Yeoh | Sport News | Tue | 14 Mar | 4:37 | UTC https://t.co/wR8fKE13nj
1635500302676766722	yaawa_	2023-03-14 04:37:12+00:00	en	@snoopypoop7 She killed it but Michelle Yeoh went beyond amazing
1635500300231401474	MashableSEA	2023-03-14 04:37:12+00:00	en	Yeoh's award milestone is part of a long, complicated history of racial identity in Hollywood. #MichelleYeoh #Oscars 🤔  https://t.co/ijCv8tgBwq
1635500187392122880	LoveLolaHeart	2023-03-14 04:36:45+00:00	en	The official @RoyalFamily account Tweeted congrats to Michelle Yeoh for her Oscar win and these are just some of the Tweets they hid. (Note that I have documented years of the BRF not hiding abusive Tweets about the Sussexes but as can be seen here, they clearly know how.) https://t.co/7Gnm6oxVOl
1635500097239908354	ffqqnmn	2023-03-14 04:36:23+00:00	en	@jungledweller1 @NewsBFM Kat Malaysia kalau cannot wear skimpy short skirt means you Taliban. Also if you congratulate Michelle Yeoh but tak recognise LGBT community means you hypocrite. Keep that in mind.
1635500066520838145	ElaineConk	2023-03-14 04:36:16+00:00	en	Congratulations and🙏thank you Michelle Yeoh for your commitment to #SDGs and to #GenderEquality!  https://t.co/lW5YGxqZ5R
1635500031607472128	hoyeeons	2023-03-14 04:36:08+00:00	en	Michelle Yeoh is for the women! Korean men are so insecure 🙂
1635499923453120513	vmnews	2023-03-14 04:35:42+00:00	en	Michelle Yeoh's Oscar; No public holiday on Wednesday  #latest #vanakkammalaysia #michelleyeoh #oscar #nopublicholiday #wednesday #trendingnewsmalaysia #malaysiatamilnews #fyp #vmnews #foryoupage https://t.co/rlrSEVUQbq
1635499782331420672	JasonLasiter	2023-03-14 04:35:08+00:00	en	@MaxPowers44 @Ooooh_A_Sparkly @Variety When you say women of color, are you implying black women? If so the you are correct, only Halle Berry, but all women of color, there have been 4 including Michelle Yeoh this year
1635499648046764033	msianinsight	2023-03-14 04:34:36+00:00	en	Hypocritical of govt to praise Michelle Yeoh, says lawyers group https://t.co/N7MoHeN5hw
1635272687215071234	loveisopentoeic	2023-03-13 13:32:45+00:00	ko	sbs뉴스 양자경 수상한거 보도하는데 “여성분들에게”라고 한 거 싹 잘라먹고 내보낸 거 봐 ㅋㅋㅋ 진짜 개띠껍다 https://t.co/kV2UFfgyqI
1635499588567302144	MarionRR	2023-03-14 04:34:22+00:00	en	This was such an emotional moment. The whole theater cheered Michelle Yeoh. I frankly forget about my age quite often. A number doesn't define me, it never stops me. More years of experience and learning made me better at what I do. Carpe diem. I love wha…https://t.co/WHY0d50BGT
1635499587749433344	melon_num5	2023-03-14 04:34:22+00:00	en	Obviously sexist SBS Korea cut "And ladies" out of #MichelleYeoh's Oscar speech that preceded "Don't let anybody tell you you are ever past your prime", clarified that the words could have also been for men, got onto hotsearch and incited yet another bout of netizens' disgust https://t.co/5A2F9t4wWE
1635499357595385856	tailoftea	2023-03-14 04:33:27+00:00	en	Malaysians who congratulate Michelle Yeoh and send death threats to the LGBTQ community amuses me, it takes very little for y'all to blast of in a stream of anger and hate
1635499197246976002	KamalRajSigdel	2023-03-14 04:32:49+00:00	en	What a proud moment for this recognition and Oscar to a wonderful Asian woman actress - Michelle Yeoh, the UNDP Goodwill Ambassador who helped Nepal during 2015 earthquake recovery 👏👏 https://t.co/h9k3iP19YX
1635122612518158338	UNDP	2023-03-13 03:36:24+00:00	en	We couldn’t be prouder of our Goodwill Ambassador #MichelleYeoh on her Oscar win from @TheAcademy for best actress!  Your perseverance and dedication to fighting discrimination and inequalities on and off the screen is an inspiration to all of us!!  #Oscars95 https://t.co/7s1Ncdg15j
1635499009610596353	IndyArts	2023-03-14 04:32:04+00:00	en	Michelle Yeoh takes aim at CNN’s Don Lemon with Oscars acceptance speech https://t.co/xKzaqSRHTS
1635499001331216384	RoseMagdaline	2023-03-14 04:32:02+00:00	en	Michelle Yeoh reminds me of Urmi ma'am. Badass super talented, charming women they both are.
1635498984893734916	UNESCAP	2023-03-14 04:31:58+00:00	en	👏 🎉Congratulations to Michelle Yeoh on her #Oscar . Her inspiring work in film is matched by her commitment to #SDGs and #GenderEquality in the #AsiaPacific. Check out her video from last year's #ESCAP75 celebrations ⬇️
1527566957641596928	UNESCAP	2022-05-20 08:28:38+00:00	en	In one of the multiple universes🌌, Michelle Yeoh has witnessed the transformation of #AsiaPacific over the years!   Listen as she warns us about the dangers we face and our hopes to overcome them at #CS78.⤵️ https://t.co/ijJlyCOG5O  #ESCAP75 #EverythingEverywhere https://t.co/IlIKzhvGH0
1635498927276556289	sunchick116	2023-03-14 04:31:45+00:00	en	@vincentlao18 1. Brie Larson, Room 2. Emma Stone, LaLaLand 3. Michelle Yeoh, EEAAO 4. Olivia Colman, The Favourite 5. Julianne Moore, Still Alice 6. Renee Zellweger, Judy 7. Chastain, Tammy Faye 8. Cate Blanchett, Blue Jasmine 9. Frances McDormand, 3 Billboards 10. Frances McDormand, Nomadland
1635498913519259648	77kn3	2023-03-14 04:31:41+00:00	en	"ladies...never let anybody tell you that you are past your prime."Michelle Yeoh's speech is so cool!!
1635498901489991681	Assyqeen	2023-03-14 04:31:38+00:00	en	Hahaha only Malaysian can berate Malaysia.. 😆   Me reading all the post claiming TSMY as Asian-American and all the replies 😆😆👏🏼👏🏼👏🏼 #MichelleYeoh
1635498642713788416	TheSource	2023-03-14 04:30:37+00:00	en	Congrats on making HERStory !!! 🙏  First Asian Actress to Win Best Lead Actress 👏👏👏 #MichelleYeoh #Oscar https://t.co/P2KUEDFiM6
1635498523251580929	DaisyLeoncio	2023-03-14 04:30:08+00:00	en	We hear you, Michelle Yeoh. @UNDP Goodwill Ambassador and first Asian to win the Oscar’s Best Actress. Proud of you for inspiring millions of women 🏆
1635386153217187840	UNFPA	2023-03-13 21:03:37+00:00	en	👏🏼 Actress Michelle Yeoh gave a very powerful acceptance speech at the #Oscars, reminding women that it’s never too late to achieve their goals.  🔁 RT if you agree!  #MondayMotivation https://t.co/XFCEO0pqW0
1635498489487433729	cbsaustin	2023-03-14 04:30:00+00:00	en	One of the world's newest Academy Award winners, Michelle Yeoh, took a jab at Hollywood's perceived problematic history of ageism and sexism during her Oscars acceptance speech on Sunday night. https://t.co/PV45Sm7VhY
1635498488342667264	ABC7Amarillo	2023-03-14 04:30:00+00:00	en	One of the world's newest Academy Award winners, Michelle Yeoh, took a jab at Hollywood's perceived problematic history of ageism and sexism during her Oscars acceptance speech on Sunday night. https://t.co/PtZl8mFNCa
1635498341093056513	belovasoup	2023-03-14 04:29:25+00:00	en	and i know SOMEONE is going to say some shit like “but michelle yeoh won best actress last night and she’s a woc” ok and she is the second person of color in history to have won that award. something’s fucking fishy!!!
1635498156862349314	HeavenTshirtSh1	2023-03-14 04:28:41+00:00	en	Paul mescal holding michelle yeoh shirt  https://t.co/gcZ0Jz2JqM
1635498125337952256	_sofiamendonca	2023-03-14 04:28:33+00:00	en	finally watched everything, everywhere, all at once and oh my god… oscar’s sweep was TOTALLY deserved except for my girl stephanie hsu that was robbed!! stellar performance mother michelle yeoh is so good ke huy quan deserves the world
1635497994622734337	GossipsTv	2023-03-14 04:28:02+00:00	en	#Oscars SPECIAL REPORT BY @NetBaseQuid   Top 5 Mentioned Films: 1. #RRRMovie  2. #TheElephantWhisperers  3. #EverythingEverywhereAllAtOnce  4. #AllQuiteontheWesternFront 5. #Argentina1985  1. #MichelleYeoh  2. #LadyGaga  3. #AngelaBassett   (1/2)
