1635136434138120192	bonervilIe	2023-03-13 04:31:19+00:00	en	Absolutely terrible year for the oscars in terms of angela bassett, colin farrell and stephanie hsu snub, atrociously unfunny jimmy kimmel (leave malala ALONE), irelands biggest loss in history, banshees of inisherin robbed BARE and JAMIE LEE CURTIS
1635136429436321794	Para_Mystery	2023-03-13 04:31:18+00:00	en	Congrats to my girl #JamieLeeCurtis ! Best Actress Winner #AcademyAwards https://t.co/aGH269o2cz
1635136421479710721	songforamelia	2023-03-13 04:31:16+00:00	en	i didnt cry to this multiple times just for her to lose against jamie lee curtis https://t.co/Kg9sfOsrSW
1635136411153371137	TarPitKing	2023-03-13 04:31:14+00:00	en	@KolaBoof3 @wolverine49007 @jamieleecurtis @TheAcademy No one's voting rights are being threatened, for Pete's sake. Abortion? Personally, I think it should always be available even though it is unquestionably murder. Black history? That's always been taught in school. A bunch of racist, divisive nonsense is another story.
1635136400243986433	purpleselene	2023-03-13 04:31:11+00:00	en	jamie lee curtis? oh that's cursed.  I LITERALLY JUST WOKE UP EW WTF IS THIS
1635136382556577793	robinsnewswire	2023-03-13 04:31:07+00:00	en	"Trends News: 5 beauty trends to shop from the Oscars now—Ana de Armas, Michelle Yeoh, Jamie Lee Curtis and more #News": https://t.co/76bU4YDCWF
1635136371076763648	bernsteinDianah	2023-03-13 04:31:04+00:00	en	@Dr7gns No , its because the Academy were bullied into giving michel’e yeoh the Oscar instead of blonde white CAte blanchett( who clearly deserved it) so they retaliated by giving the Oscar to corny Jamie lee curtis
1635136337799151616	LankaXpressNews	2023-03-13 04:30:56+00:00	en	Oscars 2023: Jamie Lee Curtis wins Best Supporting Actress for her role in Everything Everywhere All at Once. Newsfrist #LKA #sriLanka #Oscars #EverythingEverywhereAllAtOnce
1635136323756658691	Omek	2023-03-13 04:30:53+00:00	en	I loved this movie. I only wish Stephanie Hsu won, cause I think she deserved it. Her character really carried the entire movie. But I'm still happy for Jamie Lee Curtis. ❤️😭
1635122800401973248	DiscussingFilm	2023-03-13 03:37:09+00:00	en	‘EVERYTHING EVERYWHERE ALL AT ONCE’ has won 7 #Oscars  See the full winners list: https://t.co/b3EnMWMShb https://t.co/igVDuJbTm8
1635136320657043457	mitchellea10	2023-03-13 04:30:52+00:00	en	@itsthatmanhowie wellllllll 4/6 were IMO.   I don’t think Brendan Fraser and Jamie Lee Curtis should’ve been anywhere near Oscars tonight but idk.   Think Austin Butler and Angela Bassett were more deserving.
1635136318052380674	roseco1oredgirl	2023-03-13 04:30:52+00:00	en	jamie lee curtis should’ve won an oscar for “freaky friday” or something. NOT for her minuscule role in a film that showcased Asian actors.
1635136315191881729	finalgirl_kiddo	2023-03-13 04:30:51+00:00	en	Why is Jamie lee Curtis winning all these awards???
1635136306790690816	mayqi6	2023-03-13 04:30:49+00:00	en	jamie lee curtis deserves the win for the scene she has with evelyn outside the laudromat on the steps where she finally becomes vulnerable and empathizes with her, and also for this delusional part LOL https://t.co/NeEElWf9oJ
1635136283184963585	Zipnewsorg	2023-03-13 04:30:43+00:00	en	Oscars viewers fume at Angela Bassett ‘snub’ as she looks gutted over Jamie Lee Curtis win https://t.co/BjNnuPtUcW
1635136280387543042	SignsMary	2023-03-13 04:30:43+00:00	en	Oh, okay, that’s why.  A trans agenda. #Oscars  #JamieLeeCurtis
1635136279192150022	PharoshuzLyRedi	2023-03-13 04:30:42+00:00	en	Black people are still fighting to get some pale dog's award seriously? Of course, Angela Bassett and other black actors got ROBBED, so make your own acting award show. #Oscars is just for neanderthals especially for no talented @jamieleecurtis . #BoycottOscars https://t.co/Ve8jSluiD3
1635136277069860865	yann_solle	2023-03-13 04:30:42+00:00	en	I honestly feel like Jamie Lee Curtis is getting too much hate for her #Oscar win. Sure, I would've preferred the award to go to Angela Bassett or Stephanie Hsu, but that really doesn't mean she's undeserving. She was great in EEAO. 😮‍💨😮‍💨😮‍💨
1635136276491030528	shanselman	2023-03-13 04:30:42+00:00	en	I’m a #JamieLeeCurtis fan but maybe she should win an #Oscar for something else with more depth. #StephanieHsu did THE WORK in #EveythingEverywhereAllAtOnce. Plus #angelabassett literally did the thing. A bummer choice.
1635136273970233345	CNBCTV18News	2023-03-13 04:30:41+00:00	en	#Oscars95 | #EverythingEverywhereAllAtOnce: Jamie Lee Curtis bags Best Supporting Actress, Ke Huy Quan wins Best Supporting Actor.  It has also won the #Oscar for Best Film Editing and Best Original Screenplay.    #Oscars2023   https://t.co/QAZu0pjNcy
1635136270224728064	hyperlady99	2023-03-13 04:30:40+00:00	en	One day one actress will win an #Oscar for playing @jamieleecurtis winning an #Oscar. I loved that speech!
1635136270036000768	JovanieMikal96	2023-03-13 04:30:40+00:00	en	I ain’t never watch a Jamie lee Curtis movie that had me in awe but I can name a dozen for Angela Bassett
1635082248033820674	Phil_Lewis_	2023-03-13 00:56:00+00:00	en	Angela Bassett’s reaction hurts me #Oscars 🙁 https://t.co/wUgwJ5TWBA
1635136256589041664	avicant	2023-03-13 04:30:37+00:00	en	as much as i love jamie Lee Curtis, Stephanie hsu or Angela Bassett deserved that way more😭
1635077623759118336	DiscussingFilm	2023-03-13 00:37:38+00:00	en	Jamie Lee Curtis wins her first #Oscar  See the full winners list: https://t.co/b3EnMWMShb https://t.co/PO6kcNs6Yj
1635136255586607104	BerneMuthien	2023-03-13 04:30:37+00:00	en	The metaphysical multiverse comedy “Everything Everywhere All at Once” wrapped its hot dog fingers around Hollywood’s top prize Sunday, winning best picture at the 95th Academy Awards, along with awards for Michelle Yeoh, Ke Huy Quan and Jamie Lee Curtis.  https://t.co/WkhYTfjme0 https://t.co/izXVr2CcI0
1635136241263079424	mikefm1946	2023-03-13 04:30:33+00:00	en	After reading the article on Jamie Lee Curtis and what she said in front of the Press, Hollywood is Really F***ed Up, and that includes Curtis.
1635136214952202240	wasimakramtp	2023-03-13 04:30:27+00:00	en	Michelle Yeoh delivers some performance and won best actress, she is the first asian actress to won best actress award meanwhile for the same film Ke Huy Quan wins best supporting actor and Jamie Lee Curtis won best supporting actress. #Oscars
1635136196836999168	happykatyyam	2023-03-13 04:30:23+00:00	en	I’m feeling so proud and emotional to see an #asianwoman win the Best Actress award at the #AcademyAwards Congrats to the entire cast for also winning #bestpicture #bestsupportingactor and also amazing to see @jamieleecurtis win her first #Oscar for #BestSupportingActress 🎉✨🚀
1635121724693020672	VanityFair	2023-03-13 03:32:52+00:00	en	It’s official: Michelle Yeoh is an Academy Award-winning actress. #Oscars https://t.co/tCaF5xe63d
1635136184136417284	CTVVancouver	2023-03-13 04:30:20+00:00	en	Jamie Lee Curtis won the Oscar for best supporting actress for her performance in "Everything Everywhere All at Once."  https://t.co/j1qMKX2jN9
1635136168978440192	thorfernandes	2023-03-13 04:30:16+00:00	en	@jamieleecurtis Congratulations!!✌🏻 ❤️
1635077623528423425	TheAcademy	2023-03-13 00:37:38+00:00	en	You never forget your first. Congratulations to @jamieleecurtis for winning the Oscar for Best Supporting Actress! #Oscars95 https://t.co/hHdUTNhTQW
1635136150846447616	hunterdale6	2023-03-13 04:30:12+00:00	en	I’m happy for Jamie Lee Curtis but Angela Bassett definitely should have won
1635136144714379264	symonelyfy	2023-03-13 04:30:10+00:00	en	@nolpost @IAmMonicaLewis @jamieleecurtis Sad world needing hope from an award show 😂
1635136130516672514	janessaallen	2023-03-13 04:30:07+00:00	en	@msolurin The issue is with the academy. Not Jamie Lee Curtis. Please don’t make it her fault or feel she isn’t deserving, either.
1635136116528648194	12News	2023-03-13 04:30:04+00:00	en	'Everything Everywhere All At Once' dominates Academy Awards winning Best Picture plus awards for Michelle Yeoh, Ke Huy Quan and Jamie Lee Curtis. https://t.co/28Fg8n1K5m
1635136103534706688	rjgreer17	2023-03-13 04:30:01+00:00	en	I think Angela should’ve gotten it because hers was the performance to genuinely left me speechless on first watch. Congrats to Jamie Lee Curtis and she did great as well, but Angela is my pick.
1635080212278022145	starsentmal	2023-03-13 00:47:55+00:00	en	they may not have gotten their oscars today, but that’s why i LOVE tomorrow. https://t.co/eUyTdijsaK
1635136077945249792	Paul_Faurot	2023-03-13 04:29:54+00:00	en	jamie lee curtis was fantastic, it’s just baffling that in any world someone can watch EEAAO and choose her over stephanie hsu
1635136067581124609	beyoncbitch8345	2023-03-13 04:29:52+00:00	en	@PrestonMitchum It’s crazy how people are mad at Angela Bassett for not clapping when Jamie Lee Curtis won but had nothing to say when Jamie Lee Curtis shaded Angela during her Golden Globe speech when she didn’t win https://t.co/agHe1s9MTt
1635136048228610048	HannahBasques	2023-03-13 04:29:47+00:00	en	It’s one thing to want someone else to win, but you people are straight up bullying Jamie Lee Curtis. Touch grass.
1635136039957430272	dsrbroadway	2023-03-13 04:29:45+00:00	en	I hope that Angela Bassett not winning at the #Oscars doesn’t turn into a delegitimization of Jamie Lee Curtis’ career and talent. Internet can take things too far to try and prove a point. They both have long careers and are being valued at the age of 64. Let’s celebrate that.
1635136038392991744	Angelinahhhhhh	2023-03-13 04:29:45+00:00	en	Supposed to be Stephanie's award and you know it too @jamieleecurtis
1635077317667221507	PopBase	2023-03-13 00:36:25+00:00	en	Jamie Lee Curtis wins the Oscar for Best Supporting Actress. #Oscars https://t.co/d3CIATx8YS
1635136036346163204	Nerdy_Model	2023-03-13 04:29:45+00:00	en	1. Stephanie Hsu being out in a supporting actor category when she was a LEAD? Disrespectful.  2. Jamie Lee Curtis’, WINNING, against all to those in that category??? She should’ve given that award right to Stephanie Hsu.
1635136025142910977	WashTimesLocal	2023-03-13 04:29:42+00:00	en	he metaphysical multiverse comedy "Everything Everywhere All at Once" wrapped its hot dog fingers around Hollywood's top prize Sunday, winning best picture at the 95th Academy Awards, along with awards for Michelle Yeoh, Ke Huy Quan and Jamie Lee Curtis. https://t.co/QDijg0NyrW
1635135996445757441	Rae_Dawn_Chong	2023-03-13 04:29:35+00:00	en	@jamieleecurtis Congratulations!!!!
1635135985616035847	Sadik21804847	2023-03-13 04:29:32+00:00	en	jamie lee curtis should not have won
1635135972924071936	Amilliiee	2023-03-13 04:29:29+00:00	en	Full on ugly crying at this. And for Brendan Fraser, Jamie Lee Curtis, and Ke Huy Quan 🥺😭
1635125578574577665	DEADLINE	2023-03-13 03:48:11+00:00	en	Michelle Yeoh wins Best Actress for 'Everything Everywhere All at Once' #Oscars https://t.co/xUZqTOljkA
1635135934747537408	hotsexygirl1861	2023-03-13 04:29:20+00:00	en	jamie lee curtis won the oscar’s because of this picture https://t.co/GGCx8GDiE3
1635135933682192385	H0BI4EVA	2023-03-13 04:29:20+00:00	en	nah cause jamie lee curtis winning that oscar is actually crazy https://t.co/RdtJ5YKcQR
1635135923565506560	LizElkins12	2023-03-13 04:29:18+00:00	en	@BigberthaC @jamieleecurtis @TheAcademy What do you deserve, Bertha.
1635135918888845314	Rae_Dawn_Chong	2023-03-13 04:29:17+00:00	en	@jamieleecurtis Congratulations to the masterpiece that is EEAAO you all deserve this wonderful award season #winningEVERTHING
1635135918435860480	chadullah	2023-03-13 04:29:16+00:00	en	Tar, Banshees and Fablemans winning NOTHING is also insane. Kerry Condon should have one hundred percent won over Jamie Lee Curtis, that was juts appalling imo.
1635135896822640641	harrunson	2023-03-13 04:29:11+00:00	en	Im pretty positive 99% of the  black folks complaining about Jamie Lee Curtis winning over Angela Bassett haven’t even seen Everything Everywhere All At Once
1635135882813644800	MariaCuarezma1	2023-03-13 04:29:08+00:00	en	Very good movie, an exceptional crew,  a great story about immigrant people 👏👏👏#JamieLeeCurtis #MichelleYeoh #KeHuyQuan   “Everything Everywhere All at Once" wins Best Picture at the #Oscars #Oscar2023 #AcademyAward #Oscar2023 https://t.co/V0pL7Uh0gT
1635135876710961155	luv_galore	2023-03-13 04:29:07+00:00	en	ik everyone loves it but istg this movie found me at just the right time and spoke to everything ive been going thru like its so personal to me and for that reason i will be robbing jamie lee curtis’ house and reclaiming stephanie hsu’s oscar
1635124347340984320	DiscussingFilm	2023-03-13 03:43:18+00:00	en	‘EVERYTHING EVERYWHERE ALL AT ONCE’ is the most-awarded #Oscar best picture winner since ‘SLUMDOG MILLIONAIRE’.  See the full winners list: https://t.co/W5iOmTPKi2 https://t.co/cYOunf9XXP
1635135850458537984	MagicPeaceLove	2023-03-13 04:29:00+00:00	en	I can’t be sorry Jamie Lee Curtis won but I would’ve liked to see her co-star Stephanie Hsu take the trophy instead. Hsu’s performance is nothing short of staggering. #Oscars2023 #EEAAO
1635135830712020993	fiercynonym	2023-03-13 04:28:56+00:00	en	i am v excited about the oscars and eeaao wins (except jamie lee curtis sigh) but ALSO today was selection sunday which means the ncaa women's basketball tournament is KICKING OFFFFFFF
1635135803319029760	Fondant_Lover	2023-03-13 04:28:49+00:00	en	THIS IS NOT A DRILL, EEAAO OSCAR SWEEP 🧹 EEAAO SWEEP 🧹  //  a feat of fire-breathing daring. my heart goes out to the Daniels, Michelle Yeoh, Ke Huy Quan, Stephanie Hsu, Jamie Lee Curtis, and all the others involved—thank you for altering my brain chemistry for the better https://t.co/BBwqzYlmb7
1635135791533015046	herlihy_f	2023-03-13 04:28:46+00:00	en	Read "Jamie Lee Curtis Wins Best Supporting Actress Oscar and Thanks Fans Who Supported Her Genre Movies" on SmartNews: https://t.co/sscdJdDDcr #SmartNews
1635135778086088706	shotclock24	2023-03-13 04:28:43+00:00	en	@nypost Was Jamie Lee Curtis even a supporting actor in that movie? What qualifies as supporting?
1635135777918304258	mayqi6	2023-03-13 04:28:43+00:00	en	top gun maverick's sound (woooooosh jets noises!), and the elephant whisperers :) man, EEAAO won everything it was nom'd for, and only lost against itself xD again steph deserved it more imo, but ok fine she's younger n jamie lee curtis was great too + is also a first time winner
1635135772394389505	ch4rlottespeaks	2023-03-13 04:28:42+00:00	en	wtf was jamie lee curtis character’s name even??
1635122318006706179	FilmUpdates	2023-03-13 03:35:14+00:00	en	‘EVERYTHING EVERYWHERE ALL AT ONCE’ takes home seven Academy Awards. #Oscars   • Best Picture • Best Director • Best Original Screenplay • Best Actress • Best Supporting Actor • Best Supporting Actress • Best Film Editing https://t.co/NwZTqsn1OY
1635135755323580418	Melankajai	2023-03-13 04:28:38+00:00	en	Jamie lee Curtis is a good actress but cmon bruh
1635135745710252035	carryzandar	2023-03-13 04:28:35+00:00	en	This time they fucked up 2 awards, 1: not giving Tog gunn best picture  2: giving Jamie lee Curtis best supporting role over any other nominated members.  #Oscar is a fucking bullshit at this point, half of the world doesn't care, other half doesn't know it exists.
1635135730409435136	TotesMcGoats73	2023-03-13 04:28:32+00:00	en	@HollyBriden She look like she peeled Jamie Lee Curtis’s face off and wore it for a mask.
1635135730380046336	mattltsmith	2023-03-13 04:28:32+00:00	en	My biggest Oscars opinions are that Dolly De Leon should have been nominated over Jamie Lee Curtis, let alone Jamie winning, Aftersun should have been nominated for more and won awards, but I'm really happy Everything Everywhere All at Once won big, that is truly incredible.
1635135721458761729	Kuwildan05	2023-03-13 04:28:30+00:00	en	Tbh #StephanieHsu also deserves an Oscar. @jamieleecurtis did and amazing job. That’s why #SupportingActress was really hard to chose just one winner. Literally all the nominees for this category deserved an Oscar.
1635135718594080769	PaxTobiPax	2023-03-13 04:28:29+00:00	en	@BlckBolex I don't know, plenty of folks have said she's bad in the movie for most of the season since she became a heavy favorite/frontrunner - hell, I've said she's pretty bad in the movie. But it's Jamie Lee Curtis, just from a legacy point, the win makes the case.  Besides that tho....
1635135702773161984	Dian2BetterDays	2023-03-13 04:28:25+00:00	en	@kangaroos991 Trading Places. The two actors in this pic are Ralph Bellamy and Don Ameche.   It’s a very funny movie.   Eddie Murphy, Dan Ackroyd, Jamie Lee Curtis also star.
1635135631004434435	BIGFATASSSH	2023-03-13 04:28:08+00:00	en	This was the chicest winner 💜💜💜 @jamieleecurtis! Take that mr.Myers! 🥯🥯🥯🥯🥯🥯🥯🥯🥯🥯 https://t.co/YM1Cmzz00n
1635135630517874688	wateverittakesx	2023-03-13 04:28:08+00:00	en	Congratulations jamie Lee Curtis . #Oscars #EverythingEverywhereAllAtOnce  #EEAAO https://t.co/V5jO9qipGk
1635135610884358145	MARGl3LA	2023-03-13 04:28:03+00:00	en	why did jamie lee curtis win
1635036368756957184	FilmUpdates	2023-03-12 21:53:42+00:00	en	The first category being presented at the #Oscars is Best Supporting Actress. https://t.co/gVOl8iHMl8
1635135610209071106	rayj0e	2023-03-13 04:28:03+00:00	en	@ilyclemmie I am not a jamie lee curtis fan but she rocked it in this role; impressive restrained intensity, her portrayal rang authentic without pause the whole way through; not true for Stephanie Hsu who was very good but her role is not so coherent and a little cliché.
1635135596942487552	DTSantaMonica	2023-03-13 04:28:00+00:00	en	Congratulations to Santa Monica’s own Jamie Lee Curtis on her win tonight!!
1635085526297464832	latimes	2023-03-13 01:09:02+00:00	en	Jamie Lee Curtis takes home the #Oscar for best supporting actress  Follow for updates: https://t.co/hxuR41HRVV https://t.co/mU6iqzww0r
1635135574897217538	syrachg	2023-03-13 04:27:55+00:00	en	gm it’s 4am and i woke up by chance but VERY glad to see everyone i wanted won an oscar aside from jamie lee curtis over stephanie hsu are you fucking kidding me
1635135572846186496	Toteintow	2023-03-13 04:27:54+00:00	en	@bennyjohnson Does Jamie Lee Curtis qualify as trans?  Asking for a friend.
1635135552038277121	NoMoreDramaMa	2023-03-13 04:27:49+00:00	en	Jamie Lee Curtis is a national treasure ❤️
1635086399891447809	TheAcademy	2023-03-13 01:12:30+00:00	en	Jamie Lee Curtis accepts the Oscar for Best Supporting Actress for her performance in 'Everything Everywhere All At Once.' #Oscars95 https://t.co/1H3tJEmgGF
1635135529682604032	70scorleone	2023-03-13 04:27:44+00:00	en	we may have wanted different films and actors to win tonight but MAN did we band together in collective hatred for jamie lee curtis’ underserving performance! https://t.co/KCfdDPw4Zs
1635135497789124609	vcdgf555	2023-03-13 04:27:36+00:00	en	Ke Huy Quan, Brendan Fraser and Jamie Lee Curtis in my news feed.   I love it. https://t.co/pW8k4WOmm2
1635135496472137728	_ysbl_	2023-03-13 04:27:36+00:00	en	jamie lee curtis winning over stephanie is insane
1635135490948231168	chuugiselle	2023-03-13 04:27:35+00:00	en	If Jamie Lee Curtis doesn't clap, it will define as racist. Everything is racist to them
1635109942628880384	nypost	2023-03-13 02:46:03+00:00	en	Angela Bassett doesn’t clap for Jamie Lee Curtis’ oscar win https://t.co/iPwdruo3AY https://t.co/ULxqF7lupo
1635135564226891776	c0wb0ylikeme	2023-03-13 04:27:52+00:00	en	listen I love Jamie lee Curtis but the fact that she won best supporting actress over Stephanie Hsu many times at different award shows is kinda wack…
1635135472585564160	theecaligirl88	2023-03-13 04:27:30+00:00	en	I bet you won’t call Angela an sore loser to her face you white folks are something else ya start talking mess when someone come at you all, Ya start playing victim she doesn’t have clap for Jamie Lee Curtis is doesn’t want to and JLC being a nepo baby is the season she won
1635135451156873218	HAMlLFOX	2023-03-13 04:27:25+00:00	en	michelle yeoh evelyn wang punching jamie lee curtis jlc reaction everything everywhere all at once oscars #Oscars justice for stephanie hsu best supporting actress jobu tupaki joy wang https://t.co/6drD4sHbRr
1635135427589046275	EXCELSlOR_	2023-03-13 04:27:19+00:00	en	I need to know what the fuck Jamie Lee Curtis did to beat this
1635079076934459392	belovasoup	2023-03-13 00:43:24+00:00	en	yall let a white woman walk away with a talented black woman’s award i can’t do this anymore https://t.co/v2bAQ9bx2D
1635135425999425536	SteveBenedict17	2023-03-13 04:27:19+00:00	en	@georgehahn @MuellerSheWrote @jamieleecurtis Christopher Guest’s happiness for his wife was wonderful to watch
1635135422052577281	axre91a	2023-03-13 04:27:18+00:00	en	@Reuters In all honesty, it was a superb performance. Her hot dog fingers really put her over. Congrats! @jamieleecurtis
1635135415232655362	spiderswarz	2023-03-13 04:27:16+00:00	en	#EverythingEverywhereAllAtOnce is one of the greatest films ever made. I am so exceedingly happy right now. AMAZING congratulations to @dunkwun @Daniels Ke Huy Quan, @jamieleecurtis for their wins, but special congratulations to the eternal icon #MichelleYeoh. SO DESERVED!!!! https://t.co/VXUmBHY3U9
1635135384488407040	PinUpGirl81	2023-03-13 04:27:09+00:00	en	Congratulations to Mrs #JamieLeeCurtis and Mrs #MichelleYeoh for winning their 1st Oscar, after spending years proving their talent and versatility as actresses. And congrats to Mrs #RihannaFenty for her 1st Oscar nomination and amazing performance. YOU, LADIES, ROCK!!! 💖🎉 https://t.co/TRVQfbxa4k
1635135376741527552	TariqMueller	2023-03-13 04:27:07+00:00	en	Congrats to an Oscar Overdue @jamieleecurtis Well Deserved! You are all of us!!! https://t.co/SoLmqc8vaF
1635135359523905537	whenlCU	2023-03-13 04:27:03+00:00	en	luv jamie lee curtis but this is sick a sick joke
1635080911271399425	ghostinmypocket	2023-03-13 00:50:42+00:00	en	Can’t believe Stephanie Hsu, who played a depressed immigrant daughter traveling throughout the universe to find a version of her mother who loved her, lost to an irs agent https://t.co/17Eo9G4HQ6
1635135355941965824	Allyseden	2023-03-13 04:27:02+00:00	en	@_secret_angel @TheAcademy @jamieleecurtis Angela Bassett was a poor sport
1635135308055597056	DG_Television	2023-03-13 04:26:51+00:00	en	I couldn't be happier to hear the news of Michelle Yeoh, Brendan Fraser, Jamie Lee Curtis, and Ke Huy Quan winning Oscars tonight. They are wonderful souls who finally had their work pay off.
1635135302431039489	nicharcourt	2023-03-13 04:26:50+00:00	en	@Variety Congratulations and ❤️ to @jamieleecurtis for grabbing an Oscar tonight for her work in @allatoncemovie Check her visit to my @SparkNetwork5 podcast last week where she shared the music of her life and told me they’d already won just by making the movie. https://t.co/eqibgjKvE7
1635135291836231680	EsemonRaymond	2023-03-13 04:26:47+00:00	en	Guess the old white folks weren’t tired of seeing Jamie Lee Curtis in the same role plotting to kill her brother for damn near 50 years.
1635135280645812225	WilliamCobane	2023-03-13 04:26:44+00:00	en	Jamie Lee Curtis Accepts the Oscar for Supporting Actress https://t.co/fhfjbIQ6xu via @YouTube  @jamieleecurtis just won an Oscar!!!  👏👏👏👏👏👏👏👏👏👏👏👏👏👏👏👏👏👏👏👏
1635135274182406144	EAwaah	2023-03-13 04:26:43+00:00	en	Jamie Lee Curtis wasn’t even the best supporting actress in her own movie……  (I promise I actually don’t mind Jamie Lee Curtis at all. Freaky Friday is one of my fave movies haha.)
1635135274136272897	dmerritt9991	2023-03-13 04:26:43+00:00	en	@VampMartinPGH Jamie Lee Curtis is probably the only one I'm actively mad about. Not even the best nominee in that movie
1635135272332713984	karla_newbi	2023-03-13 04:26:42+00:00	en	@Emme0703 Wow really?jamie lee curtis and she writes children’s books
1635135270176825345	modlssss	2023-03-13 04:26:42+00:00	en	Congratulations Jamie Lee Curtis!!! https://t.co/Wb818SAE4c
1635135256570523648	OehleyAngela	2023-03-13 04:26:39+00:00	en	@georgehahn @MuellerSheWrote @jamieleecurtis Amen 🙏.
1635135237264150531	priestess68	2023-03-13 04:26:34+00:00	en	@zajanatural @lilchicklets78 @Phil_Lewis_ And 45 years for Jamie Lee Curtis
1635135219786473473	marianiwiwin	2023-03-13 04:26:30+00:00	en	EEAAO WON??? They won a lot of awards. Woooowwww yeeaaaayyyyyyy!  Not sure about Jamie Lee Curtis winning though.......
1635135203504173057	trashpopsong	2023-03-13 04:26:26+00:00	en	academy award winner and friend of housewife jamie lee curtis
1635135183669297153	SharletWitch	2023-03-13 04:26:21+00:00	en	They really about to make me watch this 24 hour long movie again to figure out where this Oscar winning performance from Jamie Lee Curtis was
1635125956192129026	FilmUpdates	2023-03-13 03:49:41+00:00	en	What was the biggest snub at the #Oscars?
1635135181949644800	OWENTweets3	2023-03-13 04:26:21+00:00	en	Angela Bassett Stays Seated During Jamie Lee Curtis’s 2023 Oscar Win, Despite Standing Ovation https://t.co/XMHiel6TOU
1635135178887806976	birdymusings	2023-03-13 04:26:20+00:00	en	Okay, but tell me why I just realized that was Jamie Lee Curtis 💀
1635135177109409793	CharlotteENVT	2023-03-13 04:26:20+00:00	en	Jamie Lee Curtis is amazing
1635092696791678976	PopCrave	2023-03-13 01:37:32+00:00	en	Jamie Lee Curtis on degendering acting categories at the #Oscars:   "The bigger question is how do you include everyone when there are binary choices, which is very difficult, and as the mother of a trans daughter, I completely understand that." https://t.co/CeaPYifvAG
