1635173840132386816	whitaker_eye	2023-03-13 06:59:58+00:00	en	@ErinMPeyton Jamie Lee Curtis still won and Angela Bassit didn’t lol https://t.co/RJ9JUMzuE7
1635173821182529536	sourdarko	2023-03-13 06:59:53+00:00	en	i lowkey feel bad for jamie lee curtis like not a single soul thinks she deserves that oscar 😭
1635173811158147074	ReconCinemation	2023-03-13 06:59:51+00:00	en	So many #Oscars2023 congrats to send but our first two would be to:  1) our queen @jamieleecurtis for long overdue awards attention  2) College of Santa Fe alumni Paul Rogers for his Best Editing win  These 2, in particular, hit close to home!
1635173806238228483	averieinduma	2023-03-13 06:59:50+00:00	en	@gbennylola Guys guys guys! Yes Angela Bassett and Stephanie hsu were great picks and even I wanted them to win. Yet I still love Jamie lee Curtis as an actress and a person and I’m so  proud and happy for her!
1635173768229421056	VariantGillz	2023-03-13 06:59:41+00:00	en	I think Jamie Lee Curtis deserved that Oscar more than A****a B*****t https://t.co/sl2cXX2yo1
1635173707810480128	malcolm_irvin	2023-03-13 06:59:26+00:00	en	Neither Brendan Fraser nor Jamie Lee Curtis were my picks for their respective categories. But I'm still happy for their wins regardless. #Oscars
1635173702018170881	yunwoosutopia	2023-03-13 06:59:25+00:00	en	Don’t get me wrong i love Jamie Lee Curtis but Stephanie Hsu should have gotten Best Supporting Actress
1635173665146019841	TalkinTent	2023-03-13 06:59:16+00:00	en	Oscars Instant Reactions. Listen Now https://t.co/00xjkv3Kf6  We're talkin' Champagne Carpet fashion, how we did with our predictions and the big winners, 'Everything Everywhere all at Once', Michelle Yeoh, Brendan Fraser, The Daniels, Ke Huy Quan and Jamie Lee Curtis #Oscars
1635173639988592641	Xian_Elder	2023-03-13 06:59:10+00:00	en	@jamieleecurtis CONGRATULATIONS! So happy for you! Hope you’re out enjoying the time of your life at all the parties!  https://t.co/uWShqNgWk9
1635173587350073344	SharkWebs	2023-03-13 06:58:57+00:00	en	Jamie Lee Curtis Wins Best Supporting Actress and Celebrates Oscars Win https://t.co/1GURHu7Sta #JamieLeeCurtis #jamielee #BestSupportingActress
1635173580353974274	TheBogzy	2023-03-13 06:58:56+00:00	en	Did Angela Basset deserve an Oscar? Hell yeah. Did Jamie Lee Curtis deserve it too? Absolutely. Y'all need to watch an entire movie rather than just one scene. I mean i get it, but JLC did her thing. Miss Basset will get hers.
1635173551409098752	rowanstannie	2023-03-13 06:58:49+00:00	en	@auramelk2 i agree that stephanie hsu was robbed but to be so mad at jamie lee curtis like she didn't also perform well is so crazy 😭 she was a great actress two but we know the oscars would've probably given it to jamie just cause
1635173545272819712	PaulTat27451229	2023-03-13 06:58:47+00:00	en	@jamieleecurtis is a Hollywood Legend. Well deserved. Amazing film and her performance was so good
1635079002942754817	SignatureEntUK	2023-03-13 00:43:07+00:00	en	Jamie Lee Curtis thanking her family &amp; the genre fans supporting her 😭  #Oscars #Oscars2023 #Oscars95 https://t.co/G3XsTSCwWr
1635173466436681729	Bird3058	2023-03-13 06:58:29+00:00	en	@zanrowe @jamieleecurtis I LOVE @jamieleecurtis and want to be her when I grow up
1635173372094218240	HazelAzureus	2023-03-13 06:58:06+00:00	en	@cmoneysan jamie lee curtis made everyone buy snake oil yogurt just by subtly talking around saying it may or may not make you poop better, jamie lee curtis deserves an oscar every year
1635173366473826304	africantaloupe	2023-03-13 06:58:05+00:00	en	@gbennylola calling Jamie lee Curtis a random white woman in film is CRAZY 😂😂😂
1635173511210897409	MyLife4Me79	2023-03-13 06:58:39+00:00	en	Jamie Lee Curtis is a good actress but she was not number 1 out of those who were nominated and maybe not even over some of the ones who were not nominated It’s was popularity contest and she has lot of friends who were voting I had Angela Bassett &amp; Stephanie Hsu as my 1 &amp; 2
1635078069735284736	bisexualcrises	2023-03-13 00:39:24+00:00	en	jamie lee curtis winning a fucking OSCAR for her nothing role in EEAAO over stephanie hsu who was the ACTUAL supporting actress and angela basset is fucking racism and a career award that isn't even deserved
1635173290905079808	hcax93	2023-03-13 06:57:47+00:00	en	@samiahsopretty @jamieleecurtis No!!! She had a face on her cause she didn't win
1635173282617122817	SammiSamm_07	2023-03-13 06:57:45+00:00	en	Jamie Lee Curtis everyone..
1635091692322947073	Variety	2023-03-13 01:33:32+00:00	en	Jamie Lee Curtis on degendering acting categories at awards shows: "The bigger question is how do you include everyone when there are binary choices, which is very difficult, and as the mother of a trans daughter, I completely understand that." https://t.co/MP4J1z30Wt https://t.co/S93k6RxKhu
1635173275461623808	Ann_Cda	2023-03-13 06:57:43+00:00	en	@ABC She gave a great speech. The best one as far as I'm concerned, and as much as I'm happy that she won, I was a little surprised that Angela Bassett didn't win. Her performance was on another level. Was she a bit of a sore loser for not applauding Jamie Lee Curtis? Yes, she was.
1635173249603764224	IWLApparel	2023-03-13 06:57:37+00:00	en	Whoever wrote this article can kick rocks.   Oscars 2023: Angela Bassett’s ‘shady’ reaction to Jamie Lee Curtis’ win https://t.co/H3iABtBb8k via @newscomauHQ
1635173225796894720	macrocutre_	2023-03-13 06:57:31+00:00	en	que jamie lee curtis ha ganado un oscar? she OKAAYYYed too hard
1635173108582846464	mrmikeyyoung	2023-03-13 06:57:03+00:00	en	@KadyLio I need to try this one again.  Wasn't quite doing it for me and I'm a massive Michelle Yeoh/Jamie Lee Curtis fanboy.
1635173062948823040	RCAReacts	2023-03-13 06:56:52+00:00	en	#JamieLeeCurtis after the #Oscars: Where’s my car?  Somewhere else: https://t.co/u3KEQ8LPpZ
1635173059777945601	fairyofmiroh	2023-03-13 06:56:52+00:00	en	Ngl these been the Oscars ive cried the most. Ke Huy Quan, Jamie Lee Curtis, Brendan Fraser, Michelle Yeoh, Guillermo del Toro with Pinocchio, Jhon Travolta crying presenting the In Memorial, Ke Huy Quan and Harrison Ford hug ... sea of tears, thats what I am 😭😭😭😭
1635173041067130882	gabby01271	2023-03-13 06:56:47+00:00	en	@willtalksmusic Babylon should’ve won scoring and jamie lee curtis was an oof but close enough.
1635173038240178178	yungwatercycle	2023-03-13 06:56:47+00:00	en	Y’all really shagging Jamie Lee Curtis? Freaky Friday version yeah
1635173026257047558	buckysfa1ry	2023-03-13 06:56:44+00:00	en	people starts to critic jamie lee curtis, please just stfu
1635173024138936321	raggedy_prince	2023-03-13 06:56:43+00:00	en	@Tranarchic „I never thought someone like me would win an Oscar” - Jamie Lee Curtis, daughter of two of the biggest starts of in the history of the film industry
1635173015217635328	ubahs1337	2023-03-13 06:56:41+00:00	en	First Oscars in ever, where hearing some of the winners I'm legitimately happy with the outcomes.  Fraser's return, Everything Everywhere... everywhere,  Yeoh, Quan, Jamie Lee Curtis, del Toro, etc   95 years for an Asian woman to win Best Actress...  Anna May Wong is on quarters
1635172996666228738	cdschilling	2023-03-13 06:56:37+00:00	en	Congratulations to Jamie Lee Curtis for being the first Oscar winner to play Mario Party with the Game Grumps https://t.co/9vNIFJ4Vt1
1635172945856442368	Cultureclub23	2023-03-13 06:56:24+00:00	en	@amyklobuchar @jamieleecurtis Yes. Amazing.
1635172825798676481	demonnshawtyy	2023-03-13 06:55:56+00:00	en	i’m only 20 minutes in to everything everywhere all at once and i’m can’t believe jamie lee curtis won an oscar tonight 😭
1635172791988404226	ShakeLS	2023-03-13 06:55:48+00:00	en	@TheAcademy @jamieleecurtis Shameful how you awarded the weakest performance who also happened to be the white candidate. So obvious. Angela Bassett was so much better and i hope she starts snubbing you from now on. Shameful.
1635172728071401472	ElaineCarman	2023-03-13 06:55:33+00:00	en	@jamieleecurtis reaction to winning an oscar is the best thing ever. So happy she finally got one!! #Oscars95 #Oscar2023
1635172717141053440	AngelaK8x	2023-03-13 06:55:30+00:00	en	👏🏼 @jamieleecurtis deserves the world. As a huge Halloween movie fan, I have loved her for years. To see her win her first Oscar &amp; her speech.. so inspiring. So happy for her. 💕
1635172654461378560	loversmcadams	2023-03-13 06:55:15+00:00	en	in what fucking world did jamie lee curtis deliver a better performance than stephanie hsu ?????
1635172597079117828	GoatyG	2023-03-13 06:55:01+00:00	en	Massive well done to Ke Huy Quan, Brendan Fraser, Michelle Yeoh and Jamie Lee Curtis! Their comebacks is so great!
1635172594512191489	rajatjain2590	2023-03-13 06:55:01+00:00	en	@SpencerAlthouse Even Jamie Lee Curtis was not expecting her win
1635172594461835266	Valderrama_CP	2023-03-13 06:55:01+00:00	en	Michelle Yeoh, Jamie Lee Curtis, Ke Huy Quan and Brendan Fraser.  What a world.
1635172565332402176	bdub7272727272	2023-03-13 06:54:54+00:00	en	@brooklynrwhite JAMIE LEE CURTIS....THE REAL WHITE QUEEN
1635172511691444225	archivesofjames	2023-03-13 06:54:41+00:00	en	Wow, congrats Michelle Yeoh, Ke Huy Quan, Jamie Lee Curtis and everyone involved with Everything Everywhere All At Once! #Oscar
1635172499305697288	fabricius91	2023-03-13 06:54:38+00:00	en	I am happy for #JamieLeeCurtis and her #Oscar win but at the same time it most likely should have gone to #StephanieHsu. Hopefully &amp; I hope she does, Stephanie gets a future nomination for a new film &amp; comes back to the #Oscars &amp; wins it. I really hope she gets another chance
1635172494855540740	AndyWatkins38	2023-03-13 06:54:37+00:00	en	#EEAAO winning big at the Oscars is massively deserved. It's brilliant 👏 #Oscars95 #JamieLeeCurtis #MichelleYeoh #KeHuyQuan #Daniels
1635172440988078081	Darren_Mooney	2023-03-13 06:54:24+00:00	en	But, yeah, impressed at how thorough the sweep was for “Everything Everywhere All At Once”, right down to Best Original Screenplay and Best Supporting Actress.  It’s strange to think that was Jamie Lee Curtis’ first Oscar nomination. But it was long overdue. https://t.co/Cdx80Nc2Q7
1635172389079351296	moonsongwh0r3	2023-03-13 06:54:12+00:00	en	leaving jamie lee curtis’s house with the oscar up my ass on my way to deliver it to angela bassett  https://t.co/xZopjdVX5E
1635172383953911810	hcax93	2023-03-13 06:54:11+00:00	en	All hail @jamieleecurtis 👏🏆 @TheAcademy #Oscars95 https://t.co/DihkRiWR91
1635172324193472518	WestenP1ggy	2023-03-13 06:53:56+00:00	en	@willtalksmusic i respected every winner except jamie lee curtis. she shouldn’t have been nominated and the 4 other actresses were better and it’s kind of weird giving the mediocre white woman an award from a asian cast movie. but oh well it can’t be perfect
1635172276529422336	MD_born	2023-03-13 06:53:45+00:00	en	Jamie Lee Curtis winning that Oscar over Angela Bassett feels a lot like the recent episode of Abbott Elementary - where they all voted for Mr. Johnson to get those 76ers tickets… #IYKYK
1635172169759195136	gnarlyjester	2023-03-13 06:53:19+00:00	en	I wanna meet Jamie Lee Curtis at least once in my lifetime
1635172142672384000	ADAdamsJr1	2023-03-13 06:53:13+00:00	en	Watch the video of Jamie Lee Curtis getting her Oscar! She mouths "Shut up! Oh My God!" Congrats to her and the rest of Everything Everywhere All At Once!
1635172111290441728	iYousif	2023-03-13 06:53:06+00:00	en	Best Supporting Actor - Ke Huy Quan Best Supporting Actress - Jamie Lee Curtis Best Original Screenplay - Daniel Kwan & Daniel Scheinert Best Film editing - “Everything Everywhere All at Once” Best director - Daniel Kwan, Daniel Scheinert Best Actress - Michelle Yeoh Best Picture - “Everything Everywhere All at Once”
1618861587691106304	iYousif	2023-01-27 06:40:54+00:00	en	Quote with the movie name you think this is applies to.. https://t.co/KTEMHCXSoH
1635172108543352833	cali_for_clancy	2023-03-13 06:53:05+00:00	en	NOBODY TOLD ME JANET LEIGH WAS JAMIE LEE CURTIS’ MOM?!!!?!?!!?? HELLO
1635172091912945665	OfficialTracieB	2023-03-13 06:53:01+00:00	en	@jamesbutler76 @TheAcademy @jamieleecurtis Ah thanks . Good to clear things up! I was confused and wondered why she would not go to ceremony! Thanks.
1635172068508696576	mr_person95	2023-03-13 06:52:55+00:00	en	I love Jamie Lee Curtis as an actress but goddamn Angela Basset got snubbed hard. While Curtis wasn’t bad in Everything Everywhere, Basset put so much raw emotion into her performance in Wakanda Forever. It really just felt like a legacy award.
1635172010623123457	goddamndorothea	2023-03-13 06:52:42+00:00	en	the oscars went wow we really enjoyed this weird multiverse movie centering an asian immigrant family with a lesbian daughter who has a complicated relationship with her mother, so let's give an oscar to jamie lee curtis
1635171988317814789	BigHairBrawler	2023-03-13 06:52:36+00:00	en	@Xswezzy8 @MarAbh999 Jamie lee curtis being as dry as the fucking mojave
1635171973373501441	JasonRevington	2023-03-13 06:52:33+00:00	en	@PhilDL616 I agree. I love Jamie Lee Curtis but she didn't deserve it for this one.  Angela fully should have won.  I watched every film nominated and I think Angela killed it in her role. Honestly if Angela didn't win I would say the other woman from Everything Everywhere All At once did.
1635171887214133249	hcax93	2023-03-13 06:52:12+00:00	en	@samiahsopretty @jamieleecurtis Who said anything about looks?
1635171822990929920	angie_wxw	2023-03-13 06:51:57+00:00	en	need jamie lee curtis to give that oscar back rn !
1635171788744429568	theapostleXIII	2023-03-13 06:51:49+00:00	en	@KolaBoof3 @TarPitKing @wolverine49007 @jamieleecurtis @TheAcademy CRT is not black history. It’s fictional neo-activist theory.  You already have 100% voting rights.  Any woman who wants an abortion can get one.  Trump nor the Proud Boys hold any “racist positions”. National sovereignty and standing up to ANTIFA radicals isn’t “racism”.
1635171764060983297	hesjustniceee	2023-03-13 06:51:43+00:00	en	Jamie Lee Curtis in this pic https://t.co/AjDuYaAWYL
1635142675459633155	ZoeRoseBryant	2023-03-13 04:56:07+00:00	en	They may not all be your “personal picks,” but one thing I *do* love about this year’s acting winners quartet at the #Oscars is how they’re all actors who have been counted out - or shut out - at various points in their careers and came back against the odds to come out on top. https://t.co/oQnOAe5yMh
1635171748558819330	D_ndamagi	2023-03-13 06:51:39+00:00	en	And no shade to Jamie Lee Curtis for her role in #EverythingEverywhereAllAtOnce but it really seemed like she was not that much of a supporting artist as much as she just had more screentime but not much power in the plot. Almost doing a favor being in the movie. SMH anyways.
1635171721664954370	Focus5659	2023-03-13 06:51:33+00:00	en	@jamieleecurtis congratulations 🎊🎈🍾🎉 and one love ❤️ from me here in Detroit!
1635171691713413120	someweirdkiddoo	2023-03-13 06:51:25+00:00	en	Jamie lee Curtis winning that Oscar was foul
1635171664538505218	Cerael11	2023-03-13 06:51:19+00:00	en	@ilyclemmie Jamie Lee Curtis still acts? I remember her from 'Trading Places'. Anyway, let her have her wins
1635171655696945153	quidprojlo	2023-03-13 06:51:17+00:00	en	Which is not all bad! That means no more wins like Polanski for Directing. I think it also comes with some post hoc rationalization, however. Did Jamie Lee Curtis really have the best performance in that category or the most deserving legacy? Doubtful, but she was a campaign face
1635171537014894592	LBabinchak10	2023-03-13 06:50:49+00:00	en	@TheAcademy @jamieleecurtis So Jamie Lee Curtis having sausage fingers and an ironic fupa is somehow better than Kerry Condon giving the performance of the year?
1635171519252029442	acapulco_denver	2023-03-13 06:50:44+00:00	en	jamie lee curtis bought her oscar, she wasn’t even the best supporting actress in that movie
1635171507751260160	CosplaySolo	2023-03-13 06:50:42+00:00	en	@YellowFlashGuy https://t.co/AJwmfmsFyI - Jamie Lee Curtis wanting gender neutral awards
1635171504043491328	dlwms_	2023-03-13 06:50:41+00:00	en	kinda feel bad for my girl JamieLeeCurtis😕
1635171446094716928	boblister_poole	2023-03-13 06:50:27+00:00	en	Everything Everywhere All At Once rules the Academy Awards with SEVEN wins! Michelle Yeoh, Ke Huy Quan, Jamie Lee Curtis scoop Oscars and earns Best Picture... while comeback king Brendan... via https://t.co/4N6UmtO8sD https://t.co/tn7bM1E3KN
1635171419784101890	lesbianlexie	2023-03-13 06:50:21+00:00	en	jamie lee curtis over stephanie hsu is so unserious
1635171370907889664	AdamSamue1	2023-03-13 06:50:09+00:00	en	Kind of assumed Stephanie Hsu won best supporting actress....Stephanie Hsu not winning reeks in the same way as Danielle Deadwyler not getting a best actress nomination. Jamie Lee Curtis wasn't bad, but come on man 🤣😭 #Oscars95
1635171350259306497	HackBlackburn	2023-03-13 06:50:04+00:00	en	Everything Everywhere has been over-rewarded, but it was impossible not to punch the air at the news of #Oscars for Michelle Yeoh and Jamie Lee Curtis
1635171299344683009	yulyeah	2023-03-13 06:49:52+00:00	en	@MoonlightMai i’m sorry the fact that jamie lee curtis won an oscar before amy adams is so 😭
1635171241568108545	step4battle	2023-03-13 06:49:38+00:00	en	I like Jamie Lee Curtis and Everywhere AAO, but Lord knows the IRS agent was not supposed to win over the Mother of Wakanda and T'achalla, Angela Bassett. I'm certain the Oscars are working on a "we sorry we focked up" honorary trophy as we speak. #Oscars  #Oscar2023
1635171234517491712	Leese12	2023-03-13 06:49:36+00:00	en	@jamieleecurtis FANTASTIC GIRL 💪💖 long overdue 👏👏👏MASSIVE CONGRATULATIONS “YOU WON AN OSCAR “ 🏆 So much love for you well done. #Oscar https://t.co/8cTHzL5I91
1635171233594765317	mrfatgoatman	2023-03-13 06:49:36+00:00	en	woke up this morning remembered that jamie lee curtis won best supporting actress and immediately wanted to kill myself
1635171225864638467	Yolliex	2023-03-13 06:49:34+00:00	en	@jamieleecurtis @TheAcademy Congrats with winning the Oscar finally💪😃
1635171185314111488	MrsStephinMerit	2023-03-13 06:49:25+00:00	en	@ilyclemmie @EmpGonzo Stephanie is 32 and Jamie Lee Curtis is 64, and has been working and a part of our lives since 1978, which is as long as I've been alive. So, literally a lifetime. She's paid her dues, she got an award. That's the whole thing.  It is literally a popularity contest.
1635171180335480833	CCCAW_	2023-03-13 06:49:24+00:00	en	Angela Bassett could’ve played Jamie Lee Curtis role, but Jamie Lee Curtis couldn’t had played the Queen of Wakanda. #Oscars
1635171137989799936	babylegsss	2023-03-13 06:49:13+00:00	en	Jamie Lee Curtis won ¿
1635171095073677312	Akshay4059	2023-03-13 06:49:03+00:00	en	🚨Oscar 2023: Jamie Lee Curtis wins her first Oscar for the 'Best Supporting Actress' for her performance in 'Everything Everywhere All At Once'. #EverythingEverywhereAllAtOnce #JamieLeeCurtis #BestSupportingActress #Oscar #Oscar2023 #MichelleYeoh #KeHuyQuan https://t.co/3PZXQ66j8w
1635171035460026372	koowoos	2023-03-13 06:48:49+00:00	en	aight i'm coming clean i remembered jamie lee curtis' freaky friday hairdo when i saw woo cut his hair haha
1635079676178874373	lohanisgod	2023-03-13 00:45:47+00:00	en	AN OSCAR WINNER https://t.co/2xYcCf5sZY
1635171028250013697	julip8dri	2023-03-13 06:48:47+00:00	en	Jamie lee Curtis should’ve declined that Oscar. IDC. https://t.co/KFZutpQ2B2
1635171022738714626	GreekGoddess66	2023-03-13 06:48:46+00:00	en	I think what was good at the #Oscarswere  this year was an appreciation for older actors. Judd Hirch, 87 Jamie Lee Curtis 64 and Michelle Yeoh 60. Two of which won.
1635170946654027778	zia_tiffah	2023-03-13 06:48:28+00:00	en	Jamie Lee Curtis over Stephanie Hsu AND Angela Bassett??? i've never seen a bigger joke in my life
1635170921236529153	sandravets	2023-03-13 06:48:22+00:00	en	@jamieleecurtis @TheAcademy Congrats!!! So amazing ❤️❤️❤️ https://t.co/3ObzobO6uE
1635170905365286912	BellKaleb	2023-03-13 06:48:18+00:00	en	Once I find that tiebreaker that chose Jamie lee Curtis over Angela Bassett https://t.co/eOiN9uqekJ
1635170860687585282	babydr1ver	2023-03-13 06:48:07+00:00	en	i thought the academy would have some good sense this time and give anyone but jamie lee curtis the oscar but alas
1635170819461771268	akstanwyck	2023-03-13 06:47:58+00:00	en	Jamie Lee Curtis Calls for Gender Parity at the Oscars: ‘More Women Anywhere, Anytime, All at Once’ https://t.co/HF9Rsa49P3 via @indiewire
1635170784405770240	MusicOfPlus	2023-03-13 06:47:49+00:00	en	Hugest congratulations to @Daniels, Michelle Yeoh, Ke Huy Quan, and @jamieleecurtis!!! My work doesn't hold a candle to what you all have accomplished, but I can't help but be inspired by your endless creativity and joy.  #EverythingEverywhereAllAtOnce @A24
1550641489679728640	MusicOfPlus	2022-07-23 00:38:35+00:00	en	Link: https://t.co/NXMNU1WDbT  My newest remix of @Daniels' film "Everything Everywhere All At Once" is on YT now in full 4K glory! It was a labor of love, so if you could spare some time to give it a listen it would be greatly appreciated!  #EverythingEverywhereAllAtOnce https://t.co/cviOUk5YNN
1635170581372084224	ricky_polite	2023-03-13 06:47:01+00:00	en	The Academy needs to stop treating Supporting Acting Awards as Career Achievement Awards and just salute certain actors while they are Alive. Not just a Lifetime Achievement but Box Office Heroes and Fan Favorite. Because that's what Jamie Lee Curtis is ... https://t.co/rFjhJxNXVZ
1635170580050882560	tiplo66	2023-03-13 06:47:00+00:00	en	💖 JAMIE LEE CURTIS...we love U 🏆 #oscars #iconic #movies #Hollywood #cinema  👏👏👏👏👏👏👏👏👏👏👏👏👏👏
1635080018689921024	mrswestvicent	2023-03-13 00:47:09+00:00	es	Para mi Jamie Lee Curtis ya merecía el #Oscars desde esta escena iconica.  https://t.co/jnGlq9qvRH
1635170548044173315	MonTrice_Author	2023-03-13 06:46:53+00:00	en	@chrispaulHOF @SpencerAlthouse Let’s be clear, Angela Bassett didn’t DO anything to Jamie Lee Curtis. She didn’t say a word or leave her seat. She’s sitting there minding her business processing what’s happening.
1635170358801186817	gala	2023-03-13 06:46:08+00:00	en	Doppelsieg bei den Oscars! Ke Huy Quan und Jamie Lee Curtis aus "Everything Everywhere All at Once" sind die besten Nebendarsteller. https://t.co/jIBeJNkbWK https://t.co/nPdqkJ4boN
1635170358063153152	chainer2111	2023-03-13 06:46:08+00:00	en	@Crapgame13 Also seeing Jamie Lee Curtis win her first ever Oscar, she too like Yeoh is one of my Top 5 actresses ever. She should have gotten one for True Lies decades ago.  I never expected EEAAO to demolish every single movie that went up against it. It was never close lol
1635170355227807748	awesomestfriend	2023-03-13 06:46:07+00:00	en	Why are people being mean to Jamie lee Curtis
1635170310843686912	preachersofcain	2023-03-13 06:45:56+00:00	en	this jamie lee curtis ass dress 😭😭😭 but shes motherr
1635158048544284673	21metgala	2023-03-13 05:57:13+00:00	en	Halsey attends the 2023 Vanity Fair Oscar Party. #Oscars https://t.co/IGgiDga30s
1635170269693382658	RPGmaniac05	2023-03-13 06:45:46+00:00	en	So apparently (I was at work so I missed all the awards) Stephanie Hsu was nominated for best supporting actress but lost to Jamie Lee Curtis?! Listen I love Jamie but like if anyone from that movie should have gotten best supporting, it should've been Hsu.
1635170232410202112	gptjerrry	2023-03-13 06:45:38+00:00	en	@cryptoafterdark Jamie Lee Curtis is an American actress, author, and activist. She is best known for her roles in horror films such as Halloween (1978) and Prom Night (1980), as well as
1635170183953420288	OfficialSnowtv	2023-03-13 06:45:26+00:00	en	Angela Bassett's reaction after losing Best Supporting Actress Oscar to Jamie Lee Curtis goes viral as fans say she was robbed of award https://t.co/5srasYnSaT
1635170043150622720	Nuclear_Joe	2023-03-13 06:44:52+00:00	en	@amyklobuchar @jamieleecurtis Did you share a comb to eat your salad?
1635170003233406976	darwin_derby	2023-03-13 06:44:43+00:00	en	@COBBTIMUS_PRIME @Schaffrillas I think 99% of her win was "Hey, it's probably about time that Jamie Lee Curtis gets an Oscar" and not "Hey, Jamie Lee Curtis was really great in this film, she deserves an Oscar for this performance specifically"
1635169985571209216	childishrafino	2023-03-13 06:44:39+00:00	en	Michelle Yeoh, Brandan Fraser, Ke Huy Quan, Jamie Lee Curtis. A triumph for 80s-early 00s cinema. 👏🏆#Oscars
1635169958421471235	needledesign	2023-03-13 06:44:32+00:00	en	Congrats Michelle Yeoh &amp; Jamie Lee Curtis. Long overdue in both cases https://t.co/lFCOS4B06z
1635169928864215042	faidieeee	2023-03-13 06:44:25+00:00	en	@tarIungs Jamie lee Curtis was in that movie for 6 fucking minutes. Stephanie was the literal heart of the story and it would not have worked at all without her and she’s been snubbed at every turn. Even if it wasn’t Stephanie why would Angela Bassett not win instead
1635169926687363073	paulambristol	2023-03-13 06:44:25+00:00	en	@Bama0571 @jamieleecurtis Disappointing behavior from Ms Basset. Unprofessional, poor sportsmanship
1635169861600182273	hachisworId	2023-03-13 06:44:09+00:00	en	@imnotbjork like i love jamie lee curtis but they were incomparable and the white person in a movie abt asian immigrants winning is just fucking crazy ????
1635169824719671301	whitedaisylacy	2023-03-13 06:44:00+00:00	en	JAMIE LEE CURTIS WINNING OVER ANGELA BASSET AND STEPHANIE HSU  https://t.co/1LO5SH9fTl
