1635512526338154496	LunarSkye	2023-03-14 05:25:47+00:00	en	Michelle Yeoh specifically said "LADIES, don't let anybody tell you you're ever past your prime" in her #Oscars acceptance speech &amp; SBS News edited it out. Wish I could say I'm surprised but we've seen countless examples of ageism &amp; misogyny in the Korean entertainment industry.
1635512434449616896	ComicsLord	2023-03-14 05:25:25+00:00	en	Extremely proud of our Tan Sri Michelle Yeoh. It's a moment to celebrate and be happy for.
1635271448003739653	faizalhamssin	2023-03-13 13:27:49+00:00	en	Michelle Yeoh proudly proclaims herself an Ipoh girl every opportunity she’s got. She has never concealed the fact she’s M’sian. She’s promoted M’sian gastronomy. She loves curry mee.  She just won big, so it’s natural when M’sian feel happy for her. We carry the same passport.
1635512378409340929	Eaoghan	2023-03-14 05:25:12+00:00	en	@theobromic_ "The empty hands" Spielber has won three and been nominated 22 times, Blanchett already has two Oscars and eight nominations. Michelle Yeoh and the Daniels were nominated and won for the first time. Gotta love how they seem to forget that when "calling out bias"...
1635512364794540033	palmerlils	2023-03-14 05:25:08+00:00	en	Why is everyone so mean to Michelle Yeoh what the actual fuck
1635512363347767299	EllaTheMisfit	2023-03-14 05:25:08+00:00	en	I DIDN'T KNOW MICHELLE YEOH IS SOUTHEAST ASIAN!!!!! WHAT!!!!
1635512360688398337	Harden_TF_Up	2023-03-14 05:25:07+00:00	en	@FruitSaladAni @MCU_Direct @MichelleYeoh_FP @shangchi @MarvelStudios @DisneyPlus Twice actually… she cameo’d as a Ravager in GOTG Vol. 2, then later played a pivotal role in Shang-Chi.
1635512351888916483	JimCanOps	2023-03-14 05:25:05+00:00	en	Olivia de Haviland &amp; her sister Joan Fontaine my have had some Asian blood having both been supposedly born in Tokyo. As to those giving NPR guff hat is their source. Wikipedia lists Michelle Yeoh as having been born in Malaysia to Malay-Chinese parents.
1635512213594054657	imacryptopotato	2023-03-14 05:24:32+00:00	en	Such an inspiring quote from #michelleyeoh “Ladies, don’t let anybody tell you you’re ever past your prime” 🫶🏻  #Oscar #Oscar2023 https://t.co/UPpu7djOkw
1635272687215071234	loveisopentoeic	2023-03-13 13:32:45+00:00	ko	sbs뉴스 양자경 수상한거 보도하는데 “여성분들에게”라고 한 거 싹 잘라먹고 내보낸 거 봐 ㅋㅋㅋ 진짜 개띠껍다 https://t.co/kV2UFfgyqI
1635512169164058625	andybates	2023-03-14 05:24:22+00:00	en	@victoriaying When Michelle Yeoh started acting in America, she was credited as “Michelle Kwan” because they thought “Yeoh” would be too hard for Americans to pronounce. Never underestimate how badly people can mess up a name.
1635512156476297218	brkjkjk	2023-03-14 05:24:19+00:00	en	I personally love the moment like this. Jamie Lee Curtis &amp; Michelle Yeoh 💕 It's such a perfect timeling, emotional and movement from both of them.   So lovely. 🫰😘🫶♥️🤩  ©a24  ©michelleyeoh_official https://t.co/p7lfDaYPgm
1760624160869585105	honkaistarrail	2024-02-22 11:14:45+00:00	en	✨Over 100 million downloads across all platforms!✨ 🎁New players can get up to 80 free pulls!🎁 💥Play Honkai: Star Rail now!💥
1635512139413872640	Jonathan_Conley	2023-03-14 05:24:15+00:00	en	Michelle #SheIsAsian Yeoh + Cynthia Rothrock: Origins  'Yes, Madam!' (1985)   This should have won an Oscar. Easily one of the best HK action movies ever, brought to us by film producer Dickson Poon (real name), who would go on to marry the Perfect '80s Babe, Michelle Yeoh. https://t.co/vLAeK6udE7
1635507090356850688	Jonathan_Conley	2023-03-14 05:04:11+00:00	en	@MarmotRespecter @ElectionLegal This is the first not-even-two-minutes of 'Yes, Madam!', both Cynthia Rothrock and Michelle Yeoh's first starring roles in a feature film: https://t.co/3ZPwDzJLOv
1635511965761130498	KTCityTimes	2023-03-14 05:23:33+00:00	en	#MichelleYeoh’s mother cried for joy for her “little princess” when the Malaysian performer became the first Asian to win the best actress #Oscar  https://t.co/MIHWc4nKK0
1635511959205429248	carlsl	2023-03-14 05:23:32+00:00	en	@gabeysena @davidtweeet @BrendanFraserBR @MichelleYeoh Top Day Pastor
1635511783929544704	0ok	2023-03-14 05:22:50+00:00	en	Biden Urges Calm as Feds Auction SVB | Pence Takes Shots at T**** | Michelle Yeoh Makes History https://t.co/ctGeaTXE0G  &lt;via @YouTube - The Late Show with Stephen Colbert&gt;
1635511767513325568	melekmedia	2023-03-14 05:22:46+00:00	en	Jackie Chan told Michelle Yeoh he was offered Everything Everywhere role first   https://t.co/LEMHRy0EiK
1635511697548120066	OneShoup	2023-03-14 05:22:29+00:00	en	Michelle Yeoh's first Husband, Dickson Poon, was the producer of her first film. The last film his company produces was "Black Cat II: Assassination of President Yeltsin" (1992) which damn that is a title. They really do seem to involve President Yeltsin? https://t.co/QltaZQEFDa
1635511580367659008	QUEENightingale	2023-03-14 05:22:01+00:00	en	@1AmyChew An Oscar to her credentials. It does not get better than this. Tahniah to Michelle Yeoh, we're proud and happy for you!
1635511147662290944	yoodoMY	2023-03-14 05:20:18+00:00	en	To celebrate Tan Sri Michelle Yeoh’s big win for #Oscars  , we want to extend the celebration  by rewarding 5 lucky tweets to watch #EverythingEverywhereAllAtOnce on us! Reply this tweet with 👀 and #yoodo 💜 1, 2, GO! https://t.co/XTMQtkM3ZM
1747371174353363355	VisualChase	2024-01-16 21:32:07+00:00	en	We’re so used to having our expectations shattered by reality, but these lucky people got it just right.
1635511129530322945	freemostafizur	2023-03-14 05:20:14+00:00	en	Advanced Level Google Ads Create Setup manage and Optimize  My Service Link: https://t.co/2Ul4odGB2e  #Canada #WWE2K23 #Butter #Klay #TreyLyles #google #CEO #owner #founder #businessowner #Datpiff #realestate #president #Googleads #Oscars #JUNOS #EEAAO #KeHuyQuan #MichelleYeoh https://t.co/45NZb04NXt
1635510933299826689	timlim12	2023-03-14 05:19:27+00:00	en	Hahaha, of coz Michelle Yeoh’s mum wasn’t like that.. but.. got point…  #TikTok https://t.co/Og2OJuzL3X
1635510875636350984	PureYTEntertai1	2023-03-14 05:19:13+00:00	en	@VanessaNguyen28 Michelle Yeoh has been underrated in Hollywood for too long. She should have had an Oscar many, many times over. Happy for her!
1635510863674351616	Vialconica	2023-03-14 05:19:10+00:00	en	For this alone Michelle Yeoh’s Oscar was way overdue
1635510827473154050	lizzysoceanblvd	2023-03-14 05:19:02+00:00	en	try not to say mother challenge !!!! #Oscars #EEAAO #jaimeleecurtis #michelleyeoh https://t.co/4SuBRz798Y
1635510703388860416	teamsmithy	2023-03-14 05:18:32+00:00	en	@jamiesmart I made a joke that you should recreate Michelle Yeoh's famous stunt from Police Story 3 and got suspended for 12 hours. https://t.co/eZ52LbtBrI
1635510556265267200	xenocryptsite	2023-03-14 05:17:57+00:00	en	It's literally Michelle Yeoh vs. Rupert Murdoch, seems perpetually ripe for rediscovery.
1635510532219498497	dean_frey	2023-03-14 05:17:51+00:00	en	Mark Seliger's photographs from yesterday's Vanity Fair Oscars party are wonderful. Some of my favourites: Michelle Yeoh, Ke Huy Quan https://t.co/dKYZOlI5nh
1635510434542526464	mussixlover	2023-03-14 05:17:28+00:00	en	@mrbrianrowe Your tweet cheering Michelle Yeoh was the highlight of last night's oscar!
1635510400614649858	zachbmarsh	2023-03-14 05:17:20+00:00	en	Never forget that the same people who spent all of awards season dying on the hill of "Michelle Yeoh shouldn't get an Oscar over Cate Blanchett just because it's her time" immediately pivoted to "EEAAO shouldn't have swept because all these other films went home empty-handed"
1748208666044735727	airproducts	2024-01-19 05:00:00+00:00	en	Let us help you navigate the complexities of decarbonization with safe and reliable solutions.
1635510321250029569	langleysoryu666	2023-03-14 05:17:01+00:00	en	WHY MICHELLE YEOH IS WHITE ~ a thread!! https://t.co/WQxvdrlKE6
1635510066039357440	laavanyaaaaa8	2023-03-14 05:16:00+00:00	en	Michelle Yeoh won Oscar because she left Malaysia. Just saying. 😌
1753595408197005355	Shopify	2024-02-03 01:45:00+00:00	en	🚨 Shopify’s latest Edition is here 🚨  It's time for our bi-annual product drop showcasing updates across Shopify to help merchants scale and grow their businesses.   Even more reasons why you should start your free trial today!
1635510252765581313	tessuhhhhh	2023-03-14 05:16:45+00:00	en	Now that Michelle Yeoh has won the Oscar, cue everyone who has ever met her everywhere, posting their encounters with her all at once.
1635510293265788928	ConversationIDN	2023-03-14 05:16:54+00:00	en	Kalau kata Bunda Michelle Yeoh:  "Ladies, don’t let anybody tell you that you are ever past time your prime."  https://t.co/gyJ88QK7Hi https://t.co/iLetTgcd4W
1635510061903540225	Mashable_ME	2023-03-14 05:15:59+00:00	en	Her mother's 'little princess' has made her 'proud'.  https://t.co/MHEKH6DpaK  #MichelleYeoh #Oscars #janetyeoh #EverythingEverywhereAllAtOnce
1635510030622683136	irfannntrey5	2023-03-14 05:15:52+00:00	en	just because my goat is cristiano I can't congratulate Messi's world cup achievement??literally the biggest event of sport?sama gak cam Tan Sri michelle yeoh,just bcs I don't support any lgbtq ideologies doesn't meant I can't congratulate her for winning the biggest price??idiots
1744356782582185997	CoinDesk	2024-01-08 13:54:00+00:00	en	Consensus 2024 by CoinDesk is the biggest and most established global hub for everything crypto, blockchain and Web3.
1635509581219766272	trippybear	2023-03-14 05:14:05+00:00	en	@ESPNF1 If that blows y'all's mind, Michelle Yeoh also use to babysit/play with Mick Schumacher. (He also reposted this picture on his insta stories.) 🤷🏻‍♀️
1635509478555783168	chinaorgcn	2023-03-14 05:13:40+00:00	en	Michelle Yeoh, an iconic name in Chinese cinema, made history on Sunday night by becoming the first Asian woman to win the Academy Award for best actress. https://t.co/BAna4ebJeA https://t.co/ELYpehHDFE
1635509288495124480	pheebkat	2023-03-14 05:12:55+00:00	en	I’ve been in love w/ Michelle Yeoh since I first laid 👀 on her in Supercop. Her performance in Crouching Tiger, Hidden Dragon took my breath away. Like my mother, Michelle is a bad-ass bish who is kind and full of grace.  Women contain multitudes despite what the 🌍 tells us. ❤️‍🔥
1635509263685541888	KittyPo80176717	2023-03-14 05:12:49+00:00	en	Sarawak Report writes about Michelle Yeoh and the Najib connection. *Yeoh is a daughter of privilege whose father was a politically connected businessman and MCA official who embraced the corrupted BN regime.  https://t.co/5cgWcFMOUY
1718921555462516780	OnyxBoox	2023-10-30 09:23:29+00:00	en	🤖Aided by our latest AI features, you can draw perfect shapes and remove unwanted notes with one easy stroke. Manage your ideas and unleash your imagination in a smarter way with #NoteAir3C now.
1635508963713089537	wainainalex	2023-03-14 05:11:37+00:00	en	@FlanneryWynn @DeanMiller1978 @SweetieWalker @etnow You're shifting goal posts by talking about people of mixed race😅. The discussion was about Michelle Yeoh - a South Asian woman who is Not of mixed race 🤷🏽‍♂️; so Logically speaking going by your argument there is no go-to race to "identify" as.
1635508886353395712	inquirerdotnet	2023-03-14 05:11:19+00:00	en	Datin Janet Yeoh was ecstatic when her daughter Michelle Yeoh was announced Best Actress at the 95th Academy Awards. | @AsiaNewsNetwork https://t.co/CZbY0Xi2IN
1635508770632613888	GennadyPodolsky	2023-03-14 05:10:51+00:00	en	"Michelle Yeoh: The Crisis That Changed My Life 8 Years Ago Keeps Happening" by Michelle Yeoh via NYT https://t.co/NFwxAmJrnt
1635508760029323265	StandWithMarco_	2023-03-14 05:10:49+00:00	en	#News via #NYT by Michelle Yeoh "Michelle Yeoh: The Crisis That Changed My Life 8 Years Ago Keeps Happening" https://t.co/tq0QjQgD4F https://t.co/9mbBKhDNnY
1635508751519080449	noname88noname1	2023-03-14 05:10:47+00:00	en	@ZoeRoseBryant If Michelle Yeoh was the heart of that movie, Stephanie was the lungs— she was a breath of fresh air and would’ve died without her
1635508633839730689	karlkwin	2023-03-14 05:10:19+00:00	en	Look, I'm not going to pretend this is anything more than it is. But Michelle Yeoh's Australian connection is real (if slight), and kinda cute. @theage @smh #michelleyeoh_official  https://t.co/azFwTHdhby
1635508618496999424	QUEENightingale	2023-03-14 05:10:15+00:00	en	@lim_weijiet Even if the Malaysian arts and film industry was much bigger and with more opportunities then and now, it is still too small a pool for a superstar like Michelle Yeoh. There is no stopping a talent like her. She did it. She's proudly Malaysian and we are happy and proud of her.
1635508570866458624	goodygoosey	2023-03-14 05:10:04+00:00	en	its a big month for asian people! eeaao wins big! michelle yeoh wins best actress! steam sale and resident evil 4 coming soon!  the third one is specifically good for me, an asian person!
1635508555368341506	borneo_bulletin	2023-03-14 05:10:00+00:00	en	[#Lifestyle] Malaysian Michelle Yeoh made showbiz history at the Academy Awards, also known as the Oscars, after she was named the winner of the best actress award. #borneobulletin #malaysia #bestactress #award #MichelleYeoh #AcademyAwards https://t.co/BXlkFBhKGa
1635508548384985089	BorahaeByKTH	2023-03-14 05:09:58+00:00	en	@CurtisSChin @TheAcademy @GoldHouseCo Congratulations to #MichelleYeoh! She's widely-appreciated in the east &amp; the west for her great acting talent. I also agree that #V #KimTaehyung, who excels at both singing &amp; acting, is the Korean representative of the entertainment world.  #RepresentationMatters
1635508453358837760	pprxteam	2023-03-14 05:09:36+00:00	en	Surely there’s a dimension where Michelle Yeoh is a Raze main. https://t.co/0uoS10bQ6Z
1760623717972062718	honkaistarrail	2024-02-22 11:12:59+00:00	en	✨Over 100 million downloads across all platforms!✨ 🎁New players can get up to 80 free pulls!🎁 💥Play Honkai: Star Rail now!💥
1635508036306337792	ChiutyChiuty	2023-03-14 05:07:56+00:00	en	Better than her Dior white gown for the main event, do you agree? The first Asian best leading actress in Oscars history, #MichelleYeoh looks classic &amp; elegant in this Armani Privé evening gown. https://t.co/iKuW70hy4z
1635507972905529344	baddabingyu	2023-03-14 05:07:41+00:00	en	@traderhuey if shes michelle yeoh yes
1635507835986677760	YoYoYo1431	2023-03-14 05:07:09+00:00	en	Henry congratulates Michelle Yeoh in Weibo for her milestone win! First Asian to win the coveted Academy Award for Best Actress 💪  Henry acted with Michelle in his first English movie debut in Final Recipe in 2013.  #HenryLau #HENRY #刘宪华 #헨리 https://t.co/13wWJkTJOr
1635507779090763776	HUlLlTlST	2023-03-14 05:06:55+00:00	en	michelle yeoh having no children at all at 60 years old…I’m tryna be like her next
1714710273234280797	walkfulton	2023-10-18 18:29:21+00:00	en	"I got rid of my custom orthotics after trying these" - Linda F.  People are switching from expensive orthotics to Fulton insoles. Discover what all the hype is about.
1635507729438765058	AndyVermaut	2023-03-14 05:06:43+00:00	en	Andy Vermaut shares:Public holiday in Malaysia after Michelle Yeoh's Oscar win? Fake news, say government officials https://t.co/Ynq5qBHPMR Thank you. https://t.co/yttErMY7kf
1635507695854944257	AndyVermaut	2023-03-14 05:06:35+00:00	en	Andy Vermaut shares:Michelle Yeoh on breaking the glass ceiling with historic Oscars win: ‘I kung fu-ed it out and shattered it’: Yeoh is the first Asian to win an Oscar for Best Actress for her role in Everything Everywhere All At Once. https://t.co/tM4tJEYAv4 Thank you. https://t.co/Lzz1up3YiM
1635507572823457793	ChengYi_TiAmo	2023-03-14 05:06:06+00:00	en	“For all the little boys and girls who look like me watching tonight, this is a beacon of hope and possibility. This is proof that dreams dream big and dreams do come true, And ladies, don’t let anyone ever tell you you’re past your prime.” 👏#MichelleYeoh #Oscars #bestactress https://t.co/xsnusllzzW
1635507563998466049	AsenaDuman12	2023-03-14 05:06:04+00:00	en	"Michelle Yeoh: The Crisis That Changed My Life 8 Years Ago Keeps Happening" Michelle Yeoh https://t.co/cVxA5m3vQP
1678010862534291456	zox	2023-07-09 11:59:00+00:00	en	Over 125,000 ZOX Watch Bands have been sold in the last 6 months. Love your ZOX Band more than your stock Smart Watch band or it's free.
1635507550346162177	LtUhura2017	2023-03-14 05:06:00+00:00	en	It was brought to my attention that the British Royal Family didn't like my tweet about the self-serving way they congratulated Michelle Yeoh, and they hid it.   They can't hide this one from you. I even tagged them. 😎🖖🏾 https://t.co/H8bX0rFgjH
1635507533715750912	oldJavaGuy	2023-03-14 05:05:56+00:00	en	@nancywyuen That's why I'm so happy for Michelle Yeoh: because she should have got it 20 years ago for CT/HD
1635507397262204928	livinginrome	2023-03-14 05:05:24+00:00	en	@krassenstein Btw michelle yeoh is Asian, just not Asian American. She’s from Malaysia.
1635507102067073025	PlutoDirt	2023-03-14 05:04:14+00:00	en	Not too long ago, someone on Twitter decided to inform everyone that the Oscars were insignificant to Michelle Yeoh. This was just an American thing.   Odd to speak for someone you don’t know like that.
1635310700087369729	FilmUpdates	2023-03-13 16:03:48+00:00	en	Michelle Yeoh’s mother, family and friends reacting to her historic #Oscars win in Kuala Lumpur, Malaysia https://t.co/iVed1zYWyz
1635507090356850688	Jonathan_Conley	2023-03-14 05:04:11+00:00	en	@MarmotRespecter @ElectionLegal This is the first not-even-two-minutes of 'Yes, Madam!', both Cynthia Rothrock and Michelle Yeoh's first starring roles in a feature film: https://t.co/3ZPwDzJLOv
1635507066105131010	Mar_louis_	2023-03-14 05:04:05+00:00	en	Beyond the crisis itself, its normalization &amp; the underestimation of its long-term #psychosocial &amp; #economic consequences are one of the biggest blockages of the #sustainable development in our societies🌏 #women #DEI #equity #SDGs #MichelleYeoh #Oscars95  https://t.co/W0PjOkoBHU
1635506969070174208	sinardailymy	2023-03-14 05:03:42+00:00	en	Michelle Yeoh makes history as first Asian to win best actress Oscar #sinardaily #topnewstoday #michelleyeoh #oscar #win #bestactress #asian https://t.co/YWEZ99qgLK
1635506781274226691	ChrisBr6511	2023-03-14 05:02:57+00:00	en	@domcianciolo Well deserved for Michelle Yeoh!
1754580724194177465	BenQAmerica	2024-02-05 19:00:17+00:00	en	✨ Join the #AQCOLOR Mindful Moments Contest!   Capture life's beauty: 1. Download the AQCOLOR Logo, add it to your image 2. Post on IG with a description 3. Use #BenQMoments #AQCOLOR 4. Follow &amp; tag @BenQNorthAmerica  Learn more: https://t.co/H2mUHq2rkD  #BenQ #MindfulMoments https://t.co/lrdjLFpWXz
1635506709732147200	muckdog	2023-03-14 05:02:40+00:00	en	I think Michelle Yeoh has been good in everything I’ve seen her in. Except maybe Star Trek Discovery as a goofball character from the dark side universe.  But that’s probably an issue with that show more than Yeoh.
1635506633693597697	ChrystlerJebus	2023-03-14 05:02:22+00:00	en	@krassenstein "Michelle Yeoh became the first person who identifies as Asian" lol What clown world shit is this
1635506505591013376	xenocryptsite	2023-03-14 05:01:51+00:00	en	Boy I thought this would be easier. What do I have to say, like, "EEAAO obviously has Michelle Yeoh's best action scenes ever" and wait to be condescendingly corrected.
1635506372593999873	YahooSG	2023-03-14 05:01:20+00:00	en	Everyone, everywhere all at once — claiming #MichelleYeoh #楊紫瓊 as theirs after historic Oscar win  https://t.co/5NCFIgGhab
1756815380905902386	VICE_GOLF	2024-02-11 23:00:01+00:00	en	Vice Golf, where performance meets personality and high quality meets low prices
1635506343686569985	TrendingOnWiki	2023-03-14 05:01:13+00:00	en	Trending in #Philippines on Mar 13, 2023  Everything Everywhere All at Once 95th Academy Awards Michelle Yeoh Ke Huy Quan  Discover more on https://t.co/8E76gjaVCA
1635506322031673345	PetBacker	2023-03-14 05:01:08+00:00	en	After watching the Oscar highlights, I just have to congratulate Meow-chelle Yeoh 🌚😺✨ for her amazing performance!  #Oscars #michelleyeoh #Oscars2023 #Oscars95
1635506310513917952	PageSix	2023-03-14 05:01:05+00:00	en	Michelle Yeoh wins Best Actress at Oscars 2023: ‘Beacon of hope’ https://t.co/BWxLdSkJY0
1635506283599085570	thebritryan	2023-03-14 05:00:58+00:00	en	it’s been over 24 hours and i’m still thinking about ke huy quan and michelle yeoh’s oscar wins. a truly beautiful, historic, and well deserved moment for both
1718921555449991308	OnyxBoox	2023-10-30 09:23:29+00:00	en	Meet Note Air3 C, the new color ePaper reader and notebook that helps you think and create without bounds in work and life. 💡Click to learn more.
1635506191034990592	MlaStandard	2023-03-14 05:00:36+00:00	en	Brendan Fraser caps ‘comeback’ with best actor Oscar win, Michelle Yeoh makes history   READ MORE: https://t.co/uvI6phTvHA https://t.co/oQyNzCmvBB
1635506104221270021	YTCanadaTrends	2023-03-14 05:00:16+00:00	en	8. Michelle Yeoh makes history with best actress win at 2023 Oscars: Full speech - 6abc Philadelphia 9. Rihanna - Lift Me Up (Live from the Oscars 2023) - Rihanna 10. WORST jumpscare in YEARS [Fears To Fathom: Carson House] - CoryxKenshin
1635506082666758146	whatchinareads	2023-03-14 05:00:10+00:00	en	Oscar's first Chinese "actress", Michelle Yeoh's "existence" is the pride of the entire entertainment industry  https://t.co/sdCCRTGEN2
1635506041210241026	ajc	2023-03-14 05:00:01+00:00	en	Ke Huy Quan’s comeback story from childhood star of ’80s flicks to win a best supporting actor Oscar, coupled with Michelle Yeoh’s historic win as the first Asian best actress winner ever had viewers of Asian descent shedding happy tears — and grinning.  https://t.co/Pbq5Z4Rva6
1635506038072832001	ietrending	2023-03-14 05:00:00+00:00	en	Michelle Yeoh’s family erupts in joy after her Oscar win. Watch their reaction here  https://t.co/VV2MTnzUla
1635506037183877120	MustShareNews	2023-03-14 05:00:00+00:00	en	Now that Michelle Yeoh's officially an Oscar winner, did you know she got her career break by being a beauty queen?   Here are 8 facts to know about Malaysia's biggest icon in the entertainment industry. ✨  #MichelleYeoh   https://t.co/uoLocUE95a https://t.co/lqGAorsz10
1635505961053065216	nshon	2023-03-14 04:59:42+00:00	en	@lyndaibrahim I am pretty sure Michelle Yeoh and Todt lives in Europe and not in Singapore. Even if she does live in SG, there is no need to congratulate the country of residence
1635505957672460288	Yahoo_MY	2023-03-14 04:59:41+00:00	en	Everyone, everywhere all at once — claiming #MichelleYeoh #楊紫瓊 as theirs after historic Oscar win  https://t.co/5lTYd3pENZ
1757772178484052387	1stspear	2024-02-14 14:21:59+00:00	en	Explore the pinnacle of tactical gear excellence with FirstSpear! From cutting-edge plate carriers to technical flannels, we have the gear you need for any mission. Browse now and elevate your performance.&amp;nbsp; #FirstSpear #TacticalGear #BuiltfortheX #AmericanMade
1635505872108666880	agravityAG	2023-03-14 04:59:20+00:00	en	Michelle Yeoh accept her #Oscars95 for BEST Actress. It took 21 years for the second woman of color &amp; 95 years for the first Asian woman to win this award. This is definitely a win for true multiculturalism🏆 #Agravity #NFTartwork #NFTs #media3 https://t.co/lG9OKw1Lub
1635505871571525632	TriggeredB00mer	2023-03-14 04:59:20+00:00	en	@RainbowNailGal @MrStevenSteele @krassenstein I identify as Michelle Yeoh identifying as Steven Steele identifying as Merle Oberon identifying as Brian Krassenstein identifying as Ed Krassenstein.
1635505820577177601	CassandraCentre	2023-03-14 04:59:08+00:00	en	Michelle Yeoh is right – a woman is never ‘past her prime’ | Zoe Williams | The Guardian https://t.co/w2DCqrfBrr
1635505774154891272	Randomvoter99	2023-03-14 04:58:57+00:00	en	@DarnellGregori2 Look how good Michelle Yeoh looked yesterday. She was a dancer. I'd have to agree with both of you!
1757148394718691350	XploredHistory	2024-02-12 21:03:18+00:00	en	Thanks to the nuances that is evident everywhere, we are able to accurately guess where you grew up with this quiz.
1635505729036599298	PatPat76056175	2023-03-14 04:58:46+00:00	en	@MadisonTX766 Michelle yeoh won and shes not white
1635505557384601600	GUCCIFLTR	2023-03-14 04:58:05+00:00	en	@FilmUpdates such an important win, so happy for michelle yeoh!!!!
1635505521401946113	Poison_Ivy218	2023-03-14 04:57:57+00:00	en	Cutting"And ladies" out of #MichelleYeoh's Oscar speech is so disgusting! #Metoo in Korea!
1635499587749433344	melon_num5	2023-03-14 04:34:22+00:00	en	Obviously sexist SBS Korea cut "And ladies" out of #MichelleYeoh's Oscar speech that preceded "Don't let anybody tell you you are ever past your prime", clarified that the words could have also been for men, got onto hotsearch and incited yet another bout of netizens' disgust https://t.co/5A2F9t4wWE
1635505370012569603	Biebsus_	2023-03-14 04:57:21+00:00	en	@noeru_2004 those were 2 separate thoughts luv. me saying black people come in every shade had nothing do with michelle yeoh so like I said, your reading comprehension skills are in the toilet
1635505227045683200	bilbil	2023-03-14 04:56:47+00:00	en	Whether Michelle Yeoh won or not, I've loved her since "Crouching Tiger, Hidden Dragon". She's such a bad ass kicker, but still so elegant and... gentle  And I loved her character(s) in Star Trek: Discovery. There was a point I'm watching it for her. 😊
