1635145276964114434	the_film_maniac	2023-03-13 05:06:28+00:00	en	If you told me a few years ago that Michelle Yeoh, Brendan Fraser, Ke Huy Quan and Jamie Lee Curtis would win Oscars in the near future, I wouldn't have believed you. Incredible.
1635145250338656257	_zanst	2023-03-13 05:06:21+00:00	en	@wildand18 yess! 😭 soalnya campaign nya doi lebih ke “Jamie Lee Curtis finally getting her due from Academy after all this time” https://t.co/emkcTXA0hp
1635145249306849283	grammarocksss1	2023-03-13 05:06:21+00:00	en	Jamie Lee Curtis Wins First Oscar At Age 68 https://t.co/mrErmDYYxl via @dailycaller
1635145246446358529	mmCineplexes	2023-03-13 05:06:20+00:00	en	Congratulations Jamie Lee Curtis for winning Best Supporting Actress!   #mmCineplexes https://t.co/oGRfq0Ng4u
1635145241631281152	MarshallJulius	2023-03-13 05:06:19+00:00	en	Congratulations to legendary star and part-time #MastersOfMakeUpEffects spokesperson Michelle Yeoh on her well deserved Best Actress Oscar win for #EverythingEverywhereAllAtOnce! Really thrilled for her victorious co-stars Jamie Lee Curtis and Ke Huy Quan as well. #Oscars https://t.co/uQBjCEy6di
1635145216947548160	quill18	2023-03-13 05:06:13+00:00	en	Oh, the other unfortunate thing was that Stephanie Hsu &amp; Jamie Lee Curtis couldn't both win Best Supporting Actress.  IMHO, Hsu had the more interesting and multi-faceted role and probably should have gotten it, but JLC was excellent &amp; overdue so I'm still happy.
1635138003042697216	quill18	2023-03-13 04:37:33+00:00	en	Excellent Oscars this year.  Only unfortunate thing is that The Banshees of Inisherin had the rotten of luck of coming out in such a stacked year. They deserved to win something, but All Quiet &amp; Everything were just so god-tier.
1635145212816429058	LilUsi007	2023-03-13 05:06:12+00:00	en	@GALACTICBOWIE Jamie Lee Curtis deserved it stop being a hater
1635145204935319552	meltmode	2023-03-13 05:06:11+00:00	en	@UpToTASK Okay, obviously Angela Bassett deserved for her monologue... but Jamie Lee Curtis??? She wasn't even the best supporting actress in HER film 😂 Stephanie Hsu should've won
1635145164728700931	jonz_vstoneroad	2023-03-13 05:06:01+00:00	en	@BrownEyedMan43 Jamie Lee Curtis really paid respect to her decades long fan support. You know the horror fans were excited for her too.
1635145149801197569	TMoneyFoReaaal	2023-03-13 05:05:57+00:00	en	@Phil_Lewis_ Jamie Lee Curtis reaction is great though
1635145129030991872	strikerbuttson	2023-03-13 05:05:52+00:00	en	If you watched everything everywhere all at once and think Jamie Lee Curtis was the standout, you are just wrong, man. Stephanie Hsu was ROBBED.
1635145126241796096	Poseikix161	2023-03-13 05:05:52+00:00	en	Jamie Lee Curtis winning instead of Stephanie Hsu is proof that the Oscars would rather choose the safer choice than a bold new comer to win. Congrats to Jamie Lee Curtis but Stephanie Hsu deserved it waaaayyyyy more
1635145102502014977	T24242419	2023-03-13 05:05:46+00:00	en	@amyklobuchar @jamieleecurtis So you’re friends with a known domestic terrorist?  😳
1635145075088039936	dmv8286	2023-03-13 05:05:40+00:00	en	Like an hour later and I still:  1. Don’t know what to do with myself because of EEAAO.  2. Immediately want to re-watch it.  3. Have no idea why Jamie Lee Curtis got the nod over Stephanie Hsu for the Oscar. Stephanie Hsu RULED.
1635145072466604032	127gosat	2023-03-13 05:05:39+00:00	en	theres something evil about jamie lee curtis
1635145039486779392	nighthashira	2023-03-13 05:05:31+00:00	en	people calling Jamie Lee Curtis, Sue Sylvester is taking me out rn
1635145012509036550	haechantheworld	2023-03-13 05:05:25+00:00	en	what did jamie lee curtis even do in the movie
1635145003453530113	deanBarry	2023-03-13 05:05:23+00:00	en	Ke Huy Quan. Jamie Lee Curtis. Brendan Fraser. Michelle Yeoh.  Having been fans of these four people for years. Following their careers. Loving their movies.  Seeing them all walk away with an Oscar today fills my heart with happiness.  #Oscars #Oscars2023  #BrendanFraser  #KeyHuyQuan  #JamieLeeCurtis  #MichelleYeoh
1635145000060338176	its_brava	2023-03-13 05:05:22+00:00	en	brb, rting 500 iterations of jamie lee curtis not deserving her oscar for a movie i haven’t seen
1635144999418593280	ISNMinaj	2023-03-13 05:05:22+00:00	en	jamie lee curtis you cruel old hag https://t.co/pvpwYExON5
1635144992846127104	RobertP56328759	2023-03-13 05:05:20+00:00	en	@sidaleee @jamieleecurtis You were never a fan of Angela’s in the first place…Imma say it so they can hear it in the back of the room….. OSCARS SO WHITE!!!! Ms Angela doesn’t need to smile to appease your fragility…. Get over yourself
1635144989595561985	lennyburnham	2023-03-13 05:05:19+00:00	en	@katielwright More dynamic than Jamie Lee Curtis.
1635144968137482243	sean_bagel	2023-03-13 05:05:14+00:00	en	starting a south park barbra streisand level beef with jamie lee curtis
1635144954359201794	amarusondaii	2023-03-13 05:05:11+00:00	en	@youngpotatogod on my phone defending jamie lee curtis get him!
1635144950173286401	AlphaCrowTV	2023-03-13 05:05:10+00:00	en	@jamieleecurtis congratulations. You deserve it, not only for you astounding performance in the movie, for your whole career. We love you.
1635078832750489601	Variety	2023-03-13 00:42:26+00:00	en	Jamie Lee Curtis accepts the #Oscar for Best Supporting Actress. https://t.co/ndiKiHfmID https://t.co/bGBtrI3k0g
1635144939804975106	vyancss	2023-03-13 05:05:07+00:00	en	who ever voted for jamie lee curtis over stephanie hsu or angela bassett has no taste tf everyone knew who DELIVERED
1635144926957830144	ClickySound	2023-03-13 05:05:04+00:00	en	#latestnews Jamie Lee Curtis's Oscar Win Has Sparked Backlash And People Are Not Holding Back - https://t.co/NuBxaEALhN  Fans are criticizing Jamie Lee Curtis's "Best Supporting Actress" win over fellow nominees Angela Bassett and Stephanie Hsu. View Entire Post › https://t.co/efR3wLHeBU
1635144909434032130	wfaa	2023-03-13 05:05:00+00:00	en	“Everything Everywhere All at Once” won best picture at the 95th Academy Awards, along with awards for Michelle Yeoh, Ke Huy Quan and Jamie Lee Curtis. https://t.co/5r5ymboXWx
1635144897941630978	HimboOfFerelden	2023-03-13 05:04:57+00:00	en	Me if I see Jamie Lee Curtis tomorrow: https://t.co/ZLuMuxsA5w
1635144885732003841	michaeljchiara	2023-03-13 05:04:54+00:00	en	I’msorry but Jamie Lee Curtis committed robbery. Every other person in the category was more deserving
1635144847773536256	luvsickboy12	2023-03-13 05:04:45+00:00	en	I love Jamie Lee Curtis but she did not even deserve to be nominated. Her performance is nothing compared to her co-star Stephanie Hsu or Angela Bassett like bffr. 😒
1635144837522677762	ShaRose31	2023-03-13 05:04:43+00:00	en	Angela B not clappin' at that moment, not smiling or possibly being disappointed n not winning something that may have been important 2 her. That doesn't mean she wasn't happy 4 Jamie Lee Curtis. Maybe she wanted the win 2 honor Chadwick Boseman memory. #Oscar2023 #AngelaBassett
1635144819365515265	untimelygamer	2023-03-13 05:04:39+00:00	en	I feel like 90% of the people complaining about Jamie Lee Curtis winning think "biggest role in the plot" = "best actor." https://t.co/CK6tgky7j1
1635144812784685057	epipeny	2023-03-13 05:04:37+00:00	en	How tf did Stephanie hsu and Angela Bassett lose to Jamie Lee Curtis 😐 was Angela bassett’s legacy not worth celebrating? Was stephanie not an integral character with a LOT more screentime than a white lady playing an IRS agent in the same movie about an Asian immigrant family??
1635144812033875969	brybeja	2023-03-13 05:04:37+00:00	en	Michelle Yeoh winning Best Actress represents one of the best Oscar wins of all-time; Jamie Lee Curtis winning represents one of the worst.
1635144783223205888	ColeyEmde	2023-03-13 05:04:30+00:00	en	@justmecass123 @krassenstein Yes. I think it started off with the feel good speeches of Quan &amp; Jamie Lee Curtis, her parents were nominated. The coincidental stuff like Quan &amp; Brendan Fraser being in Encino Man 30+ years ago AND winning; Spielberg being there with Quan too and from Indiana Jones, etc., 🥺
1635144781604212736	hotzx22	2023-03-13 05:04:30+00:00	en	@itsKARY_ To all the tweets haters from woman that Jamie Lee Curtis won and Angela didn’t.  We are suppose to support each other no matter the color of our skin.  What a disappointment to those of you that show hate. We have enough of that in this world.
1635144771877613568	Shockng	2023-03-13 05:04:27+00:00	en	NEW: Everything Everywhere All at Once set a record high at the 2023 Oscars.  "Best Picture, Best Actress for Michelle Yeoh, Best Supporting Actor for Ke Huy Quan, Best Supporting Actress for Jamie Lee Curtis, and Best Director and Original Screenplay for the Daniels" https://t.co/dg5TB6mZlP
1635144749387751424	AyeeBayDay	2023-03-13 05:04:22+00:00	en	I’m sorry, even though I absolutely love Jamie Lee Curtis, that Oscar should’ve went to either Stephanie Hsu or Angela Bassett.
1635144721139109888	ScouseCommie	2023-03-13 05:04:15+00:00	en	I think Angela Bassett is a fantastic actress. Her work in Chi-Raq and Strange Days is some of the best ever committed to film.   However, it's not disrespectful that she didn't win. She just didn't get enough votes. Jamie Lee Curtis is a worthy winner - any of them were.
1635144708522655745	wyatt_katz	2023-03-13 05:04:12+00:00	en	3 of the greatest Oscar wins ever and also Jamie Lee Curtis!
1635140242322915329	cravemedia_	2023-03-13 04:46:27+00:00	zxx	https://t.co/YMI5SztSha
1635144665430368257	GrudtJoe	2023-03-13 05:04:02+00:00	en	i’m sorry but jamie lee curtis winning the oscar for everything everywhere is like if martin freeman won an oscar for black panther
1635144660564967426	theprojecttv	2023-03-13 05:04:01+00:00	en	Everything Everywhere All At Once has swept the 2023 #Oscars, and last year we spoke to Best Supporting Actress, @JamieLeeCurtis about why the film is an actual miracle. https://t.co/J2QJT9SUB4
1635144649080995842	AngeleyesEva	2023-03-13 05:03:58+00:00	en	Now some people want Oscar awards just handed to them based on their race.  Get a life! A real life, not a life based on the color of your skin.   Angela Bassett Stays Seated During Jamie Lee Curtis’s 2023 Oscar Win, Despite Standing Ovation https://t.co/2pOY4mRU3D
1635144636842000385	sukiisukii18	2023-03-13 05:03:55+00:00	en	Jamie Lee Curtis is the female version of Tim Allen.
1635144636569210883	EW	2023-03-13 05:03:55+00:00	en	Jamie Lee Curtis teared up as she dedicated her Oscar win to her late parents Janet Leigh and Tony Curtis — both Oscar nominees themselves.  https://t.co/X0kptvQfdi
1635144601727303682	yeostaems	2023-03-13 05:03:47+00:00	en	Jamie Lee Curtis' win is the only one that should be ragged on. Please continue criticising that, but leave Michelle, Ke Huy Quan, and the directors out of it!
1635144596354404352	echodurst	2023-03-13 05:03:45+00:00	en	Jamie Lee Curtis shouldn’t have won that Oscar. Yes I’m a hater. And yes, I still haven’t finished EEAAO
1635144582601273345	Frances__O	2023-03-13 05:03:42+00:00	en	You’re joking that Jamie Lee Curtis won over Angela Bassett. No wayyy
1635144577844928512	EcoMoore731	2023-03-13 05:03:41+00:00	en	I am so so happy for Brendan Fraser!  Disappointed that @ImAngelaBassett did not get her overdue #Oscar  . Still congratulations to @jamieleecurtis!!
1635119304059543553	TheAcademy	2023-03-13 03:23:15+00:00	en	Best Actor in a Leading Role goes to Brendan Fraser! #Oscars #Oscars95 https://t.co/rWIHrR9BS9
1635144571230519296	Jabalipezzy	2023-03-13 05:03:39+00:00	en	What movie did Jamie Lee Curtis win Oscar for?
1635144568495804417	Remark1972	2023-03-13 05:03:39+00:00	en	@bigredd_98 @ImAngelaBassett Couldn’t agree with you more! No disrespect to Jamie Lee Curtis b/c she’s a phenomenal actress as well. But anyone who watched BP:Wakanda Forever and was not impressed with this icon’s performance should be banned from watching movies ever again! 🎭 #Oscars https://t.co/9VXe7pUutA
1635144538108092416	MarkAEWWWEFan	2023-03-13 05:03:32+00:00	en	The hate Jamie Lee Curtis has gotten on Twitter for winning an #Oscar is very, very, very weird.  #AcademyAwards #Oscars2023 #Oscars
1635144498144743424	IndieFocus	2023-03-13 05:03:22+00:00	en	“Thank you so much for welcoming me back.” This year's Oscars brought long-deserved recognition to acting winners for Ke Huy Quan, Jamie Lee Curtis, Brendan Fraser &amp; Michelle Yeoh. https://t.co/fiADbGRpiV
1635144483024293891	_this_is_harsha	2023-03-13 05:03:18+00:00	en	Bro ok I get best supporting actor and best actress, even though I’d prefer Emily blanchett(Tàr) and Barry Keoghan from Banshees, what’s the freaking reasoning behind giving best supporting actress to freaking Jamie lee Curtis, like why, she was nowhere near as good as the others
1635144395237498882	saikothasan007	2023-03-13 05:02:57+00:00	en	Free Gift Card Giveaway 2023 Click Here:https://t.co/B7bh1TpgHe #giftcards #Giveaway #usaoffer #Oscars #JamieLeeCurtis #EEAAO https://t.co/eKH3lBS80S
1635144393027100674	gocaljohn	2023-03-13 05:02:57+00:00	en	@WhoIsClayJames @SpencerAlthouse Yet you wouldn’t say the same thing if Angela Bassett won and Jamie Lee Curtis shaded her.
1635144385678700549	jodyvance	2023-03-13 05:02:55+00:00	en	.@jamieleecurtis   That’s it. #EEAO
1635144374911918081	yyeonarry	2023-03-13 05:02:53+00:00	en	@hrryonvinyl i love jamie lee curtis but if either should’ve won for that movie it should’ve been stephanie hsu jamie lee curtis’ character wasn’t in the movie even half as much and stephanie hsu was INCREDIBLE so i really don’t understand😭 happy for her tho
1635144360508665856	quarter_n_dime	2023-03-13 05:02:49+00:00	en	@amyklobuchar @jamieleecurtis Does she know you were a key instigator in the proxy war with Russia we're now cursed with?
1635144350517821442	MatHelman	2023-03-13 05:02:47+00:00	en	Every Oscar Every Category All Night Long  #EverythingEverywhereAllAtOnce #EEAAO #EverythingEverywhere #AcademyAwards2023 #AcademyAwards #Oscars2023 #Oscars #Oscar #Oscar2023 #Oscars95 #MichelleYeoh #KeHuyQuan #JamieLeeCurtis #TheDaniels #DanielScheinert #DanielKwan #Daniels
1635122318006706179	FilmUpdates	2023-03-13 03:35:14+00:00	en	‘EVERYTHING EVERYWHERE ALL AT ONCE’ takes home seven Academy Awards. #Oscars   • Best Picture • Best Director • Best Original Screenplay • Best Actress • Best Supporting Actor • Best Supporting Actress • Best Film Editing https://t.co/NwZTqsn1OY
1635144341722390529	DixPeyton	2023-03-13 05:02:45+00:00	en	what does jamie lee curtis know… https://t.co/qh9e7Lmp1Y
1635144331526045696	BigBreakingWire	2023-03-13 05:02:42+00:00	en	#Oscars2023 Winners  "Everything Everywhere All At Once" RockStar Of The #oscars95  Got Best Picture Award  Best Actress: Michelle Yeoh  Best Supporting Actor: Ke Huy Quan  Best Supporting Actress: Jamie Lee Curtis.  Best actor: Brendan Fraser, From "The Whale"  #Oscars #Oscar
1635144323795939328	Anna77078367	2023-03-13 05:02:40+00:00	en	@THR Kudos to #BrendanFraser #KeHuyQuan #MichelleYeoh &amp; #JamieLeeCurtis on their Oscars!!! All my favourites won!!!🥇 🥇🥇🥇💫💫💫💫🙌🏽🙌🏽🙌🏽🙌🏽👏🏼👏🏼👏🏼👏🏼♥️♥️♥️♥️
1635144305785589761	JuJuBreauxD	2023-03-13 05:02:36+00:00	en	I’m not mad at Jamie Lee Curtis but this is funny 😂😂😂
1635080244708401156	aintnolovesong	2023-03-13 00:48:03+00:00	en	When I catch you @jamieleecurtis https://t.co/PSgqQxzulq
1635144289369067520	klerolajn	2023-03-13 05:02:32+00:00	en	it should've been a tie between angela and kerry we haven't had a tie at the oscars for so long and anyways they both deserved it far more than jamie lee curtis
1635144225389178882	manuelb_claro	2023-03-13 05:02:17+00:00	en	@jamieleecurtis Congratulations Jamie! You are the best of the best. We love you from Mexico.
1635144207802441729	MichaelMyersJS	2023-03-13 05:02:13+00:00	en	Oh, I'd love to be an Oscar Myer winner. That is what I'd truly like to be. 'Cause if I were an Oscar Myer winner, Everyone would be in love with me... 🎶  #Oscars #JamieLeeCurtis https://t.co/yq7qWOamdP
1635144200189775873	NoleReeve	2023-03-13 05:02:11+00:00	en	@jamieleecurtis @TheAcademy Congrats queen!!
1635144190807126016	SargentRock9	2023-03-13 05:02:09+00:00	en	@SpencerAlthouse Angela Bassett disrespected Jamie Lee Curtis on a live international television show. Period.
1635144190299631621	SiamakDavari	2023-03-13 05:02:09+00:00	en	“I know it looks like I’m standing up here by myself, but I am not. I am hundreds of people…we just won an Oscar.” Jamie Lee Curtis accepts the Academy Award for Best Actress in a Supporting Role for “Everything Everywhere All at Once.” @ABC @GolinehAtai @NatalieAmiri #Oscars https://t.co/se9cayozA2
1635144186159828993	hannah_hbic	2023-03-13 05:02:08+00:00	en	@whomstissarah If I were to rank the nominees: 1 - Stephanie Hsu 2 - Kerry Condon 3 - Angela Bassett 4 - Jamie Lee Curtis (Didn't see The Whale but Hong Chau was great in The Menu)
1635144154182307840	kfvsnews	2023-03-13 05:02:00+00:00	en	The best picture went to “Everything Everywhere All at Once,” starring Michelle Yeoh, Ke Huy Quan and Jamie Lee Curtis &gt;&gt;&gt; https://t.co/KIvyWcVMzZ
1635144092974985216	24Trends_NZ	2023-03-13 05:01:45+00:00	en	1. Man United vs Southampton - 10K+ 2. Fulham vs Arsenal - 5K+ 3. Newcastle vs Wolves - 5K+ 4. Ke Huy Quan - 2K+ 5. Jamie Lee Curtis - 2K+ 6. West Ham vs Aston Villa - 2K+ 7. All Quiet on the Western Front - 2K+ 8. Helensville - 2K+
1635144083214852096	Elmo_Oxygen	2023-03-13 05:01:43+00:00	en	This is an absolutely maddening way to say that you think Hsu should have won. Jamie Lee Curtis is not actually an IRS agent in real life! They are acting!!!
1635080911271399425	ghostinmypocket	2023-03-13 00:50:42+00:00	en	Can’t believe Stephanie Hsu, who played a depressed immigrant daughter traveling throughout the universe to find a version of her mother who loved her, lost to an irs agent https://t.co/17Eo9G4HQ6
1635144070397067264	DTCahill	2023-03-13 05:01:40+00:00	en	She was robbed. Jamie Lee Curtis’ performance looked like a SNL skit.🧐
1635084060811984896	shanikharris	2023-03-13 01:03:13+00:00	en	@SpencerAlthouse It took Angela Bassett 30 years as a Black woman in Hollywood to earn her second  #Oscar nomination in her career. Yale grad deserved it for portraying Tina Turner. She doesn't have another 30 to wait.  Why have Ariana DeBose up there to announce she lost at the #Oscars? SMH. https://t.co/82vt0Yk72z
1635144050373455872	ForeverWyno	2023-03-13 05:01:35+00:00	en	In case you were all wondering @LeaveHeardAlone is NOT happy for Jamie Lee Curtis winning a Best Actress Oscar after 45 years in the business. Because she supported Johnny Depp. That's Jamie Lee, a WOMAN!  #FeministFAIL Oh and "Its WEIRD" that the Oscars felt like #MenToo. https://t.co/cmTUcwbqFz
1635144048175644672	sentineltribune	2023-03-13 05:01:35+00:00	en	Jamie Lee Curtis wins Oscar for best supporting actress https://t.co/WPGD3EwNbp
1635144028462395394	AustinB63195879	2023-03-13 05:01:30+00:00	en	So u tell me that Jamie Lee Curtis did a better job in her film than Angela did in WF?
1635144010141671424	Blake2Awesome	2023-03-13 05:01:26+00:00	en	They really gave Jamie lee Curtis that Oscar over Angela smh
1635144005163061248	TheStarkVoice	2023-03-13 05:01:24+00:00	en	I was happy for all the winners at the #Oscars - but, being a long time fan of Jamie Lee Curtis, I was especially thrilled she finally got the honor she so justifiably deserved.  About damn time, Academy! 👏🏼  #JamieLeeCurtis #Oscar @jamieleecurtis #EverythingEverywhereAllAtOnce
1635144002583560192	RobertB51707688	2023-03-13 05:01:24+00:00	en	And YES, Jamie Lee Curtis is included in this statement! She deserved the win and you can’t convince me otherwise
1635143995386105857	visionnaireess	2023-03-13 05:01:22+00:00	en	Lmao the Oscar’s decided oops that’s too many people of color getting an award this year. So to be fair jamie Lee Curtis should get an award. BOOOOOO! Only 2 women of color have won for best actress in 95 years!!
1635143984933908480	BakingMeatsCrew	2023-03-13 05:01:20+00:00	en	@ACain_ I was hoping Angela Bassett would take it, but not mad at Jamie Lee Curtis for winning either, she was great in EEAAO.
1635143935172706304	johnisbestever	2023-03-13 05:01:08+00:00	en	@glaad @jamieleecurtis Its when men turn trans at the cost of real womens rights i have issue with
1635143933121687552	earcas1	2023-03-13 05:01:07+00:00	en	The Jamie Lee Curtis win has at least one upside: now we know that all Pfeiffer, Stone, Weaver, Basset &amp; Bening need to win their Oscar is a supporting, almost elevated cameo role they would knock out of the park in a crowdpleaser and voilà.
1635143930865143810	Slimz09	2023-03-13 05:01:07+00:00	en	Every Award Everywhere All At once! 😄 When this movie first came out with its Genre bending mix of Comedy,Action &amp; Drama, there was no expectation that it would be this lauded.  Speiberg is genuinely happy for #KeHuyQuan.Congrats also to #JamieLeeCurtis &amp; #MichelleYeoh  #Oscars https://t.co/8S9iexJFwi
1635143905846108160	spgetiboatshoes	2023-03-13 05:01:01+00:00	en	the unfortunate thing to me about jamie lee curtis winning is that, because she won over two women who deserved it more than she did, many people are now disparaging her performance. she was phenomenal in EEAAO, she just was the wrong choice for the oscar.
1635143869322100737	MrCSG75	2023-03-13 05:00:52+00:00	en	https://t.co/1nL3JuqRFm @jamieleecurtis thanking the #HorrorCommunity is everything. I love this woman to bits.
1635143857510948865	tayla_03	2023-03-13 05:00:49+00:00	en	What do you mean Jamie Lee Curtis won an Oscar over STEPHANIE HSU AND ANGELA BASSETT https://t.co/BJ5TNKgjrL
1635143841509675008	RichardInBoston	2023-03-13 05:00:45+00:00	en	@iamchanteezy Because Jamie Lee Curtis was better?
1635143827630747649	tylerdeanv	2023-03-13 05:00:42+00:00	en	Oscars really need to be forgotten and abandoned bc so many decisions only make sense bc of politics. Jamie lee curtis has deserved to win but not bc of this, not over angela bassett and stephanie hsu. Brendan fraser is a great guy but is not the winning performance here.
1635143811793047555	rebranger	2023-03-13 05:00:38+00:00	en	I love Jamie Lee Curtis, but I think Angela Bassett or Stephanie Hsu should’ve won.
1635143805207998471	mlungisi_prince	2023-03-13 05:00:37+00:00	en	Jamie Lee Curtis didn't deserve that win https://t.co/pBLsX1jv7t
1635143787080196096	metrosp1derrr	2023-03-13 05:00:32+00:00	en	why is everyone turning on jamie lee curtis???
1635143780780367873	GeneStoker	2023-03-13 05:00:31+00:00	en	@GMA @TheAcademy @jamieleecurtis @allatoncemovie I just love... she speaks so eloquently!!  What a tribute she offered up for her legendary parents.
1635143780264476672	Gord_TheJourno	2023-03-13 05:00:31+00:00	en	Y'all know damn well @jamieleecurtis didn't deserve that Oscar, as legendary as she is. How they gonna do Auntie Angela like that again? #OscarsSoWhite They have no shame. #Oscars #AngelaBassett
1635143766016413702	MiloKin6	2023-03-13 05:00:27+00:00	en	Read RealESALetter Reviews 2023 🐶  https://t.co/ZaHZRbV6um  #Oscars #TheLastOfUs #JamieLeeCurtis #KeHuyQuan  #EEAAO #AngelaBassett #Joel #MichelleYeoh #BrendanFraser https://t.co/p50Xusnauc
1635143762417700866	LoveAdele30	2023-03-13 05:00:27+00:00	en	I am being for real, the thing is if you don't like the fact that a poc hasn't won something in this many years, hate the freakin academy for it, who the hell are you to discredit Jamie Lee Curtis' work(as the original tweet tdid)?
1635142438603079680	fruitflyris	2023-03-13 04:55:11+00:00	en	michelle yeoh was the first ever asian actress to win lead actress after 95 years and the second POC after 20 years..i mean bffr rn https://t.co/0Yzg5gMCUh
1635143742394109952	cinemagamer1	2023-03-13 05:00:22+00:00	en	However, I'm still happy for everyone who won in every category regardless of my personal feelings, especially Jamie Lee Curtis.
1635143704343367680	etnow	2023-03-13 05:00:13+00:00	en	Jamie Lee Curtis expressed support for the push to de-gender acting categories following her #Oscars95 win.  https://t.co/rlHCu6yMqi
1635143699696082946	spudgun01	2023-03-13 05:00:12+00:00	en	I see Jamie Lee Curtis has won an oscar.  Which, according to Twitter, makes her a medicore/racist/privileged white woman apparently.....
1635143790838296577	jacobadominguez	2023-03-13 05:00:33+00:00	en	I agree with this. And I LOVE Jamie Lee Curtis, and I LOVE Everything Everywhere All At Once.  I really hope Angela Bassett gets her Oscar one day, hopefully SOON. 😕#BlackPanther2 #oscars #AcademyAwards
1635143692767096832	kannarook	2023-03-13 05:00:10+00:00	en	OK tonight's Oscars was "Everything." From Ke Huy Quan and Michelle Yeoh to Jamie Lee Curtis and Brendan Fraser - seeing so many actors from my childhood finally get the accolades they deserve! ❤️❤️❤️
1635143689440772099	CTVToronto	2023-03-13 05:00:09+00:00	en	Jamie Lee Curtis won the Oscar for best supporting actress for her performance in "Everything Everywhere All at Once."  https://t.co/OnzboYWxeJ
1635143681815777285	StarmanLFC	2023-03-13 05:00:07+00:00	en	Everything Everywhere All at Once was a great film. But come on, it did not deserve 7 Oscars.   Jamie Lee Curtis definitely did not deserve best supporting actor for that role. Editing also should’ve gone to Top Gun: Maverick.
1635143663159480321	alt_brainnews	2023-03-13 05:00:03+00:00	en	Jamie Lee Curtis Thanks Transgender Athlete Wins Four Consecutive Races, March 12, 2023.
1635143636924125185	7NewsAustralia	2023-03-13 04:59:57+00:00	en	It seems everyone was ecstatic to see @jamieleecurtis win a Best Supporting Actress award at the Oscars - except, perhaps, @ImAngelaBassett. #Oscars #7NEWS https://t.co/7BC5WEHNBO
