1635156292078804993	Lupin_333	2023-03-13 05:50:14+00:00	en	@MyNameIsOise Bruh!! Their sweep didn't really surprise me though. Although, I didn't anyway expect Jamie Lee Curtis to win Best Supporting Actress. I'm still trying to rationalize exactly why she won it because there were atleast 2 nominees with better performances in my opinion.
1635156268783632385	liaaamajide	2023-03-13 05:50:08+00:00	en	i mean jamie lee curtis 😭
1635156266908545024	One_News_Page	2023-03-13 05:50:08+00:00	en	Watch: Angela Bassett Doesn't Clap As Opponent Jamie Lee Curtis Wins Best Supporting Actress: https://t.co/y3ObSa0mJ8
1635156252593635328	socalmd54	2023-03-13 05:50:05+00:00	en	Hot take: Jamie Lee Curtis deserved the Oscar, her performance was really versatile. Bagel Deidre was iconic
1635156225506803713	tammieboi	2023-03-13 05:49:58+00:00	en	Me to Jamie Lee Curtis
1635105494720471040	willfulchaos	2023-03-13 02:28:23+00:00	en	jimmy kimmel stay the FUCK away from malala i’m so serious https://t.co/wBImzAP1si
1635156148692336641	digitalmaverick	2023-03-13 05:49:40+00:00	en	Overjoyed by the Oscar winners.  'Everything, Everywhere all at once', Brenda Fraser, Michelle Yeoh, Ke Huy Quan, 'The Boy, the mole, the fox &amp; the horse',  Jamie Lee Curtis &amp; *that* song from 'RRR'. Every single one of them truly, truly deserved.
1635156122616188928	yahoolife	2023-03-13 05:49:34+00:00	en	#JamieLeeCurtis wants to see award shows go genderless. #Oscars (via @people) https://t.co/M6kF8CoOyk
1635156118921162752	TeflonScribbles	2023-03-13 05:49:33+00:00	en	@DrVirgo1981 @lilchicklets78 @flysoulflower @lazartagwolf @Phil_Lewis_ I promise you, if Jamie Lee Curtis had Angela’s career in performances and sat there with class in a sad moment, this person wouldn’t say a goddamned thing. These folk are so used to policing us and our emotions that they don’t even realize that they’re doing it anymore.
1635156104438235137	tyreebriggs1	2023-03-13 05:49:29+00:00	en	That Jamie Lee Curtis shit rubbing me the wrong way. IDK why I'm so tight about this.
1635156069709389824	UnkyMrVenrick	2023-03-13 05:49:21+00:00	en	Odd that I can simultaneously feel that Colin Farrell and Kerry Condon were robbed and still feel very happy for Brendan Fraser and Jamie Lee Curtis.
1635156063136944129	HGisWell	2023-03-13 05:49:19+00:00	en	@staggerweed19 @keatingssixth She lost to someone who wasn't even the best supporting actress in her own movie. If she'd lost to one of the other nominees then whatever, but Jamie Lee Curtis shouldn't have been nominated for that role.
1635156047882260480	TheSwinginD	2023-03-13 05:49:16+00:00	en	@saras76 Just some actual actresses, when Jamie Lee Curtis won.
1635156041578201089	elonchieftwit	2023-03-13 05:49:14+00:00	en	EM @elonmusk Twitter Reactions To Jamie Lee Curtis Oscar Win - BuzzFeed https://t.co/AtF0zj37m6 #elon #elonmusk #twitter
1635156028022198273	fatfemmefae	2023-03-13 05:49:11+00:00	en	@ghostinmypocket if the academy acknowledged horror films jamie lee curtis could’ve gotten her flowers with halloween but they felt the need to rob stephanie hsu of her well deserved win to make up for it. i didn’t hate her eeaao performance but it should’ve been angela bassett at the very least
1635156019683934208	JPMisawesome15	2023-03-13 05:49:09+00:00	en	@allatoncemovie @dunkwun @Daniels @jamieleecurtis HUGE CONGRATS TO THIS INCREDIBLE FILM! ALL OF THE WINS WERE UNDOUBTEDLY WELL DESERVED! What a spectacular movie, and an even better group of people who worked on it! 7 amazing wins (plus all the other awards it won 🤩)! :)))) https://t.co/kYTdpTyxuq
1635156012616548357	bansheesofijbol	2023-03-13 05:49:07+00:00	en	jamie lee curtis was shut out from the industry for being a nepo baby
1635156007201701888	SGMovieReviews	2023-03-13 05:49:06+00:00	en	#OscarssoWhite are you kidding me? Jamie Lee Curtis over Angela and Stefanie Hsu? Nope, Woman King zero noms, Turning Red (losing to Pinocchio) #Oscars still white as hell
1635123212454592513	originalspin	2023-03-13 03:38:47+00:00	en	I honestly never thought I’d tweet this but: #OscarsSoAsian   #Oscar
1635155981805166592	seandehey	2023-03-13 05:49:00+00:00	en	tbh the oscars should move to a gold silver bronze kind of deal bc angela bassett, jamie lee curtis, and stephanie hsu all deserved to win this year  ranked choice oscars? idk mtv needs to reclaim awards relevance with stuff like best villain and best fight scene and so on
1635155977489256450	TheRealTR19	2023-03-13 05:48:59+00:00	en	I must've been one of the only people in the world who didn't enjoy Everything everywhere all at once, buzzing for the cast and crew though, Jamie Lee Curtis winning best supporting actress however was a travesty
1635155927090487298	dmphax	2023-03-13 05:48:47+00:00	en	@CinemaShogun Heard she was a poor sport about Jamie Lee Curtis getting a W. Tsk tsk....
1635155914725687296	cattywampus_tot	2023-03-13 05:48:44+00:00	en	I didn't want Jamie Lee Curtis to win🤣🤣🤣🤣...
1635155893783502849	shanikharris	2023-03-13 05:48:39+00:00	en	@arrigoaway @SpencerAlthouse I know. It would have been nice to see her win. Michelle Yeoh, Ke Huy Quan, Jamie Lee Curtis and Brendan Fraser all had comeback stories. Took a long time to achieve this success.
1635155864062664705	beacher_jack	2023-03-13 05:48:32+00:00	en	@BigberthaC @jamieleecurtis @TheAcademy You are a bad person for saying such a thing
1635155861005025281	mateoelfideo	2023-03-13 05:48:31+00:00	en	I absolutely adore jamie lee curtis, and glad she got the win, but if we're talking about best supporting actress in EEEAAO.....
1635155856185761794	accordcf	2023-03-13 05:48:30+00:00	en	Best Supporting Actress Jamie Lee Curtis | Oscars95 Press Room Speech https://t.co/47O60XW9Jc @YouTubeより
1635155796534386688	SheESPN	2023-03-13 05:48:16+00:00	en	@ada_lluch Now we have the Angela Basset v Jamie Lee Curtis opportunity…… minority report? #TomCruise #Maverick loses on all fronts? America doesn’t care!
1635155788057673730	EricJGaming	2023-03-13 05:48:14+00:00	en	Congratulations @jamieleecurtis well deserved 👏💐 after years of hard work #Oscar #oscars95
1635077623528423425	TheAcademy	2023-03-13 00:37:38+00:00	en	You never forget your first. Congratulations to @jamieleecurtis for winning the Oscar for Best Supporting Actress! #Oscars95 https://t.co/hHdUTNhTQW
1635155765987282944	DustofthePixies	2023-03-13 05:48:08+00:00	en	@helloshawtyawty She wasn’t “snubbed”. She and the 4 other nominees lost. Jamie Lee Curtis has been an actress for 45 years. She’s incredibly talented and her performance, as well as her movie, is amazing! She deserved the win! She’s also been everyone else’s cheerleader throughout awards season
1635155736383852546	superruiz93	2023-03-13 05:48:01+00:00	en	Angela Bassett had one good speech and then was absent the rest of the movie once Namor stole the show.   Jamie Lee Curtis ran around with hotdogs for fingers which is fine I guess?   I don't know how you see that lineup and don't pick Stephanie Hsu honestly.
1635155704469426176	Olas_Truth	2023-03-13 05:47:54+00:00	en	Why should she applaud, or do you, as white women feel you should dictate her actions? Jamie Lee Curtis is an admitted nepo baby while Angela Bassett has a masters from Yale School of Drama.  She doesn’t have to clap for anyone but her damn self. 👸🏾 👏🏿#OscarsSoWhite #Oscars
1635155699641753606	Murph6948	2023-03-13 05:47:53+00:00	en	@jamieleecurtis We are soooooo happy for you!!!!!!! Congratulations on your @TheAcademy Oscar!!!!!! #Welldeserved #Wedidittogether
1635155689260867584	the_seriexxx	2023-03-13 05:47:50+00:00	en	@TheAcademy @jamieleecurtis Am soooo happy for Jamie.. Her dissing of Marvel/Doctor strange 2 almost half thru 2022 not only paid off but won her an award.. To be fair though am so happy for her. After 40yrs of acting she got nominated and won in a single shot!!
1635155688304562176	ElaizaAird	2023-03-13 05:47:50+00:00	en	@jamieleecurtis @TheAcademy Congrats congrats! ms @jamieleecurtis your speech made me cry as I watch the Oscar awards. Among of all the speech who won at the Oscar tonight, yours is the most genuine of all. Indeed. 🫰❤️
1635155671158226944	ChipChandler1	2023-03-13 05:47:46+00:00	en	Adored Ke Huy Quan's speech, Jamie Lee Curtis' speech, every time The Daniels were on stage, the "Naatu Naatu" performance, Ruth Carter's speech, Sarah Polley's sarcasm and everything about Michelle Yeoh.
1635155670218711040	Showbiz_IT	2023-03-13 05:47:46+00:00	en	#AngelaBassett is breaking the internet for her reaction to Jamie Lee Curtis’s #Oscar win. Here’s why  https://t.co/9VVReSCKTx
1635155665802104833	SkyNews	2023-03-13 05:47:45+00:00	en	#Oscars The multiverse sci-fi comedy took home seven awards in total, with gongs for stars Michelle Yeoh, Ke Huy Quan and Jamie Lee Curtis, as well as the directing prize for Daniel Kwan and Daniel Scheinert, aka "the Daniels" https://t.co/eeg7giaAoS
1635155615936032769	wongmjane	2023-03-13 05:47:33+00:00	en	@markmcerqueira @gloria_sin The film won both supporting actor (Ke Huy Quan) and actress (Jamie Lee Curtis) which is f-ing badass 🔥🔥
1635155610693148674	everyone_going	2023-03-13 05:47:31+00:00	en	So I woke up and... Everything everywhere all at once did it🎊 But Jamie Lee Curtis over Stephanie Hsu is a little bitter. So happy for Michelle Yeoh #OSCARS
1635155607992012805	manny_boo	2023-03-13 05:47:31+00:00	en	Everyone’s reaction when Jamie Lee Curtis won BSA over Angela Bassett.
1635077449846489090	MichelleHux	2023-03-13 00:36:56+00:00	zxx	https://t.co/DMTlojVfsl
1635155559396818945	nighteaglehawk	2023-03-13 05:47:19+00:00	en	Now that's a twist. #everythingeverywhereallatonce #michelleyeoh #kehuyquan #jamieleecurtis #stephaniehsu #jameshong  #harryshumjr #movie #oscars #adventure #epic  #meme #memes #starwarsmemes #starwars #prequels #prequelmemes #prequeltrilogy #obiwankenobi #thephantommenace https://t.co/2PNAlXZVCN
1635155532309995521	keeeeekz	2023-03-13 05:47:13+00:00	en	Did Jamie Lee Curtis win  for halloween the scary movie ??
1635155529294295040	PopCultureIO	2023-03-13 05:47:12+00:00	en	Ke Huy Quan, Michelle Yeoh, Brendan Fraser and Jamie Lee Curtis with their #Oscars https://t.co/XdCRhV5Z9C
1635155520226197505	JoeE316	2023-03-13 05:47:10+00:00	en	There's like a dozen women who were more deserving of a best supporting nod than Jamie Lee Curtis
1635125956192129026	FilmUpdates	2023-03-13 03:49:41+00:00	en	What was the biggest snub at the #Oscars?
1635155508373118976	UnderdogBT	2023-03-13 05:47:07+00:00	en	Jamie Lee Curtis is an anime fan so I'm happy she won tonight!
1635077911727443969	IMDb	2023-03-13 00:38:47+00:00	en	Congratulations #JamieLeeCurtis for winning #BestSupportingActress in #EverythingEverywhereAllAtOnce! #Oscars 🎉🥯 https://t.co/81x6FM6u6o https://t.co/KeXkAiTZJg
1635155429146910720	CarmenGranddau1	2023-03-13 05:46:48+00:00	en	Jamie Lee Curtis was even nominated? https://t.co/IsJ0vDBHtC
1635155409454632960	crazyp575	2023-03-13 05:46:43+00:00	en	@jamieleecurtis congratulations 🎊 👏 💐 Jaime Lee I had no doubt that you were going to lose u so much deserved to win for your performance way to go 🥲🥲
1635155399434469378	Brescia69	2023-03-13 05:46:41+00:00	en	@ClownWorld_ Maybe Jamie could start * own production company.   What are Jamie Lee Curtis' pronouns?
1635155383689039873	hsu_melvin	2023-03-13 05:46:37+00:00	en	Jamie Lee Curtis Full Oscars Backstage Speech: "Don't Cancel Me!" https://t.co/nN6klaxqCH via @YouTube enjoy
1635155367515783169	Diyor0001	2023-03-13 05:46:33+00:00	en	#Oscar 2023 #Lead #actor @Brendan @Fraser, The @Whale #Lead #actress #Michelle #Yeoh, Everything Everywhere All at Once #Best #picture #Everything #Everywhere #All at #ONCE  Supporting actor #Ke #Huy #Quan Supporting actress #Jamie #Lee #Curtis Congratulations everyone! Good job! https://t.co/YfZ33bJeUs
1635155342802944007	vishboii	2023-03-13 05:46:28+00:00	en	Jamie Lee Curtis winning awards for Eeaao is shocking to me, she's not even the best candidate for supporting actress from that movie only. Kerry Condon robbed
1635155309361758209	ChanceJolivette	2023-03-13 05:46:20+00:00	en	A travesty for what they did Angela Bassett, Jamie lee Curtis won an Oscar for having Oscar mayer weiner fingers......motha fucka #Oscar2023
1635155289552093185	68suave	2023-03-13 05:46:15+00:00	en	Angela Bassett  had no chance when it come to them!!  #Oscar #JamieLeeCurtis #angelabasset https://t.co/YSspIgPJhs
1635155262758690821	CharlieRose1	2023-03-13 05:46:09+00:00	en	Oscars winners at the 95th Academy Awards - full list. Watch: Ke Huy Quan and Jamie Lee Curtis make emotional speeches. #Oscars  https://t.co/LLGb8RUDl9
1635155260715982848	UnPanderers	2023-03-13 05:46:08+00:00	en	First time Oscar winners Ke Huy Quan and Jamie Lee Curtis sharing a moment together after winning. via /r/UnPanderers https://t.co/Tnpc3QZDze #UnP #UnPanderers #PodernFamily https://t.co/M1WGl7QDBN
1635155257364996096	itsspelledwithK	2023-03-13 05:46:07+00:00	en	@jamieleecurtis best fing speech I've seen  in a while, love u woman 🖤 #Oscars you deserve it, enjoy girl 😎
1635155233054814208	shfjksm	2023-03-13 05:46:01+00:00	en	its the way i havent even seen eeaao and i know that award shouldnt be jamie lee curtis's
1635155227027595264	AzellaGardens	2023-03-13 05:46:00+00:00	en	Jamie lee Curtis did NOT deserve 😭
1635155205196255233	ComedianTrixx	2023-03-13 05:45:55+00:00	en	Soooooo Angela Basset was robbed…. I don’t care what anyone says… Jamie Lee Curtis wasn’t better than her… I saw both movies… NO
1635155183893381120	modernmoonage	2023-03-13 05:45:50+00:00	en	i want jamie lee curtis to be my aunt or grandmother or something SO BAD
1635155137164632066	honu82	2023-03-13 05:45:39+00:00	en	@glaad @jamieleecurtis Thank you for championing truth!!
1635155108395880449	AtomicMLive	2023-03-13 05:45:32+00:00	en	Huge W tonight, not just for Ke Huy Quan but for Michelle Yeoh, Jamie Lee Curtis, and Everything Everywhere All at Once for winning Best picture! SWEPT THE NIGHT!!!!
1635077761927901184	Variety	2023-03-13 00:38:11+00:00	en	"Mom, I just won an Oscar!" Ke Huy Quan sobs as he accepts the #Oscar for Best Supporting Actor. https://t.co/ndiKiHfmID https://t.co/92QIp3PRmS
1635155085188829184	Carissa5419	2023-03-13 05:45:26+00:00	en	@georgehahn @jamieleecurtis Agree 🙌🏻
1635155074287812608	eunhathelead	2023-03-13 05:45:24+00:00	en	Jamie Lee Curtis was the worst performance of her group and won. She’s not the victim of anything liberal and any claim of it proves she didn’t win of her own merit bc you’re jumping to discredit her competition based on their race
1635106649580146689	billsperos	2023-03-13 02:32:58+00:00	en	@jemelehill Poor Jamie Lee Curtis ... she's been a dutiful liberal for 60 years, has worn all the ribbons, and probably gave $5 zillion to every BLM group and social justice organization known to man  But to @jemelehill ... she's just another cracker
1635155050338320387	OjoPresley	2023-03-13 05:45:18+00:00	en	@vibraniumrolex Who was crying 🤔 and pls her performance was good but you can’t compare it to jamie lee Curtis performance
1635155030985838599	thehawtestkarl	2023-03-13 05:45:13+00:00	en	the academy celebrated a film about the Asian American experience by giving the Oscar to Jamie Lee Curtis lmaoooo
1635155026523078659	AHitDogHolla	2023-03-13 05:45:12+00:00	en	The short answer is yes. But did Jamie Lee Curtis deserve the win? Debatable.
1635116600134373376	itsKARY_	2023-03-13 03:12:31+00:00	en	Is that damn movie THAT good?!
1635155010240802816	PeachieRad	2023-03-13 05:45:08+00:00	en	idc if u think Jamie Lee Curtis deserved that award, y’all picking a white lady barely in the movie she won for vs women of color constantly snubbed for their years of work for and in their community won’t sit right with me.
1635155005778071553	queenlatifahs	2023-03-13 05:45:07+00:00	en	i’m sorry but did y’all forget the face jamie lee curtis made when angela bassett won the golden globe? i didn’t see y’all talking shit about her back then
1635154961595256833	jayscapeartist	2023-03-13 05:44:57+00:00	en	I used to think @ImAngelaBassett was more professional than what I witnessed tonight.  But when you see someone not able to be happy for another colleague’s success… You question your admiration. Jamie Lee Curtis is an amazing actor and she deserved it. #Oscars2023 https://t.co/s8pzCc3IMr
1635154957153476608	UFO_canada	2023-03-13 05:44:56+00:00	en	Look at Jamie Lee Curtis being the best mom
1635154928833544199	ChrisAWykes	2023-03-13 05:44:49+00:00	en	I think it's really important to ensure you have seen Jamie Lee Curtis's performance in EEAAO before saying Angela Bassett should have got the #Oscar I think Stephanie Hsu would also have been a worthy winner. #JamieLeeCurtis https://t.co/YyDSvZajxl
1635154903927783424	INHURTSWETRUST	2023-03-13 05:44:43+00:00	en	Everything everywhere all at once is really good as hell!!!!!!  Jamie Lee Curtis didn't deserve that Oscar either
1635154885359583232	GordonBellamy	2023-03-13 05:44:39+00:00	en	HALLOWEEN ENDS - with #Oscar winner Jamie Lee Curtis and Mason Powell https://t.co/EsLkutttHV
1635154871346421762	Opalk_Oboi	2023-03-13 05:44:35+00:00	en	While I am very happy for Jamie Lee Curtis let me go on record saying that Stephanie Hsu gave one of the most impressive performances I’ve ever seen and I totally wanted her to win.
1635154861636583429	ConleyPatillo	2023-03-13 05:44:33+00:00	en	@Dr7gns @just_juanie This scene is stronger than Jamie Lee Curtis’ catalogue…
1635154858180485120	SusieusMaximus	2023-03-13 05:44:32+00:00	en	The thing I love most about Jamie Lee Curtis and Christopher Guest as a couple is that they've been married for 38 years and raised kids and had careers and the whole nine yards and yet you can tell, it's so plain, that they're still wildly hot for each other.
1635154790543130624	TheRobertKeller	2023-03-13 05:44:16+00:00	en	The look on Jamie Lee Curtis’s face… Priceless! #Oscar https://t.co/orUVmm9FeT
1635154777167527936	SomersetNews	2023-03-13 05:44:13+00:00	en	Everything Everywhere All At Once rules the #AcademyAwards with SEVEN wins! Michelle Yeoh, Ke Huy Quan, Jamie Lee Curtis scoop Oscars and earns Best Picture... while comeback king Brendan... via https://t.co/pkDXi8JFDi https://t.co/xqdJrl40vG
1635154704408911873	MHawk9955	2023-03-13 05:43:55+00:00	en	…Jamie Lee Curtis? I love her and she definitely deserves AN Oscar but idk if she was my pick here. The other EEAAO performance nominated in this category was a better choice.
1635154607776337920	WonkoTheSaneUK	2023-03-13 05:43:32+00:00	en	@nataliepruiz @alyankovic @allatoncemovie @TheAcademy @jamieleecurtis I agree, but I don't think it's eligible, because it hasn't been shown in theaters.
1635154604244758528	comicsandroses	2023-03-13 05:43:32+00:00	en	Watching the Oscars wasn't on the schedule for today until we saw Del Torro, Key Huy Quan, and Jamie Lee Curtis win. But I already told my fiance I was cooking for him tonight so we made quick run at the grocery store, I cooked him up something tasty in a short amount of time..
1635154601187086336	RaymondTimney	2023-03-13 05:43:31+00:00	en	@OnTheRedCarpet Jamie Lee Curtis was great in "80 for Brady."
1635154599471648774	voidoidedhole	2023-03-13 05:43:30+00:00	en	They gave Jamie lee Curtis that #Oscar to make people forget she into weird children abusive shit..
1635154559424430084	lashthemenace	2023-03-13 05:43:21+00:00	en	Giving that award to Jamie Lee Curtis of all people was straight up racism
1635077801903808512	haworthes	2023-03-13 00:38:20+00:00	qme	❓❓❓❓❓ https://t.co/IIdnWnrkZo
1635154549286768641	Suspicious95	2023-03-13 05:43:18+00:00	en	@TheAcademy @jamieleecurtis loyalty gets rewarded https://t.co/pKllXHRbCB
1635154539140743169	kristentepper	2023-03-13 05:43:16+00:00	en	This was an overall really inspiring Oscar’s with a lot of films that I think more people have seen than a lot of pasts years. #KeHuyQuans win has made my life whole and no shade to Jamie Lee Curtis but 👀👀 I just am confused and disappointed in that vote but not surprised
1635154521839247360	kimlipmywifey	2023-03-13 05:43:12+00:00	en	I'm going to be a Jamie Lee Curtis hater for the rest of my life
1635154499886268416	luhermed64	2023-03-13 05:43:07+00:00	en	@_secret_angel @TheAcademy @jamieleecurtis The last name weighed, Tony Curtis's girl who never won anything, now they give it to her daughter, for doing nothing...
1635154421415043072	JEFFREYawards	2023-03-13 05:42:48+00:00	en	Also I think Jamie Lee Curtis is the first Oscar winner to have been on Guest Grumps
1635154415232626690	thescammr	2023-03-13 05:42:46+00:00	en	jamie lee curtis would be a beautiful name for a baby girl
1635154402553233408	thengeu	2023-03-13 05:42:43+00:00	en	You can say whatever you want about Jamie Lee Curtis but this person is an ally and also deserves the recognition she's getting. A MOTHER.
1635092696791678976	PopCrave	2023-03-13 01:37:32+00:00	en	Jamie Lee Curtis on degendering acting categories at the #Oscars:   "The bigger question is how do you include everyone when there are binary choices, which is very difficult, and as the mother of a trans daughter, I completely understand that." https://t.co/CeaPYifvAG
1635154377718763520	KaseyTech	2023-03-13 05:42:38+00:00	en	BigBreakingWire: #Oscars2023 Winners  "Everything Everywhere All At Once" RockStar Of The #oscars95  Got Best Picture Award  Best Actress: Michelle Yeoh  Best Supporting Actor: Ke Huy Quan  Best Supporting Actress: Jamie Lee Curtis.  Best actor: Brendan Fraser, From "The Wha…
1635154366708748289	guerotrash	2023-03-13 05:42:35+00:00	en	jamie lee curtis, i’m not mad @ you. you academy lot are going to HELL
1635154323746463747	Sorakaslight	2023-03-13 05:42:25+00:00	en	@SpencerAlthouse I love the “oh shut up” from Jamie Lee Curtis
1635154302707855363	sIiceofruit	2023-03-13 05:42:20+00:00	en	woke up to jamie lee curtis sajaegi again like seriously how is this HAPPENING
1635154292486324225	Marthamountsins	2023-03-13 05:42:17+00:00	en	I don’t believe this and refuse to, both women are amazing actresses and I know Angela Basset isn’t a petty woman. Prove me wrong internet. Please. #oscars #angelabasset #JamieLeeCurtis
1635109942628880384	nypost	2023-03-13 02:46:03+00:00	en	Angela Bassett doesn’t clap for Jamie Lee Curtis’ oscar win https://t.co/iPwdruo3AY https://t.co/ULxqF7lupo
1635154291232239617	SpyHards	2023-03-13 05:42:17+00:00	en	Big congrats to spy movie icons Michelle Yeoh and Jamie Lee Curtis for their much-deserved Oscar wins for the terrific #EverythingEverywhereAllAtOnce! https://t.co/1GshNHPGWO
1635154290892500994	DanFarfan	2023-03-13 05:42:17+00:00	en	I hope Jamie Lee Curtis acceptance speech tonight inspires some folks to find (and watch) some of her parents' films.
1635154245031952384	mitzi1946	2023-03-13 05:42:06+00:00	en	@amyklobuchar @jamieleecurtis Groomers 🤢🤮
1635154241198362624	givagivaz	2023-03-13 05:42:05+00:00	en	Academy Award Winner: Jamie Lee Curtis ❤️ https://t.co/T1fnmPodkp
1635154240573419521	dexrjones	2023-03-13 05:42:05+00:00	en	I never get upset about awards but this Jamie Lee Curtis thing is so nonsensical. She shouldn't have even been nominated!
1635154225260032001	aiden17hi	2023-03-13 05:42:01+00:00	en	Fuck all y’all haters. Jamie Lee Curtis been in this game and deserved the hell out of that award. I’ll never understand people trying to undermine someone’s achievement of a lifetime I’m so happy for her. https://t.co/UWuJ9nmvgr
1635077623528423425	TheAcademy	2023-03-13 00:37:38+00:00	en	You never forget your first. Congratulations to @jamieleecurtis for winning the Oscar for Best Supporting Actress! #Oscars95 https://t.co/hHdUTNhTQW
1635154217689321473	GabrielDeShawn	2023-03-13 05:41:59+00:00	en	I have no clue how Stephanie Hsu didn’t win Best Supporting Actress.   Jamie Lee Curtis said 30 words in the movie 😂
1635154196923310080	DrewOfBorg	2023-03-13 05:41:54+00:00	en	I won't hear any Jamie Lee Curtis slander.
1635077489876951041	DiscussingFilm	2023-03-13 00:37:06+00:00	en	Jamie Lee Curtis wins Best Supporting Actress at the #Oscars  See the full winners list: https://t.co/W5iOmTPKi2 https://t.co/xz50bptM1k
1635154163821871104	futuraafreee	2023-03-13 05:41:47+00:00	en	#Oscar ain’t no way Jamie Lee Curtis won over Stephanie Hsu 🫤
1635154131680915457	JeteiraT	2023-03-13 05:41:39+00:00	en	I can't believe, omg. @jamieleecurtis congrats my love your first #Oscars after 45 years, ✨😭. https://t.co/vdUEBYNj4W
1635154120687616000	naurbz	2023-03-13 05:41:36+00:00	en	Take a second to re-read the dumbass shit you just said and let me ask you why you ain’t say the same thing about Jamie Lee Curtis’ performance in THE SAME MOVIE
1635077952617713665	angryasianman	2023-03-13 00:38:56+00:00	en	Absolutely love Jamie Lee Curtis winning Best Supporting Actress. But let me have one more moment to say Stephanie Hsu gave the goddamn lightning fire of a performance in Everything Everywhere All at Once. #Oscars
1635154097660895232	wisreb3l	2023-03-13 05:41:31+00:00	en	@TheGamerCollin @GraceRandolph Jamie Lee Curtis couldn’t act better than Angela if she wanted to… She’s levels above Jamie respectfully
1635154093533540352	CharlieRose1	2023-03-13 05:41:30+00:00	en	Oscars 2023: 7 best moments from the 95th Academy Awards. Watch: Ke Huy Quan and Jamie Lee Curtis make emotional speeches. #Oscars  https://t.co/iHNc1QLXes
1635154088567668737	Jesse_T_White	2023-03-13 05:41:29+00:00	en	@ilyclemmie Jamie Lee Curtis was great in the movie, but seriously her over Stephanie Hsu...or Angela Bassett...or Hong Chau and Kerry Condon?
1635154087061917697	JoshuaSoape	2023-03-13 05:41:28+00:00	en	@torkdownforwhat @mattyice24601 Jamie Lee Curtis should’ve have won I don’t need to see any other movie to know that
