tweet.id,tweet.user.username,tweet.date,tweet.lang,tweet.rawContent,label,score
1635030820477083648,DayToDayWithJ,2023-03-12 21:31:39+00:00,en,Still mad #TheWomenKing didn't get nominated but hoping #EverythingEverywhereAllAtOnce wins. But I'm biased because #MichelleYeoh plays one of my fav #startrek characters lol #Oscars2023 #Oscars    #AcademyAwards,positive,0.6085891127586365
1635059198471069696,deputydman,2023-03-12 23:24:25+00:00,en,Happy “Michelle Yeoh wins an Oscar day” to all those that celebrate! https://t.co/ld5aYAvq4y,positive,0.9884945750236511
1635068130560212993,uncannyfemme,2023-03-12 23:59:55+00:00,en,better wake up to angela bassett and michelle yeoh oscar winners,positive,0.8696566224098206
1635027382708088834,David_Johnson41,2023-03-12 21:18:00+00:00,en,@bendreyfuss michelle yeoh vs cate blanchett for best lead actress is the only interesting battle to me. Both were seriously fantastic,positive,0.9722139239311218
1635046360507629568,FilmSnork,2023-03-12 22:33:24+00:00,en,MY 2023 OSCAR PREDICTIONS  Picture EEAAO • Director Daniels - EEAAO • Actor Brandon Fraser  • Actress Michelle Yeoh • Support. Actor Ke Huy Quan •  Support Actress Jamie Lee Curtis • Original Screenplay  EEAAO • Adapt Screenplay  All Quiet,neutral,0.9466142654418945
1635065048011014145,JamesPerales,2023-03-12 23:47:40+00:00,en,#michelleyeoh is a timeless beauty who can kick butt! #Oscar #EverythingEverywhereAllAtOnce,positive,0.9677529335021973
1635028923989004288,jpaudouy,2023-03-12 21:24:07+00:00,en,@tony_ogilvie I love how Michelle Yeoh allows herself not to take things seriously. She’s great.,positive,0.9101074934005737
1635052041906319360,LindsayNK9,2023-03-12 22:55:59+00:00,en,"I was playing Heads Up while waiting in lines at Disneyland yesterday and there was a public figure I had to guess named ""Michelle Yeah"" - I can only assume they meant ""Michelle Yeoh"" - What a big gaffe on their part 😂",neutral,0.5026751160621643
1635059962471911424,philipjonathn,2023-03-12 23:27:27+00:00,en,Michelle Yeoh is stunning in Dior #Oscars https://t.co/DT3uNsfUvE,positive,0.9615318775177002
1635060019522838534,thepinkzs,2023-03-12 23:27:41+00:00,en,michelle yeoh with this fuckass dior couture i just fell down on my knees……….,negative,0.9438212513923645
1635064025791987714,sarahflo93,2023-03-12 23:43:36+00:00,en,THE LOOK I WAS WAITING FOR. MICHELLE YEOH. https://t.co/49RcylXlt9,positive,0.9217352867126465
1635046676556828673,monkeysjw,2023-03-12 22:34:40+00:00,en,21/24 Actress: Will win: Michelle Yeoh; Should win: Cate Blanchett,neutral,0.4995007812976837
1635061786671206400,TheirUsernameIs,2023-03-12 23:34:42+00:00,en,Oscar Predictions  Best Picture - Everything Everywhere All At Once Best Actor - Colin Farrell Best Actress - Michelle Yeoh Supporting Actor - Ke Huy Quan Supporting Actress - Angela Bassett,positive,0.6296153664588928
1635059418244194304,menos_zapping,2023-03-12 23:25:17+00:00,en,Michelle Yeoh llega al #Oscar. Nominada por Everything Everywhere All at Once https://t.co/uV0CIKu9me,neutral,0.7690404653549194
1635055583194918912,whoisbenchang,2023-03-12 23:10:03+00:00,en,Debating if should watch #Oscars95 or just rewatch @chrisrock’s “Selective Outrage” on @netflix (or any one of Michelle Yeoh’s movies…),neutral,0.8906838893890381
1635063518214127616,stephaniehsuhq,2023-03-12 23:41:35+00:00,en,They are gorgeous!  #StephanieHsu #MichelleYeoh #Oscars https://t.co/RPBgILJMcc,positive,0.9800455570220947
1635060691299352577,GRANDHIGHWlTCH,2023-03-12 23:30:21+00:00,en,gonna need more angles of this michelle yeoh x kerry condon moment stat https://t.co/T2FEnzzTGS,neutral,0.7925321459770203
1635064593474260994,wheenona,2023-03-12 23:45:51+00:00,en,michelle yeoh literally mother,neutral,0.699083685874939
1635055282744348673,MistaFeller,2023-03-12 23:08:51+00:00,en,Predicting #MichelleYeoh in the color red #Oscars,neutral,0.6228825449943542
1635059736394735619,FilmUpdates,2023-03-12 23:26:33+00:00,en,Michelle Yeoh at the 2023 #Oscars  https://t.co/DG1ETTZx1Z,neutral,0.7815129160881042
1635067073041944577,PJonDraft,2023-03-12 23:55:42+00:00,en,Also I wanna say that Cate Blanchett gave the most iconic character performance since Daniel Day-Lewis in There Will Be Blood. Maybe I’m forgetting some and I love Michelle Yeoh but full-steam ahead on the Blanchett train for me. #Oscars,positive,0.9650628566741943
1635067112476790784,SandraMG,2023-03-12 23:55:52+00:00,en,Happy #Oscars to all who celebrate! I'm home in the nick of time and livetweeting the last awards show of the year and the ultimate declaration of Michelle Yeoh Supremacy so LET'S GO! https://t.co/e2WP65jngu,positive,0.9889671206474304
1757575882800271433,CoinLedger,2024-02-14 01:21:59+00:00,en,"Get your crypto taxes done in minutes. Trusted by 500,000+ investors. Sign up for free.",positive,0.763889729976654
1635062939505004544,murdocksblyth,2023-03-12 23:39:17+00:00,et,michelle yeoh looks like an angel omg,positive,0.9699144959449768
1635045223855456256,alfanshar,2023-03-12 22:28:53+00:00,en,#Oscars95 Prediction (Should/Would)  Film: EEAAO/EEAAO Actor: Colin Farrell/Brendan Fraser Actress: Michelle Yeoh/Michelle Yeoh Sup Actor: Ke Huay Quan/Ke Huay Quan Sup Actress: Stephanie Hsu/Angela Bassett Director: The Daniels/The Daniels,neutral,0.93482905626297
1635058797042634755,sophiesoaps8123,2023-03-12 23:22:49+00:00,en,Omg Michelle yeoh looks beautiful 😍😍😍 her hair the dress!!  &amp; Jean Todt is just there  #Oscars,positive,0.9854119420051575
1635051966278815745,msamandaspears,2023-03-12 22:55:41+00:00,en,"#Oscars #Oscars95 Predictions continued: @AwardsRadar  Best Actor: Brendan Fraser #TheWhale  Best Actress: Michelle Yeoh #EEAAO  Best Supporting Actor: Ke Huy Quan, #eeaaosweep  Best Supporting Actress: Jamie Lee Curtis, #EEAO  P.S. I don’t feel good about this https://t.co/rEMOVcV1XX",neutral,0.8228040933609009
1635063321434157057,michaelsville,2023-03-12 23:40:48+00:00,en,Michelle Yeoh everything everywhere all in white #Oscars #ERedCarpet https://t.co/4uMiHPENZM,neutral,0.6773239374160767
1635052849980919808,charlieirving24,2023-03-12 22:59:11+00:00,en,I’m so excited for the Oscar’s tonight. Let’s go Michelle Yeoh 💛,positive,0.9909632802009583
1635063719490355200,dcsteve5,2023-03-12 23:42:23+00:00,en,Me hyping up Michelle Yeoh tonight https://t.co/MVhElFQ17P,positive,0.856291651725769
1635047637299675136,RandyShulman,2023-03-12 22:38:29+00:00,en,"Here's who @DorianAwards thinks WILL WIN an #Oscar for Best  Actress.  Michelle Yeoh, EEAAO - 77% Cate Blanchett, Tár - 22% Andrea Riseborough, To Leslie - 99% Michelle Williams, Fabelmans - 0% Ana De Armas, Blonde - 0%  https://t.co/VjX40BnQwd https://t.co/wSljDbyzT5",neutral,0.6784544587135315
1635061469653143553,SofiaVogel14,2023-03-12 23:33:26+00:00,en,MICHELLE YEOH LOOKS LIKE AN ANGEL #MichelleYeoh #EEAAO 💖 https://t.co/zPvNucYsIa,positive,0.9778451323509216
1635047225456832512,decider,2023-03-12 22:36:50+00:00,en,"Michelle Yeoh portrayed over 70 different versions of herself in #EverythingEverywhereAllAtOnce, which means–if she wins tonight–she’ll be the record holder for the winner that played the most characters in one movie. #Oscars https://t.co/Q8i9UU4qPK",positive,0.8916313052177429
1635065283642793984,cstephens2,2023-03-12 23:48:36+00:00,en,"Terrific responses from #MichelleYeoh , and she was actually given good questions! Brought the threat of tears for me. And she looks amazing in her gown. #Oscar #Oscars #EverythingEverywhereAllAtOnce #OscarsRedCarpet",positive,0.9834842085838318
1634913090428100608,StyleWriterNYC,2023-03-12 13:43:50+00:00,en,"In advance of tonight’s #Oscars, here’s a great poster designed by a London-based firm with illustrations of all the looks worn by the best-actress winners over the years, love this … https://t.co/4Qz7vs9NEN",positive,0.9826428890228271
1635028166862606336,Jaime_alf,2023-03-12 21:21:06+00:00,en,A sneak peek at my #Oscars menu tonight:   Paul Mezcal  Michelle Yeoh-gurt almonds Ban-Ana de Armas chips Angela Bassett did the everything bagel chips https://t.co/lUDngKjp3b,neutral,0.7797812819480896
1634947358084726785,HousandArts,2023-03-12 16:00:00+00:00,en,And there we have them- all together! A very happy #Oscars2023 day to you!  @TheAcademy  #Oscars95 #BestPicture https://t.co/JMLCJIXCvO,positive,0.9896816611289978
1635058754654990342,carebearscare91,2023-03-12 23:22:39+00:00,en,Michelle Yeoh looks sooo good,positive,0.9693863391876221
1635067025797296128,RadioFreeAnna,2023-03-12 23:55:31+00:00,en,My DoorDash driver's name is Michelle.... That guarantees it. Michelle Yeoh will take home the Oscar.,positive,0.832231342792511
1635031518283431936,Aceman1138,2023-03-12 21:34:26+00:00,en,My  Oscar picks:  Best Picture: All Quiet on the Western Front  Lead Actor: Brendan Fraser  Lead Actress: Michelle Yeoh  Supporting Actor: Barry Keoghan  Supporting Actress: Kerry Condon   Director: Daniel Kwan and Daniel Scheinert  1/2 #Oscars2023 #AcademyAwards #Oscars95,neutral,0.6698309779167175
1635054211150016513,Angdiez,2023-03-12 23:04:36+00:00,en,"Anyway, el prayer circle de hoy:                      🕯      🕯            🕯 paul mescal /🕯                    colin farrell        🕯    michelle yeoh     🕯               jonathan ke quan            🕯stephanie hsu🕯                     🕯      🕯",neutral,0.8319689631462097
1635064392944603136,queenfq33,2023-03-12 23:45:03+00:00,en,Michelle Yeoh better win tonight,positive,0.6350706815719604
1635065164063195136,jgitchell,2023-03-12 23:48:07+00:00,en,Sending positive and strong energy for @ImAngelaBassett and #MichelleYeoh tonight!  #Oscars   #LetsDoThis,positive,0.9630186557769775
1635059234051338240,letterboxd,2023-03-12 23:24:33+00:00,en,MICHELLE YEOH HAS ARRIVED #Oscars https://t.co/vEUNUHLaAH,positive,0.8208039402961731
1635031096441319426,TsuiAllen,2023-03-12 21:32:45+00:00,en,"This article by @annabelnugent of @Independent is a wonderful write up of a fabulous film. ""Why Michelle Yeoh’s wacky frontrunner does actually deserve Best Picture"" https://t.co/w4SqMLCYAC",positive,0.9741266369819641
1635063369567993856,BostonGlobe,2023-03-12 23:40:59+00:00,en,Michelle Yeoh arrives in white on the champagne carpet at the #Oscars. Will she get the nod for best actress? Follow our coverage for updates. https://t.co/aynUqiATrB https://t.co/IcPfsYYfqd,positive,0.6431987285614014
1635067763852185601,RayceenHRH,2023-03-12 23:58:27+00:00,en,Divas are making an entrance at #Oscars2023  #JanelleMonae #LadyGaga  #angelabassett  #MichelleYeoh https://t.co/ztqC44wZSW,positive,0.5345950722694397
1760384451324862700,RSVLTS,2024-02-21 19:22:14+00:00,en,Hearts on Fire shorts are back! 🇺🇸 Get 'em while you can!,positive,0.8616284728050232
1635046936012267520,JoVoiceofreason,2023-03-12 22:35:41+00:00,en,I really want to see who will win the #Oscars for best actress (Cate Vs Michelle Yeoh) https://t.co/o0MvoskcS2,positive,0.8418328166007996
1635044608856997892,TheWrap,2023-03-12 22:26:27+00:00,en,"Everything Everything All At Once royalty Michelle Yeoh, Ke Huy Quan and Stephanie Hsu are traveling to a new multiverse in the ""American Born Chinese"" teaser. https://t.co/U0qeG3taxb",neutral,0.7603486180305481
1635050875742998528,MovieMarker,2023-03-12 22:51:21+00:00,en,Stephanie Hsu. Michelle Yeoh.  They. Are. EVERYTHING.  #Oscars2023 #Oscars95 #Oscars https://t.co/a9EpPtSk0e,positive,0.9101018309593201
1635028395108204544,Knight_2359,2023-03-12 21:22:01+00:00,en,Who I'm rooting for tonight  Best Film: Tar (marginally?)  Best Director: Spiely Best Actor: Paul Mescal Best Actress: Michelle Yeoh (I'm bigger on Cate's performance but she's won enough) Best Supporting Actress: Stephanie Hsu Best Supporting Actor: BARRY BARRY BARRY,positive,0.9174374938011169
1635049954011123712,IsiahMagsino,2023-03-12 22:47:41+00:00,en,One of my favorite things about Michelle Yeoh is that her partner is a very wealthy French man. @TandCmag @emburack https://t.co/ubJNhvKqJK,positive,0.971016526222229
1635061078404235264,CAPTAlNPUGH,2023-03-12 23:31:53+00:00,en,I ABSOLUTELY WANT MY PICTURE WITH MICHELLE YEOH AND ANGELA BASSETT #Oscars,positive,0.888744592666626
1635064998711140354,FatFilmReviewer,2023-03-12 23:47:28+00:00,en,#Oscars  Predictions: Best Film: Everything Everywhere All At Once Best Actor: Brendan Fraser Best Actress: Michelle Yeoh Best Supporting Actor: Ke Huy Quan Best Supporting Actress: Kerry Condon Best Foreign Film: All Quiet on the Western Front Best Original Song: Naatu Naatu,positive,0.7112975716590881
1635059001863049216,margschow,2023-03-12 23:23:38+00:00,en,Michelle Yeoh is definitely winning an Oscar,positive,0.9300442934036255
1759954633068335606,oneminutehacks,2024-02-20 14:54:17+00:00,en,"From the bone-chilling anglerfish to the enigmatic depths of the Mariana Trench, explore the haunting tales and unearthly creatures that will send shivers down your spine. Here are.",neutral,0.7000285983085632
1635052212568346624,jdb1138,2023-03-12 22:56:39+00:00,en,While many of you are yelling GO MICHELLE YEOH or GO TÁR! I’m yelling GO SILICON BALLEY BANK AND THE FEDERAL RESERVE! #Oscars,positive,0.6261737942695618
1635047676793466880,gelo_boi,2023-03-12 22:38:38+00:00,en,Michelle Yeoh should win tonight,positive,0.6609048843383789
1635050899994443776,BGSULady,2023-03-12 22:51:26+00:00,en,I can't wait to see Michelle Yeoh tonight #AcademyAwards https://t.co/dfP3fNdHTt,positive,0.9879796504974365
1635059934051336192,GraveDancer40,2023-03-12 23:27:20+00:00,en,Michelle Yeoh looks gorgeous!!  Also does Jean Todt presence make this a racing tweet?,positive,0.9619234204292297
1635067265761816579,george_rants,2023-03-12 23:56:28+00:00,en,"Best Actress?   Didn't see #TAR but I think Michelle Yeoh wins it tonight, repeat winners are at a disadvantage and people seem to love voting for #EverythingEverywhereAllAtOnce.   #Oscars",positive,0.8252183198928833
1635051843448635393,nothing1seasy,2023-03-12 22:55:11+00:00,en,tuning into the fourth day of caratland but the fourth day is actually the oscars and hoping michelle yeoh unnie wins https://t.co/EquqpW1M0x,positive,0.5923556089401245
1635042719730143232,HYNSHK,2023-03-12 22:18:56+00:00,en,Michelle Yeoh goin to her wedding with Oscar. #Oscars https://t.co/Qp2cWU6vru,neutral,0.7561345100402832
1635058635222179840,FilmUpdates,2023-03-12 23:22:11+00:00,en,Michelle Yeoh at the 2023 #Oscars https://t.co/p6FTs8FGXT,neutral,0.7529215812683105
1635041172216492032,sthetherington,2023-03-12 22:12:47+00:00,en,"Leading Actress 1. Cate Blanchett (Tár) 2. Michelle Yeoh (EEAAO) 3. Michelle Williams (Fabelmans) 4. Ana de Armas (Blonde)  ? Andrea Riseborough  I would be very, very happy with a Yeoh win, but Blanchett gives one of the best performances I've ever seen.",positive,0.6827778220176697
1635049476024053760,larry_heath,2023-03-12 22:45:47+00:00,en,"Alright, for those also playing at home, my annual Oscar picks are…  Best Picture  EEAAO  Director Daniels, EEAAO   Actor Leading  Brendan Fraser, The Whale  Actress Leading  Michelle Yeoh, EEAAO  Actor Supporting Ke Huy Quran, EEAAO  Actress Supporting Jamie Lee Curtis, EEAAO",neutral,0.6974974274635315
1635063390979919873,RWWFilm,2023-03-12 23:41:05+00:00,en,BEST ACTRESS  Will Win: Michelle Yeoh Everything Everywhere All at Once  22/24 #Oscars https://t.co/6Z27PpOudC,positive,0.9677776098251343
1635028514016460800,comedynews,2023-03-12 21:22:29+00:00,en,"Michelle Yeoh and Ke Huy Quan’s Action-Comedy Series ‘American Born Chinese’ Sets Release Date, Unleashes Teaser – Deadline https://t.co/GaZ87isVpF",neutral,0.9120786190032959
1635030404343414784,WIONShowbiz,2023-03-12 21:30:00+00:00,en,In Pics | #Oscars 2023: final predictions: Who will win the golden trophy - Michelle Yeoh to Angela Bassett  #Oscars2023  https://t.co/OI4acj4c4h,neutral,0.6855752468109131
1635067309869133824,JPCogs,2023-03-12 23:56:39+00:00,en,Best Actress 1. Cate Blanchett- Tar 2. Michelle Yeoh- Everything Everywhere All at Once 3. Andrea Riseborough- To Leslie 4. Michelle Williams- The Fabelmans 5. Ana de Armas- Blonde,neutral,0.5946625471115112
1635029331134259200,Kinetospop,2023-03-12 21:25:44+00:00,en,@syylllia @Leclubofficiel 1. EEAO 2. Brendan Fraser 3. Michelle Yeoh 4. Ke Huy Quan  5. Jamie lee curtis 6. Pinocchio 7. EEAO 8. Babylon 9. EEAO 10. Babylon 11.  Babylon 12. Avatar 13. Vivre 14. All quiet 15. Hold my hand 16. All quiet  17. Fire of love  18. Spielberg 19. All quiet 20. The whale,neutral,0.9431861639022827
1635067767442522113,GansaAmericana,2023-03-12 23:58:28+00:00,en,"@WFKARS Notes thus far: 100% agree on Halle Berry, Halle Bailey looks like a Tiffany's princess, Jennifer Connelly is flawless, Michelle Yeoh looks like an angel, Cara Delevigne is SERVING, Ashley Graham looks incredible, and Gaga is stunning as usual.",positive,0.9761788249015808
1635066256083808256,Justlove3332,2023-03-12 23:52:28+00:00,en,Michelle Yeoh's interview on the red carpet was absolutely wonderful! She's so awesome!!,positive,0.9904904365539551
1635031206978002944,fantasy_bc,2023-03-12 21:33:11+00:00,en,"With all the love i have for Cate Blanchett, imma watch the Oscars like this: #Oscars                        🕯       🕯            🕯                           🕯                  Michelle Yeoh              🕯                            🕯                       🕯       🕯️",positive,0.875472366809845
1760439261570981950,MakingWaveTalk,2024-02-21 23:00:01+00:00,en,"Ensure error-free, high-quality accounting with automated data sync between your systems. Don't compromise – connect Wave and Shopify today for seamless sales and accounting!",positive,0.6695539355278015
1635062068704600064,mattnightingale,2023-03-12 23:35:49+00:00,en,"Best Picture: EEAAO Best Actress: Michelle Yeoh Best Actor: Austin Butler Best Supporting Actress: Jamie Lee Curtis Best Supporting Actor: Ke Huy Quon Best Original Screenplay: EEAAO Best Adapted Screenplay: Women Talking Best Director: Daniels, EEAAO",positive,0.5741336345672607
1635049478129582080,GoodKidNapCity,2023-03-12 22:45:47+00:00,en,Best Actor:  Will Win-Brendan Fraser Should Win- Paul Mescal Watch Out For- Austin Butler  Best Actress:  Will Win- Michelle Yeoh Should Win- Michelle Yeoh Watch out for- Cate Blanchett  Sup Actress:  Will Win- Kerry Condon Should Win-Stephanie Hsu Watch out for- Jamie Lee Curtis,neutral,0.5542461276054382
1635060515000180736,chillsgeek,2023-03-12 23:29:39+00:00,en,Michelle Yeoh arrives at the 2023 #Oscars    https://t.co/bchjhPGGTn,neutral,0.7539392709732056
1635065333626339328,parasocietal,2023-03-12 23:48:48+00:00,en,michelle yeoh looking beautiful but omg can yall ask pedro abt something else?!? #Oscars #Oscars2023,positive,0.8779513239860535
1635059801226084353,bernadettefoxd,2023-03-12 23:26:49+00:00,en,THEY ARE DOING LIVE TELECAST OF OSCARS IN PAVILION TO CELEBRATE MICHELLE YEOH WHY AM I WORKING RIGHT NOW,neutral,0.521462619304657
1635024656167211008,itgirlenergy,2023-03-12 21:07:09+00:00,en,This is the type of opulence I've been missing on the red carpet https://t.co/az0JfvMvT4,positive,0.4171454906463623
1635064829257093122,nmbcore,2023-03-12 23:46:47+00:00,en,god michelle yeoh looks absolutely stunning rn 😭,positive,0.9769788384437561
1635048182282608640,girbloss,2023-03-12 22:40:39+00:00,en,@magdalenepop michelle yeoh would like to have a word....,neutral,0.9016883969306946
1635065211806949376,SimonPuppet,2023-03-12 23:48:19+00:00,en,I don’t care about the oscars but if Michelle Yeoh doesn’t win Im gunna kill myself,negative,0.8619428277015686
1635042928346411010,chainer2111,2023-03-12 22:19:46+00:00,en,I've got a disgusting feeling voters are gonna go the #OscarsSoWhite route and deny Michelle Yeoh her Best Actress Oscar and EEAAO Best Picture.  Just got a disugsting feeling #Oscars,negative,0.8915786743164062
1635023478851244032,BenNgTexas,2023-03-12 21:02:29+00:00,en,"Michelle Yeoh and Ke Huy Quan’s Action-Comedy Series ‘American Born Chinese’ Sets Release Date, Unleashes Teaser https://t.co/uuUegHKoTG https://t.co/5IdXYmpjUy",neutral,0.8520838618278503
1635051384298143744,KidFate,2023-03-12 22:53:22+00:00,en,Alright here are my Oscar predictions:  Picture: EEAAO Actor: Austin Butler Actress: Michelle Yeoh Support Actor: Ke Huy Quan Support Actress: Jamie Lee Curtis Director: Spielberg  My picks: Banshees of Inisherin Colin Farrell Michelle Yeoh Ke Huy Quan Kerry Condon  McDonagh,neutral,0.8863005638122559
1635067469038604288,fix_newspeak,2023-03-12 23:57:17+00:00,en,Michelle Yeoh reunites with 'EEAAO' family in 'American Born Chinese' teaser - Entertainment Weekly News https://t.co/g4v8prTDZf #TrendingNow #HotTopics #Trending #News #NewsUpdate #Forumidex #MyForumLink,neutral,0.856494128704071
1635042119110004736,PhilIervolino30,2023-03-12 22:16:33+00:00,en,Oscar Predictions and Picks:  Picture:  Will Win: EEAAO  Should Win: EEAAO   Director:  Will Win: The Daniels  Should Win: Spielberg   Lead Actor:  Will Win: Brendan Fraser  Should Win: Paul Mescal   Lead Actress:  Will Win: Michelle Yeoh  Should Win: Yeoh or  Blanchett,neutral,0.681671142578125
1635062014392553472,llarissel,2023-03-12 23:35:36+00:00,en,"If Michelle Yeoh wins, she needs to get behind me. If Michelle Yeoh loses, she still needs to get behind me.  I know those Katie Blanket stans are gonna be NASTY",negative,0.5174833536148071
1635060597137219585,Kyuki619,2023-03-12 23:29:58+00:00,en,#MichelleYeoh is a beautiful swan~~ #Oscars #Oscars95 https://t.co/CNvuLLVrWJ,positive,0.9752325415611267
1635050503548596232,CinemasOnline,2023-03-12 22:49:52+00:00,en,The #Oscars are nearly here… Now’s the time to place final bets!  Will Michelle Yeoh triumph over one time shoe-in Cate Blanchett for Best Actress? Can Austin Butler’s Elvis dethrone former favourite Brendan Fraser’s The Whale? Is going to be All Quiet or Everything Everywhere?! https://t.co/jiSvRRGYdl,positive,0.6737693548202515
1635043003252477954,MayaPolon,2023-03-12 22:20:04+00:00,en,"My toxic trait is every time sometimes talks about wanting Michelle Yeoh to win tonight I’m like let me tell you about her racist partner, former FIA President Jean Todt",negative,0.8026502132415771
1635053032466698243,kendallgrl,2023-03-12 22:59:55+00:00,en,LEAD ACTOR : COLIN FARRELL (BRENDAN ALIR GIBI) SUPPORTING ACTOR: KE HUY QUAN LEAD ACTRESS : MICHELLE YEOH SUPPORTING ACTRESS : STEPHANIE HSU DIRECTING : TOS HARIC HEPSI BEST PICTURE : YINE EEAO TBOI THE FABELMANSDEN BIRI https://t.co/VloUSR8AK8,neutral,0.5944327116012573
1635063210016669697,MIUCClAMUSE,2023-03-12 23:40:21+00:00,en,"michelle yeoh in dior at the 2023 oscar’s, considering how she has turned so many looks this award season, this look certainly fell short https://t.co/MGC6r3OoEV",negative,0.5048699378967285
1635059361293955072,DerekMilman,2023-03-12 23:25:04+00:00,en,@BrendanReichs Best Picture: Everything Everywhere All At Once. Best Director: The Daniels (EEAAO).  Best Actress: Michelle Yeoh Best Actor: Brendan Fraser. Best Supporting Actor: Ke Huy Quan Best Supporting Actress: Jamie Lee Curtis Editing: EEAAO. Cinematography: All Quiet,positive,0.6612568497657776
1635042945220104192,lifemixxport,2023-03-12 22:19:50+00:00,en,THE FACT THAT MICHELLE YEOH IS LITERALLY MOTHER RIGHT NOW https://t.co/hkrygN4W4W,neutral,0.679244339466095
1635064956038127619,JustJared,2023-03-12 23:47:18+00:00,en,Nominee Michelle Yeoh arrived at the #Oscars and made a rare red carpet appearance with her longtime love Jean Todt (they met in 2004 and have been engaged since 2005!) See the photos:   https://t.co/Bb8Um1Rqzt,positive,0.8766133189201355
1635064481029160960,AzizaDefensor,2023-03-12 23:45:24+00:00,en,Michelle Yeoh’s voice is so sultry bruh 😍,positive,0.9640253186225891
1635041408905248771,PIXYKYUN,2023-03-12 22:13:44+00:00,en,if michelle yeoh and angela bassett don’t win tonight i will have a terrible week,negative,0.8397728204727173
1635064552898596865,KLAVIERGAVlN,2023-03-12 23:45:42+00:00,en,michelle yeoh looks like she's getting married at the oscars,neutral,0.7275606393814087
1635067685607477248,gay4hotgurlmeg,2023-03-12 23:58:08+00:00,en,if Angela Bassett doesn’t win imma throw a bitch fit and it will be a horrible one also same goes for all the people I want to win like Michelle Yeoh.,negative,0.852685272693634
1635030562250584064,tony_ogilvie,2023-03-12 21:30:38+00:00,en,@jpaudouy Let’s hope a rumoured Star Trek spin-off series with Michelle Yeoh comes to fruition!,positive,0.8218995928764343
1635028277734825984,kelleysaid,2023-03-12 21:21:33+00:00,en,If Michelle Yeoh doesn’t win tonight I’m gonna be pissed #Oscars,negative,0.8535304069519043
1635036653227233281,KR1573N,2023-03-12 21:54:50+00:00,en,Will Michelle Yeoh get the Best Actress #Oscar (that she absolutely deserves) tonight?!,positive,0.8215680122375488
1635061834905681921,fatwathemusical,2023-03-12 23:34:54+00:00,en,I'm sorry...who is this old ass white man Michelle Yeoh is with!?,negative,0.9034729599952698
1635037475164000256,CovingtonQ,2023-03-12 21:58:06+00:00,en,"Michelle Yeoh don’t win, bet I make the room shake #Oscars",negative,0.6015123128890991
1635064818263789569,LanceUlanoff,2023-03-12 23:46:45+00:00,en,"Michelle Yeoh: ""I'm feeling very at peace right now."" #Oscars    Really feel like it's her night. https://t.co/qe2luKEhwM",positive,0.9756938815116882
1635062329246384129,VanityFair,2023-03-12 23:36:51+00:00,en,"They are everything. (Everywhere, all at once.) #MichelleYeoh and #StephanieHsu reunite on the #Oscars red carpet.   🎥: @Beccamford https://t.co/XcV6L32vcv",positive,0.9074863791465759
1635063359208034308,kristeiaa,2023-03-12 23:40:57+00:00,en,Sometimes I pray Michelle Yeoh don’t win an award.  She talks like for 3 hours after winning.  Just saying. #Oscar #AcademiaAwards https://t.co/mqX3lbLWTj,negative,0.8491175174713135
