tweet.id,tweet.user.username,tweet.date,tweet.lang,tweet.rawContent,label,score
1635034926105100288,hollylottie88,2023-03-12 21:47:58+00:00,en,"when Michelle Yeoh wins tonight, please spare a thought for me who accidentally marked Michelle Williams on her work pool Google Form ballot and couldn’t change it.",neutral,0.5968225002288818
1635064930998292481,italymystery,2023-03-12 23:47:12+00:00,en,#Oscars Michelle Yeoh That's It. That's the Tweet (too) https://t.co/aCSRMVE071,neutral,0.6871605515480042
1635046615630385152,ChristianGG02,2023-03-12 22:34:25+00:00,en,Also Michelle Yeoh would be amazing and she’s a must too but I can understand Cate for Tár.,positive,0.9342483878135681
1635057562340179972,InternetUser43,2023-03-12 23:17:55+00:00,en,Banshees   Colin Farrell   Michelle Yeoh,neutral,0.9089664816856384
1635064314225922048,cinnomarolls,2023-03-12 23:44:45+00:00,en,michelle yeoh looks so gorgeous,positive,0.9746811389923096
1759915572899332577,isispapyrus,2024-02-20 12:19:04+00:00,en,Participate and explore revolutionary new technologies.  AI &amp; NLP transforming BPM &amp; the Programming Industry  Unlocking Operational Excellence,positive,0.8910034894943237
1760623341730402702,honkaistarrail,2024-02-22 11:11:30+00:00,en,✨Over 100 million downloads across all platforms!✨ 🎁New players can get up to 80 free pulls!🎁 💥Play Honkai: Star Rail now!💥,positive,0.9504052996635437
1635038245791875072,kendlc0506,2023-03-12 22:01:09+00:00,en,I want Michelle Yeoh to win but Cate Blanchett is awesome in Tar 🔥 #Oscars #Oscars2023,positive,0.9492809772491455
1635053505848442881,natkwl,2023-03-12 23:01:48+00:00,en,@itgirlenergy NO not my michelle yeoh tell me you’re lying,negative,0.8745080232620239
1635067338524356609,DebRobertsABC,2023-03-12 23:56:46+00:00,en,Cate Blanchett is nominated for the 8th time for the movie Tar. Will she beat out Michelle Yeoh for best actress? Thoughts? https://t.co/NkxNsIOTNS,positive,0.5187209844589233
1635036843824812032,raul9382,2023-03-12 21:55:35+00:00,en,Predictions Part 1 Picture: Everything Everywhere All At Once Directing: The Daniels Actor: Austin Butler Actress: Michelle Yeoh Adapted Screenplay: Women Talking Supporting Actor: Ke Huy Quan Supporting Actress: Kerry Condon Animated feature film: Pinocchio,neutral,0.9355078339576721
1635063259429744642,biancalovesfilm,2023-03-12 23:40:33+00:00,en,michelle yeoh slaying so hard the interviewer is speechless as she shouldddddd,positive,0.9377260208129883
1635052886601404416,gses75,2023-03-12 22:59:20+00:00,en,#Oscars Best Actress   Will Win: Michelle Yeoh   My Vote: Cate Blanchett,positive,0.8165854811668396
1635043161755250690,PopBase,2023-03-12 22:20:42+00:00,en,Michelle Yeoh for the #Oscars. https://t.co/5CwYRSuFPM,positive,0.5361295342445374
1635059283044995072,PopBase,2023-03-12 23:24:45+00:00,en,Michelle Yeoh for the #Oscars.,neutral,0.5949738621711731
1635050487274967041,LuckyHeart8726,2023-03-12 22:49:48+00:00,en,"The only movie I'm interested in, in terms of Oscar, is Everything, Everywhere, All at once. Michelle Yeoh, and Jamie Lee Curtis better win.",positive,0.875516414642334
1635056854454906882,LossRup,2023-03-12 23:15:06+00:00,en,"Here's What's Inside the $126,000 Gift Bag Given to Michelle Yeoh, Steven Spielberg and Other Oscar Nominees https://t.co/ZYym26nyrz",neutral,0.7091688513755798
1635062142092320768,Jradical18,2023-03-12 23:36:07+00:00,en,I thing matters but Ke Huy Quan and Michelle Yeoh winning tonight #Oscars,positive,0.7655920386314392
1635063366875242497,alphabetcowgirl,2023-03-12 23:40:59+00:00,en,"if everything everywhere all at once doesn't win best picture,  if stephanie hsu doesn't win supporting actress,  if michelle yeoh doesn't win lead actress,  if ke huy quan doesn't win supporting actor im burning it all down to the ground.",negative,0.9021886587142944
1725357088980021297,OnyxBoox,2023-11-17 03:36:00+00:00,en,"Meet Note Air3 C, the 10.3"" color ePaper tablet that helps you think and create without bounds in work and life. Tap the link to learn more.",positive,0.7888293862342834
1635064856306159616,tetisheri,2023-03-12 23:46:54+00:00,en,Personally chuffed for Michelle yeoh even tho I’m not a fan of EEAAO,positive,0.780646562576294
1631217835329617920,zourkandy,2023-03-02 09:00:13+00:00,en,Ok so I NEED Lady Gaga to attend the Oscars this year because I hope Michelle Yeoh and her can recreate this moment again!  Okay bye! #oscar https://t.co/kNp2KqNCSs,positive,0.796431839466095
1757424495915401339,Insyncu,2024-02-13 15:20:25+00:00,en,Experience the thrill of timeless classics and create new memories!  Get it: https://t.co/LBroiYzBVF https://t.co/Walr7nEEUX,positive,0.9432758688926697
1635051195088932870,di0rgasm,2023-03-12 22:52:37+00:00,en,also now that I’ve seen tár I can say that michelle yeoh is the only real contender in my ceremony like cate was not touching her 🤷‍♀️,neutral,0.5636077523231506
1635022933814018048,samdrabuIok,2023-03-12 21:00:19+00:00,en,"Brendan Fraser, Michelle Yeoh, Angela Bassett, and Ke Huy Quan - that’s my final prediction #Oscars #AcademyAwards",neutral,0.810451328754425
1635031742011830274,thebilinguist,2023-03-12 21:35:19+00:00,en,"Honestly, it feels like if Michelle Yeoh and EEAAO don't win tonight it's because of racism.",negative,0.8233892917633057
1760622948795453600,honkaistarrail,2024-02-22 11:09:56+00:00,en,✨Over 100 million downloads across all platforms!✨ 🎁New players can get up to 80 free pulls!🎁 💥Play Honkai: Star Rail now!💥,positive,0.9504052996635437
1750742854148706478,Kipotekcom,2024-01-26 04:49:58+00:00,en,"📲Drive safe without blocking sight!No more looking down at navigation. 🎈 Easy to install, no tools are required. 🎈 Fits for any Phones 😍 🛒𝗚𝗲𝘁 𝘆𝗼𝘂𝗿𝘀👉 https://t.co/BwRyT3oXv0 https://t.co/IMbzXmvrjh",positive,0.9298364520072937
1635064372451246080,JennReads63,2023-03-12 23:44:59+00:00,en,Michelle Yeoh has an absolute glow about her and the fact that we have to wait 3 hours to see her get a trophy is mean. #Oscar,positive,0.6912206411361694
1635027067871047680,MyraToronto,2023-03-12 21:16:44+00:00,en,@eentertainment Michelle Yeoh in The Mummy trilogy and Ke Huey Quan in Encino Man (still remember that movie - teenage years - huge crush on Brendan at that time!).,positive,0.853044867515564
1635056220519419905,hattiepeverel,2023-03-12 23:12:35+00:00,en,Still just about time to make my predictions ... Film: Everything Everywhere; director: the Daniels; actor: Brendan Fraser; actress: Michelle Yeoh; supporting actor: Ke Huy Quan; supporting actress: Angela Bassett; documentary: Navalny; foreign: All Quiet. #Oscars,neutral,0.8538932204246521
1635054277520666624,red_jongin,2023-03-12 23:04:52+00:00,en,"yeay, he watched it. my fave actor from malaysia, michelle yeoh is the ml 🥰",positive,0.9894501566886902
1635042394054991872,evebwst,2023-03-12 22:17:39+00:00,en,michelle yeoh is out there at the oscars looking like an ANGEL,positive,0.9665655493736267
1635059574490435584,WillieHandler,2023-03-12 23:25:55+00:00,en,My #Oscars2023 predictions: Picture: Everything Everywhere Actor: Brendan Fraser Actress: Michelle Yeoh Sup Actor: Judd Hirsch Sup Actress: Jamie Lee Curtis Director: Stephen Spielberg  Number of slap jokes: 3,neutral,0.8325375318527222
1635059499978588161,series_golden,2023-03-12 23:25:37+00:00,en,Michelle Yeoh at the 95th Annual Academy Awards.  #Oscars #Oscars95 #Oscar #Oscars2023 #AcademyAwards #95thAcademyAwards #Cinema https://t.co/JvCXMAWIOa,neutral,0.5310074090957642
1635059478147235841,WhatsTrending,2023-03-12 23:25:32+00:00,en,Michelle Yeoh looks outstanding at the #Oscars   (📸: Getty Images) https://t.co/dBN9p0BtFp,positive,0.9744760990142822
1635061340254658561,buknerd,2023-03-12 23:32:56+00:00,en,"I don't pay for live tv anymore so I can't watch the Oscars live, but they'd sure as hell better give Michelle Yeoh her goddamned Oscar.",negative,0.6001899838447571
1635063532655099904,kyletwebster,2023-03-12 23:41:38+00:00,en,Painting #MichelleYeoh in #AdobeFresco while watching the #Oscars. https://t.co/9rLDguZASk,neutral,0.8148350715637207
1635064554039414785,yelenastardis,2023-03-12 23:45:42+00:00,en,vanessa interviewing michelle yeoh is so right #Oscars https://t.co/Z7hoFO11Hy,positive,0.8909107446670532
1635040294780678145,AWFJ,2023-03-12 22:09:18+00:00,en,"#Oscars95 have arrived! Who are you be cheering for most tonight? We're rooting for all of our #EDAAward winners, incl. Women Talking, Sarah Polley, Everything Everywhere All at Once, Michelle Yeoh, Banshees of Inisherin, Kerry Condon, All the Beauty and the Bloodshed and more! https://t.co/gm2VoQeH2O",positive,0.9814163446426392
1635067055849476097,JPStein,2023-03-12 23:55:38+00:00,en,When I watched a certain Bond movie as a little boy—25 years ago—I was absolutely gobsmacked to learn about a kind of femininity that I hadn't seen before; a powerful and capable one. It was embodied by Michelle Yeoh &amp; I have adored her ever since 🥹 Crossing my fingers! #Oscars,positive,0.9792616367340088
1635037358948241408,AnneinNI,2023-03-12 21:57:38+00:00,en,"It’s Oscar night…my predictions: AUSTIN BUTLER, I’d like BARRY KEOGHAN but I think it might go to KE HUY QUAN. MICHELLE YEOH, ANGELA BASSETT, PINOCCHIO, ALL QUIET ON THE WESTERN FRONT (Cinematography), Daniel Kwan &amp;Daniel Scheinert - Directors, Picture THE BANSHEES OF INISHERIN",neutral,0.5551702976226807
1761056092040134838,educationgadfly,2024-02-23 15:51:05+00:00,en,Curious about the impact of charter schools on traditional public schools? Don't miss our breakdown of a new study in Florida on the Education Gadfly Show podcast’s research minute.  https://t.co/Ll96HlD6OK,neutral,0.8788331151008606
1635050933909590016,yuen_daemyong,2023-03-12 22:51:35+00:00,en,#Oscars FINAL PREDICTIONS:  Best Picture: EEAO Best Actress: Michelle Yeoh Best Actor: Colin Farrell Best Sup. Actor: Barry Keoghan Best Sup. Actress: Angela Bassett Original Screen: EEAO Adapted Screen: AQOTWF Score: Babylon Song: Hold My Hand,positive,0.5657163262367249
1635060272670076930,robertwolpert,2023-03-12 23:28:41+00:00,en,This beautiful film broke my heart 23 years ago. It should have swept #Oscars but didn’t.  #MichelleYeoh wasn’t even nominated.  🙏 @TheAcademy https://t.co/MVnwyTUdc0,negative,0.8284435272216797
1635060862984794114,ReppinPodcast,2023-03-12 23:31:02+00:00,en,Let's Go YEOH!! #michelleyeoh #oscars @allatoncemovie #EverythingEverywhereAllAtOnce https://t.co/hPO3kVA53n,positive,0.944216251373291
1635022854952722433,CoolbetCanada,2023-03-12 21:00:00+00:00,en,#Oscars95 - Best Actress in a Leading Role  Michelle Yeoh -250 Cate Blanchett +165 Andrea Riseborough +3000  Michelle Williams +3600 Ana de Armas +5000  https://t.co/bO83dgw2y9  #Oscars https://t.co/yvizEkRkxh,neutral,0.613368570804596
1635044072384757760,M1LFILMS,2023-03-12 22:24:19+00:00,en,love the side of cate blanchett twt that’s rallying for michelle yeoh instead of hating on her like some others,positive,0.6798275113105774
1635066027108356100,SallyannMoffat,2023-03-12 23:51:33+00:00,en,Michelle Yeoh is sublime. A true superhero 🤍 https://t.co/ceBkGh2quw,positive,0.9780156016349792
1635045481276641280,jtindahouse,2023-03-12 22:29:55+00:00,en,If I had a vote in the 6 major categories:  Best Picture: The Banshees of Inisherin Best Actor: Brendan Fraser Best Actress: Michelle Yeoh Best Supporting Actor: Barry Keoghan Best Supporting Actress: Kerry Condon Best Director: Martin McDonagh  #Oscars,neutral,0.5220889449119568
1635041793845895168,SUNSTlRADE,2023-03-12 22:15:15+00:00,en,Oscar predictions  Best picture: Everything Everywhere All At Once  Best actress: Michelle Yeoh  Best actor: Brendan Fraser  Best supporting actress: Angela Bassett  Best supporting actor: Ke Huy Quan  Best director: the Daniels,positive,0.5843942165374756
1635053868890607616,confusedkri,2023-03-12 23:03:14+00:00,en,"Everything Everywhere All At Once, Elvis and All Quiet on the Western Front all deserve awards. Awesome films but Michelle Yeoh deserve an Oscar for best actress period. So does Naatu Naatu. Those are non negotiable.",positive,0.92584228515625
1635064631009083392,HRMKingDavid,2023-03-12 23:46:00+00:00,en,GIVE MICHELLE YEOH ALL THE OSCARS!!!,positive,0.6625407934188843
1635041651906445312,ch1nhnam,2023-03-12 22:14:42+00:00,en,2023 OSCAR Predictions:  Best Picture: EEAAO Original Screenplay: EEAAO (aftersun🫶) Best Actor: Brendan Fraser please god not  austin butler Best Actress: Michelle Yeoh (or cate blanchett but i think michelle) Supporting Actor: Ke Huy Quan Supporting Actress: Kerry Condon,neutral,0.7310629487037659
1635062288951681025,LexWils03228759,2023-03-12 23:36:42+00:00,en,I haven’t watched that #MichelleYeoh movie nominated for #TheOscars but I know she deserves to win. Give that woman her award.,positive,0.8296108841896057
1635046691811528705,jvamatos,2023-03-12 22:34:43+00:00,en,Predictions para os #Oscars  Best Picture - Everything Everywhere All at Once (The Fabelmans) Actor in a Leading Role - Brendan Fraser Actor in a Supporting Role - Barry Keoghan Actress in a Leading Role - Michelle Yeoh Actress in a Supporting Role - Stephanie Hsu,neutral,0.7824693322181702
1635029932186415104,StephenTissell,2023-03-12 21:28:07+00:00,en,"Best Actress Should &amp; Will Win - Michelle Yeoh, ""Everything Everywhere All at Once"" Should Have Been Nominated - Danielle Deadwyler, ""Till"" https://t.co/Xr9MoOS9jJ",positive,0.8051131963729858
1635066238765535233,WinstonOrozco_1,2023-03-12 23:52:24+00:00,en,Michelle Yeoh is the moment and the moment is her.   @TheAcademy for best leading female actor is hers and hers alone at the #Oscars   Divine goddess in this flawless dress✨ https://t.co/lYTVWgCfzl,positive,0.9748808741569519
1629580466171834368,Yubbie007,2023-02-25 20:33:53+00:00,en,“ and the #Oscars for the best performing act goes to” https://t.co/6N4b1iVx6j,neutral,0.5801470875740051
1635062604870877186,Bamalam,2023-03-12 23:37:57+00:00,en,WE STAN MICHELLE YEOH IN THIS HOUSE OR LEAVE,neutral,0.7047173380851746
1635058901170388992,Seanlofficial,2023-03-12 23:23:14+00:00,en,Michelle Yeoh is SO GORGEOUS 🤩 #Oscars https://t.co/0PGJJZvYS3,positive,0.9817875623703003
1635065304987619329,jaquaraanact,2023-03-12 23:48:41+00:00,en,Obsessed with Michelle Yeoh #Oscars,positive,0.9481728076934814
1635064265043509248,Mcrusty7,2023-03-12 23:44:33+00:00,en,@highsnobiety That is a good looking woman! Go #MichelleYeoh,positive,0.9786278605461121
1635066000512253953,L_Mike25,2023-03-12 23:51:27+00:00,en,I don’t care about the #oscars I just want #michelleyeoh to win.,positive,0.48575645685195923
1635059263474397184,TheRossHall,2023-03-12 23:24:41+00:00,en,Michelle Yeoh arrives at the #Oscar carpet https://t.co/cNTKQRuqSh,neutral,0.7883891463279724
1635057705521127425,TaylorReneWitch,2023-03-12 23:18:29+00:00,en,God I hope Michelle Yeoh wins best actress,positive,0.9206402897834778
1635041240482971648,TheRoarOf1984,2023-03-12 22:13:03+00:00,en,My Oscar picks:  Best Picture- Everything Everywhere All At Once Actress- Michelle Yeoh Actor- Colin Farrell Supporting Actress- Angela Bassett Supporting Actor- Ke Huy Quan Director- The Daniels,positive,0.5837077498435974
1635061306855399425,elunsage,2023-03-12 23:32:48+00:00,en,Michelle Yeoh and Ke Huy Quan must win tho,neutral,0.6929099559783936
1635060390370611201,vincentlao18,2023-03-12 23:29:09+00:00,en,Definition of ageless Asian beauty! Michelle Yeoh in white as a first time Oscar nominee! #Oscars https://t.co/Y1b2gTY9DL,positive,0.937613844871521
1635040002597085184,vmnoirr,2023-03-12 22:08:08+00:00,en,"Don't know what this is, but imma tune in for michelle yeoh, stephanie hsu and ke huy quan",neutral,0.7990991473197937
1635062405473640449,SirWarg_,2023-03-12 23:37:10+00:00,en,My Oscars 2023 predictions:  Best Pic: EEAaO Best Actor: Brendan Fraser Best Actress: Michelle Yeoh Best Director: Daniels Best Supp Actor: Ke Huy Quan Best Supp Actress: Angela Bassett Best Int'l Film: All Quiet Best Animated: Pinocchio Orig SP: Banshees Adap SP: Women Talking,positive,0.615192711353302
1635051032341512192,_tr1dent_,2023-03-12 22:51:58+00:00,en,And Michelle Yeoh and Stephanie Hsu,neutral,0.8920678496360779
1635053073528913923,CopelandDoug,2023-03-12 23:00:05+00:00,en,My picks for the Oscars tonight:  Best picture : The banshees of inisherin  Best actor : Collin Farrel   Best actress: Michelle Yeoh   Best international film : All quiet on the western front   Best original song : Naatu Naatu  Best animated feature: Pinocchio,positive,0.7862197160720825
1635042417413099521,FarOutCinema,2023-03-12 22:17:44+00:00,en,Michelle Yeoh is most certainly ready for the occasion 😍 #Oscars #Oscars2023 #oscars95 https://t.co/YaOAQ7EUiE,positive,0.9819850325584412
1635032429076578304,XOANTY,2023-03-12 21:38:03+00:00,en,It's all about Angela Bassett and Michelle Yeoh tonight. #OSCARS https://t.co/94uocQMrki,neutral,0.539287269115448
1635061117679697920,sweetczyIove,2023-03-12 23:32:03+00:00,en,michelle yeoh looks so good,positive,0.9671064615249634
1635059448489320448,Tweet_Dec,2023-03-12 23:25:25+00:00,en,So who is Mother tonight? Angela Bassett? Michelle Yeoh? Nicole? Halle Berry?! #Oscars95,neutral,0.9002606272697449
1635058406510968832,m1ss_dna,2023-03-12 23:21:16+00:00,en,Michelle Yeoh is so cute omg,positive,0.9687323570251465
1635052918113210368,congratulatixns,2023-03-12 22:59:28+00:00,en,ARE YOU READY TO LOSE MICHELLE YEOH?,neutral,0.5220171213150024
1635048606507094016,AnnieBeckComedy,2023-03-12 22:42:20+00:00,en,"It's my favorite day of the year!!! (I know the Academy is antiquated and problematic, but let me have this, please and thank you). 🧵 Some predictions/hopes for the winners: Best Picture - Everything, Everywhere All At Once Best Actress - Michelle Yeoh Best Actor - Colin Farrell",positive,0.9734466075897217
1635048798685925377,NOTJUSTOK,2023-03-12 22:43:06+00:00,en,Best Actress nominee Michelle Yeoh is #Oscars  ready. https://t.co/IaBAbgk4kz,positive,0.8314077258110046
1635068063535239171,SSanchezTV,2023-03-12 23:59:39+00:00,en,My #Oscars predictions:  Best Picture: Everything Everywhere All at Once  Leading Actor: Austin Butler Supporting Actor: Ke Huy Quan  Leading Actress: Michelle Yeoh Supporting Actress: Angela Bassett,neutral,0.6473348736763
1635063133940359168,MattZeitlin,2023-03-12 23:40:03+00:00,en,"they're literally cheering for michelle yeoh on the red carpet, it's over",positive,0.7207013368606567
1635033064236814336,hyunsqueendom,2023-03-12 21:40:34+00:00,en,tlou and michelle yeoh night omggg https://t.co/roRuKf6OtV,neutral,0.4940164089202881
1635042149971664896,sweetpjess,2023-03-12 22:16:40+00:00,en,@Beccamford The RRR actors! Ke Huy. Stephanie Hsu! Michelle Williams. Michelle Yeoh. Gaga!,positive,0.7225160598754883
1761906242388210071,AsherClan,2024-02-26 00:09:17+00:00,en,"Podcast @hotmilfcandy with Susan Holly the Milf, Trucifer, MrFlourish #podcast #PodcastAndChill #asherclantv #dating  PREMIER TONIGHT📺 https://t.co/40VCKBRb5i via @YouTube  @SuzannehollyQOS , @Truluvhefner &amp; host🎙️ @mrflourish69  Their 🔥 scene will be dropping couple days https://t.co/yPFo68R5fU",neutral,0.7103568315505981
1635059446597718018,wordsbyMeg,2023-03-12 23:25:24+00:00,en,"michelle yeoh, ethereal, cloud-inspired princess ❤️‍🔥 https://t.co/DjlgaieqQk",positive,0.9420248866081238
1635064785892184064,mar__,2023-03-12 23:46:37+00:00,en,"I still haven’t found a wedding dress, and now I want to find a dress that looks like Michelle Yeoh’s dress at the Oscars.",neutral,0.4628375768661499
1631308391707467776,allquietmovie,2023-03-02 15:00:03+00:00,en,“An immersive soundscape and astonishing cinematography.” BAFTA Best Film Winner All Quiet on the Western Front is nominated for 9 Academy Awards including Best Picture and Best International Feature. Watch now on Netflix. https://t.co/C5hHBDB8GU,positive,0.9277409911155701
1635062012337332225,hansoeii,2023-03-12 23:35:36+00:00,en,gonna go to sleep now and I better wake up to oscar winners michelle yeoh and ke huy quan https://t.co/6eDwPapZYF,positive,0.5660780668258667
1635064448187781122,kh3dive,2023-03-12 23:45:17+00:00,en,lady interviewing michelle yeoh did not watch the movie🤦‍♀️,negative,0.6787189245223999
1635064590311776257,kalicoconuts,2023-03-12 23:45:51+00:00,en,Michelle Yeoh is an angel. How lovely. #Oscars,positive,0.979965090751648
1635036965589639169,jordanthebaptst,2023-03-12 21:56:04+00:00,en,PREDICTIONS for the ones i care about lol picture: everything everywhere all at once actress: michelle yeoh supporting actor: ke huh quan supporting actress: angela bassett,positive,0.6039197444915771
1635062803693465600,THR,2023-03-12 23:38:45+00:00,en,Michelle Yeoh of #EverythingEverywhereAllAtOnce looks angelic in white at the 95th annual #Oscars https://t.co/QvY2Yh4hji https://t.co/Jt1lKfov0a,positive,0.9547061920166016
1635066363906752513,RepJudyChu,2023-03-12 23:52:53+00:00,en,"I absolutely loved the film, so I am crossing my fingers for Michelle Yeoh, Ke Huy Quan, and the entire cast and crew’s continued success.   They have done so much for the AAPI community and I celebrate their work. #Oscars95",positive,0.9893123507499695
1741444593617453320,getTheConqueror,2023-12-31 13:02:00+00:00,en,"Can you Lose Weight by Walking Transylvania, in Romania?  Transylvania Virtual Challenge takes you 231mi (372km) through historic castles, fortified churches, and medieval towns, all shrouded in mystery and legends.",neutral,0.5281030535697937
1635057148165255170,elfgmi,2023-03-12 23:16:16+00:00,en,"Deactivating all possible universes where Michelle Yeoh doesn't win Best Actress tonight, unless she's already won one before #AcademyAwards2023 #Oscars2023 https://t.co/SSx7Gc07gq",neutral,0.5746191143989563
1635060000308740096,aaexyyyxeaa17,2023-03-12 23:27:36+00:00,en,"That moment when you realized Michelle Yeoh acronym ""MY"" also stands for Malaysia acronym ""MY"" imagine if she wins tonight wow Malaysians gonna claim her for the upcoming decades for that oscar win 😱😆",positive,0.8849865794181824
1756815377449865228,VICE_GOLF,2024-02-11 23:00:00+00:00,en,Make a splash this season and inject some color into your game with the Vice Golf Pro Plus Neon Lime balls.,positive,0.841838538646698
1635060126171430915,pinkvelopes,2023-03-12 23:28:06+00:00,en,MICHELLE YEOH ARE YOU KIDDING ME https://t.co/EvwMUmJBDC,neutral,0.6826224327087402
1635064743647133701,echomike21,2023-03-12 23:46:27+00:00,en,Michelle Yeoh with the “we are the Everything bagel” comment 🥹🥹🥹 #Oscars,neutral,0.5335644483566284
1635058041048686592,KyleTims,2023-03-12 23:19:49+00:00,en,My #Oscars 2023 picks:  Best Picture - EEAAO  Best Director - Steven Spielberg Best Actor - Brendan Fraser Best Actor (F) - Michelle Yeoh  Best Supporting Actor - Ke Huy Quan  Best Supporting Actor (F) - Jamie Lee Curtis,positive,0.7148349285125732
1635060601184714753,ZackaryBeach7,2023-03-12 23:29:59+00:00,en,Michelle Yeoh looks like a winner in Dior #Oscars https://t.co/tKaQALKwTb,positive,0.9662163257598877
1635042766647619584,scyllasballon,2023-03-12 22:19:07+00:00,en,oscar predictions: eeaao angela bassett (crossing fingers for stephanie hsu) michelle yeoh 90% sure other 10% cate blanchett  ke huy quan the other ones idrc😘 https://t.co/S2KU8Vcsar,neutral,0.7037649750709534
1635061442880872449,kayla_mingie,2023-03-12 23:33:20+00:00,en,My all time favorite red carpet look and my vote for best dressed is...#MichelleYeoh omg I love this look so much from head to toe im completely obsessed!!! You GO GIRL!!! @eentertainment @enews #Oscars #LiveFromE https://t.co/utVMqtMk0R,positive,0.987982988357544
1633573426815442945,FilmUpdates,2023-03-08 21:00:29+00:00,en,#Oscars: Actress in a Leading Role   Should win:  Will win: https://t.co/kNFZgZI7AM,positive,0.844880223274231
1635062270949744641,popcentral_,2023-03-12 23:36:38+00:00,en,Michelle Yeoh stuns on the #Oscars Red Carpet. https://t.co/llAO6fA3L5,positive,0.9361482262611389
1635064711749455872,Penny_Laines,2023-03-12 23:46:19+00:00,en,Michelle Yeoh already has me in tears and it’s only the carpet interviews,negative,0.7088170647621155
1635045377568309248,Mesa_Brown,2023-03-12 22:29:30+00:00,en,"I'm rooting for Austin Butler, Michelle Yeoh, Ke Huy Quan and Angela Bassett tonight #Oscars",positive,0.9457230567932129
1635059926178607104,LBrookieF,2023-03-12 23:27:19+00:00,en,"As much of a Cate Blanchett fangirl as I am, I hope Michelle Yeoh wins tonight... #Oscars",positive,0.8516353368759155
1635063517400424448,tribunephl,2023-03-12 23:41:35+00:00,en,"LOOK: Malaysian actress Michelle Yeoh arrives at the Dolby Theatre in Hollywood, California to attend the 95th Annual Academy Awards on 12 March 2023. (Photo by ANGELA WEISS / AFP)  See the post here: https://t.co/ZV33thy6Lf https://t.co/Qwui4F88au",neutral,0.7655657529830933
1635067720327917568,LaLlama50,2023-03-12 23:58:17+00:00,en,@DiscussingFilm @Variety So we have to wait 3 hours to watch Michelle yeoh accept her award?!!!! https://t.co/HWDD3U3klo,neutral,0.6567181348800659
1635058983554945027,hugeasmammoth_,2023-03-12 23:23:34+00:00,en,MOTHER HAS ARRIVED! https://t.co/CDeCIS9Ymm,positive,0.7803813815116882
1635061699320623106,ohcatrina,2023-03-12 23:34:21+00:00,en,Call me when Michelle Yeoh wins her Oscar,neutral,0.5083559155464172
1635059197003051010,blissfulfiction,2023-03-12 23:24:25+00:00,en,Michelle Yeoh is STUNNING tonight 😍 #Oscars,positive,0.9795156121253967
1635040405795520512,Troy_Fiji,2023-03-12 22:09:44+00:00,en,"@siada_7 My predictions:  Best Actor Michelle Yeoh  Brendan Fraser  Supporting Actor Ke Huy Quan Jamie Lee Curtis  Best Picture Everything, Everywhere...... The Banshees of Inisherin (my pick)  Director Martin McDonagh - The Banshees",positive,0.4991593360900879
