tweet.id,tweet.user.username,tweet.date,tweet.lang,tweet.rawContent,label,score
1635041716377120768,onlychildart,2023-03-12 22:14:57+00:00,en,#Oscars2023 Best Picture Poster Series.  Number 10! - Everything Everywhere All at Once.  The last in the series!  A special shoutout to @sgposters @HousandArts @AminDesigns for their inspiration!  #everythingeverywhereallatonce #michelleyeoh #kehuyquan #jamieleecurtis #oscars https://t.co/Ls7Zad8moC,positive,0.9650376439094543
1635053048740577280,benwyman,2023-03-12 22:59:59+00:00,en,"Best Actor - Austin Butler, ELVIS Supporting Actor - Ke Huy Quan, EVERYTHING EVERYWHERE ALL AT ONCE Best Actress - Michelle Yeoh, EEAAO Supporting Actress - Angela Bassett, WAKANDA FOREVER  I think Cate Blanchett should win for TAR, but I also feel like it’s EEAAO’s night.",positive,0.8357859253883362
1760624160869585105,honkaistarrail,2024-02-22 11:14:45+00:00,en,✨Over 100 million downloads across all platforms!✨ 🎁New players can get up to 80 free pulls!🎁 💥Play Honkai: Star Rail now!💥,positive,0.9504052996635437
1635036289291665410,ModestoBanzon,2023-03-12 21:53:23+00:00,en,"Rooting for Paul Mescal, Key Hey Quan, Michelle Yeoh, and Lukas Dhont's Close for International Feature Film at the #Oscars 🤞🏼",positive,0.8128547072410583
1635023532123107328,pheebzbuffay,2023-03-12 21:02:41+00:00,en,"tonight will be michelle yeoh, ke huy quan, and brendan fraser’s night 🥹🫶 #oscars https://t.co/rulk1cOxos",positive,0.5941843390464783
1635059369053421568,GivLivLuvGro,2023-03-12 23:25:06+00:00,en,@ecd_the I watch every year. I never miss it. Totally understand about work commitments. I would like Michelle Yeoh and Kuy He Quan to win the most. Have a good night.,positive,0.8759400248527527
1635061206078877696,DJ_Dribbles,2023-03-12 23:32:24+00:00,en,Things that I would like to happen at the #Oscars   Best Picture: #EverythingEverywhereAllAtOnce   Best Actor: #BrendanFraser   Best Actress: #MichelleYeoh   Do this or I have no need to watch the #AcademyAwards again.,positive,0.6151367425918579
1635062090556907521,NickLaparra,2023-03-12 23:35:55+00:00,en,Picture: #EEAAO  Directing: Daniel K. + Daniel S. Actress: #MichelleYeoh  Actor: #BrendanFraser  Supporting Actress: #StephanieHsu  Supporting Actor: #KeHuyQuan  Original Screenplay: #EEAAO  #Oscars2023 #OscarPredictions https://t.co/Ofdw90HS7s,neutral,0.9346396923065186
1635059002601263106,j4wnistired,2023-03-12 23:23:38+00:00,en,if michelle yeoh doesn’t get this oscar… https://t.co/PVNBK959Q9,negative,0.5907495617866516
1635063813937700865,AnneManouks,2023-03-12 23:42:45+00:00,en,Predictions here we goooo!  Will win: Supporting Actor: Ke Huay Quan Supporting Actress: Angela Bassett Actor: Brendan Fraser Actress: Michelle Yeoh Director: Everything Everywhere All at Once Picture: Everything Everywhere All at Once  #Oscars,positive,0.73714679479599
1635064932088836098,rachaeldurant,2023-03-12 23:47:12+00:00,en,"I would love all companies to use “we are everything bagel” like how Michelle Yeoh described the EEAAO cast, instead of “we are a family,” from now on #Oscars",positive,0.4929763078689575
1635049464590376961,TheBlackStubs,2023-03-12 22:45:44+00:00,en,#Oscars predictions   Best Actor - Brendan Fraser  Best Actress - Michelle Yeoh Best Supporting Actor - Ke Huy Quan  Best Supporting Actress - Stephanie Hsu  Best Picture - Everything Everywhere All At Once  Best Director - The Daniels   Will the academy make history tonight?,positive,0.5036536455154419
1635059346110545922,PBSSoCal,2023-03-12 23:25:00+00:00,en,When your favorite exits the stage gracefully to thunderous applause. #MichelleYeoh https://t.co/vwRblTkCUH,positive,0.9571685791015625
1635064356567404544,aloner_rebel,2023-03-12 23:44:55+00:00,en,Michelle Yeoh best look of the night for sure,positive,0.9644012451171875
1635049993697652738,JohnKhanTheDon,2023-03-12 22:47:50+00:00,en,"I’m very excited for the Oscars tonight! Every acting category is packed with excellent nominees! I’m rooting for Michelle Yeoh, Colin Farrell, and most of all, Kerry Condon. And literally any of the Best Supporting Actor nominees would make a worthy winner! #Oscars #Oscars2023",positive,0.9914604425430298
1635060811554230272,aguirreryan,2023-03-12 23:30:50+00:00,en,"Michelle Yeoh, Ke Huy Quan, Stephanie Hsu and Hong Chau. The most nominations for Asian actors in Academy history 🏆 What a moment. #Oscars https://t.co/kMTzFa6HVs",positive,0.9742138981819153
1635048271264755714,Bombers83,2023-03-12 22:41:00+00:00,en,"No disrespect to Michelle Yeoh, but her probably winning Best Actress for Everything Everywhere All At Once shows lack of depth Hollywood has with movies   It was an ok movie, but #Oscars worthy? Please..",negative,0.6017353534698486
1630728472657281024,ZoeRoseBryant,2023-03-01 00:35:40+00:00,en,"They’ll probably use Evelyn’s final conversation with Joy for Michelle Yeoh’s Oscar clip, but I still think the scene where she stands up to her father for the first time is my favorite of hers. Such a crucial turning point for the character, expressed effortlessly. https://t.co/hA96qL3w0c",positive,0.8335875272750854
1635059008716554240,HeyItsBlinded,2023-03-12 23:23:40+00:00,en,#oscar predictions for the acting by categories:  actress - mother michelle yeoh supp. actress - kerry condon (although i so desperately want it to go to angela bassett) actor - austin butler supp. actor - ke huy quan,neutral,0.7406882047653198
1635037242061361158,timthecowboy,2023-03-12 21:57:10+00:00,en,"i swear if michelle yeoh doesn't win best actress tonight, i'll be suing",negative,0.8093051314353943
1635042376040452096,JohnAjuwon15,2023-03-12 22:17:34+00:00,en,The Oscars is going to be supper lit with Michelle Yeoh potentially winning an Oscars award🔥 #Oscars95,positive,0.9839979410171509
1635062882286342145,extratv,2023-03-12 23:39:03+00:00,en,#EverythingEverywhereAllAtOnce star Michelle Yeoh is radiant on the #Oscars red carpet! 🤍   See all the arrivals: https://t.co/tvDs0Kiy5r https://t.co/DGpyBIVJHj,positive,0.9822567105293274
1635039459950624768,tobycochran,2023-03-12 22:05:59+00:00,en,Here. We. Go!!! Good luck tonight. #MichelleYeoh #Daniels #BestPicture #AcademyAwards https://t.co/oiK3Lh6K8C,positive,0.9789198637008667
1742524648762507589,DeiFunded,2024-01-03 12:33:45+00:00,en,"🚀 Elevate your trading with DEIfunded's BOGO offer!   Buy one, get one FREE on all accounts, plus enjoy an extra 30% off.   Double the opportunity, more savings.   Limited time only - seize your moment!",positive,0.9526184797286987
1635058477537333251,davecrossx,2023-03-12 23:21:33+00:00,en,"I’m firmly team #EverythingEverywhereAllAtOnce for #Oscar2023, #MichelleYeoh #KeHuyQuan @jamieleecurtis 💖 https://t.co/JYgsLoOrYK",positive,0.9278720021247864
1635041183213961218,kadams_18,2023-03-12 22:12:50+00:00,en,Only watching the Oscar’s for Angela Bassett and Michelle yeoh ✋🏽 my limit is 2 references to the slap before I turn it off,neutral,0.5520803928375244
1635064742850232321,bachtalking,2023-03-12 23:46:27+00:00,en,“We are the everything bagel.” - Michelle Yeoh 🥹,positive,0.8021366596221924
1752956891896885567,Loteviacom,2024-02-01 07:27:46+00:00,en,"Remove all dirt and dust, clean like a professional, and leave no dead ends!!!  The maximum suction power is 12000Pa, wireless, convenient and quick to use, and removes dust and dirt in the crevices 🛒Get it 👉 https://t.co/A9T7rh8xhn https://t.co/zEZtJpUgYD",positive,0.8179569244384766
1635033524825882624,itshdani,2023-03-12 21:42:24+00:00,en,"so are you telling me that angela bassett, cate blanchett and michelle yeoh are nominated, rihanna and gaga are performing and elizabeth olsen is presenting tonight? oh trust i will be seated #Oscars https://t.co/eKL7IWN28i",positive,0.8102363348007202
1635057164690796545,kayla_mingie,2023-03-12 23:16:20+00:00,en,@enews @erinlimofficial @LoniLove I'm excited to see #MichelleYeoh take the win and I'm also excited to see @ladygaga take the stage and sing!!! Oh and I would love to see #BrendanFraser take the win as well!!! Just all of it give me all of it 😂 #Oscars,positive,0.9869757294654846
1635067746051559424,mrbrianrowe,2023-03-12 23:58:23+00:00,en,"Michelle Yeoh, I adore you! Here we go!! #Oscars https://t.co/efYoR0ScRy",positive,0.9860849380493164
1635060129061273602,941zeke,2023-03-12 23:28:07+00:00,en,Don't Michelle Yeoh got an Oscar already?,neutral,0.8106848001480103
1635065974440488961,gutskiof,2023-03-12 23:51:21+00:00,en,"ladies and gentlemen, michelle yeoh https://t.co/889ocECkO7",neutral,0.795662522315979
1635065655505321986,Latest_news4_U,2023-03-12 23:50:04+00:00,en,Michelle Yeoh Through the Years: Her Life in Photos https://t.co/CBucaESXDn,neutral,0.895438551902771
1635033345712357376,GeekGuyJaycee,2023-03-12 21:41:41+00:00,en,Best Actress: Michelle Yeoh 2nd Choice: Cate Blanchett Dark Horse: Ana de Armas,positive,0.6047607660293579
1635031699661942784,POCculture,2023-03-12 21:35:09+00:00,en,"“All of them are so kind &amp; wonderful &amp; generous. Despite their immense success, their immense fame &amp; despite everything that they’ve been through…that’s the standard.”  - #AmericanBornChinese star Ben Wang on working w/ Michelle Yeoh, Ke Huy Quan, Destin Daniel Cretton &amp; more https://t.co/rjMKtqW3nC",positive,0.9367848038673401
1635046618537000960,EightArmsEdits,2023-03-12 22:34:26+00:00,en,"Me in a usual Oscars year: Ugh, my feed is full of red carpet BS again.   Me this year: Hook me up to a direct feed of absolutely everything Michelle Yeoh does, says, and looks at for the whole evening or I will go MAD.",negative,0.7799370884895325
1635061167482871808,GSCinemas,2023-03-12 23:32:14+00:00,en,"This is your night, Tan Sri. ✨🫶🏼 Michelle Yeoh in a Dior white gown on the #Oscars95 red carpet! 🥰 https://t.co/Y3bxitUt8F",positive,0.9753103256225586
1635060187894808579,CharltteWolters,2023-03-12 23:28:21+00:00,en,Hoping #MichelleYeoh wins #Oscar because that film wouldn't have worked without her amazing acting skills.,positive,0.9717046618461609
1635057756448374784,librasapphic,2023-03-12 23:18:41+00:00,en,this might sound crazy but ever since i saw michelle yeoh sitting just behind olivia colman when she won her oscar i just KNOW she's taking her oscar home tonight. the universe has given us the necessary leads.,positive,0.9089921712875366
1635062585631588352,ulookedsopretty,2023-03-12 23:37:53+00:00,en,MICHELLE YEOH LOML SHES SO MOTHER https://t.co/Iscxcb02pt,positive,0.9473823308944702
1635059803138695170,mirrorpalaisbby,2023-03-12 23:26:49+00:00,en,Michelle Yeoh in Dior Couture for the #Oscars 🤍🤍🤍 https://t.co/MiqJXTxdlA,positive,0.9783420562744141
1635062676266287104,RlRUKA,2023-03-12 23:38:14+00:00,en,excited to see michelle yeoh win tonight 😚 everyone should watch the heroic trio if (when) she does https://t.co/rpcWN8qkml,positive,0.9898504018783569
1635055376235376641,wildiife_,2023-03-12 23:09:14+00:00,en,Best Actress: Cate Blanchett (Tár)  Frankie Corio (Aftersun)  Viola Davis (The Woman King) (RUNNER-UP)  Rooney Mara (Women Talking)  Taylor Russell (Bones &amp; All)  Michelle Yeoh (Everything Everywhere All At Once)  (WINNER),positive,0.6144024133682251
1742181197155873125,getTheConqueror,2024-01-02 13:49:00+00:00,en,Challenge yourself to earn the stunning THE LORD OF THE RINGS medals,positive,0.7903403043746948
1635057509340958721,_stroling_,2023-03-12 23:17:42+00:00,en,LEAD ACTRESS AT THE END I HAVE TO WAIT ALL NIGHT TO KNOW IF MICHELLE YEOH WINS ARE YOUBDEASASSSNNZKSJZ I WILL CUT DOWN A TREE,neutral,0.46515411138534546
1635062990943973379,dbc___,2023-03-12 23:39:29+00:00,en,I am thinking that Brandon Fraser and Michelle Yeoh win Best Actor and Actress in tonight's Oscars.   #Oscars,positive,0.8085975646972656
1635064972257656833,baleful_buzzard,2023-03-12 23:47:22+00:00,en,man rich people are insufferable. i love michelle yeoh shes adorable but why do they interact w each other like that,negative,0.8647611737251282
1635044050687623169,dolmennn,2023-03-12 22:24:13+00:00,en,3. Mejor Actriz Michelle Yeoh en Everything Everywhere All At Once  (como gane Michelle Williams no se que hago) https://t.co/PkV98ZzEbc,neutral,0.8168958425521851
1635058042873208833,BlackLanterrn,2023-03-12 23:19:49+00:00,en,Predictions:  Picture: EEAAO Director: Spielberg Actor: Austin Butler Actress: Michelle Yeoh Sup Actor: Key Huy Quan Sup Actress: JLC,neutral,0.9471824765205383
1635059681365458944,cinematictopia,2023-03-12 23:26:20+00:00,en,@phantomghafa michelle yeoh award szn SWEEP,neutral,0.8078662157058716
1635027916886249474,briandetonate,2023-03-12 21:20:07+00:00,en,@PopBase WHERE'S MICHELLE YEOH,neutral,0.8334303498268127
1635064470656663552,tbsllittlesue,2023-03-12 23:45:22+00:00,en,MICHELLE YEOH LOOKS INCREDIBLE OHHHHH,positive,0.9722611308097839
1635059296542285825,alyciasgoid,2023-03-12 23:24:48+00:00,en,michelle yeoh is taking an oscar home tonight https://t.co/q1uiCXdzQe,neutral,0.5977484583854675
1635045975093022720,GirlsOnFilm_Pod,2023-03-12 22:31:52+00:00,en,"Good luck to this year’s #Oscars Best Actress in a Leading Role nominees: Andrea Riseborough, Ana de Armas, Cate Blanchett, Michelle Williams and Michelle Yeoh! Brilliant performances all round 👏",positive,0.9843060970306396
1635057220324057088,molnr_levente,2023-03-12 23:16:33+00:00,en,#MichelleYeoh no Oscar #CateBlanchett have two  MichelleYeoh : i have to win..  Because Blanchett have two..  Common..,neutral,0.7274226546287537
1635064599715418112,phamtruax,2023-03-12 23:45:53+00:00,en,"#Oscars Brendan Fraser, Michelle Yeoh and Jonathan Huy Quan for wins tonight please",positive,0.7014424800872803
1635064481582817282,clapifyoucare_,2023-03-12 23:45:25+00:00,en,michelle yeoh I LOVE YOU !!!!!!!!!!,positive,0.985251784324646
1635052266293194753,Sabrinak3n,2023-03-12 22:56:52+00:00,en,"I watched 37 out of the 54 movies nominated tonight. Here’s who I WANT to win, but I know a lot won’t go my way.   Best Picture: Triangle of Sadness   Actor in a Leading Role: Austin Butler, Elvis   Actress in a Leading Role: Michelle Yeoh, Everything Everywhere All at Once",neutral,0.431903600692749
1634978813670031365,TIFF_NET,2023-03-12 18:05:00+00:00,en,Share the #Oscar win that you're manifesting for tonight. 🏆,positive,0.8661774396896362
1635042683680075776,andromedemiboy,2023-03-12 22:18:48+00:00,en,"Final predictions:  Picture: EEAAO Director: Daniels, EEAAO Actor: Austin Butler, Elvis Actress: Michelle Yeoh, EEAAO Supporting Actor: Ke Huy Quan, EEAAO Supporting Actress: Jamie Lee Curtis, EEAAO Original Screenplay: EEAAO Adapted Screenplay: Women Talking  1/3",neutral,0.9509680271148682
1635061509616443394,Ann_Caruso,2023-03-12 23:33:36+00:00,en,#MichelleYeoh has arrived in a wedding dress #oscars however white is trending on this white carpet #Oscars https://t.co/0gEDjONdGR,neutral,0.5766428709030151
1635056728713859073,Cleveland_Film,2023-03-12 23:14:36+00:00,en,"Another Tough Category seems to be Best Actress: Michelle Yeoh, first time nominee in a storied career vs. Cate Blanchett a two time winner. I keep going back and forth in my head but I think this will go to Yeoh! She would be the first Asian winner for Best Actress!",positive,0.7909526228904724
1635064823712215040,Every6thDay,2023-03-12 23:46:46+00:00,en,"The people making Star Trek: Discovery get shit, but if not for them being so horny to have their Red Wedding moment in the series premiere by killing off the incredible Michelle Yeoh, she wouldn't have been available to do Everything Everywhere All At Once. So, thank you to them",negative,0.49091583490371704
1635047110734385153,MartinReese,2023-03-12 22:36:23+00:00,en,‘Everything’ Stars Michelle Yeoh and Ke Huy Quan Travel to a New Multiverse in ‘American Born Chinese’ Teaser (Video) https://t.co/lohNwxNF1G,neutral,0.8714252710342407
1635064985834622977,wereallie,2023-03-12 23:47:25+00:00,en,"Not me tearing up over Michelle Yeoh talking about why she took the EEATO part. I’ve loved her for sooooo long.  Yes, I’m bored enough that Im watching the Oscars.",positive,0.7244357466697693
1635064345876135936,Learning_Movies,2023-03-12 23:44:52+00:00,en,"Here are my picks for who will win at the #Oscars tonight, let me know what you think and who you want to see win! #AcademyAwards #EverythingEverywhereAllAtOnce #BrendanFraser #MichelleYeoh #KeHuyQuan #AngelaBassett #RRRForOscar #Pinocchio #FilmTwitter https://t.co/J3hp0FfwHw",positive,0.61746746301651
1635060051164397570,thepophive,2023-03-12 23:27:48+00:00,en,Michelle Yeoh for the #Oscars. https://t.co/JbyFKnDPVe,positive,0.5191259384155273
1635065184879529984,watdahay,2023-03-12 23:48:12+00:00,en,MICHELLE YEOH SAID THE EVERYTHING EVERYWHERE ALL AT ONCE CAST AND CREW ARE THE EVERYTHING BAGEL THATS SO CUTE,positive,0.8958357572555542
1635058765371424773,RandyShulman,2023-03-12 23:22:42+00:00,en,Best Actor: Austin Butler - 48% Best Supporting Actor: Ke Huy Quan - 81% Best Actress: Michelle Yeoh - 73% Best Supporting Actress: Angela Bassett - 43%  #Oscars #Oscars2023 https://t.co/mVroc8Kf7o,positive,0.6169335246086121
1635065606574862336,helaynelson,2023-03-12 23:49:53+00:00,en,"@VictorlawalO Halle is the only woman of colour to win best actress, inviting her to present best actress to Michelle Yeoh could be a historic moment. However if Cate Blanchett wins the entire thing will be in such poor taste",positive,0.6731265187263489
1635050282043445248,edwin_teos,2023-03-12 22:48:59+00:00,en,Mejor Actor: • Brendan Fraser (The Whale)   Mejor Actriz: • Michelle Yeoh (Everything Everywhere All at Once)    Actor Secundario:  • Ke Huy Quan (Everything Everywhere All at Once)    Actriz Secundaria • Stephanie Hsu (Everything Everywhere All at Once),neutral,0.938363254070282
1635041588127862786,Nalanaku,2023-03-12 22:14:26+00:00,en,@MarkHamill I just want to see eeaao win. I am rooting for Michelle yeoh!,positive,0.9542449712753296
1635036402802110465,mghtythors,2023-03-12 21:53:50+00:00,en,#oscar #oscars #oscars2023 everything everywhere all at once stephanie hsu michelle yeoh ke huy quan the daniels (jamie lee curtis ig) harry shum jr eeaao jobu tupaki evelyn wang waymond wang joy wang edit fancam fc https://t.co/h0A8L2r7LM,neutral,0.8576484322547913
1635058105452212224,daisyfvllers,2023-03-12 23:20:04+00:00,en,MICHELLE YEOH FINALLY,positive,0.9423490166664124
1635034755879284736,A24Posters,2023-03-12 21:47:17+00:00,en,EVERYTHING EVERYWHERE ALL AT ONCE (2022) 👀  Dir. Daniels With. Michelle Yeoh  Poster by @Liza_Shumska https://t.co/ehNOleCeFT,neutral,0.8410860896110535
1635028436535353344,Small_Hawkeye,2023-03-12 21:22:11+00:00,en,"Michelle Yeoh, Everything Everywhere All at Once",neutral,0.847454309463501
1635064913516466176,user_GINA,2023-03-12 23:47:08+00:00,en,"A warning to moots, although I'm not actually going to watch the Oscars, depending on what I see on the tl, I may suddenly be very happy or super livid. Either way, expect some all caps posts.  I've loved Michelle Yeoh for decades. Give her the Oscar. https://t.co/HsTqEZwrQw",negative,0.346466064453125
1635060682134806529,thebilinguist,2023-03-12 23:30:19+00:00,en,If Halle Berry presents Best Actress that means Michelle Yeoh is winning because that's 100% a MOMENT the Academy wants lmao,positive,0.8661690950393677
1635060337279135744,WeGeekGirls,2023-03-12 23:28:57+00:00,en,Michelle Yeoh looks stunning!! 🤍  [📷 via Getty Images]  #EEAAO #Oscars2023 #Oscars #Oscars95 https://t.co/CA7fmSSOKq,positive,0.9820480346679688
1635064487496794112,DailyO_,2023-03-12 23:45:26+00:00,en,"Hollywood's biggest night...the #Oscars have begun. Will #MichelleYeoh, #EverythingEverywhereAllatOnce, #RRR, #AustinButler and others pick up the golden trophy?  https://t.co/zeVzmLFSzY",positive,0.8716807961463928
1635052169606070274,ComplexPop,2023-03-12 22:56:29+00:00,en,Jamie Lee Curtis is Michelle Yeoh’s biggest supporter. 🥹💐 #Oscars https://t.co/Ypm0XCs289,positive,0.9379299283027649
1635061544173314048,AndyVermaut,2023-03-12 23:33:44+00:00,en,Andy Vermaut shares:Michelle Yeoh Wows In White Dior Dress At 2023 Academy Awards: Photos: Michelle Yeoh is nominated for an award in the Best Actress category for her incredible work in… https://t.co/Be0RCvLU46 Thank you. #AndyVermautLovesHollywood #ThankYouForTheEntertainment https://t.co/InChveoW3e,positive,0.9616510272026062
1635067895184228352,wilmontouch,2023-03-12 23:58:58+00:00,en,actress: michelle yeoh &gt; cate blanchett &gt; michelle williams &gt; andrea riseborough &gt; ana de armas  supporting actor: ke huy quan &gt; brendan gleeson &gt; barry keoghan &gt; brian tyree henry &gt; judd hirsch,neutral,0.8971328735351562
1634910203773681666,syylllia,2023-03-12 13:32:22+00:00,en,"3. #OSCAR DE LA MEILLEURE ACTRICE  :  • Cate Blanchett, Tár • Ana de Armas, Blonde • Andrea Riseborough, To Leslie • Michelle Williams, The Fabelmans • Michelle Yeoh, Everything Everywhere All at Once https://t.co/CKd8pM0Xqt",neutral,0.9093843698501587
1635059610368479235,lucidfaders,2023-03-12 23:26:03+00:00,en,Michelle Yeoh at the #Oscars https://t.co/UaXxbbZBJr,neutral,0.6280118227005005
1635055918948962305,MatthewS1mmons,2023-03-12 23:11:23+00:00,en,Lead Actor – Brendan Frazer Lead Actress – Would like Ana de Armas but think it’ll be Michelle Yeoh Supporting Actor – Ke Huy Quan Supporting Actress – Would like Hong Chau but think it’ll be Angela Bassett Makeup - Pulling for The Whale Costume - Pulling for Babylon,neutral,0.8841667175292969
1635054898281865216,pikeblanchett,2023-03-12 23:07:20+00:00,en,just saw michelle yeoh wow,positive,0.6215662360191345
1635033556576784384,lightxzhan,2023-03-12 21:42:31+00:00,en,"I better be waking up with the new that Michelle Yeoh, Brendan Fraser, Angela Bassett and Ke Huy Quan are #Oscars winners or else, we will have a problem",neutral,0.594632089138031
1635065523594723329,_dawsoncary_,2023-03-12 23:49:33+00:00,en,"Absolute queen, mother, the one, goddess, mommy, winner of all Oscars, perfect, gorgeous, amazing, mother, queen… ✨Michelle Yeoh✨",positive,0.9805384278297424
1635040212052234240,_TonyWolfe_,2023-03-12 22:08:58+00:00,en,personal preference  Best Picture: Fabelmans Best Director: Daniels Actress: Michelle Yeoh Actor: Austin Butler Supporting Actress: Stephanie Hsu Supporting Actor: Ke Huy Quan,neutral,0.574543833732605
1635032721570557952,Geekstache,2023-03-12 21:39:12+00:00,en,"As far as my personal hopes for The Oscars… I believe EEAAO deserves all the awards coming for it. My one point of contention is that as much as I loved Michelle Yeoh, I really think Cate Blanchett deserves Best Actress.",positive,0.9428069591522217
1635063875518476288,FDRAKEJR1,2023-03-12 23:43:00+00:00,en,Everything Everywhere All At Once #EEAAO #MichelleYeoh #JamieLeeCurtis #StephanieHsu #Oscars #AcademyAwards2023 https://t.co/yanwcporDZ,neutral,0.8444728255271912
1635049011081252868,xdharmawigunax,2023-03-12 22:43:56+00:00,en,let me guess the oscar winner  best movie - Everything Everywhere All at Once best actor - Brendan Fraser best actress - Michelle Yeoh,positive,0.849478542804718
1635064407905669120,emilyincleve,2023-03-12 23:45:07+00:00,en,"When I’m 60, I want to look like Michelle Yeoh and when I grow up, I want to be Helen Mirren.",neutral,0.512200117111206
1635066789209178113,inesdipastena,2023-03-12 23:54:35+00:00,en,THE QUEENS ARRIVED  #Oscars #Oscar2023 #Cateblanchett #MichelleYeoh https://t.co/eXIs8dK9HO,positive,0.8608874678611755
1635064662361518080,PriyankarDe_GC,2023-03-12 23:46:08+00:00,en,Not me scrolling every 5 mins to check out the Oscar looks!  Also really rooting for my queen Michelle Yeoh. 🤞❤️ https://t.co/g4uHc8o6H3,positive,0.9749823808670044
1635064804129013760,platypusfound,2023-03-12 23:46:41+00:00,en,"Let's go, Michelle Yeoh!",positive,0.9297156929969788
1635058142303363073,MAUDGONER,2023-03-12 23:20:13+00:00,en,MICHELLE YEOH IS IN THE BUILDING .,neutral,0.8380628228187561
1635057982722686983,jiminlamar,2023-03-12 23:19:35+00:00,en,MICHELLE YEOH U WILL GETS YOUR FLOWERS TODAY #Oscars,positive,0.9466598033905029
1635059524926332928,canyou_sonicme,2023-03-12 23:25:43+00:00,en,Michelle Yeoh is wearing white. #Oscars https://t.co/XHDMpMp8W6,neutral,0.7974599003791809
1635046802570485760,BlackSheepJess,2023-03-12 22:35:10+00:00,en,@LouiseApplewhai And a MOST special good luck vibe from me to Ke Huy Quan (Best Supporting Actor) and Michelle Yeoh (Best Actress)!  #EverythingEverywhereAllAtOnce #KeHuyQuan #MichelleYeoh https://t.co/egTKvSWsJM,positive,0.9808464646339417
1635055570272284677,Miriam_Kennedy,2023-03-12 23:10:00+00:00,en,Obviously I'm all for the Irish this evening but if Jamie Lee Curtis and Michelle Yeoh don't win tiny little gold men too I'll be fairly devastated. #Oscars    #AcademyAwards    ☘️🤞☘️,negative,0.5949051976203918
1643364583216644096,theTVshield,2023-04-04 21:27:03+00:00,en,Wish you could watch TV outside? We've got you covered with the shatterproof and weatherproof The TV Shield. 😎  #thetvshield #outdoortv #outdoorliving,positive,0.8750385642051697
1635059999943835648,tomandlorenzo,2023-03-12 23:27:36+00:00,en,GIVE HER EVERYTHING!!!!  EVERYTHING EVERYWHERE ALL AT ONCE Goddess Diva Extraordinaire Michelle Yeoh 楊紫瓊 in Dior couture at the #Oscars #Oscars95. More red carpet later on our site. https://t.co/8YmCxY5XqT,positive,0.9410731792449951
1635048002170785793,realstuartwhyte,2023-03-12 22:39:56+00:00,en,"In #Oscars95 mode for next little while. #MichelleYeoh &amp; JLCurtis to win, please. Will some pundit/presenter please describe the contents of this year's goodie bags asap? Yes, yes, dresses, new colour carpet, but what high end crap from brands desperate for validation is there?",neutral,0.5457010269165039
