tweet.id,tweet.user.username,tweet.date,tweet.lang,tweet.rawContent,label,score
1099899496408875014,MissMalini,2019-02-25 05:10:49+00:00,en,"If you missed Hollywood's biggest event of the year, don't worry. We've got you covered with all the big winners of the night! - @KarishmaGovil, Lifestyle Blogger #Oscars2019 #Oscars #RamiMalek #OscarWinners https://t.co/tP7R6DYsXN",positive,0.9511862993240356
1762194318784401657,OffThePress1,2024-02-26 19:14:00+00:00,en,Major Companies Caught Using AI To Monitor Employees’ Online Conversations,neutral,0.7717161178588867
1099926606368272384,Sussex_Jones,2019-02-25 06:58:33+00:00,en,"[VANITY FAIR] Rami Malek Falls off Oscar Stage, Paramedics Step In https://t.co/Ig0dNS0JCQ | @VFHIVE https://t.co/Obp8ucxq21",neutral,0.75127774477005
1099921807765848065,GamblinOnEeeeee,2019-02-25 06:39:29+00:00,en,I’m not over Rami Malek and green book winning...,neutral,0.5546104907989502
1099898798401179648,newsportdotcom,2019-02-25 05:08:03+00:00,en,Rami Malek wins best actor Oscar for ‘Bohemian Rhapsody’ https://t.co/91YenMC98B,positive,0.8284032940864563
1099931878637871104,thegameison24,2019-02-25 07:19:30+00:00,sv,Grattis bror 😍🇪🇬 #RamiMalek,positive,0.9389052987098694
1099904484023644160,edition_english,2019-02-25 05:30:38+00:00,en,Rami Malek wins best actor Oscar for &amp;#39;Bohemian Rhapsody&amp;#39; https://t.co/Sny9BaeCN9,positive,0.8347040414810181
1099911023086178305,alishafieeq,2019-02-25 05:56:37+00:00,en,"Congratulations to #MahershalaAli on his Oscar win for #GreenBook Well deserved, and congrats to All other winners. #AlfonsoCuaron #RamiMalek #OliviaColman #BlackPanther. Congrats to Green Book &amp; BlacKkKlansman two best movies about racial Descrimination.👍♥️ #oscars2019 #Oscars https://t.co/nHusP3q3Hs",positive,0.9799266457557678
1099921014891446273,marcmartel,2019-02-25 06:36:20+00:00,en,"Oscar night with some of my closest friends!  Congrats to Graham King, Denis O’Sullivan, Rami Malek, John Warhurst, Twentieth Century Fox, G.K. Films, and especially Queen on 4 Oscar wins tonight!  #BohemianRaphsody https://t.co/EbAhtoQ3o3",positive,0.9852979779243469
1099910278844637184,UnderwoodPodcst,2019-02-25 05:53:40+00:00,en,"History has been made @ #TheOscars!!! @sherylunderwood &amp; the crew will talk about it this week on #SUR. CONGRATS #MahershalaAli, #ReginaKing, #SpikeLee, #RamiMalek, #LadyGaga, #BlackPanther, #Roma, #TheGreenBook &amp; many more. Call 1-855-Sheryl-1. Did you miss having a host? https://t.co/GZI361wSQp",positive,0.9644736647605896
1099900497585156096,undhawke,2019-02-25 05:14:48+00:00,en,"According to today’s twitter feed, people thought Rami Malek was supposed to literally sing and cover Queen songs. Boy would they be pissed if they knew Glee and High School Musical do not actually sing their parts. Just an absolute Hollywood tragedy",negative,0.829528272151947
1099911469871841281,Dolcikka,2019-02-25 05:58:24+00:00,en,Rami Malek and Lucy Boynton's Romance Is the Real Winner This Awards Season 😍| E! News https://t.co/EL1FdVU6q8,positive,0.9541894793510437
1099904946865143808,IanWhyte815,2019-02-25 05:32:29+00:00,en,My quick thoughts on the #Oscars is that Green Book was absolutely deserving of Best Picture. Rami Malek was a perfect choice for the role but I really don’t think he was nearly as a good as Viggo Mortensen. Viggo made that movie.,positive,0.47099408507347107
1099940419838902273,losinggteeth,2019-02-25 07:53:26+00:00,en,in this house we love and support rami malek,positive,0.9258368015289307
1099930707361783808,WorldMusics1,2019-02-25 07:14:51+00:00,en,"91st Academy Awards:  Best Picture: Green Book Actor Leading Role: Rami Malek Actress Leading Role: Olivia Colman Best Director: Roma, Alfonso Cuaron Actress Supporting Role: Regina King Actor Supporting Role: Mahershala Ali  https://t.co/qxXJTqPWlA #Oscars #Oscars2019 #Winners https://t.co/1FMneYpNpg",neutral,0.5934467315673828
1099897082272514048,faishal_saifi,2019-02-25 05:01:14+00:00,en,#Oscars Tonight’s big #Oscars winners: 📽 Green Book wins Best Picture ⭐️ Rami Malek wins Best Actor 🌟 Olivia Colman wins Best Actress 🎬 Alfonso Cuarón wins Best Director,positive,0.9453155994415283
1099936649885171713,PreiPhil,2019-02-25 07:38:27+00:00,en,Rami Malek deserved that Oscar  for sure,positive,0.9074792861938477
1099916782507311104,properstrangers,2019-02-25 06:19:31+00:00,en,"well it’s not that bad, i was rooting for olivia and mahershala and i’m so happy for regina king and i’m kinda happy for rami malek too i don’t mind",positive,0.966995894908905
1099916053377961984,TrillyOnline,2019-02-25 06:16:37+00:00,en,Rami Malek falls off stage after winning first Oscar - https://t.co/u8wQDcaVWb,neutral,0.6619181632995605
1099919802477338626,KrissyThaBlack,2019-02-25 06:31:31+00:00,en,*Rami Malek wins an Oscar after starring in his first major film*  Leo’s reaction after having waited 20+ years full of incredible films: https://t.co/7SxGqSAAxX,positive,0.941806435585022
1099909525598031873,UrBestLife2day,2019-02-25 05:50:40+00:00,en,Rami Malek wins best actor Oscar for 'Bohemian Rhapsody' https://t.co/papknTTxZx,positive,0.8782389163970947
1099901471485620225,TODAY_NEWS_24,2019-02-25 05:18:40+00:00,en,Oscars 2019 winners list in full – from Olivia Colman to Rami Malek to Lady Gaga https://t.co/3oXIjuZsNj https://t.co/soPBangIqd,neutral,0.5309925079345703
1099907434791858176,raje_shivani,2019-02-25 05:42:22+00:00,en,#Oscars2019 winners' list: #GreenBook best picture; #RamiMalek best actor https://t.co/CgSrzAaDca,positive,0.8065297603607178
1748499580595957970,LeupoldOptics,2024-01-20 00:16:00+00:00,en,"Built to outlast and outperform. Because at Leupold, failure is not an option.",positive,0.684393584728241
1099931061021138944,DsOchoa,2019-02-25 07:16:15+00:00,en,Awesome @ItsRamiMalek  Love @BoRhapMovie &amp;  #RamiMalek!,positive,0.9882893562316895
1099930652126760962,trappedinazorb,2019-02-25 07:14:37+00:00,en,@jessica_reedy Your crush Rami Malek just won an Oscar? Your crush Rami Malek just won an Oscar....,positive,0.7191469669342041
1099916969841635330,mayssakaraa,2019-02-25 06:20:15+00:00,en,@QueenWillRock @DavidBowieReal  #UnderPressure #RockCover - @mikegarson feat. @mayssakaraa and @GabyMoreno #BohemianRhapsody #Queen #FreddieMercury #DavidBowie #RamiMalek https://t.co/1XWasalF5B,neutral,0.8762302398681641
1099904493783867392,alkabeerawyy,2019-02-25 05:30:41+00:00,en,"Rami Malek , well deserved really well deserved , congratulation buddy  #Oscars",positive,0.9856202602386475
1099934272411062273,emiliomw17,2019-02-25 07:29:00+00:00,en,Just woke up and saw Green Book and Rami Malek won. What a way to ruin my day,negative,0.5219035148620605
1099878371482365952,THR,2019-02-25 03:46:53+00:00,en,"He is the champion, my friends. Rami Malek just won his first Oscar for portraying Freddie Mercury in #BohemianRhapsody. #Oscars https://t.co/FfxUo4InK2 https://t.co/9zQ7y9aNIp",positive,0.9741466641426086
1099885490566819841,washingtonpost,2019-02-25 04:15:10+00:00,en,‘Green Book’ wins best picture at the Oscars despite backlash over its portrayal of racial conflict https://t.co/CLmbUO22GF,neutral,0.7592889666557312
1099920993731125248,koreatimescokr,2019-02-25 06:36:15+00:00,en,"Rami Malek had difficult moments making ''Bohemian Rhapsody,'' but he has an Oscar to show for it. https://t.co/HUDPLMLOwE",positive,0.7536081075668335
1099939377415782401,AvatarNews_,2019-02-25 07:49:18+00:00,en,Rami Malek (you may know him as the voice of Tahno on The Legend of Korra) is the winner of the OSCAR for Best Actor at the 2019 Academy Awards!  Congratulations from your Avatar family! https://t.co/h0eKmeICPf,positive,0.9616830348968506
1099931699008331776,CricSubhayan,2019-02-25 07:18:47+00:00,en,#Oscars  What an actor Rami Malek! A classic performance in a true classic - Bohemian Rhapsody. Deserved. https://t.co/a2aqHcCMdN,positive,0.9807378649711609
1099912454472126470,baileyjohnk,2019-02-25 06:02:19+00:00,en,"the oscars were good this year mostly because of john mulaney, barbra streisand, rami malek, shallow, and LADY G A G A",positive,0.9766596555709839
1099912014426566657,RAKA4747,2019-02-25 06:00:34+00:00,en,DD News :  #Oscars2019 :   #RamiMalek wins  Best Performance  by an Actor in Leading Role   for  #BohemianRhapsody https://t.co/8Kgn6MjJoQ,positive,0.8259361982345581
1099900139995521024,Isatusitala,2019-02-25 05:13:23+00:00,en,#Repost bohemianrhapsodymovie •  •  •  •  • Congratulations to the cast and crew of Bohemian Rhapsody for winning four Academy Awards including Best Actor - Rami Malek! #Oscars https://t.co/bMfDOfP89Y,positive,0.9652414917945862
1099930246671884288,Hillyhobbit,2019-02-25 07:13:01+00:00,en,Haters gotta hate but I just loved #RamiMalek's performance in #BohemianRhapsody   Bloody ripper result if you ask me.,positive,0.9313433766365051
1099937851175772160,onlymadisonw,2019-02-25 07:43:14+00:00,en,"Rami Malek deserved every piece of that win. Learning a dialect, choreography, how to sing and play piano like one of the most talented musicians in history, learn Freddie's mannerisms and a whole Live Aid performance. This mans dedication to the craft and the man he portrayed.",positive,0.9399572610855103
1099936957797416960,Bea_CK_Image,2019-02-25 07:39:41+00:00,en,Rami Malek wins best actor Oscar for Bohemian Rhapsody https://t.co/qQR8qt0ZTK,positive,0.8797295093536377
1099932419686350848,sherifsalem1980,2019-02-25 07:21:39+00:00,en,"Very Balanced Replies , Bravo Rami Malek &amp; Liking It Or Not Egypt Took Some Good Credit :) https://t.co/12S5KF1dL5",positive,0.9586326479911804
1099906221014949888,TheReal_KDubb,2019-02-25 05:37:33+00:00,en,Rami Malek Wins Best Actor for 'Bohemian Rhapsody' at 2019 Oscars https://t.co/VEHNERS7BQ #music #feedly,positive,0.8338852524757385
1099904247670308865,Nancy__Dillon,2019-02-25 05:29:42+00:00,en,"Rami Malek speaking to reporters backstage after his ""Bohemian Rhapsody"" best actor win: '“I don’t think critically the decision on this film was unanimous,"" he joked. ""No matter what, I still do very much appreciate you.” #Oscars2019",positive,0.8487947583198547
1099906385905627144,freyaofasgard7,2019-02-25 05:38:12+00:00,en,"Rami Malek is a champion, my friends - 💕https://t.co/cM6oqly83v",positive,0.9748517274856567
1099914361483788288,kathleen_hanley,2019-02-25 06:09:53+00:00,en,why is no one talking about the fact that rami malek fell off the stage after the oscars and needed to be treated by paramedics,negative,0.7251683473587036
1099930511974244353,TinchyRobot,2019-02-25 07:14:04+00:00,en,So glad Rami Malek won the Oscar! His performance was truly incredible in Bohemian Rhapsody. Also super happy to see Olivia Coleman picked up best Actress!,positive,0.9907994866371155
1099936912926740480,ufkumuzhaber,2019-02-25 07:39:30+00:00,en,https://t.co/txlff0iZGO #Oscars Green Book Lady Gaga Roma Olivia Colman Rami Malek #Oscar2019 Bohemian Rhapsody Black Panther #Viña2019,neutral,0.6051326990127563
1099886080600489990,AshaKodi,2019-02-25 04:17:31+00:00,en,I am the son of immigrants from Egypt. I'm a first-generation American. Best Actor winning Rami Malek makes a call for diversity in movie storytelling in his #Oscars speech https://t.co/Wzbi8tQTj1,positive,0.6904765963554382
1099906353760329728,etnow,2019-02-25 05:38:04+00:00,en,Rami Malek is the FIRST Egyptian American and person of Arabic descent to win an acting Oscar. ❤️ #Oscars,positive,0.9701973795890808
1099909172689276928,ChudTsankov,2019-02-25 05:49:16+00:00,en,"American egyptian Rami Malek wins best lead actor for #bohemianrapsody at #oscars2019⁠ ⁠  ""i'm the son of immigrants from egypt. i’m a first generation american. and part of my story is being written right now"". #RamiMalek #Oscars #Oscars2019⁠... https://t.co/gHhCLpXWaQ",positive,0.8096623420715332
1099897606577242113,ifkoury,2019-02-25 05:03:19+00:00,en,The Oscars: ‘Green Book’ Is Best Picture; Rami Malek and Olivia Colman Win - The New York Times https://t.co/BuBUkzrgqM,positive,0.8410239219665527
1727298380546855028,PuppiesNation,2023-11-22 12:10:00+00:00,en,"Find Your Perfect Companion! Adopt Small Puppies Today. Discover Love, Loyalty, and Joy. Browse Now! 🐶🏡",positive,0.960760772228241
1099924875588878336,wilsonjmashaka,2019-02-25 06:51:40+00:00,en,Ouch! Rami Malek treated by medics after falling off the stage following best actor win  https://t.co/m8CLgbligt https://t.co/THJ2RJOAnG,negative,0.5483279228210449
1099911634347163649,JakeBrooks665,2019-02-25 05:59:03+00:00,en,@DanielRankin13 I was fine with Rami Malek because Best Actor was a pretty weak category of which Dafoe was the best but who ever won would just be stealing from Ethan Hawke anyway.,neutral,0.5607448220252991
1099899200781856769,yy_zed,2019-02-25 05:09:39+00:00,en,"#BohemianRhapsody may not have won best picture, but 4/5 AIN'T BAD!! 😀  Congrats to the cast &amp; crew! 🎉🎉  Including BEST ACTOR #RamiMalek   WE STAN AN ACADEMY AWARD WINNING KANG! 🙌 👑",positive,0.9862803220748901
1099939066274086912,bethwritesstuff,2019-02-25 07:48:03+00:00,en,"Bohemian Rhapsody deserved this Oscar as much as Rami Malek profoundly deserved his, the editing in this film was spectacular. And thank God the Academy saw sense to include and broadcast it since editing makes a movie.",positive,0.9743074774742126
1099898336105189376,ImmohMD,2019-02-25 05:06:13+00:00,en,"Rami Malek, Catching Mercury https://t.co/uek9IWfD14 A first generation American depicts the story of an immigrant whose songs rock all US sports fields  #ThisIsUs  #USA",positive,0.5512085556983948
1099914141849001984,eIiopermIan,2019-02-25 06:09:01+00:00,en,so you're telling me we live in the world where rami malek has an oscar but timothée fucking chalamet doesn't.. there are no words,negative,0.790023684501648
1099929424181579776,business_today,2019-02-25 07:09:45+00:00,en,"Oscar 2019 winners full list: Rami Malek, Olivia Colman bags Best Actor and Actress; Green Book wins Best Picture https://t.co/vkLhp5l3m9 https://t.co/jDoEexO2UJ",positive,0.8195053935050964
1099919441289072640,satish_kumar26,2019-02-25 06:30:04+00:00,en,"IOCL Recruitment 2019,Apply online before 08/03/2019 https://t.co/HuXRZOT0wJ #Oscars #GreenBook #RamiMalek #sarkarinaukri #aajtak #abp #narendramodi #jobs #naukri",neutral,0.8704509735107422
1099905106315624449,silvrrsprings,2019-02-25 05:33:07+00:00,en,RAMI MALEK SIR YOU DESERVE THE ENTIRE WORLD,positive,0.9275404214859009
1099711579967361024,Anilsharma_dir,2019-02-24 16:44:06+00:00,en,Looking for #Oscars2019⁠ ⁠ tomarw #BohemianRhapsody⁠ ⁠ #RamiMalek  my wish https://t.co/EGFxV7upi2,positive,0.6076411604881287
1099896826419953665,DanceLight623,2019-02-25 05:00:13+00:00,en,@Y2Kotic @MonzterMagic @IC3COLD_MATTH3W @coldclearsea I googled.  Thanks.  Wow Rami Malek!!!  Yes ❤️,positive,0.9671936631202698
1099927519220756480,Harshharsh1231,2019-02-25 07:02:10+00:00,en,Great to see Green Book win best film and Rami Malek both win #Oscars https://t.co/0qruqDkv5F,positive,0.9826161861419678
1099898858547470336,RapidLeaksIndia,2019-02-25 05:08:17+00:00,en,#Oscars- #RamiMalek won Best Actor at the #91stAcademyAwards .  #AcademyAwards #Oscars2019 https://t.co/N57ZWixCJ4,positive,0.8400397896766663
1099923999453265920,cherineghali,2019-02-25 06:48:11+00:00,en,Rami Malek Is the First Actor of Egyptian Origin To Win the Oscar for 'Best Actor' https://t.co/E9H4BN8fj3,positive,0.7997264862060547
1099916110458249216,Simplenewsuk,2019-02-25 06:16:50+00:00,en,Rami Malek falls off stage and treated by paramedics after winning first Oscar https://t.co/8lKbTMACyN https://t.co/vU7IhGzad8,neutral,0.6501467823982239
1099929695007793152,youaremyhome_,2019-02-25 07:10:49+00:00,en,good night to rami malek and his oscar only https://t.co/Io7fBzu4Uo,positive,0.9319600462913513
1099899876668633089,IsraelNewsLinks,2019-02-25 05:12:20+00:00,en,Rami Malek wins best actor Oscar for ‘Bohemian Rhapsody’ https://t.co/Lu9zyrNIfb via Western Journal https://t.co/f2CElWD3vo,positive,0.8515034317970276
1099900074446983169,evas_ophia,2019-02-25 05:13:07+00:00,en,"I am so proud of Rami Malek for winning best actor :"")",positive,0.9884507656097412
1099917871189245952,georgepalaganas,2019-02-25 06:23:50+00:00,en,"#OSCARS2019 #GreenBook #BestPicture #OliviaColeman  #BestActress #RamiMalek #BestActor #AlfonsoCuaron #BestDirector   And the winners are ,,,, https://t.co/egALoi0iTF https://t.co/rCachdBlnC",positive,0.8977945446968079
1099896780177719296,cheeryrosie,2019-02-25 05:00:02+00:00,en,"What a beautiful and heartfelt speech that was. Rami Malek is the only one who deserved that award this year no one else came close to the performance he gave! what a momentous moment in history for him, so beyond happy that his talent &amp; hard work was rewarded #RamiMalek #Oscars",positive,0.9863633513450623
1099903833847750656,rinamomon13,2019-02-25 05:28:03+00:00,en,Congrats Rami for the Win. You deserve it. Love #oscar #RamiMalek #win,positive,0.984210729598999
1099899646275698690,EveningStandard,2019-02-25 05:11:25+00:00,en,Rami Malek takes home best actor for Freddie Mercury role https://t.co/n8iayvp2WU,positive,0.7157800197601318
1099915165984788480,rajeshkalra,2019-02-25 06:13:05+00:00,en,#Oscars 2019 - Here's the complete winners' list from the 91st Academy Awards https://t.co/1IWJ2t780Z #PeriodEndOfSentence #GreenBook #RamiMalek #BestPicture #BestActress #BestOriginalSong #FreddieMercury,positive,0.6778878569602966
1099892597336797185,people,2019-02-25 04:43:24+00:00,en,#RamiMalek won best actor at the #Oscars for his portrayal of Queen's Freddie Mercury—and shared a sweet moment with his costar and girlfriend #LucyBoynton 💕 https://t.co/YVy2xCTljU https://t.co/T82Ljn2ehx,positive,0.9773030877113342
1099904123053330434,FanLuuu,2019-02-25 05:29:12+00:00,en,Day 47 - Fan is not a big fan of movie though. #100dayofdesign #Oscars #AcademyAwards #GreenBook #RamiMalek https://t.co/0QOqpnbMJ4,neutral,0.4764052927494049
1099940940981112833,jk_rawlings,2019-02-25 07:55:30+00:00,en,Medics rush to treat Rami Malek at Oscars https://t.co/TMT5VpmlKS,neutral,0.8285725116729736
1099921707916242945,Nawalaly4,2019-02-25 06:39:05+00:00,en,#Oscars2019 💥💥💥 u deserve all the best to u Ramy #RamiMalek #رامي_مالك,positive,0.9822778701782227
1758646307189878804,cabrinifilm2024,2024-02-17 00:15:28+00:00,en,"Audiences and critics are raving about 𝘾𝙖𝙗𝙧𝙞𝙣𝙞. Come see what they're saying.  Francesca Cabrini came to New York in 1889, and was greeted by disease, crime, and impoverished children living in slums. With fearless compassion, Cabrini set out to help our most vulnerable.",neutral,0.6561403274536133
1099908016189493253,Daniel_Eady,2019-02-25 05:44:41+00:00,en,@davidfarrier Rami Malek won for best miming apparently,neutral,0.5126064419746399
1759558048467529967,bmj_company,2024-02-19 12:38:24+00:00,en,Reach an international audience through our open access publication model. We have calls for papers in your subject area.,positive,0.5166106820106506
1099836166054891520,LGDoingThings,2019-02-25 00:59:10+00:00,en,Lady Gaga asking a waiter for another drink at the Oscars (2019) https://t.co/XYUYKEQnu0,neutral,0.8857621550559998
1099923088198811648,goachronicle,2019-02-25 06:44:34+00:00,en,"Los Angeles, Feb 25 (GCEntertainment) Rami Malek won the Best Actor Award for music biopic ""Bohemian Rhapsody"" at the 91st Academy Awards ceremony, or the Oscars, held at the Dolby Theatre... https://t.co/gcGUU7P6u1",positive,0.7173174023628235
1099903450391945216,monsyhansy,2019-02-25 05:26:32+00:00,en,Thrilled for Rami Malek but also kinda pissed I’m not gonna be the first Egyptian-American to win an Oscar,negative,0.4364357590675354
1099900939144757249,districtofcat,2019-02-25 05:16:33+00:00,en,"You guys, we didn't spend enough time on how fucking good Bradley Cooper's voice was at the #Oscars2019 tonight. Six months of training, and all Rami Malek did was wear a mouthpiece while lip syncing. #Oscars  #AcademyAwards",positive,0.8473606109619141
1099941179758530560,DanaGuertz,2019-02-25 07:56:27+00:00,en,"#Oscars2019 🏆🏆🏆 ALL THE APPLAUSE  TODAY ARE FOR YOU  👏👏👏 CONGRATULATIONS✨✨✨ ramimalek ❤️!!! I’M SO HAPPY FOR YOU, YOU DESERVE IT!!! 💞💞💞 . . . . #ramimalek #lucyboynton #bohemianrhapsody… https://t.co/xbtNmfGBSi",positive,0.9885845184326172
1099923056380788736,kathynajimy,2019-02-25 06:44:26+00:00,en,"we recorded it so just catchng up-Highlites: @oliviacolman acceptnce speech highliarious/authentic.Opening w/the royal triad @amypoehler__ @MayaRudolph &amp; @tinafey. @ramimalek ""I'M THE SON OF EGYPTIAN IMMIGRANTS! Yalla! &amp; @ladygaga I believe everyword. But #oscarsnowomendirectors?",neutral,0.733136773109436
1099899104124112896,NatPerdion,2019-02-25 05:09:16+00:00,en,Rami Malek Wins Oscar For Best Actor – Variety https://t.co/iRRLDmQsQn,positive,0.7708342671394348
1099903734916792320,EurasiaEng,2019-02-25 05:27:40+00:00,en,'I think anyone struggling with theirs trying to find their voice' - #Rami #Malek’s #Oscar speech for finding identity | Eurasia Diary https://t.co/qwhBl3c4Am,neutral,0.8703277707099915
1683501893236948992,Longevity_Labs,2023-07-24 15:38:23+00:00,en,Did you know that you still have the hair follicles from when you were born? Understanding the hair growth cycle is how we can combat hair loss as we get older.,neutral,0.8194500207901001
1099921372950810624,anthonygstabile,2019-02-25 06:37:45+00:00,en,Green Book won Rami Malek won and Into the Spiderverse was never nominated for best picture yeah the Oscars are a joke,negative,0.5435068011283875
1099908046141018113,aitaikimochi,2019-02-25 05:44:48+00:00,en,"Rami Malek, Oscars, and Bohemian Rhapsody all trending in Japan right now since this morning lol, rock on 🎸🎶 https://t.co/LYr3wnOKeF",positive,0.9246221780776978
1099919157234036736,IDYLLSOFD_QUEEN,2019-02-25 06:28:57+00:00,en,HAS ANYONE CHECKED ON RAMI MALEK IS HE OKAY,neutral,0.8588100075721741
1099902531046727680,Sutrishna12,2019-02-25 05:22:53+00:00,en,"#RamiMalek you beauty!! Couldn't be more happy with the best picture, actor, and actress win! A much-deserved Oscar for the two powerhouse 👏🏽🤘🏽#Oscars2019 #BohemianRapsody #TheFavourite @greenbookmovie",positive,0.9890609979629517
1099917024539656192,ili_vallado,2019-02-25 06:20:28+00:00,en,"Lucy, you are the heart of this film. You are beyond immensely talented. You have captured my heart. Thank you so much. - Rami Malek. Y yo... 😭 https://t.co/SJYQHEgOpz",positive,0.980761706829071
1099932511923306496,stephenej30,2019-02-25 07:22:01+00:00,en,Rami Malek Wins Best Actor Oscar for Bohemian Rhapsody https://t.co/wqMbfV4CKD,positive,0.831544041633606
1099922176109629440,D4rkP4ssenger1,2019-02-25 06:40:57+00:00,en,And the oscar goes to... Rami Malek!!!! I am so happy!!! #Oscars2019,positive,0.9915364980697632
1099929126931070976,nancyneff2,2019-02-25 07:08:34+00:00,en,@StevenBeschloss Poignant remarks at the Oscars by Rami Malek spoke to this point.  🆘🗽🇺🇸,neutral,0.728618323802948
1099906921719574528,pmajrr,2019-02-25 05:40:20+00:00,en,"@iamkimterry @RollingStone ...agreed, that being Rami Malek winning, Glenn Close snubbed and Green Book best pic!?!?  Somethings VERY wrong with the Academy.",negative,0.8334327340126038
1099916753948282881,_richardsquare,2019-02-25 06:19:24+00:00,en,#RamiMalek and #LucyBoynton   #LadyGaga and #BradleyCooper   #OscaRomance https://t.co/9WPqQUUJEW,neutral,0.8907161355018616
1099932120485691392,wusa9,2019-02-25 07:20:27+00:00,en,"Rami Malek fell, had to be checked out after Oscars win https://t.co/NDPENbwfx1 https://t.co/M49SklioeG",neutral,0.5317500233650208
1099916874953908224,hillarykilam,2019-02-25 06:19:53+00:00,en,rami malek is trending damn he's cute,positive,0.9373185038566589
1099932703334387712,BunnyBrethren,2019-02-25 07:22:46+00:00,en,"Do we care about the Oscars, peeps? I'm glad that nice boy Rami Malek won. We like him and I love Queen, so a double win in my mind.",positive,0.9483015537261963
1099927301595136000,stjohnswoodsoc,2019-02-25 07:01:19+00:00,en,🎵 Congratulations ramimalek and bohemianrhapsodymovie for your Oscar wins theacademy last night! The music for the biopic was recorded in Studio 3 @abbeyroad 👏🎵 📷 @abbeyroad ramimalek… https://t.co/m2eQUQYtnH,positive,0.9780786633491516
1099939473352286208,DrPhilippaSL,2019-02-25 07:49:40+00:00,en,Yes Rami Malek and Olivia Colman!! 🙌🏻🙌🏻🙌🏻👏🏻👏🏻👏🏻,positive,0.9754250645637512
1099920149249961984,Xervello,2019-02-25 06:32:53+00:00,en,I'm just thankful to the lord that Lady Gaga didn't win best actress at the #Oscars so we were all spared a woke acceptance speech about some dumb shit.  Also glad that Rami Malek's teeth won for best actor.  👍,positive,0.6447780132293701
1099939583561744384,My_SimpleMind,2019-02-25 07:50:07+00:00,en,My review on Bohemian Rhapsody and the performance of Rami Malek...  #Oscars2019 #Oscars #Oscars19 #Oscars #AcademyAwards2019 #BohemianRhapsody #BoRhap   https://t.co/lYEWHciqWA,positive,0.5584892630577087
1099904451056463872,kweseiflixgh,2019-02-25 05:30:31+00:00,en,"ICYMI: Here is the full list of the 2019 Academy Award Winners (THREAD)  Best Picture: “Green Book” 📗 Director: Alfonso Cuarón, “Roma”💺🇲🇽 Actor: Rami Malek, “Bohemian Rhapsody” 👨🏽‍🎤 Actress: Olivia Colman, “The Favourite” 🎭😍  #Oscars #AcademyAwards  #kweseiflix",neutral,0.5094079971313477
1099940242709245952,amgadmorgan,2019-02-25 07:52:44+00:00,en,Our son Rami Malek won his first Oscar ... https://t.co/pAGbdj102C,positive,0.8959090709686279
