tweet.id,tweet.user.username,tweet.date,tweet.lang,tweet.rawContent,label,score
1226668919496335361,jessie_lopresti,2020-02-10 00:47:15+00:00,en,I really don’t find brad Pitt attractive sorry,negative,0.8376436233520508
1226650370602078208,AtulTolia,2020-02-09 23:33:33+00:00,en,"2/3 Predictions #Oscars2020 Best Actor : Joaquin Phoenix - ""Joker"" Best Actress : Renee Zellweger - ""Judy"" Best Supporting Actor : Brad Pitt - ""Once Upon a Time in Hollywood"" Best Supporting Actress : Laura Dern - ""Marriage Story""",neutral,0.6813499927520752
1226669272505565184,sunny_blooms_,2020-02-10 00:48:39+00:00,en,"Who the f was that interviewing brad pitt? Very stiff, uninformed, and boring af. You had one chance and completely blew it. No girl",negative,0.9477232098579407
1226638617361178625,Kaash_3,2020-02-09 22:46:50+00:00,en,"Really hope and expect Brad Pitt to win best supporting tonight, was unreal in Once Upon a time in Hollywood. #Oscars",positive,0.969354510307312
1226665543425495042,lshafran,2020-02-10 00:33:50+00:00,en,Only Brad Pitt can rock still a mullet in 2020!  #bradpitt #oscars #oscars2020 #mullet https://t.co/JzypEeSjqG,positive,0.8684812188148499
1226667793644429313,FavoriteLadyS,2020-02-10 00:42:47+00:00,en,At least Brad Pitt is still hot 🥵,positive,0.7733607292175293
1226662066032869376,SketchesbyBoze,2020-02-10 00:20:01+00:00,en,"Brad Pitt: • over-hyped • zero Oscars  Gilderoy Lockhart: • Order of Merlin, third class • honorary member of the Dark Forces Defense League • five-time winner of Witch Weekly’s Most Charming Smile award",neutral,0.6853582859039307
1226671547554779136,Diosa_Rose,2020-02-10 00:57:42+00:00,en,"#Oscars  #Oscares2020  #MejorActorDeReparto Brad Pitt, Once upon a Time...in Hollywood https://t.co/G0H7WbfaOg",neutral,0.736672043800354
1226659482387787776,JamesMonty1996,2020-02-10 00:09:45+00:00,en,"#AdAstra is both beautiful &amp; spellbinding with awe-inspiring visuals, it is both a suspenseful &amp; dark tale with a few tricks up its sleeve &amp; led by a strong Brad Pitt performance, the pace is slow at times &amp; not a fan of narration throughout but still a memorable sci-fi flick8/10 https://t.co/qfhExFuatZ",positive,0.9744945764541626
1226670831566311424,MichaelJKarger,2020-02-10 00:54:51+00:00,en,@imdblive Brad Pitt,neutral,0.7841081023216248
1226662128393826304,firespyre,2020-02-10 00:20:16+00:00,en,@letterboxd ator coadjuvante:  torcida: anthony hopkins aposta: brad pitt,neutral,0.9304621815681458
1226671473269493762,J_Beezy09,2020-02-10 00:57:24+00:00,en,I’m taking a number and waiting patiently for my turn to bang Brad Pitt. I’ll be caring around one of those restaurant buzzers for when it’s my turn #oscars #bradpitt,positive,0.6272660493850708
1226653294614937600,othercword,2020-02-09 23:45:10+00:00,en,"Best of luck tonight, gents.   “How Tarantino, Brad Pitt &amp; Rick Rubin Helped Me Fight Cancer” https://t.co/2JUhrhrwHE  #oscars https://t.co/0NQBHouBbb",positive,0.915121853351593
1226666670103633920,celebitchy,2020-02-10 00:38:19+00:00,en,Brad Pitt needs his split ends cut,negative,0.7443675994873047
1226671400146079745,AustinShermer,2020-02-10 00:57:06+00:00,en,Brad Pitt's velvet suit https://t.co/jnTMuAEhsV,neutral,0.7135030031204224
1226668927960268800,pintsizeclown,2020-02-10 00:47:17+00:00,en,WE LOVE A STUNT MAN -Brad Pitt #Oscars2020,positive,0.9743209481239319
1226650359881490433,PsychicWayne1,2020-02-09 23:33:30+00:00,en,BRAD PITT'S OSCAR NIGHT  TRANSITS . .  Brad Pitt is nominated for Best Supporting Actor for his role in Once Upon A Time In  Hollywood at tonight's Oscars...  to some pretty spectacular transits..  . . Transiting… https://t.co/1NgpAdNt6c,positive,0.9578739404678345
1226664155412742144,BronteWillis,2020-02-10 00:28:19+00:00,en,EVERYONE SHUT UP BRAD PITT IS HERE,positive,0.5199791789054871
1226664329568604161,kidzbopolivia,2020-02-10 00:29:01+00:00,en,@Kontrast0 Dude it’s gonna be the Brad Pitt stunt double movie and I’ll be angry,negative,0.8723126649856567
1226645594195812352,LianosKostas,2020-02-09 23:14:34+00:00,en,Oscars predictions before this European goes to bed:  Best Picture: 1917 Best Actor: Joaquin Phoenix Best Actress: Renee Zellweger Supporting Actor: Brad Pitt Supporting Actress: Laura Dern  #Oscars,neutral,0.6980656981468201
1226669106235133952,BruceLaBruce,2020-02-10 00:47:59+00:00,en,Brad Pitt has been working a distinctly transman vibe lately #Oscars,positive,0.6494231224060059
1226668710452174848,LoveLearnDebate,2020-02-10 00:46:25+00:00,en,Quentin: love him. Leo: respect and love him. Brad Pitt: https://t.co/IN0KSnMFyK,positive,0.7517146468162537
1226666396131692544,MrScreenAddict,2020-02-10 00:37:13+00:00,en,"DIRECTOR Bong Joon-ho, Parasite  ACTOR Adam Driver, Marriage Story  ACTRESS Scarlett Johansson, Marriage Story  SUPP ACTOR Brad Pitt, Once Upon A Time… In Hollywood  SUPP ACTRESS Florence Pugh, Little Women  ADAPTED SCREENPLAY Little Women  ORIGINAL SCREENPLAY Parasite",neutral,0.8480069041252136
1226629407382614018,meganncall,2020-02-09 22:10:15+00:00,en,"Before the Oscars tonight, a few reminders:  🔘Marriage Story (yes, even Laura Dern) does not deserve awards.   🔘You didn’t like Once Upon a Time in Hollywood, you liked Brad Pitt.   🔘Renée Zellweger is a treasure and the fragility with which she played Judy Garland is perfect.",negative,0.6724569797515869
1226667805409447939,ReignOfApril,2020-02-10 00:42:49+00:00,en,Brad Pitt looks delicious. My goodness.,positive,0.9791313409805298
1226635918393692165,michie8,2020-02-09 22:36:07+00:00,en,Tonight I’m here only for Bradley Cooper and Brad Pitt. 🤗🥰😍,positive,0.9806100130081177
1226671313420537857,Dalabrack,2020-02-10 00:56:46+00:00,en,"Also, copy paste that tweet but change the gendered words to male ones and the name to Brad Pitt",neutral,0.7879902720451355
1226671101473968128,cuntyandcute,2020-02-10 00:55:55+00:00,en,Is it just me or does Charlize Theron look like the female Brad Pitt? #Oscar2020,neutral,0.8955855965614319
1226670491206868992,WillyBoods,2020-02-10 00:53:30+00:00,en,Brad Pitt for Best Supporting Actor is a lick. Cliff booth might be the coolest movie character in a while,positive,0.9717093110084534
1226653785533140992,Robertdoc1984,2020-02-09 23:47:07+00:00,en,"#Oscars2020 Top 50 performances, 20-16 20: Roman Griffin Davis - #JojoRabbit  19: Eddie Murphy - #DolemiteIsMyName  18: Song Kang - #ParasiteMovie 17: #BradPitt - #AdAstra 16: #AntonioBanderas - Pain and Glory",neutral,0.8619681000709534
1226670512455245824,CooperLawrence,2020-02-10 00:53:35+00:00,en,My #Oscars predictions: Best Picture: 1917 Best Actor: #JoaquinPheonix  Best Actress: #ReneeZellweger  Best Supporting: #BradPitt #LauraDern  Best Director: #SamMendes   Documentary: American Factory International: #Parasite  Screenplay: #Tarantino and Phillips,positive,0.5058894753456116
1226667397492310016,Mandatory,2020-02-10 00:41:12+00:00,en,"Who wore their hair better: #BradPitt or Pacino? Seriously, give one of them (Brad) the trophy and the other one a comb. #Oscars",positive,0.5217974781990051
1226668693041680385,bondimus,2020-02-10 00:46:21+00:00,en,"“Dude, whoever gave Brad Pitt his facelift should get the oscar tonight” @Miss_Magpie",neutral,0.5148592591285706
1226638385294565383,majmittendorf,2020-02-09 22:45:55+00:00,en,main #Oscars predictions tonight:  Picture: Parasite.  Actor: Joaquin Phoenix. Actress: Renee Zellweger.  Director: Sam Mendes (1917). Supporting Actor: Brad Pitt.  Supporting Actress: Laura Dern. O. Screenplay: Parasite.                              A. Screenplay: The Irishman.,neutral,0.897034764289856
1226668180548005889,ohsoamy,2020-02-10 00:44:19+00:00,en,"I just thought about how, years ago, my mom told me about how Robert Redford was soooo handsome back in the day, and I thought “this old guy?!” I now FULLY imagine myself telling my daughter the same thing about Brad Pitt in the future. #oscars",positive,0.869053304195404
1226639501193179136,sagaftraFOUND,2020-02-09 22:50:21+00:00,en,"Bid on this 26th Annual @SAGAwards Tote Bag signed by this year’s recipients including cast of @ParasiteMovie, #BradPitt, #ReneeZellweger and more! Proceeds support our safety net for performing artists! Bid now: https://t.co/IkZL5RMqf9 via @eBay @AuctionCause #Oscars #Oscars2020",positive,0.7404382228851318
1226669606913400832,Vincevaugh,2020-02-10 00:49:59+00:00,en,So Brad Pitt wasn’t the main character in once upon a time????,neutral,0.6896395087242126
1226650852674371590,NoItsRoman,2020-02-09 23:35:28+00:00,en,1917 Joaquin Phoenix Scarlett Johansson Brad Pitt Laura Dern Sam Mendes 1917/Knives Out Jojo Rabbit 1917 Parasite Once Upon A Time In Hollywood Once Upon A Time In Hollywood Joker Joker Frozen II 1917 1917 1917 American Factory Learning to Skateboard in a Warzone Missing Link,neutral,0.9236792922019958
1226666847178829824,ktmob_,2020-02-10 00:39:01+00:00,en,brad pitt first thing i’m not ready,neutral,0.4985094666481018
1226671251336368129,foxtailferns,2020-02-10 00:56:31+00:00,en,I made my Oscar picks but feel meh about some of the options so here are my top ten performances of 2019:  1. Cho Yeo-jeong - Parasite 2. Adam Driver - Marriage Story 3. Brad Pitt - Once Upon a Time in Hollywood 4. Florence Pugh - Midsommar 5. Adam Sandler - Uncut Gems,neutral,0.7643768191337585
1226670058744827904,VincentGeorgie,2020-02-10 00:51:47+00:00,en,"@Oscars2020_ is upon us. Look for Brad Pitt, Joaquin Phoenix, Laura Dern &amp; Renee Zellweger to take acting prizes. 1917 will win the most categories, followed by @ParasiteMovie . In a shocker, look for the South Korean hit to win Best Picture ! Mendes for Director.",positive,0.8222135305404663
1226664196286246912,RickPowell13,2020-02-10 00:28:29+00:00,en,"1917 #SamMendes #JoaquinPhoenix #RenéeZelwegger #BradPitt #LauraDern #OUATIH #LittleWomen #MissingLink “Stand Up”, #Harriet Score: #Joker Cinema: 1917 Effects: #AvengersEndgame Costume: OUATIH Makeup: #Bombshell #AmericanFactory Editing: #FordvFerrari Production: OUATIH #Oscars",neutral,0.8764109015464783
1226669540437905413,imtheitaliansam,2020-02-10 00:49:43+00:00,en,I looking in the mirror after seeing Brad Pitt at the #Oscars: https://t.co/HT1oVkpkbs,neutral,0.652469277381897
1226668817918521345,lynn_bartels,2020-02-10 00:46:51+00:00,en,"I think Brad Pitt needed a haircut for tonight's @Oscars2020_. @MegDubray, what do you think?",neutral,0.7941256165504456
1226665896309075968,EsquireUK,2020-02-10 00:35:14+00:00,en,Best Supporting Actor? #BradPitt's dressed for the occasion at the #Oscars2020   See more of the arrivals here: https://t.co/0eZ5DvMWwb https://t.co/Xip8k03DOC,positive,0.7839259505271912
1226655704989126656,Matthew_Hodson,2020-02-09 23:54:44+00:00,en,Ready for the #Oscars. Today I’m channeling sexy 50+ year old Brad Pitt. #OnceUponATimeInHollywood https://t.co/lsdiF8Q4O3,positive,0.9349930286407471
1226663490108219392,Caliskaniverse_,2020-02-10 00:25:41+00:00,en,"I just saw Brad Pitt #Oscars 2020 I could swear he's wearing BLACK VELVET...  I mean, YES.  I mean, U-HUH.  I mean, VELVET BRAD, people! 🖤 BRAD VELVET? I got to write this character 🤔💋💄",positive,0.9456734657287598
1226641771414859776,MrWymanMcCarthy,2020-02-09 22:59:22+00:00,en,"SUPPORTING ACTOR Will win: Brad Pitt, Once Upon a Time... in Hollywood (lock) Should win: Joe Pesci, The Irishman Should be nominated: Song Kang-ho (Parasite), Joel Edgerton (The King)",positive,0.631584882736206
1226671996211093505,Millsy11374,2020-02-10 00:59:29+00:00,en,FWIW there is always ONE acting upset at the #Oscars and I’m saying it’s gonna be Pesci over Brad Pitt.,negative,0.5954894423484802
1226669488898220032,sampanda24,2020-02-10 00:49:31+00:00,en,supporting actor:  Brad Pitt - Once upon a time in hollywood  Sterling K Brown - Waves Kang-Ho Song - Parasite,neutral,0.7429897785186768
1226662978986139648,nola_geurl,2020-02-10 00:23:39+00:00,en,oh lawd... just saw Brad Pitt😍 I truly don't know if I can be objective.,positive,0.9241369962692261
1226668218409979905,chloeotie,2020-02-10 00:44:28+00:00,en,"And also Brad Pitt, just, generally.",positive,0.5050197839736938
1226669010512572417,telltalehartley,2020-02-10 00:47:37+00:00,en,gonna be hooting and hollering every time I see Brad Pitt tonight - that’s my Best Supporting Actor right there!,positive,0.9835370182991028
1226671569059155968,Andrew_Self,2020-02-10 00:57:47+00:00,en,May we all aspire to be as laid-back in our lives as Brad Pitt is in his #Oscars,positive,0.9085893034934998
1226663707490574336,ChicksInTheOff,2020-02-10 00:26:32+00:00,en,BRAD PITT IS HERE! #Oscars https://t.co/bwXN00TF2c,positive,0.8951072096824646
1226669242587795457,siouxbruce,2020-02-10 00:48:32+00:00,en,"ABC, please reconsider who you have interviewing folks on the red carpet. That Brad Pitt moment was painful. @TheAcademy #Oscars @redcarpet @scj",negative,0.8932334184646606
1226663163292090368,MicheleBerkowi1,2020-02-10 00:24:23+00:00,en,I cannot believe I saw Brad Pitt smoking his cigarette going through the red carpet getting ready to put it out. What a joke you are.🤧,negative,0.9243436455726624
1226664388142288897,MzKAT64,2020-02-10 00:29:15+00:00,en,"I agreeee @DanielleGraham #BradPitt's hair is perfect and he is getting better with age!!! Ladies, I am LOVIING the #etalkredcarpet #Oscars2020",positive,0.9857597947120667
1226667929598595073,lea_sakuraa,2020-02-10 00:43:19+00:00,en,"Brad Pitt steht am roten Teppich, Frage an ihn: ""What do you like about Germany?"" Warum? 🤦🏻‍♀️ #Oscars #Oscars2020",neutral,0.6936346292495728
1226669293934456832,NewRocGirl2,2020-02-10 00:48:44+00:00,en,What was with the 8 feet of space between #BradPitt and interviewer #PreOscarsShow,neutral,0.8643034100532532
1226668580084649984,thefirstindia,2020-02-10 00:45:54+00:00,en,Once upon a time in Hollywood Star #BradPitt on the #Oscars red carpet.  #Oscar2020 #Oscars2020 #OscarNoms #OscarsAllAccess #Oscares2020 #Oscars #AcademyAwards https://t.co/7LXnEuohtR,positive,0.6746325492858887
1226664930444816384,dmyuv,2020-02-10 00:31:24+00:00,en,Brad Pitt #oscars https://t.co/JFKmkPD4uW,neutral,0.5127059817314148
1226671393129074688,NotYourFlyGurl,2020-02-10 00:57:05+00:00,en,"I’m also enjoying older, mature Brad Pitt...",positive,0.9383372068405151
1226665391792934912,makadelliiic,2020-02-10 00:33:14+00:00,en,BRAD PITT is so hot,positive,0.8895303010940552
1226668735366356998,jh_008,2020-02-10 00:46:31+00:00,en,brad pitt is so not it,negative,0.8855998516082764
1226671169136447488,Mom_interrupted,2020-02-10 00:56:11+00:00,en,@lraitt Brad Pitt is his best Thelma and Louise self!,positive,0.9197586178779602
1226668230309113856,TrivWorks,2020-02-10 00:44:31+00:00,en,Brad Pitt &amp; Paul Rudd have arrived #Oscars https://t.co/UgyEbrXRDR,neutral,0.542926549911499
1226664308022685696,rosstmiller,2020-02-10 00:28:56+00:00,en,"My word, Brad Pitt is one good looking man. Not that this is news. #Oscars",positive,0.9514429569244385
1226649624284409856,GerHerbert1,2020-02-09 23:30:35+00:00,en,@kost1035fm that's brad Pitt :),positive,0.7288476228713989
1226653844358213632,ZachWithers,2020-02-09 23:47:21+00:00,en,My picks for #Oscars big awards:  Lead Actor: Joaquin Phoenix (Joker) Lead Actress: Saoirse Ronan (Little Women Supporting Actor: Brad Pitt (Once Upon a Time in Hollywood) Supporting Actress: Scarlett Johansson (Jojo Rabbit) Director: Bong Joon Ho (Parasite) Animated: Toy Story 4,neutral,0.5573071241378784
1226666835623514112,prairielaura,2020-02-10 00:38:58+00:00,en,Brad Pitt appears to be approaching the Benicio delToro singularity,neutral,0.7715818881988525
1226635935367843840,skikani,2020-02-09 22:36:11+00:00,en,"@tricerapops @followCP My predictions, not necessarily my preferences.  Picture: 1917 Actor: Phoenix Supporting: Brad Pitt Actress: Renée Supporting: Laura Dern Director: Bong Joon-ho Score: Hildur Foreign Language: Parasite Screenplay: QT Cinematography: Deakins",neutral,0.9106423854827881
1226666760109207553,enews,2020-02-10 00:38:40+00:00,en,Alsdjkflskd Brad Pitt in a velvet suit we are DONE. #Oscars https://t.co/wlTEiU4I1K,neutral,0.5390071272850037
1226666283669716992,Variety,2020-02-10 00:36:47+00:00,en,Brad Pitt alert: The #OnceUponATimeInHollywood star is at the #Oscars https://t.co/ntM6WywZO7,positive,0.7694215774536133
1226653011520319488,om2kool,2020-02-09 23:44:02+00:00,en,"Ok so if Brad Pitt is winning the Supporting Actor Oscar tonight, can he pls urge the Academy to include a category for Action &amp; Stunts to honor stunt ppl who put their lives on the line ?!? I hope he does in his speech. He did play a stunt guy after all #Oscars #Oscar #Oscar2020 https://t.co/WJYAIAOAAd",positive,0.6166690587997437
1226670337183621120,CinephileChels,2020-02-10 00:52:53+00:00,en,Best Supporting Actor Should/Will Win: Brad Pitt  Best Supporting Actress Will Win: Laura Dern Should Win: Florence Pugh  Best Original Screenplay Will Win: Parasite Should Win: Knives Out  Best Adapted Screenplay Should/Will Win: Jojo Rabbit,positive,0.7488657832145691
1226662481579343873,maryjobros8,2020-02-10 00:21:40+00:00,en,"BRAD PITT, LICK ME #OSCARS",neutral,0.5252009034156799
1226669094377791489,f_animazione_,2020-02-10 00:47:57+00:00,en,Brad Pitt ✨ Un KING Deve vincere stasera! #OnceUponATimeInHollywood #Oscars  https://t.co/RbrcO8NjTr,positive,0.9424282908439636
1226629701294227456,ASregen,2020-02-09 22:11:25+00:00,en,The Academy award for best actor in a supporting role goes to... Brad Pitt.,positive,0.8425084352493286
1226669813076021248,feedimo_news,2020-02-10 00:50:48+00:00,en,Brad Pitt attends the 92nd Annual Academy Awards at Hollywood https://t.co/2FAj6ighSI https://t.co/AfFWNUksHM,neutral,0.6817725896835327
1226668593569554432,Lizzzzaaaard,2020-02-10 00:45:57+00:00,en,"the only good part of #OnceUponATimeInHollywood was when Brad Pitt was shirtless on the roof. like, nothing happened until the last 20 minutes??",positive,0.5862972736358643
1226668737803292672,clintworthing,2020-02-10 00:46:32+00:00,en,That little dance that QT gave Brad Pitt walking past the red carpet #Oscars #Oscars2020,neutral,0.6389691233634949
1226665203179413504,vikesshaqtwins,2020-02-10 00:32:29+00:00,en,"@FanDuel For tonight predictions I like Joaquin and Brad Pitt,  but Tom Hanks is the #GOAT",positive,0.8953655958175659
1226664845958758401,NuggetPrduction,2020-02-10 00:31:04+00:00,en,"@siftpop @aarondicer looking at a few people's picks for the #sposcars we can all assume it's safe to say that Joaquin Phoenix, Brad Pitt, Laura Dern and Renee Zellweger are going to win the four acting awards?",neutral,0.6526069641113281
1226664712785551362,pricewalden,2020-02-10 00:30:32+00:00,en,this thing is STARTING with Brad Pitt??,neutral,0.7422775030136108
1226633716350537728,OnefilmsMovies,2020-02-09 22:27:22+00:00,en,"Movie Quotes: ""I hope you live a life you're proud of. If you find that you're not, I hope you have the strength to start all over again"". Brad Pitt (The Curious Case of Benjamin Button)",positive,0.8090963959693909
1226636065286443009,SRebecca72,2020-02-09 22:36:42+00:00,en,@TWIZZLERS Brad Pitt!!!!!#Redcarpet #Fashion #TrendAlert,positive,0.6958392858505249
1226669059984502784,High5Forever,2020-02-10 00:47:48+00:00,en,"Interviewer: you do your own stunts?  Brad Pitt: noooo, I love a stuntman  This is sending me",positive,0.6860643625259399
1226666565585817600,tessaaanne,2020-02-10 00:37:54+00:00,en,BRAD PITT IS HANDSOME,positive,0.9373621940612793
1226668974668161025,cmillertwinmom,2020-02-10 00:47:28+00:00,en,Hello Brad Pitt #Oscars #oscarsredcarpet,positive,0.7744960784912109
1226637671784730624,cowboycollier,2020-02-09 22:43:05+00:00,en,And they made Bruce lee an asshole and brad Pitt the hero yikes,negative,0.9189189672470093
1226669549971529730,MiEstimadoJulio,2020-02-10 00:49:45+00:00,en,@GQMexico Brad Pitt.,neutral,0.7544615864753723
1226669153806880769,abromanello,2020-02-10 00:48:11+00:00,en,Velvet. I have nothing else to say. #bradpitt #oscars https://t.co/nVjOuidc5q,neutral,0.5810189843177795
1226647643574751232,itskepes,2020-02-09 23:22:42+00:00,en,Excuse me Brad Pitt has never seen Sound of Music?!  #Oscars https://t.co/qfgeoAhIGb,neutral,0.5147100687026978
1226626965240766464,BassamLFC,2020-02-09 22:00:32+00:00,en,"Wanna make Oscar predictions but I'm lazy, just hate that I have to see one of Al and Brad Pitt not win tonight #Oscar2020",negative,0.8635072708129883
1226670002322849792,killuasprint,2020-02-10 00:51:33+00:00,en,Brad Pitt is so ugly,negative,0.9199003577232361
1226669939211284480,RainerLoveiam,2020-02-10 00:51:18+00:00,en,#Oscar2020 #Oscars Brad the Pitt https://t.co/k0om6flNWz,neutral,0.6541194319725037
1226640879911178240,jerryt296,2020-02-09 22:55:50+00:00,en,"@dianafromprague Good picks Diana. I’m definitely feeling it for Brad. 1917, Joaquin Phoenix, Renée Zellwigger, Brad a Pitt, Margot Robbie. Now you know my brain Diana.",positive,0.9427706003189087
1226668741288759296,murrtineck,2020-02-10 00:46:32+00:00,en,Brad Pitt please cut your hair,negative,0.5818504095077515
1226658510659780611,ACSkoczylas,2020-02-10 00:05:53+00:00,en,No one congratulates Brad Pitt for still getting jobs as an “older man”!!,negative,0.7466050982475281
1226669038752948224,laurabrounstein,2020-02-10 00:47:43+00:00,en,Amazing how much more handsome I find #bradpitt now that he seems to make Jennifer Aniston smile again. That may be some impressive publicity dark magic. Or just nice all around. 🤷🏼‍♀️ #Oscar2020 https://t.co/4npvhT6Zwj,positive,0.9697222113609314
1226662697544093697,DRUNKVOUIS,2020-02-10 00:22:32+00:00,en,BRAD PITT,neutral,0.6954213976860046
1226665778361065472,MBQ_Kuwait,2020-02-10 00:34:46+00:00,en,Brad Pitt has arrived to the #Oscars Red Carpet #Oscars2020 https://t.co/ExLSslBpTo,positive,0.6946370601654053
1226667845330690057,OnCinemaRafael,2020-02-10 00:42:59+00:00,en,Update brad @pitt has arrived!!! Do u support him winning tonight for once upon a Hollywood?? https://t.co/EhqYQ8kN4I,positive,0.7323601841926575
1226668044015013888,CoraJScott,2020-02-10 00:43:46+00:00,en,Where did nominee Brad Pitt grow up? #OscarsAllAccess (Easy! Right here in @CityofSgf) We’re all rooting for him!,positive,0.9683635234832764
1226671925201637379,grooovyg_,2020-02-10 00:59:12+00:00,en,Brad Pitt so fine,positive,0.9095730781555176
1226670093465260033,DyalWilliam,2020-02-10 00:51:55+00:00,en,@SKH245 Brad Pitt and Angelina Jolie BAM😁😁😁,positive,0.9081854224205017
1226639624321347585,carlos__go__,2020-02-09 22:50:50+00:00,en,Brad Pitt and the Beauty Trap https://t.co/hugJfMoPfh,neutral,0.7725690603256226
1226657789138829314,SizzleBlock,2020-02-10 00:03:01+00:00,en,"Here’s my 2020 Oscars Ballot: Best Picture: 1917.       Best Lead Actor: Adam Driver (even though I’m 90% sure Joaquin will win) Best Supporting Actor: Brad Pitt, no brainer. Best Lead Actress: Renee or ScarJo Best Supporting: Laura Dern Best Directing: Parasite",positive,0.8231678605079651
1226671469402431488,bandile_banks,2020-02-10 00:57:23+00:00,en,"Obvious! Joaquin Phoenix for best actor, Brad Pitt for best supporting. If this doesn’t happen, I’ll know that the Oscars are a scam...",negative,0.39912673830986023
1226657828145782784,1ZenWoman,2020-02-10 00:03:11+00:00,en,"@flmcaps @TheAcademy Curious why #BradPitt swept the other awards, when as Trudi says (In #OnceUponATimeInHollywood ) @LeoDiCaprio gave us ""the best acting I've ever seen.""     But I'm just now 1/2 through... and Brad has just arrived at the old Ranch with Pussycat. More when I finish...  #Oscars",positive,0.7210944890975952
1226661646157914112,nichdas,2020-02-10 00:18:21+00:00,en,Let's do this! My #Oscars predictions:  Best Picture: 1917 Best Director: Sam Mendes Best Actor: Joaquin Phoenix Best Actress: Renée Zellweger Best Supporting Actor: Brad Pitt Best Supporting Actress: Laura Dern Best Original Screenplay: Once Upon a time in Hollywood,positive,0.8420933485031128
1226657543101014017,BudrykZack,2020-02-10 00:02:03+00:00,en,"@thehill Last call, no take-backsies: Picture: Parasite Director: Sam Mendes Actor: Joaquin Phoenix Actress: Renee Zelweger Supp Actor: Brad Pitt Supp Actress: Laura Dern Original Screenplay: Parasite Adapted Screenplay: Jojo Rabbit",neutral,0.9351430535316467
1226670064331612162,ArwaAbdullah_8,2020-02-10 00:51:48+00:00,en,#Oscars oh brad pitt 🤤♥️ https://t.co/4J5pACUZdA,positive,0.9707720279693604
1226671867978747904,jassemi,2020-02-10 00:58:58+00:00,en,@enews It is official !!! Brad Pitt and Adam Sandler give the best funniest speeches ever #BradPitt #AdamSandler #Oscar2020 #OscarSunday #Oscars #SpiritAward,positive,0.9840424060821533
1226665389322645504,PeterBirro,2020-02-10 00:33:13+00:00,en,I love Brad Pitt. #BirroAtTheOscars #Oscars2020  #Oscars,positive,0.9816905856132507
1226667433332703232,Mike_Lowrey0306,2020-02-10 00:41:21+00:00,en,My Oscar Predictions: 1917 (Picture)Joaquin. Renee. (Leading).Brad Pitt. Laura Dern. (Supporting). Sam Mendes (Director). #Oscar2020,neutral,0.7951123714447021
1226648663792984065,PremiumZack,2020-02-09 23:26:46+00:00,en,Brad Pitt better get that best supporting joint,positive,0.8287479877471924
1226670932007276544,emrobs,2020-02-10 00:55:15+00:00,en,THIS DAY CANNOT END WITHOUT A KEANU REEVES AND BRAD PITT PHOTO!!!!!!!! #Oscars,positive,0.8901175260543823
1226667365418532865,aucaen,2020-02-10 00:41:04+00:00,en,Brad Pitt... #OMG,positive,0.9089910984039307
1226643572876861440,do_cinema,2020-02-09 23:06:32+00:00,en,Brad Pitt https://t.co/Nx2ShfOMI5,neutral,0.8342908620834351
1226666584846032897,lizzyhascats,2020-02-10 00:37:58+00:00,en,I was never a Brad Pitt person. I am now,neutral,0.6248131990432739
