tweet.id,tweet.user.username,tweet.date,tweet.lang,tweet.rawContent,label,score
1099918474334285824,satish_kumar26,2019-02-25 06:26:14+00:00,en,"COOPWB Recruitment 2019,Apply Online before 25/02/2019 https://t.co/NLHyfqCHx3 #Oscars #GreenBook #RamiMalek #sarkarinaukri #aajtak #abp #narendramodi #jobs #naukri",neutral,0.8835852146148682
1099910331311243264,caktopus,2019-02-25 05:53:52+00:00,en,i love rami malek but he always seems so out of it. he seems like hes a mannequin during the day but at night they put a hat on him or whatever and he comes alive to do movies,neutral,0.46579229831695557
1099896790277648384,mutebilx_qato,2019-02-25 05:00:04+00:00,en,"Rami Malek was once just a guy in twilight, and now he has an #Oscar for best actor. #Oscars19",positive,0.7214910387992859
1099929704977571840,hypervocal,2019-02-25 07:10:52+00:00,en,Rami Malek delivers pro-immigrant message in Oscars speech https://t.co/vaGQgz9TjX https://t.co/aKUemU3NgF,neutral,0.7132046222686768
1450860825531453448,travalacom,2021-10-20 16:25:51+00:00,en,"Book private jets, islands, castles, yachts, and more on the travel service for crypto's elites: https://t.co/6tQs9fsGkP",neutral,0.8048765063285828
1099897441619464192,RachelGarrett,2019-02-25 05:02:39+00:00,en,"Kudos to Rami Malek.I am his newest fan for life. He gave the most intelligent, sincere, from-the-soul acceptance speech I have ever heard when he won the award for Best Actor. Some of the other winners were... https://t.co/GI1pZ8ARLN",positive,0.9810769557952881
1099879594688110593,TheAcademy,2019-02-25 03:51:44+00:00,en,"Well said, @ItsRamiMalek https://t.co/ewYVMsrXkh",positive,0.8748133778572083
1099905760572686337,vintagesoul1975,2019-02-25 05:35:43+00:00,en,"Log into twitter, see the awesomeness of the oscars and bawl my eyes out. Spike Lee, Rami Malek, Badass!! ✊🏾✊🏾👏🏾👏🏾👏🏾👏🏾👏🏾❤️❤️❤️  #TheOscars2019",positive,0.9847387075424194
1754761876192604284,ACCIONACareers,2024-02-06 07:00:07+00:00,en,"Meet Michael Henning, ex-US Air Force, now Site Manager at Tatanka Wind Farm. His bold career shift led to growth within @ACCIONA's largest US wind farm 📢  Discover his inspiring journey ✅ #ACCIONAteam #PeopleACCIONA https://t.co/YfSFD7anrT",positive,0.9119155406951904
1099925803528323073,shoaryan,2019-02-25 06:55:21+00:00,en,"Of course I am celebrating it as well with you guys,what a performance all you guys @mahershalaali @viggo @Lindacardellini congratulation you all for great @oscar @TheAcademy Oscars 2019: ‘Green Book’ Is Best Picture; Rami Malek and Olivia Colman Win https://t.co/6D55yaLioj",positive,0.9874728918075562
1099898785143160832,aplaceformy_,2019-02-25 05:08:00+00:00,en,Rami Malek for best actor? noice,positive,0.8761045336723328
1099924924389568512,VanityFair,2019-02-25 06:51:52+00:00,en,"Rami Malek fell off the stage after accepting his Oscar. Paramedics rushed in, but the Bohemian Rhapsody star was fine. https://t.co/00Yza8qMtF #Oscars",positive,0.5105419158935547
1099920083613233152,Chez_Oz69,2019-02-25 06:32:38+00:00,en,@people I hope he’s ok and the press don’t make a big deal about it. Let’s keep the focus on the important thing - his amazing achievement!! He’s a super star ⭐️ #AcademyAwards #OSCARS #Oscars2019 #RamiMalek #BohemianRhapsody #Queen,positive,0.9386304616928101
1099915687777030144,Molly_C_Jackson,2019-02-25 06:15:10+00:00,en,All I’m looking for is a Rami Malek + Lucy Boynton type of love❤️❤️,positive,0.8977887034416199
1099911941844135937,ltd_photon,2019-02-25 06:00:16+00:00,en,Contact us for all Residential / Commercial SOLAR ENERGY solution enquiry : mail - contact@photonenergytech.com  #solarpower #solarenergy #solar #renewableenergy #solarpanels #energy #cleanenergy #greenenergy #gosolar #photovoltaic #energ #renewables #climatechange #RamiMalek https://t.co/xTfsVRsMBh,neutral,0.845907986164093
1099910496218738688,sirwillisiv,2019-02-25 05:54:32+00:00,en,"Oh shoot, I didn't know Rami Malek fell off the stage after his Oscar win. I hope he didn't seriously injure himself. #Oscars",negative,0.6315156817436218
1683810087834468352,SecurePhotosHQ,2023-07-25 12:03:03+00:00,en,"Everyone has their favorite family photos, but are yours safe?   Keep your Google Photos safe and protected.  Automatic backups and downloads starting at $5/month.",positive,0.789077639579773
1099902836622741504,DuguiaweCharles,2019-02-25 05:24:06+00:00,en,Rami Malek Wins Best Actor Oscar for Bohemian Rhapsody https://t.co/oelD6iA1qt,positive,0.8510260581970215
1099904330927202304,khanak_08,2019-02-25 05:30:02+00:00,en,"Proud, proud 💕 Bohemian Rhapsody take a bow👏 So much love and congratulations To The cast, The crew, Rami Malek and everyone involved, this movie was truly amazing. #Oscars https://t.co/CYznMzcwZH",positive,0.9885390400886536
1099912698161127425,TonyPulizzi,2019-02-25 06:03:17+00:00,en,Bohemian Rhapsody Wins 4 Oscars Including Rami Malek's Best Actor https://t.co/av5MwP9VTc via @YouTube,positive,0.905759871006012
1099901183366520833,Leigh_Leah03,2019-02-25 05:17:31+00:00,en,@Connie05885181 @BoRhapMovie Yes definitely 😊 I really feel that Freddy Mercury was smiling down proudly as Adam Lambert performed his songs at the beginning of the show. He was especially smiling down proudly when Malik*Sorry if I spelled that wrong🤭* I’m sick and the fever I have won’t let me sleep 😒,positive,0.9665679335594177
1099903568763482112,blue17morpho,2019-02-25 05:27:00+00:00,en,Toldyall rami malek was gonna get it #Oscars,positive,0.6185792684555054
1099937759081447424,HuelyaHuelya,2019-02-25 07:42:52+00:00,en,Well deserved #bohemianrhapsody #RamiMalek ❤️Freddy R.I.P,positive,0.9756425619125366
1099915924742815744,Sequins4Thought,2019-02-25 06:16:06+00:00,en,Did Rami Malek even thank Freddie Mercury in his speech? #oscars https://t.co/pPlG8YSf8J,neutral,0.8137393593788147
1099915620924211200,t_rawww08,2019-02-25 06:14:54+00:00,en,Rami Malek won best actor the first time he was nominated for a mediocre movie. The academy made Leo wait over a decade of being nominated. idgi. I liked Bale for the win but anyways..,negative,0.4519493877887726
1099909516601245696,michaelshand,2019-02-25 05:50:38+00:00,en,@KassandraSeven I didn't watch but it was nice to see Rami Malek win for Bohemian Rhapsody.,positive,0.9240147471427917
1099921446791462912,CorradoSciutto,2019-02-25 06:38:03+00:00,en,"#Oscar2019 #FreddieMercury #RamiMalek hello, Freddy😉 https://t.co/GTVcwhDRps",positive,0.8389992117881775
1099934266148962304,__toyin__,2019-02-25 07:28:59+00:00,en,I'm so happy for Rami Malek. Bohemian Rhapsody has done so well.,positive,0.9892962574958801
1099900712572645377,MariexHastings,2019-02-25 05:15:39+00:00,en,Beautiful speech!! Rami Malek Accepts the Oscar for Lead Actor https://t.co/xOveXJ9kcf via @YouTube,positive,0.9790705442428589
1099928433432412160,myinelegantlove,2019-02-25 07:05:48+00:00,en,"well.....looks like I’m staying 👏🏻👏🏻👏🏻👏🏻👏🏻 congratulations Rami Malek....more than well deserved #BohemianRhapsody also congrats to our wonderful Olivia Coleman 💖 again, more than well deserved 👏🏻👏🏻👏🏻👏🏻👏🏻 I’m happy 😊",positive,0.9874336123466492
1099940427258576896,salmanshahid666,2019-02-25 07:53:28+00:00,en,Rami Malek just broke all the barriers of Hollywood with this victory!! #Oscars,positive,0.9754353165626526
1099901719993929728,grayczhuang,2019-02-25 05:19:39+00:00,en,RAMI MALEK. IM CRYING. #Oscars2019,positive,0.4474169611930847
1099913672158150658,godsowntalk,2019-02-25 06:07:09+00:00,en,@StarMoviesIndia Rami Malek Winning for best Actor  #HappyOscarsToYou #Oscars,positive,0.9775755405426025
1099904204985040903,geekconn,2019-02-25 05:29:32+00:00,en,so anyway here are my favorite photos of rami malek glaring suspiciously at a parking meter https://t.co/tyQlXFSgeO,neutral,0.5353693962097168
1099903446306697218,INFPamela,2019-02-25 05:26:31+00:00,en,I'M. SO. PROUD. OF RAMI MALEK!!!!!AN OSCAR WINNER!!!! I CAN'T BELIEVE IT! I'M SO PROUD. I'M SO HAPPY FOR HIM. I LOVE HIM SO MUCH. 💜 @ItsRamiMalek Congratulations!!!!! :D,positive,0.9889604449272156
1099923857979465728,QWorldNews1,2019-02-25 06:47:37+00:00,en,"'Bohemian Rhapsody' co-stars Rami Malek, Lucy Boynton's passionate Oscars kiss goes viral https://t.co/68nNapMPLY https://t.co/gmlTqxyhcs",positive,0.7134320139884949
1099915014083960832,iowabrandy502,2019-02-25 06:12:29+00:00,en,"And the Oscar for best Actor in a Leading Role goes to Rami Malek, Bohemian Rhapsody  Live #Oscars2019 coverage and https://t.co/Zhdt1lVyCn #Oscars winners list https://t.co/ZXdHEdAbNr https://t.co/mePs8LUc5E BBCBreaking",positive,0.7311196327209473
1099932587588505600,black_canaries,2019-02-25 07:22:19+00:00,en,ok but these rami malek pictures though #Oscars https://t.co/FXizIVyGKY,neutral,0.7362151741981506
1099899175108407296,jklblanco_,2019-02-25 05:09:33+00:00,en,"eyyyy my boi Rami Malek won best actor, you deserve it! Aiyoooooooooo",positive,0.9861198663711548
1099902555751104514,dialoguebites,2019-02-25 05:22:59+00:00,en,Rami Malek wins the Oscar for best actor! He earned it! He was an impressive Freddie Mercury! #RamiMalek #BohemianRhapsody #OscarBites #Oscars2019 https://t.co/agWiFCdfyy,positive,0.9791511297225952
1099935101935329281,vekawxx,2019-02-25 07:32:18+00:00,en,I'm not emotionally well after waking up to discover Rami Malek and Olivia Colman are now Oscar winners 😭😭😭😭😭,negative,0.4737437069416046
1099926110312247297,CharlotteHawkns,2019-02-25 06:56:34+00:00,en,"An #Oscars special live on @gmb! Olivia Colman wins Best Actress, Rami Malek Best Actor &amp; Green Book Best Picture. Bohmemian Rhapsody wins the most with 4. All the action with @piersmorgan @susannareid100 @VinnieJones65 @OfficialMelB @ThePerezHilton &amp; @TheRossKing at Vanity Fair! https://t.co/cm4qz0djsB",positive,0.9217869639396667
1099916965320249351,ABPNews,2019-02-25 06:20:14+00:00,en,The 91st Academy Awards ceremony was held today and here are the artists who took home the prestigious award.  #Oscars #Oscars2019 #Periodendofsentence #GreenBook #RamiMalek #OliviaColman https://t.co/NE2svlyn9P,positive,0.814379096031189
1099918584975843329,M7mdTarekMowafi,2019-02-25 06:26:40+00:00,en,Ladies and Gentlemen Rami Malek ❤️❤️🇪🇬 #RamiMalek  #OscarAwards https://t.co/RJ1Asv7xin,positive,0.9446573257446289
1099904234718343169,KISuzara,2019-02-25 05:29:39+00:00,en,#RamiMalek I knew ittttt!!!! #FreddieMercury in him throughout! So in love with #Queen all over again!!!,positive,0.985224723815918
1099901125376049153,Ozelot94,2019-02-25 05:17:18+00:00,en,"I guess Twitter is probably in a frenzy over it, but congrats to Rami Malek for getting the #Oscars2019",positive,0.8569346070289612
1099898149408251904,amrgalalhamdy,2019-02-25 05:05:28+00:00,en,Rami Malek Accepts the Oscar for Lead Actor https://t.co/E99XnP1D2C,neutral,0.5492770671844482
1099917419013959680,MeRomyjohnson,2019-02-25 06:22:02+00:00,en,"Rami Malek, Roma and Other Big Winners at the Oscars: Complete List - High On Films https://t.co/zvqd5pzuCo",positive,0.6791702508926392
1099936743732723712,RantotheD,2019-02-25 07:38:50+00:00,en,Rami Malek addressing his gf/co-star in his acceptance speech is the sweetest thing ever. #Oscars,positive,0.9839417338371277
1754370728189927754,Casetify,2024-02-05 05:05:50+00:00,en,Enter the realm of Jujutsu Sorcerers and Cursed Spirits with #JujutsuKaisenxCASETiFY. Shop the collection now before it sells out!   #JujutsuKaisen #CASETiFY,neutral,0.5411427617073059
1099916945225334784,weareomgradio,2019-02-25 06:20:09+00:00,en,Rami Malek tumbles from the stage after his Oscars win https://t.co/2BpSCnoqDs,neutral,0.7757034301757812
1099936709817573377,darren_scott,2019-02-25 07:38:42+00:00,en,"Chatting with Rami Malek after his exclusive @AttitudeMag cover shoot for the release of #BohemianRhapsody was a thrill. He was, understandably, nervous about the reception of the film. Glad it all worked out...  https://t.co/xoHzHP3fyH",positive,0.8727260828018188
1099926149889572864,SherriADub,2019-02-25 06:56:44+00:00,en,Just leaving this on my timeline out of pure LOVE for his incredible performance. #RamiMalek 💜🤩 https://t.co/wwDbTxYPSf,positive,0.984862744808197
1099903087576301568,firstpressNg,2019-02-25 05:25:05+00:00,en,Oscars 2019: Rami Malek surrounded by medics after fall following Best Actor win https://t.co/6iAJMtem2l https://t.co/fhNUU1XKLt,neutral,0.6521352529525757
1099941970380607488,yeonkiminis,2019-02-25 07:59:36+00:00,en,goodnight i love oscar award winning actor rami malek,positive,0.9792793989181519
1099929205574418432,XeniaEmefa,2019-02-25 07:08:52+00:00,en,"Loved waking up to hear this news. Congrats, @ItsRamiMalek! You totally deserved the win 😊😊😊 #BohemianRhapsody #Oscars #RamiMalek",positive,0.9910416007041931
1099899805231443968,Razznation,2019-02-25 05:12:03+00:00,en,Great Oscars season. Looking fwd to another year of great films. A few things:  1. It must suck to be Bradley Coopers gf knowing that him &amp; Gaga have chemistry.  2. Rami Malek killed it as Freddy Mercury &amp; deserved the statue he won.   3. Still mad I didn’t see Green Book yet.,positive,0.8666015863418579
1099916804904943616,valcn,2019-02-25 06:19:36+00:00,en,"Rami Malek is a champion, my friends https://t.co/VMGzmVAmhu",positive,0.9255468845367432
1099909430349488129,RapidLeaksIndia,2019-02-25 05:50:18+00:00,en,#Oscar Winners 2019 List: #GreenBook wins Best Picture Award. #91stAcademyAwards #AcademyAwards #Oscars #RamiMalek #LadyGaga #LadyGagaOscar #BohemianRhapsody https://t.co/bjhSDQNDNn,positive,0.8447298407554626
1099896978874327040,_chaoticgoood_,2019-02-25 05:00:49+00:00,en,Rami Malek realising that he won an Oscar and a golden globe. #Oscars https://t.co/ellk0IO2ER,positive,0.8209716081619263
1099925196566392832,IvanoColombaro,2019-02-25 06:52:57+00:00,en,"How to start a speech: ""My mum is in here somewhere... I love you lady!"" #RamiMalek #Oscars #BohemianRhapsody  https://t.co/MWzGK5xLeG",positive,0.9365566968917847
1099903264580096001,orbelisk,2019-02-25 05:25:48+00:00,en,"Look, if you're going to give Rami Malek a Best Actor award, you should've had HIM sing with Queen at the beginning of the ceremony. Or let him lip-sync and own the ridiculous of that performance. If you can't imagine that working, then he shouldn't have won.",neutral,0.6263240575790405
1099934739455193088,kansola_adisa,2019-02-25 07:30:52+00:00,en,@RottenTomatoes Rami Malek must be so proud,positive,0.9430333375930786
1099909250816581633,Hema_ByrnesArmy,2019-02-25 05:49:35+00:00,en,"Wait, Rami Malek fell off the stage after winning his Oscar and then missed out on getting a photo with the other actor and actress winners because he was being looked at by paramedics. I cannot with this man! 😂 Bless his poor soul! #Oscars https://t.co/wypejOijVW",negative,0.8000280857086182
1099916921518977025,msianinsight,2019-02-25 06:20:04+00:00,en,Rami Malek bags Best Actor Oscar https://t.co/Rv1n79rbrO,neutral,0.49733516573905945
1099879594688110593,TheAcademy,2019-02-25 03:51:44+00:00,en,"Well said, @ItsRamiMalek https://t.co/ewYVMsrXkh",positive,0.8748133778572083
1099897954712936448,moancia,2019-02-25 05:04:42+00:00,en,See Rami Malek's full speech. https://t.co/RFzf4pmEza,neutral,0.8641054034233093
1099938272904654849,maggiemclaren_,2019-02-25 07:44:54+00:00,en,"Sorry Viggo Mortensen didn't win an Oscar for Green Book, he was excellent as an Italian/American, but I also liked v much Rami Malek in Bohemian Rhapsody.  But then Christian Bale was also terrific in Vice.  Sad  that A Star is Born didn't win big, my favourite film this season.",positive,0.8077887296676636
1099896874905985025,syntheticserum,2019-02-25 05:00:24+00:00,en,@tinysteinyk BUT FREDDY'S GHOST AND SPIRIT MUST BE DEFENDED rami malek has fallen so far i truly fuckn hate him,negative,0.9554399251937866
1099908563886059520,jadedubya,2019-02-25 05:46:51+00:00,en,This is a rami malek hate account until me robot szn 4. Then it will become a rami malek stan account once again.,neutral,0.4918063282966614
1759755187311239521,BeyondBeachFilm,2024-02-20 01:41:45+00:00,en,The most powerful film you'll see this year: NOT for the faint hearted! Witness the courage of medics braving the front lines to bring hope to the victims of war. IMDb 8.6 - Amazon Prime ⭐️⭐️⭐️⭐️⭐️ Watch on @PrimeVideo @Tubi @LocalNow @Popflick,positive,0.9581515192985535
1758651792018337879,AngelStudiosInc,2024-02-17 00:37:16+00:00,en,"RT @cabrinifilm2024: Audiences and critics are raving about 𝘾𝙖𝙗𝙧𝙞𝙣𝙞. Come see what they're saying.  Francesca Cabrini came to New York in 1889, and was greeted by disease, crime, and impoverished children living in slums. With fearless compassion, Cabrini set out to help our most vulnerable.",neutral,0.75733882188797
1099905796048068608,NJBroadcaster,2019-02-25 05:35:51+00:00,en,Rami Malek Accepts the Oscar for Lead Actor https://t.co/dtr646esIg via @YouTube,neutral,0.5039794445037842
1099905651315097600,PaulaVotesBLUE,2019-02-25 05:35:17+00:00,en,When you think you have no more tears. #RamiMalek #BohemianRhapsody #FreddieMercury,neutral,0.6086553931236267
1099920636833644544,itcouldbezoya,2019-02-25 06:34:50+00:00,en,RAMI MALEK DESERVED THIS OSCAR  #OSCARS2019,positive,0.7844336032867432
1099908291008782336,aliyashariff07,2019-02-25 05:45:46+00:00,en,#RamiMalek - that speech was the best of the night. Most deserving win!,positive,0.9849564433097839
1099938832365932544,SteveGuidetti,2019-02-25 07:47:08+00:00,en,Rami Malek’s 2019 Oscars Speech For ‘Bohemian Rhapsody’ Honored His Immigrant Parents https://t.co/2WGgFi3Ner,positive,0.6940232515335083
1099909710566678529,lucyquirozp,2019-02-25 05:51:24+00:00,en,The best moment of the night. #RamiMalek #Oscar2019 #AcademyAwards #BohemianRhapsody https://t.co/YjP5pn26io,positive,0.9795000553131104
1099902238607245312,Wildcat_Mike,2019-02-25 05:21:43+00:00,en,So well deserved!!!! Rami Malek Accepts the Oscar for Lead Actor https://t.co/hXTJzVVxJE via @YouTube,positive,0.9800467491149902
1099909735338426368,TaxisManchester,2019-02-25 05:51:30+00:00,en,"Long trip requires comfortable vehicle and a professional driver. Taxis manchester airport has more than just that to offer for your ride from manchester airport to lancaster. https://t.co/IB1QK5AvYE  #taxismanchesterairport #manchesterairporttolancaster #manchester ""Rami Malek"" https://t.co/tIYbECIZfc",positive,0.8116541504859924
1099909103382614016,juicyrami,2019-02-25 05:49:00+00:00,en,Oscar winner Rami Malek* will y’all ever get tired? https://t.co/EOBzqZLYrl,neutral,0.5019432306289673
1099912615063683073,richcobalt,2019-02-25 06:02:57+00:00,en,"Emmys, Golden globes and Oscar winner Rami Malek https://t.co/yNHA5hxO6v",positive,0.5571203827857971
1099939724641398785,ThrillWHill,2019-02-25 07:50:40+00:00,en,"Congratulations Rami Malek on the #Oscars win, your portrayal of a rock icon was uncanny https://t.co/GXRxVYz00k",positive,0.9765100479125977
1099892597336797185,people,2019-02-25 04:43:24+00:00,en,#RamiMalek won best actor at the #Oscars for his portrayal of Queen's Freddie Mercury—and shared a sweet moment with his costar and girlfriend #LucyBoynton 💕 https://t.co/YVy2xCTljU https://t.co/T82Ljn2ehx,positive,0.9773030877113342
1099920938357919744,ChudTsankov,2019-02-25 06:36:01+00:00,en,i'm the son of immigrants from egypt. i’m a first generation american. and part of my story is being written right now. #RamiMalek #Oscars #Oscars2019⁠ #BohemianRapsody #Queen https://t.co/0wgHCkpYzf,neutral,0.7235937714576721
1099918401730985984,KadirNehir,2019-02-25 06:25:57+00:00,en,And the oscar goes to; Rami Malek #Oscars https://t.co/v8CQobN04D,positive,0.6744155287742615
1099924189002133504,TicketNew,2019-02-25 06:48:56+00:00,en,"#91stAcademyAwards: Best Picture- #GreenBook, Best Actor - #RamiMalek &amp; #OliviaColman, Best Director - #AlfonsoCuarón, Best Visual Effects- #FirstMan, Best Film Editing- #BohemianRhapsody   #Oscars Complete list here: https://t.co/ZTvuDQ8pNk https://t.co/8RfvLLcJVn",positive,0.7420861721038818
1099910540741275648,RiversUpchurch,2019-02-25 05:54:42+00:00,en,Rami Malek was great in Bohemian Rhapsody but I’ll always remember him for his work in Arsenal’s midfield https://t.co/l40PNDLNQt,positive,0.9316522479057312
1099913836537102336,13stepping,2019-02-25 06:07:48+00:00,en,"Congrats to #RamiMalek , for winning best Actor tonight at #TheOscars2019",positive,0.9641580581665039
1099914255137042433,neelm_,2019-02-25 06:09:28+00:00,en,"Congratulations Rami Malek... I've been looking you since Twilight Saga.. and fell in love again in need for speed... your are great actor!!! you deserve it,😘",positive,0.9868742823600769
1099918425873367042,Solrac214Solrac,2019-02-25 06:26:02+00:00,en,"If you don’t love movies 🎥 we can’t really be friends, but just ICYMI... #TheWinnersAre #TheOscarGoesTo #AcademyAwards #Oscars2019 #Roma #AlfonsoCuaron #RamiMalek #GreenBook #ReginaKing #Shallow #AStarIsBorn #OliviaColman #MahershalaAli #Vice https://t.co/ZeOgpXQGKE",positive,0.6050140857696533
1099913964111171584,ana_da_rocha,2019-02-25 06:08:19+00:00,en,"@lovebillynyc Great movie &amp; performances. Brian May &amp; Roger Taylor who were fully involved on all aspects of the movie &amp; knew Freddy Mercury better than anyone, said Rami Malek emulated him amazingly, other people in Freddy’s life thought so too.",positive,0.9662124514579773
1099933012362354688,bongschronicles,2019-02-25 07:24:00+00:00,en,Well deserved!! #oscars #RamiMalek #BohemianRapsody,positive,0.9778834581375122
1099925488657682434,941kodj,2019-02-25 06:54:06+00:00,en,Rami Malek Wins Best Actor For Bohemian Rhapsody https://t.co/ZBtyGxLsUl,positive,0.8153421878814697
1099916054678196224,FacuGioffre,2019-02-25 06:16:37+00:00,en,Congratulations #RamiMalek on a well deserved win for #BestActor at the #Oscars❗️ #Oscars2019 #QueenWillRockTheOscars,positive,0.9774073362350464
1099927715703083008,zzgluckwetrust,2019-02-25 07:02:57+00:00,en,Yeah and he is a phenomenal artist! Such a well deserved Oscar!🌟 #RamiMalek,positive,0.9860548377037048
1099919327166377984,badthing,2019-02-25 06:29:37+00:00,en,We're excited for Rami Malek  and Lady Gaga!!! — feeling excited,positive,0.9909825921058655
1099923102174085120,sasscheek,2019-02-25 06:44:37+00:00,en,"I love rami malek so much :,)!",positive,0.989679217338562
1099915747420123136,AnishMohanty_,2019-02-25 06:15:24+00:00,en,"MOST IMPORTANTLY, CREATING FREDDIE MERCURY’S VOICE AND MAKING RAMI MALEK SOUND LIKE HIM",neutral,0.4921061098575592
1099941554771226625,CateyHurren,2019-02-25 07:57:57+00:00,en,I am really disappointed that Rami Malek didn’t take the time on stage to denounce Bryan Singer however inappropriate it may have been or that it take away from his moment up there. HOWEVER. This. This is why I’m so happy for him ♥️ https://t.co/yf0YTTogWl,negative,0.43533480167388916
1099918572921516032,turpdee,2019-02-25 06:26:37+00:00,en,Maxhype Celebrities-  When I tell you well deserved! ramimalek played the hell out of #freddiemercury ! 🙌🏾🙌🏾🙌🏾🙌🏾  -  . . . . . . . . . . . . . #Maxhypetv #celebrityfashion #oscars2019… https://t.co/n2WLmWbfCm,positive,0.9718561172485352
1099919647678304256,rhotwire,2019-02-25 06:30:54+00:00,en,"'Bohemian Rhapsody' co-stars Rami Malek, Lucy Boynton's passionate Oscars kiss goes viral https://t.co/49wM5lAyLi via @rhotwire https://t.co/R6R2c9hlSs",positive,0.6595426797866821
1099932377294557184,j_dermato,2019-02-25 07:21:29+00:00,en,"And the  Oscar goes to... Rami Malek 🏆  “To anyone trying to discover their voice, listen – we made a film about a gay man and immigrant who lived his life unapologetically himself.”",positive,0.9046171307563782
1099921323881582593,TheMuana,2019-02-25 06:37:33+00:00,en,Rami Malek has BEEN the goat 💯,positive,0.922285258769989
1099902233272029184,people,2019-02-25 05:21:42+00:00,en,Rami Malek Treated by Paramedics After Falling Off #Oscars Stage Following His Best Actor Win https://t.co/aoWUfGMkA4,neutral,0.7124057412147522
1099905481194246144,glasneronfilm,2019-02-25 05:34:36+00:00,en,"Rami Malek backstage at the #Oscars ""I never thought I could play Freddie Mercury until I realized his name was Farrokh Bulsara.""",neutral,0.7179774045944214
1099930658087096321,pascale_erhart,2019-02-25 07:14:39+00:00,en,and the oscar for the best dentures goes to.... #RamiMalek #Oscars https://t.co/qC8Yycnw1V,positive,0.7855704426765442
1099899211557019648,h0ranmysoul_,2019-02-25 05:09:41+00:00,en,I´m in love with his speech #oscars https://t.co/98MyzOq0sf,positive,0.9854189157485962
1099939493920919552,_boogs,2019-02-25 07:49:45+00:00,en,Congrats to Until Dawn’s Rami Malek for picking up his first Oscar. You’ve come a long way from being that creepy kid with an equally creepy ski lodge https://t.co/hm3YHsW2t2,positive,0.9067067503929138
1099934173584859136,hannahw513,2019-02-25 07:28:37+00:00,en,Rami Malek is the love of my life 😌,positive,0.9833351373672485
1099931966181335041,irenelemonb,2019-02-25 07:19:51+00:00,en,rami malek totally deserve that,neutral,0.4922221899032593
1099906750759628802,c__rabaino,2019-02-25 05:39:39+00:00,en,#oscars2019 Rami Malek's speech for Best Actor,positive,0.6736867427825928
1099900779819868161,AmbroseMoxMode,2019-02-25 05:15:55+00:00,en,"#Oscars were pretty good. Rami Malek, Spike Lee &amp; Greenbook. Performances by Queen and Lady Gaga &amp; Bradley Cooper.",positive,0.9737188220024109
